label,type,title,author,journal,abstract,year,doi,volume,issue,pages,language,issn,keywords,url,institution,DA,j2,DP,l1,l2,ST
Piovezan_2012_JoofthAmGeSo,JOUR,Assessment of undergraduate clinical reasoning in geriatric medicine: application of a script concordance test,"Piovezan, Ronaldo D. and Custodio, Osvladir and Cendoroglo, Maysa S. and Batista, Nildo A. and Lubarsky, Stuart and Charlin, Bernard",Journal of the American Geriatrics Society,"A challenging aspect of geriatric practice is that it often requires decision-making under conditions of uncertainty. The Script Concordance Test (SCT) is an assessment tool designed to measure clinical data interpretation, an important element of clinical reasoning under uncertainty. The purpose of this study was to develop and analyze the validity of results of an SCT administered to undergraduate students in geriatric medicine. An SCT consisting of 13 cases and 104 items covering a spectrum of common geriatric problems was designed and administered to 41 undergraduate medical students at a medical school in Sao Paulo, Brazil. A reference panel of 21 practicing geriatricians contributed to the test's score key. The responses were analyzed, and the psychometric properties of the tool were investigated. The test's internal consistency and discriminative capacity to distinguish students from experienced geriatricians supported construct validity. The Cronbach alpha for the test was 0.84, and mean scores for the experts were found to be significantly higher than those of the students (80.0 and 70.7, respectively; P < .001). This study demonstrated robust evidence of reliability and validity of an SCT developed for use in geriatric medicine for assessing clinical reasoning skills under conditions of uncertainty in undergraduate medical students. These findings will be of interest to those involved in assessing clinical competence in geriatrics and will have important potential application in medical school examinations.",2012,10.1111/j.1532-5415.2012.04152.x,60,10,1946-1950,eng,1532-5415 0002-8614,"Surveys and Questionnaires and Educational Measurement/*methods and *Education, Medical, Undergraduate and Geriatrics/*education",NA,NA,2012/10//undefined,J Am Geriatr Soc,NA,NA,NA,NA
Fried_2017_JoofthAmGeSo,JOUR,Engagement in Advance Care Planning and Surrogates' Knowledge of Patients' Treatment Goals,"Fried, Terri R. and Zenoni, Maria and Iannone, Lynne and O'Leary, John and Fenton, Brenda T.",Journal of the American Geriatrics Society,"OBJECTIVES: A key objective of advance care planning (ACP) is improving surrogates' knowledge of patients' treatment goals. Little is known about whether ACP outside of a trial accomplishes this. The objective was to examine patient and surrogate reports of ACP engagement and associations with surrogate knowledge of goals. DESIGN: Cohort study SETTING: Primary care in a Veterans Affairs Medical Center. PARTICIPANTS: 350 community-dwelling veterans age <e2><89><a5>55 years and the individual they would choose to make medical decisions on their behalf, interviewed separately. MEASUREMENTS: Treatment goals were assessed by veterans' ratings of 3 health states: severe physical disability, cognitive disability, and pain, as an acceptable or unacceptable result of treatment for severe illness. Surrogates had knowledge if they correctly predicted all 3 responses. Veterans and surrogates were asked about living will and health care proxy completion and communication about life-sustaining treatment and quality versus quantity of life (QOL). RESULTS: Over 40% of dyads agreed that the veteran had not completed a living will or health care proxy and that there was no QOL communication. For each activity, sizeable proportions (18-34%) disagreed about participation. In dyads who agreed QOL communication had occurred, 30% of surrogates had knowledge, compared to 21% in dyads who agreed communication had not occurred and 15% in dyads who disagreed (P = .01). This relationship persisted in multivariable analysis. Agreement about other ACP activities was not associated with knowledge. CONCLUSION: Disagreement about ACP participation was common. Agreement about communication regarding QOL was modestly associated with surrogate knowledge of treatment goals. Eliciting surrogates' perspectives is critical to ACP. Even dyads who agree about participation may need additional support for successful engagement.",2017,10.1111/jgs.14858,65,8,1712-1718,eng,1532-5415 0002-8614,"Humans and Female and Male and Primary Health Care and Aged and Surveys and Questionnaires and Hospitals, Veterans and *Decision Making and *Patient Preference and Veterans/psychology/statistics & numerical data and *Advance Care Planning and *Proxy and advance care planning and surrogate decision making and treatment goals",NA,NA,2017/08//undefined,J Am Geriatr Soc,NA,NA,NA,NA
Palacios_2020_JoAd.J,JOUR,Circulating Plasma Metabolites and Cognitive Function in a Puerto Rican Cohort,"Palacios, Natalia and Lee, Jong Soo and Scott, Tammy and Kelly, Rachel S. and Bhupathiraju, Shilpa N. and Bigornia, Sherman J. and Tucker, Katherine L.",Journal of Alzheimer's disease : JAD,"BACKGROUND: Minorities, including mainland Puerto Ricans, are impacted disproportionally by Alzheimer's disease (AD), dementia, and cognitive decline. Studying blood metabolomics in this population has the potential to probe the biological underpinnings of this health disparity. OBJECTIVE: We performed a comprehensive analysis of circulating plasma metabolites in relation to cognitive function in 736 participants from the Boston Puerto Rican Health Study (BPRHS) who underwent untargeted mass-spectrometry based metabolomics analysis and had undergone a battery of in-person cognitive testing at baseline. METHODS: After relevant exclusions, 621 metabolites were examined. We used multivariable regression, adjusted for age, sex, education, apolipoprotein E genotype, smoking, and Mediterranean dietary pattern, to identify metabolites related to global cognitive function in our cohort. LASSO machine learning was used in a complementary analysis to identify metabolites that could discriminate good from poor extremes of cognition. We also conducted sensitivity analyses: restricted to participants without diabetes, and to participants with good adherence to Mediterranean diet. RESULTS: Of 621 metabolites, FDR corrected (p < 0.05) multivariable linear regression identified 3 metabolites positively, and 10 negatively, associated with cognitive function in the BPRHS. In a combination of FDR-corrected linear regression, logistic regression regularized via LASSO, and sensitivity analyses restricted to participants without diabetes, and with good adherence to the Mediterranean diet, <ce><b2>-cryptoxanthin plasma concentration was consistently associated with better cognitive function and N-acetylisoleucine and tyramine O-sulfate concentrations were consistently associated with worse cognitive function. CONCLUSION: This untargeted metabolomics study identified potential biomarkers for cognitive function in a cohort of Puerto Rican older adults.",2020,10.3233/JAD-200040,76,4,1267-1280,eng,1875-8908 1387-2877,"Humans and Female and Male and Middle Aged and Aged and Cohort Studies and Risk Factors and diabetes and Neuropsychological Tests and metabolomics and Puerto Rico and Diabetes Mellitus/*blood and Puerto Ricans and Cognitive function and Cognition/*physiology and Cognitive Dysfunction/*blood/*metabolism and Diet, Mediterranean/psychology",NA,NA,2020///,J Alzheimers Dis,NA,NA,NA,NA
Step_2009_JoofthAmGeSo,JOUR,Differences in oncologist communication across age groups and contributions to adjuvant decision outcomes,"Step, Mary M. and Siminoff, Laura A. and Rose, Julia H.",Journal of the American Geriatrics Society,"The objective of this study was to assess potential age-related differences in oncologist communication during conversations about adjuvant therapy decisions and subsequent patient decision outcomes. Communication was observed between a cross-section of female patients aged 40 to 80 with early-stage breast cancer (n=180) and their oncologists (n=36) in 14 academic and community oncology practices in two states. Sources of data included audio recordings of visits, followed by post-visit patient interviews. Communication during the visit was assessed using the Siminoff Communication Content and Affect Program. Patient outcome measures included self-reported satisfaction with decision, decision conflict, and decision regret. Results showed that oncologists were significantly more fluent and more direct with older than middle-aged patients and trended toward expressing their own treatment preferences more with older patients. Satisfaction with treatment decisions was highest for women in their 50s and 60s. Decision conflict was significantly associated with more discussion of oncologist treatment preferences and prognosis. Decision regret was significantly associated with patient age and education. Older adults considering adjuvant therapy may find that oncologists' communication accommodations to perceived deficiencies in older adult cognition or communication challenge their decision-making involvement. Oncologists should carefully assess patient decision-making preferences and be mindful of accommodating their speech to age-related stereotypes.",2009,10.1111/j.1532-5415.2009.02512.x,57 Suppl 2,NA,282-S279,eng,1532-5415 0002-8614,"Humans and Female and Adult and Middle Aged and Cross-Sectional Studies and Aged and Decision Making and Physician-Patient Relations and Cohort Studies and Treatment Outcome and Patient Satisfaction and Aged, 80 and over and Age Factors and Combined Modality Therapy and *Communication and *Patient Participation and *Medical Oncology and Breast Neoplasms/*psychology/*therapy",NA,NA,2009/11//undefined,J Am Geriatr Soc,NA,NA,NA,NA
de.Boer_2011_JoofthAmGeSo,JOUR,Advance directives for euthanasia in dementia: how do they affect resident care in Dutch nursing homes? Experiences of physicians and relatives,"de Boer, Marike E. and Droes, Rose-Marie and Jonker, Cees and Eefsting, Jan A. and Hertogh, Cees M. P. M.",Journal of the American Geriatrics Society,"OBJECTIVES: To gain insight into how advance directives for euthanasia affect resident care in Dutch nursing homes. DESIGN: Survey of elderly care physicians and additional qualitative interviews with a selection of elderly care physicians and relatives of people with dementia who had an advance directive for euthanasia. SETTING: Dutch nursing home practice. PARTICIPANTS: Four hundred thirty-four elderly care physicians completed the general part of the questionnaire; 110 physicians provided case histories. Interviews were conducted with 11 physicians and eight relatives. MEASUREMENTS: The questionnaire contained general questions about the incidence of advance directives for euthanasia in people with dementia. A second part involved questions about the most recent case of a person with dementia and an advance directive for euthanasia who had died. The interviews with elderly care physicians and relatives focused on further exploration of the decision-making process regarding adherence to the advance directive for euthanasia. RESULTS: Despite law-based possibilities, advance directives for euthanasia of people with dementia were rarely adhered to, although they seem to have a supportive role in setting limitations on life-sustaining treatments. Elderly care physicians and relatives were found to be reluctant to adhere to advance directives for euthanasia. Not being able to engage in meaningful communication played a crucial role in this reluctance. CONCLUSION: Advance directives for euthanasia are never adhered to in the Netherlands in the case of people with advanced dementia, and their role in advance care planning and end-of-life care of people with advanced dementia is limited. Communication with the patient is essential for elderly care physicians to consider adherence to an advance directive for euthanasia of a person with dementia.",2011,10.1111/j.1532-5415.2011.03414.x,59,6,989-996,eng,1532-5415 0002-8614,"Humans and Female and Male and Aged and Health Services Research and Decision Making and Surveys and Questionnaires and Aged, 80 and over and Netherlands and Interview, Psychological and *Attitude of Health Personnel and *Nursing Homes and Advance Directives/*legislation & jurisprudence/psychology and *Homes for the Aged and Mental Competency/legislation & jurisprudence/psychology and *Caregivers/psychology and Advance Directive Adherence/*legislation & jurisprudence/psychology and Dementia/diagnosis/psychology and Euthanasia/*legislation & jurisprudence and Medical Futility/legislation & jurisprudence/psychology and Suicide, Assisted/legislation & jurisprudence/psychology",NA,NA,2011/06//undefined,J Am Geriatr Soc,NA,NA,NA,NA
Verduzco.Aguirre_2019_JoofthAmGeSo,JOUR,The Effect of a Geriatric Oncology Clinic on Treatment Decisions in Mexican Older Adults With Cancer,"Verduzco-Aguirre, Haydee C. and Navarrete-Reyes, Ana P. and Chavarri-Guerra, Yanin and Avila-Funes, Jose A. and Soto-Perez-de-Celis, Enrique",Journal of the American Geriatrics Society,"OBJECTIVES: Geriatric assessment and interventions improve the care of older adults with cancer, but their effect on treatment decision making in resource-limited settings is unknown. We studied the effect of recommendations made by a consultative geriatric oncology clinic on treatment decision making by oncologists in Mexico. DESIGN, SETTING, AND PARTICIPANTS: Retrospective chart review of 173 consecutive patients with solid tumors referred before treatment initiation to the geriatric oncology clinic at a third-level public hospital in Mexico City between March 2015 and October 2017. Patients were evaluated by a multidisciplinary geriatric oncology clinic, and treatment recommendations were issued to treating oncologists. MEASUREMENTS: We determined the overall proportion of agreement between geriatric oncology recommendations and oncologists' treatment decisions. We assessed whether agreement increased when geriatric oncology recommendations were acknowledged in the treating oncologist's clinic note. The homogeneity of agreement was tested using the Stuart-Maxwell test. RESULTS: Median age was 79 years (range = 64-97 years). ""Standard treatment"" was recommended in 48% of cases, followed by ""less intensive treatment"" in 32%, and ""best supportive care"" in 20%. The overall proportion of agreement for the entire population was 80% (<ce><ba> = 0.69), although agreement was heterogeneous (X(2) = 8.16, P = .02). Geriatric oncology recommendations were acknowledged in the treating oncologists' notes in 62% of cases. Overall agreement was higher when the evaluation was acknowledged (83%, <ce><ba> = 0.74) than when it was not acknowledged (74%, <ce><ba> = 0.60). Agreement was homogeneous only when recommendations were acknowledged in the oncologist's note (X(2) = 3.0, P = .22). CONCLUSIONS: The overall proportion of agreement between geriatric oncology recommendations and final treatment decisions was high, particularly when recommendations were acknowledged in the treating oncologists' note. Including geriatric oncology evaluations in everyday clinical practice and fostering interdisciplinary communication between geriatric oncology and treating oncologists may provide valuable guidance for physicians caring for older patients with cancer in resource-limited settings. J Am Geriatr Soc 67:992-997, 2019.",2019,10.1111/jgs.15753,67,5,992-997,eng,1532-5415 0002-8614,"Humans and Female and Male and Middle Aged and Retrospective Studies and Aged and decision making and Aged, 80 and over and Age Factors and Incidence and neoplasms and *Clinical Decision-Making and *Medical Oncology and developing countries and Geriatric Assessment/*methods and Referral and Consultation/*standards and Neoplasms/epidemiology/*therapy and *Geriatrics and *Hospitals, Special and geriatric assessment and interdisciplinary communication and Mexico/epidemiology",NA,NA,2019/05//undefined,J Am Geriatr Soc,NA,NA,NA,NA
Allen_2008_JoofthAmGeSo,JOUR,"End-of-life decision-making, decisional conflict, and enhanced information: race effects","Allen, Rebecca S. and Allen, Jessica Y. and Hilgeman, Michelle M. and DeCoster, Jamie",Journal of the American Geriatrics Society,"OBJECTIVES: To examine the effect of enhanced information regarding the risks, benefits, and life-sustaining treatment alternatives on hypothetical medical decisions and decisional conflict in older, community-dwelling Caucasian and African-American adults. DESIGN: Two-group (enhanced information; no information) between-subjects design. SETTING: Community-based dwellings, two assisted living facilities, and one senior citizen center. PARTICIPANTS: Seventy-eight adults (aged 74.5+/-7.18) with a mean Telephone Interview for Cognitive Status--Modified (TICS-m) score of 31.5+/-4.7 were recruited through personal contacts and informational talks held at the recruitment sites. MEASUREMENTS: Measures included the Life Support Preferences/Predictions Questionnaire--modified (LSPQ-m); the Decisional Conflict Scale; and enhanced information, including detailed descriptions of life-sustaining treatment options for each LSPQ-m illness scenario, risks of the treatment, benefits of the treatment, and alternatives for each treatment (called medical information stimuli). RESULTS: Enhanced information (e.g., medical information stimuli) reduced decisional conflict (P=.049, d=0.47) for hypothetical life-sustaining treatment decisions. A mixed analysis of variance with group and race as between-subjects variables and illness and treatment as within-subjects variables revealed significant main effects of race, illness, and treatment, as well as a significant race-by-illness-by-group interaction (Wilk's lambda=0.923, F(2, 73)=3.05, P=.05, partial eta(2)=0.08). Enhanced information produced different patterns of desire for life-sustaining treatments in African Americans and Caucasians. CONCLUSION: Physicians and other healthcare professionals can reduce decisional conflict in patients by providing enhanced information regarding treatment risks, benefits, and alternatives. Such decision aids may provide new information or knowledge and thus reduce desire for treatment in African Americans.",2008,10.1111/j.1532-5415.2008.01929.x,56,10,1904-1909,eng,1532-5415 0002-8614,"Humans and Female and Male and Aged and Advance Care Planning and *Decision Making and *Patient Education as Topic and *Life Support Care and Conflict, Psychological and African Americans/*psychology and Whites/*psychology",NA,NA,2008/10//undefined,J Am Geriatr Soc,NA,NA,NA,NA
Cooper_2020_JoofthAmGeSo,JOUR,Launching a Geriatric Surgery Center: Recommendations from the Society for Perioperative Assessment and Quality Improvement,"Cooper, Lisa and Abbett, Sarah K. and Feng, Aiden and Bernacki, Rachelle E. and Cooper, Zara and Urman, Richard D. and Frain, Laura N. and Edwards, Angela F. and Blitz, Jeanna D. and Javedan, Houman and Bader, Angela M.",Journal of the American Geriatrics Society,"To prepare for the increasing numbers of older adults undergoing surgery, the American College of Surgeons (ACS) has recently launched the Geriatric Surgery Verification Program with the goal of encouraging the creation of centers of geriatric surgery. Meanwhile, the Society for Perioperative Assessment and Quality Improvement (SPAQI) has published recommendations for the preoperative management of frailty, which state that teams should actively screen for frailty before surgery and that pathways, including geriatric comanagement, shared decision-making, and multimodal prehabilitation, should be embedded in routine care to help improve patient outcomes. Both SPAQI and the ACS advocate for a multidisciplinary approach to improve the value of care for older adults undergoing surgery. However, the best way to implement geriatric services in the surgical setting is yet to be determined. In this statement, we will describe the SPAQI recommendations for launching a geriatric surgery center and the process by which its value should be assessed over time.",2020,10.1111/jgs.16681,68,9,1941-1946,eng,1532-5415 0002-8614,"Humans and Risk Assessment and Aged and value and Societies, Medical and Length of Stay and multidisciplinary and *Patient Care Team and *Quality Improvement and *Elective Surgical Procedures and *Geriatric Assessment and frailty and Frailty/psychology and geriatric comanagement and geriatric surgery",NA,NA,2020/09//undefined,J Am Geriatr Soc,NA,NA,NA,NA
Riffin_2018_JoofthAmGeSo,JOUR,Patient and Caregiver Perspectives on Managing Multiple Health Conditions,"Riffin, Catherine and Van Ness, Peter H. and Iannone, Lynne and Fried, Terri",Journal of the American Geriatrics Society,"OBJECTIVES: To explore patient and caregiver experiences, preferences, and attitudes toward the provision and receipt of caregiving assistance with medical tasks. DESIGN: Qualitative study consisting of in-depth interviews with 20 patient-caregiver dyads. SETTING: Community and academic-affiliated primary care clinics. PARTICIPANTS: Individuals aged 65 or older with 2 or more health conditions and their family caregivers (n=20 patient-caregiver dyads). MEASUREMENTS: Open-ended questions were asked about the tasks that the patient and caregiver performed to manage the patient's health conditions; questions were designed to elicit participant reactions and attitudes toward the help they provided or received. Transcripts were analyzed using the constant comparative method. RESULTS: Participant preferences and attitudes toward the receipt and provision of disease management tasks were highly personal. Participant responses clustered into 2 caregiving typologies: supportive caregiving relationships and conflicted caregiving relationships. Supportive relationships were characterized by patient-caregiver agreement about caregiver level of involvement, agreement about one another's competency to perform disease-related tasks, mutual understanding, collaborative decision-making and disease management, and use of family and formal caregiving. Conflicted relationships were characterized by disagreement about caregiver level of involvement, disagreement about one another's competency to perform disease management tasks, underappreciation of one another's experiences, disagreement over decision-making and disease management, and use of formal caregiving. CONCLUSIONS: The views that patient-caregiver dyads expressed in this study illustrate the varied preferences and attitudes toward caregiving assistance with multiple health conditions. These findings support a dyadic approach to evaluating and addressing patient and caregiver needs and attitudes toward provision of assistance.",2018,10.1111/jgs.15501,66,10,1992-1997,eng,1532-5415 0002-8614,"Humans and Female and Male and Middle Aged and Aged and Social Support and Decision Making and Qualitative Research and Aged, 80 and over and Caregivers/*psychology and Multiple Chronic Conditions/*psychology",NA,NA,2018/10//undefined,J Am Geriatr Soc,NA,NA,NA,NA
