label,type,title,author,journal,abstract,year,doi,volume,issue,pages,language,issn,keywords,url,institution,DA,j2,DP,l1,l2,ST
Salter_2014_JoofthAmGeSo,JOUR,Age and sex disparities in discussions about kidney transplantation in adults undergoing dialysis,"Salter, Megan L. and McAdams-Demarco, Mara A. and Law, Andrew and Kamil, Rebecca J. and Meoni, Lucy A. and Jaar, Bernard G. and Sozio, Stephen M. and Kao, Wen Hong Linda and Parekh, Rulan S. and Segev, Dorry L.",Journal of the American Geriatrics Society,"OBJECTIVES: To explore whether disparities in age and sex in access to kidney transplantation (KT) originate at the time of prereferral discussions about KT. DESIGN: Cross-sectional survey. SETTING: Outpatient dialysis centers in Maryland (n = 26). PARTICIPANTS: Individuals who had recently initiated hemodialysis treatment (N = 416). MEASUREMENTS: Participants reported whether medical professionals (nephrologist, primary medical doctor, dialysis staff) and social group members (significant other, family member, friend) discussed KT with them and, when applicable, rated the tone of discussions. Relative risks were estimated using modified Poisson regression. RESULTS: Participants aged 65 and older were much less likely than those who were younger to have had discussions with medical professionals (44.5% vs 74.8%, P < .001) or social group members (47.3% vs 63.1%, P = .005). Irrespective of sex and independent of race, health-related factors, and dialysis-related characteristics, older adults were more likely not to have had discussions with medical professionals (relative risk (RR) = 1.13, 95% confidence interval (CI) = 1.03-1.24, for each 5-year increase in age through 65; RR = 1.28, 95% CI = 1.14-1.42, for each 5-year increase in age beyond 65). Irrespective of age, women were more likely (RR = 1.45, 95% CI = 1.12-1.89) not to have had discussions with medical professionals. For each 5-year increase in age, men (RR = 1.04, 95% CI = 0.99-1.10) and women (RR = 1.17, 95% CI = 1.10-1.24) were more likely not to have discussions with social group members. Of those who had discussions with medical professionals or social group members, older participants described these discussions as less encouraging (all P < .01). CONCLUSION: Older adults and women undergoing hemodialysis are less likely than younger adults and men to have discussions about KT as a treatment option, supporting a need for better clinical guidelines and education for these individuals, their social network, and their providers.",2014,10.1111/jgs.12801,62,5,843-849,eng,1532-5415 0002-8614,"Humans and Female and Male and Middle Aged and Cross-Sectional Studies and Aged and Sex Factors and Sex Distribution and Age Factors and Disease Progression and Age Distribution and *Decision Making and Ambulatory Care/*methods and *Healthcare Disparities and kidney transplantation and dialysis and Renal Dialysis/*statistics & numerical data and Survival Rate/trends and Morbidity/trends and access to transplantation and age disparities and Kidney Failure, Chronic/epidemiology/*therapy and Kidney Transplantation/*statistics & numerical data and Maryland/epidemiology and sex disparities",NA,NA,2014/05//undefined,J Am Geriatr Soc,NA,NA,NA,NA
Naik_2016_JoofthAmGeSo,JOUR,"Health Values and Treatment Goals of Older, Multimorbid Adults Facing Life-Threatening Illness","Naik, Aanand D. and Martin, Lindsey A. and Moye, Jennifer and Karel, Michele J.",Journal of the American Geriatrics Society,"OBJECTIVES: To identify a taxonomy of health-related values that frame goals of care of older, multimorbid adults who recently faced cancer diagnosis and treatment. DESIGN: Qualitative analysis of data from a longitudinal cohort study of multimorbid cancer survivors. SETTING: Cancer registries from regional Department of Veterans Affairs networks in New England and southeast Texas. PARTICIPANTS: Multimorbid adults who completed interviews 12 months after diagnosis of head and neck, colorectal, gastric, or esophageal cancer and after cancer treatment (N = 146). MEASUREMENTS: An interdisciplinary team conducted thematic analyses of participants' intuitive responses to two questions: Now that you have had cancer and may face ongoing decisions about medical care in the future, what would you want your family, friends, and doctors to know about you, in terms of what is most important to you in your life? If your cancer were to recur, is there anything you'd want to be sure your loved ones knew about you and your goals of care? RESULTS: Analysis revealed five distinct health-related values that guide how multimorbid cancer survivors conceptualize specific health care goals and medical decisions: self-sufficiency, life enjoyment, connectedness and legacy, balancing quality and length of life, and engagement in care. Participants typically endorsed more than one value as important. CONCLUSION: Older multimorbid adults who recently faced life-threatening cancer endorsed a multidimensional taxonomy of health-related values. These health-related values guide how they frame their goals for care and treatment preferences. Eliciting individuals' sense of their values during clinical encounters may improve their experiences with health care and more effectively align treatments with goals of care.",2016,10.1111/jgs.14027,64,3,625-631,eng,1532-5415 0002-8614,decision-making and Humans and Female and Male and Middle Aged and Aged and Longitudinal Studies and qualitative and *Advance Care Planning and Neoplasms/complications/*therapy and advanced care planning and *Terminal Care/standards and multiple morbidities,NA,NA,2016/03//undefined,J Am Geriatr Soc,NA,NA,NA,NA
Bandy_2014_JoofthAmGeSo,JOUR,"Wishard Volunteer Advocates Program: an intervention for at-risk, incapacitated, unbefriended adults","Bandy, Robin and Sachs, Greg A. and Montz, Kianna and Inger, Lev and Bandy, Robert W. and Torke, Alexia M.",Journal of the American Geriatrics Society,"Unbefriended, incapacitated individuals who lack surrogates to make medical decisions present a complex problem to the healthcare providers who treat them. Adults without surrogates are among the most vulnerable in the community and are often alone and estranged from family, neglected and abused, and at risk of receiving inappropriate medical treatment. This article describes the program model and outcomes for the first 2 years of the Wishard Volunteer Advocates Program (WVAP), a guardianship program using trained, supervised volunteers as surrogates for unbefriended, incapacitated individuals. Of the 50 individuals enrolled during the study period, 20 were female, and 39 were Caucasian and 11 African American. Their average age was 67. Nineteen were insured with Medicare as primary and Medicaid as supplementary insurance. Ninety-eight percent had four or more comorbid conditions at the time of the index hospitalization. Before program referral, many lived alone in unsafe conditions. Adult Protective Services was involved in almost half of the cases at the time of the index hospitalization. Approximately half of the participants required some type of property management. Healthcare usage data demonstrated that most were not receiving medical care before WVAP enrollment; the data indicated a decrease in emergency department visits and hospitalization after WVAP enrollment. The WVAP completed Medicaid applications for 12 participants, resulting in $297,481.62 in reimbursement for the index hospitalization and a payer source for subsequent hospitalization and long-term care. The volunteer advocate model provides an efficient and quality mechanism for providing unbefriended individuals with surrogates.",2014,10.1111/jgs.13096,62,11,2171-2179,eng,1532-5415 0002-8614,"Communication and Humans and Female and Male and Adult and Middle Aged and Retrospective Studies and Aged and Decision Making and Cost-Benefit Analysis and Program Evaluation and Comorbidity and Aged, 80 and over and Indiana and Mental Competency/*psychology and Chronic Disease/therapy and Frail Elderly/*psychology and Disabled Persons/*psychology and unbefriended and Legal Guardians/education/*psychology and Elder Abuse/prevention & control/psychology and guardian and Health Resources/economics/statistics & numerical data and Health Services Needs and Demand/economics/organization & administration and incapacitated and Patient Advocacy/economics/education/*psychology and Single Person/*psychology and Social Welfare/economics/psychology and Utilization Review/economics and Volunteers/education/*psychology and Vulnerable Populations/*psychology",NA,NA,2014/11//undefined,J Am Geriatr Soc,NA,NA,NA,NA
D.Adamo_2020_JoofthAmGeSo,JOUR,Coronavirus Disease 2019 in Geriatrics and Long-Term Care: The ABCDs of COVID-19,"D'Adamo, Heather and Yoshikawa, Thomas and Ouslander, Joseph G.",Journal of the American Geriatrics Society,"The pandemic of coronavirus disease of 2019 (COVID-19) is having a global impact unseen since the 1918 worldwide influenza epidemic. All aspects of life have changed dramatically for now. The group most susceptible to COVID-19 are older adults and those with chronic underlying medical disorders. The population residing in long-term care facilities generally are those who are both old and have multiple comorbidities. In this article we provide information, insights, and recommended approaches to COVID-19 in the long-term facility setting. Because the situation is fluid and changing rapidly, readers are encouraged to access frequently the resources cited in this article. J Am Geriatr Soc 68:912-917, 2020.",2020,10.1111/jgs.16445,68,5,912-917,eng,1532-5415 0002-8614,"COVID-19 and Humans and Aged and Decision Making and Risk Factors and Health Knowledge, Attitudes, Practice and Comorbidity and Infection Control and Long-Term Care and coronavirus and United States/epidemiology and pandemic and Health Personnel/psychology and Pandemics/*prevention & control and long-term care and Coronavirus Infections/*epidemiology/*prevention & control and Pneumonia, Viral/*epidemiology/*prevention & control and *Geriatrics and *Residential Facilities",NA,NA,2020/05//undefined,J Am Geriatr Soc,NA,NA,NA,NA
Bayliss_2016_JoofthAmGeSo,JOUR,Using Electronic Health Record Data to Measure Care Quality for Individuals with Multiple Chronic Medical Conditions,"Bayliss, Elizabeth A. and McQuillan, Deanna B. and Ellis, Jennifer L. and Maciejewski, Matthew L. and Zeng, Chan and Barton, Mary B. and Boyd, Cynthia M. and Fortin, Martin and Ling, Shari M. and Tai-Seale, Ming and Ralston, James D. and Ritchie, Christine S. and Zulman, Donna M.",Journal of the American Geriatrics Society,"OBJECTIVES: To inform the development of a data-driven measure of quality care for individuals with multiple chronic conditions (MCCs) derived from an electronic health record (EHR). DESIGN: Qualitative study using focus groups, interactive webinars, and a modified Delphi process. SETTING: Research department within an integrated delivery system. PARTICIPANTS: The webinars and Delphi process included 17 experts in clinical geriatrics and primary care, health policy, quality assessment, health technology, and health system operations. The focus group included 10 individuals aged 70-87 with three to six chronic conditions selected from a random sample of individuals aged 65 and older with three or more chronic medical conditions. MEASUREMENTS: Through webinars and the focus group, input was solicited on constructs representing high-quality care for individuals with MCCs. A working list was created of potential measures representing these constructs. Using a modified Delphi process, experts rated the importance of each possible measure and the feasibility of implementing each measure using EHR data. RESULTS: High-priority constructs reflected processes rather than outcomes of care. High-priority constructs that were potentially feasible to measure included assessing physical function, depression screening, medication reconciliation, annual influenza vaccination, outreach after hospital admission, and documented advance directives. High-priority constructs that were less feasible to measure included goal setting and shared decision-making, identifying drug-drug interactions, assessing social support, timely communication with patients, and other aspects of good customer service. Lower-priority domains included pain assessment, continuity of care, and overuse of screening or laboratory testing. CONCLUSION: High-quality MCC care should be measured using meaningful process measures rather than outcomes. Although some care processes are currently extractable from electronic data, capturing others will require adapting and applying technology to encourage holistic, person-centered care.",2016,10.1111/jgs.14248,64,9,1839-1844,eng,1532-5415 0002-8614,"quality and Humans and Female and Male and Aged and Quality Improvement and Comorbidity and Qualitative Research and electronic health record and Aged, 80 and over and Delphi Technique and Focus Groups and multimorbidity and Chronic Disease/*therapy and *Quality of Health Care and *Electronic Health Records and *Outcome and Process Assessment, Health Care",NA,NA,2016/09//undefined,J Am Geriatr Soc,NA,NA,NA,NA
Keim_2020_JoofthAmGeSo,JOUR,Patient Factors Linked with Return Acute Healthcare Use in Older Adults by Discharge Disposition,"Keim, Susan K. and Ratcliffe, Sarah J. and Naylor, Mary D. and Bowles, Kathryn H.",Journal of the American Geriatrics Society,"OBJECTIVES: Compare patient characteristics by hospital discharge disposition (home without services, home with home healthcare (HHC) services, or post-acute care (PAC) facilities). Examine timing and rates of 30-day healthcare utilization (rehospitalization, emergency department (ED) visit, or observation (OBS) visit) and patient characteristics associated with rehospitalization by discharge location. DESIGN: Retrospective analysis of hospital administrative and clinical data. SETTING AND PARTICIPANTS: A total of 3,294 older adult inpatients discharged home with or without HHC services or to a PAC facility. MEASUREMENTS: Patient-level sociodemographic and clinical characteristics. Number of and time to occurrences of rehospitalization or ED/OBS visit within 30 days of hospital discharge. RESULTS: Most rehospitalizations and ED/OBS visits occurred within 14 days from hospital discharge. Patients who returned within 24 hours came mostly from inpatient rehabilitation facilities (IRFs). More intense levels of PAC services were linked with higher rehospitalization risk. However, specific predictors differed by discharge location. Being unemployed, being single, and having more comorbidities were most associated with rehospitalization in those who went home with or without services, whereas patients rehospitalized from IRFs were younger, with less chronic illness burden, but greater and recent functional decline. Those discharged with HHC services had more return ED/OBS visits. CONCLUSIONS: Although sicker patients were referred for more intense levels of PAC services, patients with greater chronic illness burden were still most often rehospitalized. In addition to unique patient differences, rehospitalizations from IRF within 24 hours suggest systems factors are contributory. Most return acute healthcare utilization occurred within 14 days; therefore, interventions should focus on smoothing transitions to all discharge locations. Because predictors of rehospitalization risk differed by discharge disposition, future research is necessary to study approaches aimed at matching patients' care needs with the most suitable PAC services at the right time. J Am Geriatr Soc 68:2279-2287, 2020.",2020,10.1111/jgs.16645,68,10,2279-2287,eng,1532-5415 0002-8614,"United States and Humans and Female and Male and Retrospective Studies and Aged and Aged, 80 and over and Patient Acceptance of Health Care/*statistics & numerical data and Patient Readmission/*statistics & numerical data and clinical decision support systems and readmission risk and patient discharge and Patient Discharge/*statistics & numerical data and post-acute care and Home Care Services/statistics & numerical data and inpatient rehabilitation facility and Skilled Nursing Facilities/statistics & numerical data and Subacute Care/statistics & numerical data",NA,NA,2020/10//undefined,J Am Geriatr Soc,NA,NA,NA,NA
Fried_2017_JoofthAmGeSo_1,JOUR,A Dyadic Perspective on Engagement in Advance Care Planning,"Fried, Terri and Zenoni, Maria and Iannone, Lynne",Journal of the American Geriatrics Society,"OBJECTIVES: To understand the perspectives of both patients and the person who would make medical decisions for them if they were unable (surrogates) on their participation in advance care planning (ACP). DESIGN: Qualitative cross-sectional study. SETTING: Community. PARTICIPANTS: Thirty-one veterans age 55 years and older and their surrogates. MEASUREMENTS: In interviews conducted with both the veteran and surrogate, they were asked to discuss their participation in four ACP activities: communication about life-sustaining treatment, communication about views on quality of life, completion of a living will, and appointment of a healthcare proxy. They were asked about barriers to and facilitators of ACP engagement. When they did not agree about engagement, they each provided their perspective on what they believed had or had not occurred. RESULTS: Many of the same barriers to and facilitators of engagement were discussed by both patients and surrogates. These included difficulty thinking about dying, differences in values, and experiences with others that demonstrated the ability of ACP to decrease burden or avoid conflict. Reasons for disagreements in perceptions about whether communication had occurred included surrogates' need for more detailed information, surrogates' lack of readiness to hear what the patient was saying, and surrogates' reliance on what they know about the patient. For some dyads, participation in the study prompted additional communication, resulting in a better shared understanding of ACP engagement. CONCLUSION: Surrogates can both impede and facilitate engagement in ACP, and they can hold different perceptions from patients regarding this engagement. Efforts to promote ACP may be most successful if they assess and address both patients' and surrogates' attitudes and help to facilitate clear communication between them.",2017,10.1111/jgs.14497,65,1,172-178,eng,1532-5415 0002-8614,Communication and communication and Connecticut and Humans and Female and Male and Middle Aged and Cross-Sectional Studies and Aged and Veterans and Interviews as Topic and Patient Preference and *Decision Making and *Advance Care Planning and *Proxy and *Attitude to Death and advance care planning and surrogates,NA,NA,2017/01//undefined,J Am Geriatr Soc,NA,NA,NA,NA
Jacobsohn_2019_JoofthAmGeSo,JOUR,Factors Influencing Emergency Care by Persons With Dementia: Stakeholder Perceptions and Unmet Needs,"Jacobsohn, Gwen Costa and Hollander, Matthew and Beck, Aaron P. and Gilmore-Bykovskyi, Andrea and Werner, Nicole and Shah, Manish N.",Journal of the American Geriatrics Society,"BACKGROUND/OBJECTIVES: People with dementia (PwD) frequently use emergency care services. To mitigate the disproportionately high rate of emergency care use by PwD, an understanding of contributing factors driving reliance on emergency care services and identification of feasible alternatives are needed. This study aimed to identify clinician, caregiver, and service providers' views and experiences of unmet needs leading to emergency care use among community-dwelling PwD and alternative ways of addressing these needs. DESIGN: Qualitative, employing semistructured interviews with clinicians, informal caregivers, and aging service providers. SETTING: Wisconsin, United States. PARTICIPANTS: Informal caregivers of PwD (n = 4), emergency medicine physicians (n = 4), primary care physicians (n = 5), geriatric healthcare providers (n = 5), aging service providers (n = 6), and community paramedics (n = 3). MEASUREMENTS: Demographic characteristics of participants and data from semistructured interviews. FINDINGS: Four major themes were identified from interviews: (1) system fragmentation influences emergency care use by PwD, (2) informational, decision-making, and social support needs influence emergency care use by PwD, (3) emergency departments (EDs) are not designed to optimally address PwD and caregiver needs, and (4) options to prevent and address emergency care needs of PwD. CONCLUSION: Participants identified numerous system and individual-level unmet needs and offered many recommendations to prevent or improve ED use by PwD. These novel findings, aggregating the perspectives of multiple dementia-care stakeholder groups, serve as the first step to developing interventions that prevent the need for emergency care or deliver tailored emergency care services to this vulnerable population through new approaches. J Am Geriatr Soc 67:711-718, 2019.",2019,10.1111/jgs.15737,67,4,711-718,eng,1532-5415 0002-8614,Humans and Female and Male and Adult and Middle Aged and primary care and dementia and emergency department and *Attitude of Health Personnel and Dementia/*therapy and Emergency Medical Services/*statistics & numerical data and acute illness and caregiving and Facilities and Services Utilization/*statistics & numerical data and Health Services Needs and Demand/*statistics & numerical data,NA,NA,2019/04//undefined,J Am Geriatr Soc,NA,NA,NA,NA
Overbeek_2018_JoofthAmGeSo,JOUR,Advance Care Planning in Frail Older Adults: A Cluster Randomized Controlled Trial,"Overbeek, Anouk and Korfage, Ida J. and Jabbarian, Lea J. and Billekens, Pascalle and Hammes, Bernard J. and Polinder, Suzanne and Severijnen, Johan and Swart, Siebe J. and Witkamp, Frederika E. and van der Heide, Agnes and Rietjens, Judith A. C.",Journal of the American Geriatrics Society,"OBJECTIVES: To determine the effectiveness of advance care planning (ACP) in frail older adults. DESIGN: Cluster randomized controlled trial. SETTING: Residential care homes in the Netherlands (N=16). PARTICIPANTS: Care home residents and community-dwelling adults receiving home care (N=201; n=101 intervention; n=100 control). Participants were 75 years and older, frail, and capable of consenting to participation. INTERVENTION: Adjusted Respecting Choices ACP program. MEASUREMENTS: The primary outcome was change in patient activation (Patient Activation Measure, PAM-13) between baseline and 12-month follow-up. Secondary outcomes included change in quality of life (SF-12), advance directive (AD) completion, and surrogate decision-maker appointment. Use of medical care in the 12 months after inclusion was also assessed. Multilevel analyses were performed, controlling for clustering effects and differences in demographics. RESULTS: Seventy-seven intervention participants and 83 controls completed the follow-up assessment. There were no statistically significant differences between the intervention (-0.26<c2><b1>11.2) and control group (-1.43<c2><b1>10.6) in change scores of the PAM (p=.43) or the SF-12. Of intervention group participants, 93% completed an AD, and 94% appointed a decision-maker. Of control participants, 34% completed an AD, and 67% appointed a decision-maker (p<.001). No differences in the use of medical care were found. CONCLUSIONS: ACP did not increase levels of patient activation or quality of life but did increase completion of ADs and appointment of surrogate decision-makers. It did not affect use of medical care.",2018,10.1111/jgs.15333,66,6,1089-1095,eng,1532-5415 0002-8614,"Humans and Patient-Centered Care and Female and Male and Aged and Decision Making and Aged, 80 and over and Outcome Assessment, Health Care and Netherlands and Geriatric Assessment and *Quality of Life and patient activation and older adults and frailty and advance care planning and Advance Care Planning/*organization & administration and randomized controlled trial and *Advance Directives/psychology/statistics & numerical data and Homes for the Aged/statistics & numerical data and *Frail Elderly/psychology/statistics & numerical data and Independent Living/psychology/statistics & numerical data and Patient Participation/*methods/psychology/statistics & numerical data",NA,NA,2018/07//undefined,J Am Geriatr Soc,NA,NA,NA,NA
