label,type,title,author,journal,abstract,year,doi,volume,issue,pages,language,issn,keywords,url,institution,DA,j2,DP,l1,l2,ST
Moorhouse_2012_JoofthAmGeSo,JOUR,Palliative and therapeutic harmonization: a model for appropriate decision-making in frail older adults,"Moorhouse, Paige and Mallery, Laurie H.",Journal of the American Geriatrics Society,"Frail older adults face increasingly complex decisions regarding medical care. The Palliative and Therapeutic Harmonization (PATH) model provides a structured approach that places frailty at the forefront of medical and surgical decision-making in older adults. Preliminary data from the first 150 individuals completing the PATH program shows that the population served is frail (mean Clinical Frailty Score = 6.3), has multiple comorbidities (mean 8), and takes many medications (mean = 9). Ninety-two percent of participants were able to complete decision-making for an average of three current or projected health issues, most often (76.7%) with the help of a substitute decision-maker (SDM). Decisions to proceed with scheduled medical or surgical interventions correlated with baseline frailty level and dementia stage, with participants with a greater degree of frailty (odds ratio (OR) = 3.41, 95% confidence interval (CI) = 1.39-8.38) or more-advanced stage of dementia (OR = 1.66, 95% CI = 1.06-2.65) being more likely to choose less-aggressive treatment options. Although the PATH model is in the development stage, further evaluation is ongoing, including a qualitative analysis of the SDM experience of PATH and an assessment of the effectiveness of PATH in long-term care. The results of these studies will inform the design of a larger randomized controlled trial.",2012,10.1111/j.1532-5415.2012.04210.x,60,12,2326-2332,eng,1532-5415 0002-8614,"Humans and Female and Male and Aged and Decision Making and Models, Theoretical and Aged, 80 and over and *Palliative Care and *Geriatric Assessment and *Frail Elderly and *Health Planning and Dementia/diagnosis",NA,NA,2012/12//undefined,J Am Geriatr Soc,NA,NA,NA,NA
Sapkota_2018_Frinagne,JOUR,"Alzheimer's Biomarkers From Multiple Modalities Selectively Discriminate Clinical Status: Relative Importance of Salivary Metabolomics Panels, Genetic, Lifestyle, Cognitive, Functional Health and Demographic Risk Markers","Sapkota, Shraddha and Huan, Tao and Tran, Tran and Zheng, Jiamin and Camicioli, Richard and Li, Liang and Dixon, Roger A.",Frontiers in aging neuroscience,"Background: Among the neurodegenerative diseases of aging, sporadic Alzheimer's disease (AD) is the most prevalent and perhaps the most feared. With virtually no success at finding pharmaceutical therapeutics for altering progressive AD after diagnosis, research attention is increasingly directed at discovering biological and other markers that detect AD risk in the long asymptomatic phase. Both early detection and precision preclinical intervention require systematic investigation of multiple modalities and combinations of AD-related biomarkers and risk factors. We extend recent unbiased metabolomics research that produced a set of metabolite biomarker panels tailored to the discrimination of cognitively normal (CN), cognitively impaired and AD patients. Specifically, we compare the prediction importance of these panels with five other sets of modifiable and non-modifiable AD risk factors (genetic, lifestyle, cognitive, functional health and bio-demographic) in three clinical groups. Method: The three groups were: CN (n = 35), mild cognitive impairment (MCI; n = 25), and AD (n = 22). In a series of three pairwise comparisons, we used machine learning technology random forest analysis (RFA) to test relative predictive importance of up to 19 risk biomarkers from the six AD risk domains. Results: The three RFA multimodal prediction analyses produced significant discriminating risk factors. First, discriminating AD from CN was the AD metabolite panel and two cognitive markers. Second, discriminating AD from MCI was the AD/MCI metabolite panel and two cognitive markers. Third, discriminating MCI from CN was the MCI metabolite panel and seven markers from four other risk modalities: genetic, lifestyle, cognition and functional health. Conclusions: Salivary metabolomics biomarker panels, supplemented by other risk markers, were robust predictors of: (1) clinical differences in impairment and dementia and even; (2) subtle differences between CN and MCI. For the latter, the metabolite panel was supplemented by biomarkers that were both modifiable (e.g., functional) and non-modifiable (e.g., genetic). Comparing, integrating and identifying important multi-modal predictors may lead to novel combinations of complex risk profiles potentially indicative of neuropathological changes in asymptomatic or preclinical AD.",2018,10.3389/fnagi.2018.00296,10,NA,296,eng,1663-4365,cognition and genetics and Alzheimer's disease and mild cognitive impairment and biomarkers and cognitively normal and salivary metabolomics and victoria longitudinal study,NA,NA,2018///,Front Aging Neurosci,NA,NA,NA,NA
Siegel_2017_JoAd.J,JOUR,Deep Brain Stimulation for Alzheimer's Disease: Ethical Challenges for Clinical Research,"Siegel, Andrew M. and Barrett, Marna S. and Bhati, Mahendra T.",Journal of Alzheimer's disease : JAD,"Deep brain stimulation (DBS) is an invasive neuromodulation modality that has shown early promise as a novel treatment of Alzheimer's disease (AD). Further clinical research is warranted on the basis of positive results from animal and human studies, as well as the inadequacy of existing treatments in reducing the enormous medical and financial costs of untreated AD. Nevertheless, unique ethical challenges require particular attention to elements of subject enrollment and informed consent. Study protocols should specify robust assessment and regular monitoring of subject decision-making capacity to consent to trial participation. Investigators should also assess for and mitigate therapeutic misconception (the phenomenon whereby a research participant conflates the goals of research with those of clinical treatment) and ensure that all prospective trial participants have adequate post-trial access to treatment and DBS device maintenance. In the following discussion, each issue is summarized and followed by recommendations for proper ethical procedure. We conclude by assimilating relevant ethical considerations into a decision-making algorithm designed to aid future clinical investigators of DBS for AD with the task of ethical subject enrollment.",2017,10.3233/JAD-160356,56,2,429-439,eng,1875-8908 1387-2877,Humans and Animals and Alzheimer's disease and Alzheimer Disease/*therapy and Informed Consent/ethics and Advance directive and informed consent and research ethics and Clinical Trials as Topic/ethics and deep brain stimulation and Deep Brain Stimulation/*ethics and Scopoletin,NA,NA,2017///,J Alzheimers Dis,NA,NA,NA,NA
Petrillo_2018_JoofthAmGeSo,JOUR,"Older Adult and Surrogate Perspectives on Serious, Difficult, and Important Medical Decisions","Petrillo, Laura A. and McMahan, Ryan D. and Tang, Victoria and Dohan, Daniel and Sudore, Rebecca L.",Journal of the American Geriatrics Society,"OBJECTIVES: To elicit decisions that diverse older adults and surrogates perceive as serious, difficult, or important and explore what helped them make those decisions. DESIGN: Focus groups (N=13) in which participants were asked to recall serious, difficult, or important medical decisions and what helped them make those decisions. SETTING: Clinics, support groups and senior centers. PARTICIPANTS: Diverse English- and Spanish-speaking older adults (age: mean 78, range 64-89) and surrogates (age: mean 57, range 33-76) (29% African American, 26% white, 26% Asian or Pacific Islander, 19% Hispanic) (N=69). MEASUREMENTS: We used thematic analysis to analyze transcripts. RESULTS: We identified 168 decisions. Older adults from all racial and ethnic groups frequently recalled cancer treatment decisions and decisions about chronic illness management. Surrogates described decisions about transitions in care and medical crises. Older adults valued self-sufficiency and maximizing survival and relied on personal experiences as often as medical advice. In all racial and ethnic groups, surrogates valued avoiding suffering for loved ones. CONCLUSION: Diverse older adults and surrogates perceive life-threatening illness and day-to-day decisions about chronic disease to be serious, difficult, and important. The surrogates' goal of avoiding suffering of older adults may differ from older adults' priorities of self-sufficiency and maximizing survival. Clinicians should support older adults and surrogates in identifying important and difficult decisions and learn about the values and information sources they bring to decision-making. With this knowledge, clinicians can customize decision support and achieve person-centered care.",2018,10.1111/jgs.15426,66,8,1515-1523,eng,1532-5415 0002-8614,"Humans and Female and Male and Adult and Middle Aged and Aged and Aged, 80 and over and person-centered care and Focus Groups and Advance Care Planning and *Decision Making and Terminal Care/*psychology and medical decision-making and advance care planning and serious illness and African Americans/*psychology and Advance Directives/ethnology/psychology and Chronic Disease/ethnology/psychology and Hispanic or Latino/*psychology and Whites/*psychology",NA,NA,2018/08//undefined,J Am Geriatr Soc,NA,NA,NA,NA
Rosen_2019_JoAd.J,JOUR,Are Disease Modifying Treatments Enough? Improving Quality of Life in Late-Stage Patients,"Rosen, Allyson C. and Toy, Leslie and Langston, Ashley H.",Journal of Alzheimer's disease : JAD,The potential for successful disease modifying treatments for Alzheimer's disease (AD) opens up the possibility that there will be a large cohort of patients living with late-stage dementia and poor quality of life. There must thus be a parallel effort to leverage restorative therapies that improve quality of life in these patients. With the potential for stopping the onset of AD in new patients must come a commitment to those patients living with this chronic disability for many more years than first thought. Legal and ethical implications surrounding who makes decisions and equity in receiving care will become increasingly important if AD is no longer a terminal illness.,2019,10.3233/JAD-181193,68,4,1317-1319,eng,1875-8908 1387-2877,"Humans and Alzheimer's disease and dementia and quality of life and therapy and Ethics, Medical and *Decision Making and *Quality of Life and hospice and end of life and Palliative Care/*ethics and neuroethics and Alzheimer Disease/*drug therapy",NA,NA,2019///,J Alzheimers Dis,NA,NA,NA,NA
Reckrey_2011_JoofthAmGeSo,JOUR,Resident physician interactions with surrogate decision-makers: the resident experience,"Reckrey, Jennifer M. and McKee, M. Diane and Sanders, Justin J. and Lipman, Hannah I.",Journal of the American Geriatrics Society,"This study explored interactions between medical residents and patient surrogates in order to clarify resident understanding of roles and relationships, resident emotional experience, and resident learning processes. Qualitative analysis of in-depth interviews were used involving three family medicine residency programs serving culturally diverse, urban, underserved patient populations. Eighteen second- and third-year trainees described a memorable interaction with a surrogate and then were prompted to discuss their learning experience and their role in the interaction. Interviews were transcribed verbatim and analyzed through an iterative process. Residents experienced significant emotional burden during interactions yet continued to value their relationships with surrogates. Despite their reservations about giving recommendations, residents adopted a variety of roles with surrogates as they gave support, information, and advice. Although residents reported little formal education about surrogate decision-making, they relied on passive role modeling and their own previous experiences to help surrogates make decisions. Residents have complex and emotionally significant interactions with surrogates despite minimal formal education about surrogate decision-making. Educational efforts should seek to help residents understand their own emotions and the ethical beliefs that underlie the roles they adopt with surrogates. This will help residents to facilitate value-based conversations with surrogates and better support surrogates in the decision-making process.",2011,10.1111/j.1532-5415.2011.03728.x,59,12,2341-2346,eng,1532-5415 0002-8614,Humans and *Decision Making and *Internship and Residency and *Professional-Family Relations,NA,NA,2011/12//undefined,J Am Geriatr Soc,NA,NA,NA,NA
Farrell_2017_JoofthAmGeSo,JOUR,AGS Position Statement: Making Medical Treatment Decisions for Unbefriended Older Adults,"Farrell, Timothy W. and Widera, Eric and Rosenberg, Lisa and Rubin, Craig D. and Naik, Aanand D. and Braun, Ursula and Torke, Alexia and Li, Ina and Vitale, Caroline and Shega, Joseph",Journal of the American Geriatrics Society,"In this position statement, we define unbefriended older adults as patients who: (1) lack decisional capacity to provide informed consent to the medical treatment at hand; (2) have not executed an advance directive that addresses the medical treatment at hand and lack capacity to do so; and (3) lack family, friends or a legally authorized surrogate to assist in the medical decision-making process. Given the vulnerable nature of this population, clinicians, health care teams, ethics committees and other stakeholders working with unbefriended older adults must be diligent when formulating treatment decisions on their behalf. The process of arriving at a treatment decision for an unbefriended older adult should be conducted according to standards of procedural fairness and include capacity assessment, a search for potentially unidentified surrogate decision makers (including non-traditional surrogates) and a team-based effort to ascertain the unbefriended older adult's preferences by synthesizing all available evidence. A concerted national effort is needed to help reduce the significant state-to-state variability in legal approaches to unbefriended patients. Proactive efforts are also needed to identify older adults, including ""adult orphans,"" at risk for becoming unbefriended and to develop alternative approaches to medical decision making for unbefriended older adults. This document updates the 1996 AGS position statement on unbefriended older adults.",2017,10.1111/jgs.14586,65,1,14-15,eng,1532-5415 0002-8614,surrogate decision maker and substituted judgment and best interest and capacity assessment and ethics committee and position statement and unbefriended,NA,NA,2017/01//undefined,J Am Geriatr Soc,NA,NA,NA,NA
Emre_2014_Md.ojotMDS,JOUR,Cognitive impairment and dementia in Parkinson's disease: practical issues and management,"Emre, Murat and Ford, Paul J. and Bilgic, Basar and Uc, Ergun Y.",Movement disorders : official journal of the Movement Disorder Society,"Cognitive impairment and dementia pose particular challenges in the management of patients with Parkinson's disease (PD). Decision-making capacity can render patients vulnerable in a way that requires careful ethical considerations by clinicians with respect to medical decision making, research participation, and public safety. Clinicians should discuss how future decisions will be made as early in the disease course as possible. Because of cognitive, visual, and motor impairments, PD may be associated with unsafe driving, leading to early driving cessation in many. DBS of the STN and, to a lesser degree, globus pallidus interna (GPi) has consistently been associated with decreased verbal fluency, but significant global cognitive decline is usually not observed in patients who undergo rigorous selection. There are some observations suggesting lesser cognitive decline in GPi DBS than STN DBS, but further research is required. Management of PD dementia (PDD) patients involves both pharmacological and nonpharmacological measures. Patients with PDD should be offered treatment with a cholinesterase inhibitor taking into account expected benefits and potential risks. Treatment with neuroleptics may be necessary to treat psychosis; classical neuroleptics, as well as risperidone and olanzapine, should be avoided. Quetiapine might be considered first-line treatment because it does not need special monitoring, although the strongest evidence for efficacy exists for clozapine. Evidence from randomized, controlled studies in the PDD population is lacking; selective serotonin reuptake inhibitors or serotonin-norepinephrine reuptake inhibitors may be used to treat depressive features. Clonazepam or melatonin may be useful in the treatment of rapid eye movement behavior disorder.",2014,10.1002/mds.25870,29,5,663-672,eng,1531-8257 0885-3185,Humans and ethics and Animals and dementia and Automobile Driving and Parkinson's disease and decision-making capacity and cognitive impairment and Cognition/physiology and Cognition Disorders/physiopathology/psychology/*therapy and Dementia/etiology/physiopathology/psychology/*therapy and driving and Parkinson Disease/complications/diagnosis/physiopathology/*therapy,NA,NA,2014/04/15/,Mov Disord,NA,NA,NA,NA
Ho_2015_JoofthAmGeSo,JOUR,When Frail Individuals or Their Families Request Nonindicated Interventions: Usefulness of the Four-Box Ethical Approach,"Ho, Anita and Spencer, Martha and McGuire, Marlee",Journal of the American Geriatrics Society,"In the age of person-centered care, there is an emphasis on promoting patient autonomy and surrogate decision maker authority in making treatment decisions that are aligned with the patient's priorities and values. As technological advances offer multiple clinical options with various levels and types of risks and benefits, person-centered clinical practice encourages the incorporation of patients' and families' heterogeneous experiences into decisions regarding illness management. In caring for frail elderly adults, clinicians are sometimes faced with situations in which individuals and their surrogate decision-makers request a treatment that the clinicians feel is clinically inappropriate. This article provides a case example of a frail older adult with advanced chronic kidney disease who requests dialysis despite the advice of his nephrologist to pursue conservative management. The four-box approach, which provides clinicians with a structured ethical framework to facilitate informed and ethically justified treatment decisions, is then introduced. By considering the patient's medical indications, preferences, quality of life, and contextual factors, how each consideration plays a unique yet equally important role in informing clinically responsible and person-centered care is illustrated.",2015,10.1111/jgs.13531,63,8,1674-1678,eng,1532-5415 0002-8614,"Humans and Aged and Aged, 80 and over and patient-centered care and *Decision Making and *Quality of Life and *Ethics, Medical and Family/*psychology and *Personal Autonomy and Frail Elderly/*psychology and shared decision-making and dialysis and chronic kidney disease and ethical framework",NA,NA,2015/08//undefined,J Am Geriatr Soc,NA,NA,NA,NA
Franke_2017_Frinagne,JOUR,Premature Brain Aging in Baboons Resulting from Moderate Fetal Undernutrition,"Franke, Katja and Clarke, Geoffrey D. and Dahnke, Robert and Gaser, Christian and Kuo, Anderson H. and Li, Cun and Schwab, Matthias and Nathanielsz, Peter W.",Frontiers in aging neuroscience,"Contrary to the known benefits from a moderate dietary reduction during adulthood on life span and health, maternal nutrient reduction during pregnancy is supposed to affect the developing brain, probably resulting in impaired brain structure and function throughout life. Decreased fetal nutrition delivery is widespread in both developing and developed countries, caused by poverty and natural disasters, but also due to maternal dieting, teenage pregnancy, pregnancy in women over 35 years of age, placental insufficiency, or multiples. Compromised development of fetal cerebral structures was already shown in our baboon model of moderate maternal nutrient reduction. The present study was designed to follow-up and evaluate the effects of moderate maternal nutrient reduction on individual brain aging in the baboon during young adulthood (4-7 years; human equivalent 14-24 years), applying a novel, non-invasive neuroimaging aging biomarker. The study reveals premature brain aging of +2.7 years (p < 0.01) in the female baboon exposed to fetal undernutrition. The effects of moderate maternal nutrient reduction on individual brain aging occurred in the absence of fetal growth restriction or marked maternal weight reduction at birth, which stresses the significance of early nutritional conditions in life-long developmental programming. This non-invasive MRI biomarker allows further longitudinal in vivo tracking of individual brain aging trajectories to assess the life-long effects of developmental and environmental influences in programming paradigms, aiding preventive and curative treatments on cerebral atrophy in experimental animal models and humans.",2017,10.3389/fnagi.2017.00092,9,NA,92,eng,1663-4365,machine learning and magnetic resonance imaging (MRI) and BrainAGE and developmental programming and in vivo and maternal nutrient restriction (MNR) and non-human primates,NA,NA,2017///,Front Aging Neurosci,NA,NA,NA,NA
Watt_2019_JoAd.J,JOUR,"""To Treat or not To Treat"": Informing the Decision for Disease-Modifying Therapy in Late-Stage Alzheimer's Disease","Watt, Andrew D. and Jenkins, Nicole L. and McColl, Gawain and Collins, Steven and Desmond, Patricia M.",Journal of Alzheimer's disease : JAD,"Rosen et al. thoughtfully extend the ethical discussion surrounding disease-modifying therapies in late-stage Alzheimer's disease (AD) to correctly emphasize that the perceived quality of life (QoL) of the individual living with the disease is a critical component to decisions regarding their clinical care. The primary purpose of our original article regarding the use of disease-modifying therapeutics in late-stage AD was to ensure that those affected by AD and their primary care team are empowered to make informed care decisions in the best interest of the individual living with AD. Consequently, it appears axiomatic that major therapeutic decisions need to incorporate consideration of the current and future QoL of individuals living with dementia; however, in the absence of effective restorative therapies, it is important to acknowledge the context within which extant QoL measures were developed and question whether such measures are adequate to inform treatment decisions that may hold the potential to significantly or perhaps indefinitely prolong severe disability.",2019,10.3233/JAD-190033,68,4,1321-1323,eng,1875-8908 1387-2877,"Humans and ethics and Alzheimer's disease and quality of life and restoration and therapeutics and Ethics, Medical and *Decision Making and *Quality of Life and Palliative Care/*ethics and Alzheimer Disease/*drug therapy and late-stage",NA,NA,2019///,J Alzheimers Dis,NA,NA,NA,NA
de.la.Torre_2014_JoAd.J,JOUR,In-house heart-brain clinics to reduce Alzheimer's disease incidence,"de la Torre, Jack C.",Journal of Alzheimer's disease : JAD,"The incidence rate in Alzheimer's disease (AD) is expected to quadruple worldwide by 2050. To limit this impending socio-medical calamity, a fulcrum change from how AD is presently managed is crucial. The present approach has not averted the stress of AD on medical resources nor reduced the already cost-strained government health care programs. Since substantial evidence indicates that sporadic AD is directly associated with vascular risk factors, a strategic plan is proposed to target this association and markedly reduce the onset of AD. This plan would establish in-house heart-brain clinics devoted to identifying, detecting, and preventing the progression of vascular risk factors that predispose to cognitive impairment and development of AD. The heart-brain clinics would be staffed with a multidisciplinary group of neurologists, psychologists, neuroradiologists, cardiovascular specialists, and technical personnel Their goal would be to apply and interpret non-invasive, cost-effective multidiagnostic testing of heart and brain function in outpatient asymptomatic and symptomatic patients at risk of dementia. Multidiagnostic testing would permit better risk stratification, medical decision-making, and a tailored intervention of patients at-risk of dementia than the present monotherapeutic approach. Personalized intervention, moreover, should achieve better patient compliance and outcome through periodic follow-up visits to the clinics where the medical plan of action could be monitored and modified as needed. Multidisciplinary heart-brain clinics will be costly at first but eventually should become cost-effective while providing an invaluable medical service to an aging population and possibly extending years of full-health lived in those at risk of dementia.",2014,10.3233/JAD-141560,42 Suppl 4,NA,442-S431,eng,1875-8908 1387-2877,Humans and Risk Factors and prevention and Alzheimer's disease and Incidence and detection and cognitive impairment and *Alzheimer Disease/diagnosis/epidemiology/prevention & control and Cerebrovascular Disorders/*epidemiology and heart-brain clinics and multidiagnostic testing and Nervous System Diseases/*epidemiology and vascular risk factors,NA,NA,2014///,J Alzheimers Dis,NA,NA,NA,NA
