label,type,title,author,journal,abstract,year,doi,volume,issue,pages,language,issn,keywords,url,institution,DA,j2,DP,l1,l2,ST
Liu_2018_ThJoofar,JOUR,Patient-Identified Barriers and Facilitators to Pre-Visit Patient-Reported Outcomes Measures Completion in Patients With Hip and Knee Pain,"Liu, Tiffany C. and Ohueri, Chelsi W. and Schryver, Eric M. and Bozic, Kevin J. and Koenig, Karl M.",The Journal of arthroplasty,"BACKGROUND: Although patient-reported outcomes measures (PROMs) provide valuable health information and aid medical decision making for patients with hip and knee arthritis, survey completion rates remain low. The purpose of this study is to elucidate patient preferences regarding location of completion, delivery method, and barriers or facilitators to pre-visit completion. METHODS: Patients with hip and/or knee pain who were asked to complete pre-visit PROMs at 2 urban arthroplasty clinics were recruited. In-person, semi-structured, audio-recorded interviews were conducted, transcribed, and coded for thematic analysis. Codes were developed using a data-driven approach. RESULTS: We analyzed 51 interviews. The mean age was 57 years, 57% were women, and 45% had private or Medicare insurance. Prevalent themes regarding location preferences were convenience and communication preferences. Thirty-four patients stated a preference for completing pre-visit PROMs at home, 19 for in-office completion, and 10 stated no preference. Prevalent themes around delivery methods included technology access and familiarity. Of the 43 patients asked to select their preferred pre-visit PROM delivery method (phone call, email, text message, or postal mail), 31 (72%) preferred email or text messaging. Barriers to completing pre-visit PROMs were technological issues, recognizing the message was healthcare-related, and being too busy or forgetting. Twenty patients identified no barriers. CONCLUSION: Electronic PROM collection is favored by many patients, but alternative methods for patients without access to or familiarity with technology remain important. Clear recognition that the message is from a physician's office and physician communication of the utility of PROMs in clinical decision making may increase pre-visit completion.",2018,10.1016/j.arth.2017.10.022,33,3,643-649.e1,eng,1532-8406 0883-5403,"Physicians and United States and Medicare and Humans and Female and Male and Adult and Middle Aged and Aged and Insurance, Health and Pilot Projects and Surveys and Questionnaires and value and Aged, 80 and over and Patient Preference and *Decision Making and *Patient Reported Outcome Measures and Data Collection/*methods and *Patient Participation and *Pain and Arthroplasty and electronic survey and Osteoarthritis, Hip/therapy and Osteoarthritis, Knee/therapy and patient-reported outcomes measures and survey completion and total hip and knee arthroplasty",NA,NA,2018/03//undefined,J Arthroplasty,NA,NA,NA,NA
Roberts_2019_Tb.jj,JOUR,Increased conditional risk of recurring complications with contralateral total hip arthroplasty surgery,"Roberts, H. J. and Tsay, E. L. and Grace, T. R. and Vail, T. P. and Ward, D. T.",The bone & joint journal,"AIMS: Increasingly, patients with bilateral hip arthritis wish to undergo staged total hip arthroplasty (THA). With the rise in demand for arthroplasty, perioperative risk assessment and counselling is crucial for shared decision making. However, it is unknown if complications that occur after a unilateral hip arthroplasty predict complications following surgery of the contralateral hip. PATIENTS AND METHODS: We used nationwide linked discharge data from the Healthcare Cost and Utilization Project between 2005 and 2014 to analyze the incidence and recurrence of complications following the first- and second-stage operations in staged bilateral total hip arthroplasty (BTHAs). Complications included perioperative medical adverse events within 30 to 60 days, and infection and mechanical complications within one year. Conditional probabilities and odds ratios (ORs) were calculated to determine whether experiencing a complication after the first stage of surgery increased the risk of developing the same complication after the second stage. RESULTS: A total of 13 829 patients (5790 men and 8039 women) who underwent staged BTHAs were analyzed. The mean age at first operation was 62.9 years (14 to 95). For eight of the 12 outcomes evaluated, patients who experienced the outcome following the first arthroplasty had a significantly increased probability and odds of developing that same complication following the second arthroplasty, compared with those who did not experience the complication after the first surgery. This was true for digestive complications (OR 25.67, 95% confidence interval (CI) 13.86 to 46.08; p < 0.001), urinary complications (OR 6.48, 95% CI 1.7 to 20.73; p = 0.01), haematoma (OR 12.17, 95% CI 4.55 to 31.14; p < 0.001), deep vein thrombosis (OR 4.82, 95% CI 2.34 to 9.65; p < 0.001), pulmonary embolism (OR 12.03, 95% CI 2.02 to 46.77; p = 0.01), deep hip infection (OR 534.21, 95% CI 314.96 to 909.25; p < 0.001), superficial hip infection (OR 1574.99, 95% CI 269.83 to 9291.81; p < 0.001), and mechanical malfunction (OR 117.49, 95% CI 91.55 to 150.34; p < 0.001). CONCLUSION: The occurrence of certain complications after unilateral THA is associated with an increased risk of the same complication occurring after staged arthroplasty of the contralateral hip. Patients who experience these complications after unilateral hip arthroplasty should be appropriately counselled regarding their risk profile prior to undergoing staged contralateral hip arthroplasty. Cite this article: Bone Joint J 2019;101-B(6 Supple B):77-83.",2019,10.1302/0301-620X.101B6.BJJ-2018-1488.R1,101-B,6_Supple_B,77-83,eng,2049-4408 2049-4394,"Humans and Female and Male and Adolescent and Adult and Middle Aged and Young Adult and Retrospective Studies and Aged and Risk Factors and Aged, 80 and over and Recurrence and Arthroplasty, Replacement, Hip/*adverse effects and Joint arthroplasty and Postoperative Complications/etiology and Bilateral and Hip arthroplasty and Osteoarthritis, Hip/*surgery and Staged",NA,NA,2019/06//undefined,Bone Joint J,NA,NA,NA,NA
Kelman_2016_ThJoofar,JOUR,The Choice Between Total Hip Arthroplasty and Arthrodesis in Adolescent Patients: A Survey of Orthopedic Surgeons,"Kelman, Mark G. and Studdert, David M. and Callaghan, John J. and Farid, Monica S. and Titan, Ashley L. and Dietz, Frederick R.",The Journal of arthroplasty,"For adolescent patients with end-stage hip disease, the choice between total hip arthroplasty (THA) and arthrodesis is complex; the clinical evidence is not definitive, and there are difficult trade-offs between clear short-term benefits from THA and uncertain long-term risks. We surveyed nearly 700 members of the Pediatric Orthopedic Society of North America and the American Association of Hip and Knee Surgeons. Respondents chose between a recommendation of THA or arthrodesis in four clinical vignettes. A clear majority of surgeons recommended THA in two of the vignettes, however opinion was somewhat divided in one vignette (overweight adolescent) and deeply divided in another (adolescent destined for manual labor job). Across all vignettes, recommendations varied systematically according to surgeons' age and their attitudes regarding tradeoffs between life stages.",2016,10.1016/j.arth.2015.07.020,31,1,70-75,eng,1532-8406 0883-5403,"Humans and Female and Male and Adolescent and Adult and Middle Aged and Aged and Surgeons and Surveys and Questionnaires and survey and ethics and adolescents and clinical decision making and Societies, Medical and Overweight and *Practice Patterns, Physicians' and North America and Orthopedics/*methods and total hip arthroplasty and arthrodesis and Arthrodesis/*statistics & numerical data and Arthroplasty, Replacement, Hip/*statistics & numerical data",NA,NA,2016/01//undefined,J Arthroplasty,NA,NA,NA,NA
Yin_2015_ThJoofboanjosuAmvo,JOUR,Impact of fellowship training on clinical practice of orthopaedic sports medicine,"Yin, Bob and Gandhi, Jaipal and Limpisvasti, Orr and Mohr, Karen and ElAttrache, Neal S.",The Journal of bone and joint surgery. American volume,"BACKGROUND: Approximately 90% of current orthopaedic graduates are engaging in fellowship training, with sports medicine being the most commonly chosen specialty. The purpose of this study was to evaluate the impact of fellowship training on clinical decision-making by fellowship-trained sports medicine surgeons. METHODS: A survey was designed to assess the importance of fellowship on common clinical decisions made in the nonoperative and surgical treatment of knee, shoulder, and elbow disorders. The survey also included questions for the respondents on their comfort level with a variety of routine and complex surgical procedures. The survey was sent to alumni of 113 orthopaedic sports medicine programs across the United States. RESULTS: Completed surveys were returned by 310 surgeons who had been in practice for an average of 9.0 years. They represented alumni of twenty-nine orthopaedic sports medicine fellowship programs across sixteen states. Fellowship was considered very important for surgical decision-making in the knee and shoulder. For nonoperative treatment, fellowship had a greater impact on shoulder disorders than on knee or elbow disorders. Fellowship was significantly more important than residency (p < 0.001) for determining preferred surgical equipment, implants, and braces. Among the surgical procedures assessed, respondents were least comfortable with the treatment of multi-ligamentous knee injuries, posterior cruciate ligament injuries, and shoulder instability with bone loss. CONCLUSIONS: Fellowship has a significantly higher impact than residency on industry-related decision-making. Fellowship-trained sports surgeons should consider seeking additional training in the treatment of multi-ligamentous knee injuries, posterior cruciate ligament injuries, shoulder instability with bone loss, and elbow disorders. The current findings were limited by the relatively small respondent pool, which represented only 26% of sports medicine fellowship programs in the United States.",2015,10.2106/JBJS.N.00164,97,5,e27,eng,1535-1386 0021-9355,"United States and Humans and Program Evaluation and Population Surveillance and Clinical Competence/*statistics & numerical data and Fellowships and Scholarships/*statistics & numerical data and Education, Medical, Graduate/*economics and Health Services Needs and Demand/statistics & numerical data and Joint Diseases/diagnosis/therapy and Knee/surgery and Orthopedic Procedures/methods and Orthopedics/*education/statistics & numerical data and Shoulder Joint/surgery and Shoulder/surgery and Sports Medicine/*education/statistics & numerical data",NA,NA,2015/03/04/,J Bone Joint Surg Am,NA,NA,NA,NA
Shohat_2020_Tb.jj,JOUR,2020 Frank Stinchfield Award: Identifying who will fail following irrigation and debridement for prosthetic joint infection,"Shohat, Noam and Goswami, Karan and Tan, Timothy L. and Yayac, Michael and Soriano, Alex and Sousa, Ricardo and Wouthuyzen-Bakker, Marjan and Parvizi, Javad",The bone & joint journal,"AIMS: Failure of irrigation and debridement (I&D) for prosthetic joint infection (PJI) is influenced by numerous host, surgical, and pathogen-related factors. We aimed to develop and validate a practical, easy-to-use tool based on machine learning that may accurately predict outcome following I&D surgery taking into account the influence of numerous factors. METHODS: This was an international, multicentre retrospective study of 1,174 revision total hip (THA) and knee arthroplasties (TKA) undergoing I&D for PJI between January 2005 and December 2017. PJI was defined using the Musculoskeletal Infection Society (MSIS) criteria. A total of 52 variables including demographics, comorbidities, and clinical and laboratory findings were evaluated using random forest machine learning analysis. The algorithm was then verified through cross-validation. RESULTS: Of the 1,174 patients that were included in the study, 405 patients (34.5%) failed treatment. Using random forest analysis, an algorithm that provides the probability for failure for each specific patient was created. By order of importance, the ten most important variables associated with failure of I&D were serum CRP levels, positive blood cultures, indication for index arthroplasty other than osteoarthritis, not exchanging the modular components, use of immunosuppressive medication, late acute (haematogenous) infections, methicillin-resistant Staphylococcus aureus infection, overlying skin infection, polymicrobial infection, and older age. The algorithm had good discriminatory capability (area under the curve = 0.74). Cross-validation showed similar probabilities comparing predicted and observed failures indicating high accuracy of the model. CONCLUSION: This is the first study in the orthopaedic literature to use machine learning as a tool for predicting outcomes following I&D surgery. The developed algorithm provides the medical profession with a tool that can be employed in clinical decision-making and improve patient care. Future studies should aid in further validating this tool on additional cohorts. Cite this article: Bone Joint J 2020;102-B(7 Supple B):11-19.",2020,10.1302/0301-620X.102B7.BJJ-2019-1628.R1,102-B,7_Supple_B,11-19,eng,2049-4408 2049-4394,"Humans and Female and Male and Retrospective Studies and Aged and Algorithms and Machine Learning and Age Factors and Failure and *Debridement and C-Reactive Protein/analysis and *Therapeutic Irrigation and *Treatment Failure and Arthroplasty, Replacement, Hip/adverse effects/methods and Arthroplasty, Replacement, Knee/adverse effects/methods and Gram-Negative Bacterial Infections/therapy and Gram-Positive Bacterial Infections/therapy and Hip Prosthesis/*adverse effects and Immunosuppressive Agents/adverse effects and Irrigation and debridement and Knee Prosthesis/*adverse effects and Prosthesis-Related Infections/microbiology/*therapy and Prosthetic joint infection and Skin Diseases, Bacterial/complications and Total hip arthroplasty",NA,NA,2020/07//undefined,Bone Joint J,NA,NA,NA,NA
Bodde_2014_ThJoofboanjosuAmvo,JOUR,Informed Decision-Making Regarding Amputation for Complex Regional Pain Syndrome Type I,"Bodde, Marlies I. and Dijkstra, Pieter U. and Schrier, Ernst and van den Dungen, Jan J. and den Dunnen, Wilfred F. and Geertzen, Jan H.",The Journal of bone and joint surgery. American volume,"BACKGROUND: Literature on complex regional pain syndrome type I (CRPS-I) discussing the decision to amputate or not, the level of amputation, or the timing of the amputation is scarce. We evaluated informed decision-making regarding amputation for CRPS-I. METHODS: We describe our findings in a retrospective study of the decision-making process of thirty-six patients who underwent amputation for CRPS-I at our university medical center from 2000 to 2012. Additionally, we present the incidents preceding the CRPS-I, the reasons for and the levels of the amputation, and the outcomes after the amputations. RESULTS: Team members and the patient decided together whether or not to amputate and the level of amputation. Issues such as level of pain or allodynia, infection, desired length of the residual limb, joint range of motion, strength of all extremities, ability to use walking aids, and psychological ""green, yellow, and red flags"" were weighed in this process. There were no complications during the amputation surgery, a 22% rate of complications (infection in all but one patient) immediately postoperatively (reamputation not required), a 72% rate of phantom pain immediately after or within the first three months after the amputation, and a 77% rate of phantom pain more than one year after the amputation. CONCLUSIONS: Informed decision-making regarding amputation for CRPS-I remains a complex process for which little evidence is available to support patient choices; patient-specific outcomes are not predictable. However, amputation should not be ignored as a treatment option for long-standing therapy-resistant CRPS-I. LEVEL OF EVIDENCE: Therapeutic Level IV. See Instructions for Authors for a complete description of levels of evidence.",2014,10.2106/JBJS.M.00788,96,11,930-934,eng,1535-1386 0021-9355,Humans and Female and Male and Adult and Middle Aged and Retrospective Studies and Treatment Outcome and Quality of Life and Pain Measurement and *Decision Making and *Amputation and Postoperative Complications/epidemiology and Arm/*surgery and Complex Regional Pain Syndromes/*psychology/*surgery and Leg/*surgery and Phantom Limb/epidemiology,NA,NA,2014/06/04/,J Bone Joint Surg Am,NA,NA,NA,NA
Sagheb_2021_ThJoofar,JOUR,Use of Natural Language Processing Algorithms to Identify Common Data Elements in Operative Notes for Knee Arthroplasty,"Sagheb, Elham and Ramazanian, Taghi and Tafti, Ahmad P. and Fu, Sunyang and Kremers, Walter K. and Berry, Daniel J. and Lewallen, David G. and Sohn, Sunghwan and Maradit Kremers, Hilal",The Journal of arthroplasty,"BACKGROUND: Natural language processing (NLP) methods have the capability to process clinical free text in electronic health records, decreasing the need for costly manual chart review, and improving data quality. We developed rule-based NLP algorithms to automatically extract surgery specific data elements from knee arthroplasty operative notes. METHODS: Within a cohort of 20,000 knee arthroplasty operative notes from 2000 to 2017 at a large tertiary institution, we randomly selected independent pairs of training and test sets to develop and evaluate NLP algorithms to detect five major data elements. The size of the training and test datasets were similar and ranged between 420 to 1592 surgeries. Expert rules using keywords in operative notes were used to implement NLP algorithms capturing: (1) category of surgery (total knee arthroplasty, unicompartmental knee arthroplasty, patellofemoral arthroplasty), (2) laterality of surgery, (3) constraint type, (4) presence of patellar resurfacing, and (5) implant model (catalog numbers). We used institutional registry data as our gold standard to evaluate the NLP algorithms. RESULTS: NLP algorithms to detect the category of surgery, laterality, constraint, and patellar resurfacing achieved 98.3%, 99.5%, 99.2%, and 99.4% accuracy on test datasets, respectively. The implant model algorithm achieved an F1-score (harmonic mean of precision and recall) of 99.9%. CONCLUSIONS: NLP algorithms are a promising alternative to costly manual chart review to automate the extraction of embedded information within knee arthroplasty operative notes. Further validation in other hospital settings will enhance widespread implementation and efficiency in data capture for research and clinical purposes. LEVEL OF EVIDENCE: Level III.",2021,10.1016/j.arth.2020.09.029,36,3,922-926,eng,1532-8406 0883-5403,"artificial intelligence and Humans and Electronic Health Records and natural language processing and electronic health records and Algorithms and Natural Language Processing and total knee arthroplasty and *Arthroplasty, Replacement, Knee and Common Data Elements and constraint and patella resurfacing",NA,NA,2021/03//undefined,J Arthroplasty,NA,NA,NA,NA
Fu_2021_ThJoofar,JOUR,Automated Detection of Periprosthetic Joint Infections and Data Elements Using Natural Language Processing,"Fu, Sunyang and Wyles, Cody C. and Osmon, Douglas R. and Carvour, Martha L. and Sagheb, Elham and Ramazanian, Taghi and Kremers, Walter K. and Lewallen, David G. and Berry, Daniel J. and Sohn, Sunghwan and Kremers, Hilal Maradit",The Journal of arthroplasty,"BACKGROUND: Periprosthetic joint infection (PJI) data elements are contained in both structured and unstructured documents in electronic health records and require manual data collection. The goal of this study is to develop a natural language processing (NLP) algorithm to replicate manual chart review for PJI data elements. METHODS: PJI was identified among all total joint arthroplasty (TJA) procedures performed at a single academic institution between 2000 and 2017. Data elements that comprise the Musculoskeletal Infection Society (MSIS) criteria were manually extracted and used as the gold standard for validation. A training sample of 1208 TJA surgeries (170 PJI cases) was randomly selected to develop the prototype NLP algorithms and an additional 1179 surgeries (150 PJI cases) were randomly selected as the test sample. The algorithms were applied to all consultation notes, operative notes, pathology reports, and microbiology reports to predict the correct status of PJI based on MSIS criteria. RESULTS: The algorithm, which identified patients with PJI based on MSIS criteria, achieved an f1-score (harmonic mean of precision and recall) of 0.911. Algorithm performance in extracting the presence of sinus tract, purulence, pathologic documentation of inflammation, and growth of cultured organisms from the involved TJA achieved f1-scores that ranged from 0.771 to 0.982, sensitivity that ranged from 0.730 to 1.000, and specificity that ranged from 0.947 to 1.000. CONCLUSION: NLP-enabled algorithms have the potential to automate data collection for PJI diagnostic elements, which could directly improve patient care and augment cohort surveillance and research efforts. Further validation is needed in other hospital settings. LEVEL OF EVIDENCE: Level III, Diagnostic.",2021,10.1016/j.arth.2020.07.076,36,2,688-692,eng,1532-8406 0883-5403,"artificial intelligence and Humans and Electronic Health Records and natural language processing and electronic health records and Natural Language Processing and Arthroplasty and *Arthritis, Infectious and *Prosthesis-Related Infections/diagnosis/epidemiology/etiology and periprosthetic joint infection and total joint arthroplasty",NA,NA,2021/02//undefined,J Arthroplasty,NA,NA,NA,NA
Padilla_2019_ThJoofar,JOUR,Modifying Patient Expectations Can Enhance Total Hip Arthroplasty Postoperative Satisfaction,"Padilla, Jorge A. and Feng, James E. and Anoushiravani, Afshin A. and Hozack, William J. and Schwarzkopf, Ran and Macaulay, William B.",The Journal of arthroplasty,"BACKGROUND: A better understanding of patient expectations within the perioperative setting will enable clinicians to better tailor care to the needs of the total hip arthroplasty (THA) recipient. Such an approach will promote patient-centered decision-making and optimize recovery times while enhancing mandated hospital quality metrics. In the present study, we preoperatively and postoperatively surveyed THA candidates to elucidate the relationship between patient expectations and length of stay (LOS). METHODS: This is a multi-institutional prospective study among THA candidates. Patients were surveyed regarding discharge planning 1 week preoperatively and postoperatively to capture perioperative patient expectations and correlate with inpatient LOS. RESULTS: In total, 93 THAs performed by 6 high-volume orthopedic surgeons at 2 medical centers. Our results demonstrated that patients of male gender and commercial insurance had significantly (P < .05) shorter LOS. Shorter LOS patients demonstrated significantly higher levels of LOS acceptance (""very comfortable"" rate in same-day discharge: 75.0% and next-day discharge: 63.8%; 2 days: 40.7%; 3+ days: 42.9%; P < .05) and a higher likelihood to participate in SDD programs. Postoperatively, patients with a shorter LOS had more acceptance to their LOS, albeit not statistically significant (P = .20). CONCLUSION: Our results suggest that guiding patient expectations within the perioperative setting is an essential component for successful and timely discharge after THA. Having clear and transparent discussion with the surgical team regarding the perioperative course can improve a THA candidate's understanding and buy-in with the postoperative plan, regardless of LOS. Finally, inpatient LOS does not appear to affect patient satisfaction. LEVEL OF EVIDENCE: Level II, prospective observational study.",2019,10.1016/j.arth.2018.12.038,34,7S,S209-S214,eng,1532-8406 0883-5403,"Hospitals and Orthopedics and Humans and Patient-Centered Care and Female and Male and Middle Aged and Aged and Patient Discharge and Insurance, Health and Decision Making and Surveys and Questionnaires and Prospective Studies and patient satisfaction and Inpatients and Length of Stay and patient education and Postoperative Period and *Patient Satisfaction and *Motivation and length of stay and total hip arthroplasty and patient-reported outcomes and Arthroplasty, Replacement, Hip/*methods and patient expectations and Preoperative Care/*psychology",NA,NA,2019/07//undefined,J Arthroplasty,NA,NA,NA,NA
