label,type,title,author,journal,abstract,year,doi,volume,issue,pages,language,issn,keywords,url,institution,DA,j2,DP,l1,l2,ST
Devine_2016_ThJoofboanjosuAmvo,JOUR,Postoperative Pain Management Among Dominican and American Health-Care Providers: A Qualitative Analysis,"Devine, Christopher A. and Yu, Amy and Kasdin, Rachel G. and Bogart, Laura M. and Davis, Aileen M. and Alcantara Abreu, Luis and Ghazinouri, Roya and Thornhill, Thomas S. and Katz, Jeffrey N.",The Journal of bone and joint surgery. American volume,"BACKGROUND: U.S. practitioners have prescribed opioid analgesics increasingly in recent years, contributing to what has been declared an opioid epidemic by the U.S. Centers for Disease Control and Prevention (CDC). Opioids are used frequently in the preoperative and postoperative periods for patients undergoing total joint replacement in developed countries, but cross-cultural comparisons of this practice are limited. An international medical mission such as Operation Walk Boston, which provides total joint replacement to financially vulnerable patients in the Dominican Republic, offers a unique opportunity to compare postoperative pain management approaches in a developed nation and a developing nation. METHODS: We interviewed American and Dominican surgeons and nurses (n = 22) during Operation Walk Boston 2015. We used a moderator's guide with open-ended questions to inquire about postoperative pain management and factors influencing prescribing practices. Interviews were recorded and transcripts were analyzed using content analysis. RESULTS: Providers highlighted differences in the patient-provider relationship, pain medication prescribing variability, and access to medications. Dominican surgeons emphasized adherence to standardized pain protocols and employed a paternalistic model of care, and American surgeons reported prescribing variability and described shared decision-making with patients. Dominican providers described limited availability of potent opioid preparations in the Dominican Republic, in contrast to American providers, who discussed opioid accessibility in the United States. CONCLUSIONS: Our findings suggest that cross-cultural comparisons provide insight into how opioid prescribing practices, approaches to the patient-provider relationship, and medication access inform distinct pain management strategies in American and Dominican surgical settings. Integrating lessons from cross-cultural pain management studies may yield more effective pain management strategies for surgical procedures performed in the United States and abroad.",2016,10.2106/JBJS.15.01004,98,12,e50,eng,1535-1386 0021-9355,"United States and Humans and Cross-Cultural Comparison and Dominican Republic and Analgesics, Opioid/*therapeutic use and *Physician-Patient Relations and Clinical Decision-Making and *Practice Patterns, Physicians' and Pain Management/*methods and Pain, Postoperative/*drug therapy",NA,NA,2016/06/15/,J Bone Joint Surg Am,NA,NA,NA,NA
Araoye_2020_ThJoofboanjosuAmvo,JOUR,A National Survey of Orthopaedic Residents Identifies Deficiencies in the Understanding of Medical Statistics,"Araoye, Ibukunoluwa and He, Jun Kit and Gilchrist, Scott and Stubbs, Trevor and McGwin, Gerald Jr and Ponce, Brent A.",The Journal of bone and joint surgery. American volume,"BACKGROUND: Biomedical research is essential for optimizing patient care. Research has suggested inadequacies in nonorthopaedic trainees' understanding of study design and biostatistics. This study assesses orthopaedic residents' knowledge of common biostatistical and study design concepts, as well as their confidence in utilizing the medical literature. METHODS: A validated survey assessing knowledge and the application of study design concepts was administered to residents at 10 U.S. institutions. The survey tested knowledge as well as confidence and attitudes regarding common biostatistics principles. The association of demographic characteristics, work activities, and confidence and attitude ratings with test performance were examined using t tests and analysis of variance. RESULTS: The survey response rate was 64% (178 of 279). The largest group of participants were men (83%, 137 of 165), were between the ages of 26 and 30 years (59%, 105 of 177), and had graduated medical school within the past 4 to 10 years (43%, 76 of 175). Fifty-three percent (93 of 176) had prior biostatistics training, while 44% (77 of 176) had prior epidemiology training. Less than 5% of biostatistics or epidemiology training had taken place after medical school. Forty-seven percent (83 of 176) were unable to determine a study's design. Thirty-eight percent (67 of 178) could not apply the concept of specificity and sensitivity. Eighty-three percent (147 of 178) could not assess the strength of a relationship using odds ratios. Sixty-nine percent (123 of 178) understood the implications of p values. Previous biostatistics training, but not epidemiology or evidence-based medicine training; inclusion of reading research, attending conferences, and data analysis; as well as a self-reported finding of statistics as important for the analysis of one's own research data were significantly associated with better test performance (p < 0.05). CONCLUSIONS: Notable deficits exist in orthopaedic residents' biostatistical knowledge. Greater emphasis is needed to improve biostatistics and research design training. The impact of biostatistics knowledge and/or aptitude on clinical decision-making is an area of suggested research.",2020,10.2106/JBJS.19.01095,102,5,e19,eng,1535-1386 0021-9355,"United States and Humans and Female and Male and Adult and Young Adult and Surveys and Questionnaires and Research Design and Attitude of Health Personnel and Self Concept and *Data Interpretation, Statistical and *Internship and Residency and *Clinical Competence and Orthopedics/*education and *Biostatistics",NA,NA,2020/03/04/,J Bone Joint Surg Am,NA,NA,NA,NA
Banerjee_2014_ThJoofboanjosuAmvo,JOUR,A distributed health data network analysis of survival outcomes: the International Consortium of Orthopaedic Registries perspective,"Banerjee, Samprit and Cafri, Guy and Isaacs, Abby J. and Graves, Stephen and Paxton, Elizabeth and Marinac-Dabic, Danica and Sedrakyan, Art",The Journal of bone and joint surgery. American volume,"The International Consortium for Orthopaedic Registries is a multinational initiative established by the United States Food and Drug Administration to develop a health data network aimed at providing a robust infrastructure to facilitate evidence-based decision-making on performance of medical devices. Through the International Consortium for Orthopaedic Registries, individual data holders have complete control of their data and can choose to participate in studies of their choice. In this article, we present an overview of the data extraction process and the analytic strategy employed to answer several device performance-related questions in total hip arthroplasty and total knee arthroplasty. In the process, we discuss some nuances pertinent to International Consortium for Orthopaedic Registries data that pose certain statistical challenges, and we briefly suggest strategies to be adopted to address them.",2014,10.2106/JBJS.N.00642,96 Suppl 1,Suppl 1,11-7,eng,1535-1386 0021-9355,"United States and Orthopedics and Humans and Registries and United States Food and Drug Administration and *Data Mining and *Knee Prosthesis and *Arthroplasty, Replacement, Knee and *Arthroplasty, Replacement, Hip and Prosthesis Design and *Hip Prosthesis",NA,NA,2014/12/17/,J Bone Joint Surg Am,NA,NA,NA,NA
Capozzi_2009_ThJoofboanjosuAmvo,JOUR,Discussing treatment options,"Capozzi, James D. and Rhodes, Rosamond and Chen, Darwin",The Journal of bone and joint surgery. American volume,"A sixty-year-old man presented to an orthopaedic surgeon with a periprosthetic infection after total knee arthroplasty performed by another surgeon. He underwent removal of the components, placement of an antibiotic spacer, and antibiotic suppression therapy. Eight weeks later, a revision total knee arthroplasty was performed. The patient did well initially but returned four months after the revision with periprosthetic reinfection. The revision components were removed, another antibiotic spacer was placed, and antibiotic suppression therapy was again administered. During the operation, the entire extensor mechanism, including the quadriceps tendon, patella, and patellar tendon, was found to be necrotic and required radical debridement. Five months later, another operation was performed to remove the spacer, and a plastic surgeon was consulted to assist in the wound closure because of the presence of extensive scar tissue. Intraoperative cultures were negative during these two most recent procedures. The orthopaedic surgeon presented the patient with four treatment options: arthrodesis, resection arthroplasty, amputation, or revision total knee arthroplasty with extensor mechanism allograft and a possible flap closure (rotational or free flap). The patient refused a knee arthrodesis and voiced a strong preference for amputation over arthrodesis. The patient's first choice, however, was to save the knee and to have a second radical revision performed. The surgeon then discussed in detail the risks that would be involved with reconstruction, including the high risk of reinfection and other wound complications. An infection, he explained, could lead to amputation, sepsis, and death. The surgeon also informed the patient that the procedure was not commonly performed, had no proven success rate, and could be fraught with complications. The patient remained steadfast in his choice and elected to undergo radical reconstruction of the knee.",2009,10.2106/JBJS.H.01104,91,3,740-742,eng,1535-1386 0021-9355,"Humans and Male and Middle Aged and Informed Consent and Reoperation and Clinical Competence and Arthroplasty, Replacement, Knee and *Ethics, Medical and Decision Making/*ethics and Physician-Patient Relations/*ethics and Knee Prosthesis/*adverse effects and Reconstructive Surgical Procedures and Prosthesis-Related Infections/*surgery",NA,NA,2009/03/01/,J Bone Joint Surg Am,NA,NA,NA,NA
Lovecchio_2016_ThJoofar,JOUR,Is Outpatient Arthroplasty as Safe as Fast-Track Inpatient Arthroplasty? A Propensity Score Matched Analysis,"Lovecchio, Francis and Alvi, Hasham and Sahota, Shawn and Beal, Matthew and Manning, David",The Journal of arthroplasty,"BACKGROUND: In the emerging fiscal climate of value-based decision-making and shared risk and remuneration, outpatient total joint arthroplasty is attractive provided the incidence of costly complications is comparable to contemporary ""fast-track"" inpatient pathways. METHODS: All patients undergoing total hip arthroplasty or total knee arthroplasty between 2011 and 2013 were selected from the American College of Surgeons-National Surgical Quality Improvement Program database. A propensity score was used to match 1476 fast-track (<e2><89><a4>2 day length of stay) inpatients with 492 outpatients (3:1 ratio). Thirty-day complication, reoperation, and readmission rates were compared, both during and after hospitalization. Logistic regression was used to calculate propensity score adjusted odds ratios. RESULTS: After matching, outpatients had higher rates of medical complication (anytime, 10.0% vs 6.7%, P = .018; post discharge, 6.3% vs 1.1%, P < .001). Most complications were bleeding requiring transfusion, which occurred at similar rates after surgery but at higher rates post discharge in outpatients (anytime, 7.5% outpatients vs 5.6% inpatients, P = .113; post discharge, 4.1% outpatients vs 0.1% inpatients, P < .001). There was no difference in readmission rate (2.4% outpatient vs 2.0% inpatient, P = .589). CONCLUSION: Outpatients experience higher rates of post-discharge complications, which may countermand cost savings. Surgeons wishing to implement outpatient total joint arthroplasty clinical pathways must focus on preventing post-discharge medical complications to include blood management strategies.",2016,10.1016/j.arth.2016.05.037,31,9 Suppl,197-201,eng,1532-8406 0883-5403,"Hospitalization and Humans and Female and Male and Middle Aged and Aged and Patient Discharge and Logistic Models and Databases, Factual and outcomes and readmissions and Aged, 80 and over and Odds Ratio and Incidence and Propensity Score and United States/epidemiology and Patient Readmission/statistics & numerical data and Postoperative Complications/*epidemiology and Outpatients/*statistics & numerical data and Inpatients/*statistics & numerical data and complications and Arthroplasty, Replacement, Knee/*adverse effects/statistics & numerical data and Reoperation/statistics & numerical data and Arthroplasty, Replacement, Hip/*adverse effects/statistics & numerical data and outpatient hip arthroplasty and outpatient knee arthroplasty",NA,NA,2016/09//undefined,J Arthroplasty,NA,NA,NA,NA
Dwyer_2015_ThJoofboanjosuAmvo,JOUR,Competency-Based Medical Education: Can Both Junior Residents and Senior Residents Achieve Competence After a Sports Medicine Training Module?,"Dwyer, Tim and Wright, Sara and Kulasegaram, Kulamakan M. and Theodoropoulos, John and Chahal, Jaskarndip and Wasserstein, David and Ringsted, Charlotte and Hodges, Brian and Ogilvie-Harris, Darrell",The Journal of bone and joint surgery. American volume,"BACKGROUND: Competency-based medical education as a resident-training format will move postgraduate training away from time-based training, to a model based on observable outcomes. The purpose of this study was to determine whether junior residents and senior residents could demonstrate clinical skills to a similar level, after a sports medicine rotation. METHODS: All residents undertaking a three-month sports medicine rotation had to pass an Objective Structured Clinical Examination. The stations tested the fundamentals of history-taking, examination, image interpretation, differential diagnosis, informed consent, and clinical decision-making. Performance at each station was assessed with a binary station-specific checklist and an overall global rating scale, in which 1 indicated novice, 2 indicated advanced beginner, 3 indicated competent, 4 indicated proficient, and 5 indicated expert. A global rating scale was also given for each domain of knowledge. RESULTS: Over eighteen months, thirty-nine residents (twenty-one junior residents and eighteen senior residents) and six fellows (for a total of forty-five participants) completed the examination. With regard to junior residents and senior residents, analysis using a two-tailed t test demonstrated a significant difference (p < 0.01) in both total checklist score and overall global rating scale; the mean total checklist score (and standard deviation) was 56.15% <c2><b1> 10.99% for junior residents and 71.87% <c2><b1> 8.94% for senior residents, and the mean global rating scale was 2.44 <c2><b1> 0.55 for junior residents and 3.79 <c2><b1> 0.49 for senior residents. There was a significant difference between junior residents and senior residents for each knowledge domain, with a significance of p < 0.05 for history-taking and p < 0.01 for the remainder of the domains. CONCLUSIONS: Despite intensive teaching within a competency-based medical education model, junior residents were not able to demonstrate knowledge as well as senior residents, suggesting that overall clinical experience is critically important for achieving competency as measured by the Objective Structured Clinical Examination.",2015,10.2106/JBJS.O.00252,97,23,1985-1991,eng,1535-1386 0021-9355,"Humans and Canada and Models, Educational and *Clinical Competence and Sports Medicine/*education and Internship and Residency/*methods and Competency-Based Education/*methods",NA,NA,2015/12/02/,J Bone Joint Surg Am,NA,NA,NA,NA
Ayala_2017_ThJoofar,JOUR,Preoperative Patient-Recorded Outcome Measures Predict Patient Discharge Location Following Unicondylar Knee Arthroplasty,"Ayala, Alfonso E. and Lawson, Kevin A. and Gruessner, Angelika C. and Dohm, Michael P.",The Journal of arthroplasty,"BACKGROUND: Advantages of unicondylar knee arthroplasty (UKA) over total knee arthroplasty include rapid recovery and shorter lengths of stay following surgery. Patients requiring extended postoperative care fail to recognize these benefits. Patient-reported outcome measures have proved useful in predicting outcomes following joint arthroplasty. The purpose of this study was to identify and report preoperative patient-reported outcome measures and clinical variables that predict discharge to skilled nursing facilities following UKA. METHODS: A prospective cohort of 174 patients was used to collect 36-Item Short Form scores and objective clinical data. Univariate and multivariate analysis with backward elimination were conducted to find a predictive risk model. RESULTS: The predictive model reported (78.7% concordance, receiver operating characteristic curve c-statistic 0.719, P = .0016) demonstrates that risk factors for discharge to skilled nursing facilities are: older age (odds ratio 4.18; 95% confidence interval [CI] 1.256-13.911, P = .019), bilateral UKA procedures (odds ratio 1.887; 95% CI 1.054-3.378, P = .0326) and lower patient-reported preoperative 36-Item Short Form physical function scores (odds ratio 0.968; CI 0.938-1, P = .0488). CONCLUSION: The information presented here regarding possible patient disposition following UKA could aid informed decision-making regarding patients' short-term needs following surgery and help streamline preoperative planning.",2017,10.1016/j.arth.2016.07.034,32,2,386-389,eng,1532-8406 0883-5403,"Humans and Female and Male and Adult and Middle Aged and Aged and Surveys and Questionnaires and Multivariate Analysis and Prospective Studies and Medical Records and Aged, 80 and over and Predictive Value of Tests and Odds Ratio and ROC Curve and Length of Stay and *Patient Discharge and Skilled Nursing Facilities and Postoperative Period and *Patient Reported Outcome Measures and *Outcome Assessment, Health Care and patient reported outcome measures and Arthroplasty, Replacement, Knee/*methods and skilled nursing facility and Postoperative Care and discharge location and postoperative planning and unicondylar knee arthroplasty",NA,NA,2017/02//undefined,J Arthroplasty,NA,NA,NA,NA
Daniels_2014_ThJoofboanjosuAmvo,JOUR,Variability in spine surgery procedures performed during orthopaedic and neurological surgery residency training: an analysis of ACGME case log data,"Daniels, Alan H. and Ames, Christopher P. and Smith, Justin S. and Hart, Robert A.",The Journal of bone and joint surgery. American volume,"BACKGROUND: Current spine surgeon training in the United States consists of either an orthopaedic or neurological surgery residency, followed by an optional spine surgery fellowship. Resident spine surgery procedure volume may vary between and within specialties. METHODS: The Accreditation Council for Graduate Medical Education surgical case logs for graduating orthopaedic surgery and neurosurgery residents from 2009 to 2012 were examined and were compared for spine surgery resident experience. RESULTS: The average number of reported spine surgery procedures performed during residency was 160.2 spine surgery procedures performed by orthopaedic surgery residents and 375.0 procedures performed by neurosurgery residents; the mean difference of 214.8 procedures (95% confidence interval, 196.3 to 231.7 procedures) was significant (p = 0.002). From 2009 to 2012, the average total spinal surgery procedures logged by orthopaedic surgery residents increased 24.3% from 141.1 to 175.4 procedures, and those logged by neurosurgery residents increased 6.5% from 367.9 to 391.8 procedures. There was a significant difference (p < 0.002) in the average number of spinal deformity procedures between graduating orthopaedic surgery residents (9.5 procedures) and graduating neurosurgery residents (2.0 procedures). There was substantial variability in spine surgery exposure within both specialties; when comparing the top 10% and bottom 10% of 2012 graduates for spinal instrumentation or arthrodesis procedures, there was a 13.1-fold difference for orthopaedic surgery residents and an 8.3-fold difference for neurosurgery residents. CONCLUSIONS: Spine surgery procedure volumes in orthopaedic and neurosurgery residency training programs vary greatly both within and between specialties. Although orthopaedic surgery residents had an increase in the number of spine procedures that they performed from 2009 to 2012, they averaged less than half of the number of spine procedures performed by neurological surgery residents. However, orthopaedic surgery residents appear to have greater exposure to spinal deformity than neurosurgery residents. Furthermore, orthopaedic spine fellowship training provides additional spine surgery case exposure of approximately 300 to 500 procedures; thus, before entering independent practice, when compared with neurosurgery residents, most orthopaedic spine surgeons complete as many spinal procedures or more. Although case volume is not the sole determinant of surgical skills or clinical decision making, variability in spine surgery procedure volume does exist among residency programs in the United States.",2014,10.2106/JBJS.M.01562,96,23,e196,eng,1535-1386 0021-9355,"United States and Humans and Internship and Residency/*statistics & numerical data and Neurology/*education and Orthopedics/*education and Education, Medical, Graduate/*statistics & numerical data and Neurosurgical Procedures/education/*statistics & numerical data and Orthopedic Procedures/education/*statistics & numerical data",NA,NA,2014/12/03/,J Bone Joint Surg Am,NA,NA,NA,NA
Gundle_2010_ThJoofboanjosuAmvo,JOUR,Effect of insurance status on the rate of surgery following a meniscal tear,"Gundle, Kenneth R. and McGlaston, Timothy J. and Ramappa, Arun J.",The Journal of bone and joint surgery. American volume,"BACKGROUND: Uninsured and underinsured Americans face barriers to access to medical care. The objective of this study was to characterize the effect of insurance status on whether patients with a torn meniscus proceed to elective arthroscopic knee surgery. METHODS: The records from January 2003 through April 2006 at a single academic orthopaedic surgery institution in Massachusetts were retrospectively reviewed to identify patients diagnosed with a meniscal tear and to determine whether surgery had been performed within six months after the diagnosis. Six categories of insurance were identified: private insurance, Workers' Compensation, Medicare, Medicaid, Uncompensated Care Pool, and self pay. A comparison of the proportions of insured and uninsured patients who underwent surgery was the primary outcome measure. RESULTS: A total of 1127 patients were identified, and 446 (40%) of them underwent surgery within six months after an office visit. The patients with and without surgery had similar age and sex distributions. When patients were divided, according to their insurance status, into insured and uninsured groups, no significant difference was found in the rate of surgery (p = 0.23). However, subgroup analysis revealed significant differences among the six insurance categories. Logistic regression analysis showed that patients in the self-pay group had a lower rate of surgery than those with private insurance (odds ratio, 0.33; 95% confidence interval, 0.14 to 0.75; p = 0.008), whereas patients receiving Workers' Compensation (odds ratio, 1.93; 95% confidence interval, 1.05 to 3.55; p = 0.034) and those receiving Medicaid (odds ratio, 1.63; 95% confidence interval, 1.09 to 2.42; p = 0.016) had higher surgical rates than those with private insurance. CONCLUSIONS: The rate of elective arthroscopic knee surgery for meniscal tears varied significantly for some insurance categories at this single academic institution in Massachusetts. Further work is necessary to clarify the patient and surgeon factors influencing these disparities in clinical decision-making.",2010,10.2106/JBJS.I.01369,92,14,2452-2456,eng,1535-1386 0021-9355,"United States and Humans and Female and Male and Adult and Middle Aged and Retrospective Studies and Aged and Logistic Models and Boston and Odds Ratio and Health Services Accessibility/economics and *Insurance, Health and Medically Uninsured/statistics & numerical data and Medicaid/economics and Academic Medical Centers/economics and *Insurance Coverage and Arthroscopy/*economics/statistics & numerical data and Elective Surgical Procedures/*economics/statistics & numerical data and Knee Injuries/economics/*surgery and Menisci, Tibial/*surgery and Tibial Meniscus Injuries and Workers' Compensation/economics",NA,NA,2010/10/20/,J Bone Joint Surg Am,NA,NA,NA,NA
