label,type,title,author,journal,abstract,year,doi,volume,issue,pages,language,issn,keywords,url,institution,DA,j2,DP,l1,l2,ST
Isaac_2015_Joh.ns,JOUR,"Correlations between acoustic rhinometry, subjective symptoms, and endoscopic findings in symptomatic children with nasal obstruction","Isaac, Andre and Major, Michael and Witmans, Manisha and Alrajhi, Yaser and Flores-Mir, Carlos and Major, Paul and Alsufyani, Noura and Korayem, Mohamed and El-Hakim, Hamdy",JAMA otolaryngology-- head & neck surgery,"IMPORTANCE: Nasal obstruction is common in children and difficult to quantify objectively. Symptom quantification is paramount for surgical and medical decision making. Acoustic rhinometry is a relatively new technique aimed at the objective assessment of nasal obstruction. There is no standardized method for the objective assessment of the pediatric nasal airway. OBJECTIVE: To explore the correlations between acoustic rhinometry (AR), subjective symptoms, and endoscopic findings in children presenting with nasal obstruction. DESIGN, SETTING, AND PARTICIPANTS: A cross-sectional, exploratory, diagnostic study of prospectively collected data from a multidisciplinary airway clinic (pulmonology, orthodontics, and otolaryngology) database at a tertiary academic referral center. Data were collected over a 2-year period (2010-2012) from 65 nonsyndromic children (38 boys) 7 years and older (mean [SD] age, 10.3 [2.5] years [range, 7-14 years]), presenting with persistent nasal obstructive symptoms for at least 1 year, without signs and symptoms of sinus disease. INTERVENTIONS: We collected patient demographics and medical history information including allergy, asthma, and sleep-disordered breathing. Subjective nasal obstruction was scored using a visual analog scale (VAS). Sleep-disordered breathing was assessed using overnight pulse oximetry. The adenoid size, septal position, and visual severity of chronic rhinitis (endoscopic rhinitis score [ERS]) were rated on nasal endoscopy by 2 independent reviewers and validated by agreement. Acoustic rhinometry (AR) was undertaken before and after use of a decongestant. MAIN OUTCOMES AND MEASURES: Correlation and multiple regression analyses were performed to explore interrelationships between subjective nasal obstruction VAS, AR, and nasal endoscopy. RESULTS: Among the 65 patients, 28 (43%) had symptoms of sleep-disordered breathing, 14 (22%) had allergic rhinitis, 10 (15%) had asthma, 27 (41%) had grade 3 or 4 adenoidal obstruction, 28 (43%) had an ERS of 2, 6 (9%) had an ERS of 3, and 19 (29%) had septal deviation. Significant correlations were found between subjective nasal obstruction VAS score and ERS (r = -0.364, P = .003), ERS and minimal cross-sectional area before decongestion (r = -0.278, P = .03), and adenoid size and calculated nasal resistance after decongestion (r = 0.430, P < .001). Multiple regression analysis showed that the ERS was the only significant predictor of VAS score (<ce><b2> of -22.089; 95% CI, -35.56 to -8.61 [P = .002]). No predictors were identified for AR variables. CONCLUSIONS AND RELEVANCE: Among the evaluated tools, endoscopy appears to be the most reliable tool to estimate the degree of subjective nasal symptoms.",2015,10.1001/jamaoto.2015.0468,141,6,550-555,eng,2168-619X 2168-6181,"Humans and Female and Male and Adolescent and Child and Cross-Sectional Studies and Sex Distribution and Cohort Studies and Causality and Comorbidity and Age Distribution and Medical History Taking and *Natural Orifice Endoscopic Surgery and *Rhinometry, Acoustic and Asthma/diagnosis/epidemiology and Nasal Obstruction/*diagnosis/epidemiology and Obesity/diagnosis/epidemiology and Rhinitis, Allergic/diagnosis/epidemiology and Sleep Apnea Syndromes/diagnosis/epidemiology",NA,NA,2015/06//undefined,JAMA Otolaryngol Head Neck Surg,NA,NA,NA,NA
Liu_2014_Joh.ns,JOUR,Infarction of papillary thyroid carcinoma after fine-needle aspiration: case series and review of literature,"Liu, Yuan F. and Ahmed, Sameer and Bhuta, Sunita and Sercarz, Joel A.",JAMA otolaryngology-- head & neck surgery,"IMPORTANCE: Although infarction after fine-needle aspiration (FNA) is a rare occurrence, it is a known phenomenon that may lead to difficulties in interpretation for pathologists and in decision-making for head and neck surgeons. OBJECTIVE: To characterize our experience with infarction in papillary thyroid carcinomas (PTCs) after FNA and review existing cases of infarcted PTCs in the literature to better understand this phenomenon. DESIGN, SETTING, AND PARTICIPANTS: This was a retrospective case series and review of literature at a tertiary medical center (University of California, Los Angeles [UCLA], Medical Center). All patients who had a surgical pathologic diagnosis of infarcted PTC and who underwent FNA prior to surgery at UCLA from June 2006 to June 2012 were identified. There were 620 cases of PTC and 12 cases of infarcted PTC. MAIN OUTCOMES AND MEASURE: Demographic data, FNA cytologic findings, and surgical pathologic data were gathered for each patient. A comprehensive literature search for infarcted PTC was performed. RESULTS: Twelve cases of infarcted PTC were found in a total of 620 cases of PTC (1.9%). The mean (SD) time interval between the last FNA and surgery was 52 (35) days (range, 13-133 days). All patients received a diagnosis of infarcted PTC after thyroidectomy was performed. Focal infarction was found in 4 patients (33%), and near-total infarction was found in 8 patients (67%). Five patients (47%) had the follicular variant of PTC, making it the most common subtype in our series. A thorough literature search yielded 11 articles reporting a total of 26 cases of infarcted PTC after FNA. To our knowledge, our case series on infarcted PTC is the largest reported series in the literature. CONCLUSIONS AND RELEVANCE: Although infarction of PTC after FNA occurs infrequently, it may lead to difficulties in histologic diagnosis. Awareness of this phenomenon and its histologic associations, along with careful reevaluation of the FNA and surgical specimens, is important for appropriate diagnosis and subsequent treatment. At this point, infarction in PTC should not alarm a head and neck surgeon to change management, but future prospective studies with a large population of patients with infarcted PTCs are needed to establish the impact of infarction on differences in treatment outcomes for therapies that may be used in PTCs.",2014,10.1001/jamaoto.2013.5650,140,1,52-57,eng,2168-619X 2168-6181,"Humans and Female and Male and Adult and Middle Aged and Retrospective Studies and Aged and Time Factors and Biopsy, Fine-Needle/*adverse effects and Carcinoma, Papillary and Carcinoma/*pathology/surgery and Infarction/*etiology and Thyroid Cancer, Papillary and Thyroid Neoplasms/*pathology/surgery and Thyroidectomy and Ultrasonography, Interventional",NA,NA,2014/01//undefined,JAMA Otolaryngol Head Neck Surg,NA,NA,NA,NA
Miller_2016_H.n,JOUR,Do you know your guidelines? An initiative of the American Head and Neck Society's Education Committee,"Miller, Matthew C. and Goldenberg, David",Head & neck,"Clinical practice guidelines abound in medicine. Head and neck oncology is no exception. Well-crafted guidelines can promote evidence-based diagnosis, treatment, and followup for patients with head and neck cancers. Recognizing this, the Education Committee of the American Head and Neck Society has developed a series of articles to review clinical practice guidelines germane to our field, the evidence behind them, and opportunities for improvement and better adherence to them. This paper serves to introduce the concepts relevant to guideline development and clinical application. It serves as a framework for the topical guideline papers that will follow.",2016,10.1002/hed.24104,38,2,165-167,eng,1097-0347 1043-3074,"United States and Humans and Attitude of Health Personnel and Societies, Medical and Clinical Competence and patient care and *Practice Guidelines as Topic and Clinical Decision-Making and *Guideline Adherence and *Evidence-Based Practice and head and neck cancer and clinical practice guidelines and evidence based and National Comprehensive Cancer Network (NCCN)",NA,NA,2016/02//undefined,Head Neck,NA,NA,NA,NA
Shuman_2014_H.n,JOUR,Optimizing perioperative management of geriatric patients with head and neck cancer,"Shuman, Andrew G. and Patel, Snehal G. and Shah, Jatin P. and Korc-Grodzicki, Beatriz",Head & neck,"Given emerging demographic trends, many more elderly patients are being diagnosed with head and neck cancers. The surgical care paradigm for this cohort of patients must take into account specific challenges inherent to geriatric perioperative management. This article attempts to summarize the existing body of literature relevant to the geriatric head and neck cancer population, and to extrapolate relevant data from geriatric perioperative medicine in order to better understand and guide management decisions. The involvement of geriatricians and of patients' primary care providers may be invaluable in assisting in complex perioperative decision-making and in participating in longitudinal management. Preoperative risk stratification and assessment of medical, social, and functional variables are critical for appropriate decision-making in this challenging patient population.",2014,10.1002/hed.23347,36,5,743-749,eng,1097-0347 1043-3074,"Humans and Female and Male and Risk Assessment and Aged and Treatment Outcome and risk stratification and Aged, 80 and over and Quality of Life and Age Factors and Follow-Up Studies and Survival Rate and Frail Elderly and geriatrics and Perioperative Care/*methods and *Geriatric Assessment and functional assessment and head and neck cancer and Head and Neck Neoplasms/mortality/pathology/*surgery and perioperative care",NA,NA,2014/05//undefined,Head Neck,NA,NA,NA,NA
Leung_2015_Joh.ns,JOUR,Developing a laddered algorithm for the management of intractable epistaxis: a risk analysis,"Leung, Randy M. and Smith, Timothy L. and Rudmik, Luke",JAMA otolaryngology-- head & neck surgery,"IMPORTANCE: For patients with epistaxis in whom initial interventions, such as anterior packing and cauterization, had failed, options including prolonged posterior packing, transnasal endoscopic sphenopalatine artery ligation (TESPAL), and embolization are available. However, it is unclear which interventions should be attempted and in which order. While cost-effectiveness analyses have suggested that TESPAL is the most responsible use of health care resources, physicians must also consider patient risk to maintain a patient-centered decision-making process. OBJECTIVE: To quantify the risk associated with the management of intractable epistaxis. DESIGN AND SETTING: A risk analysis was performed using literature-reported probabilities of treatment failure and adverse event likelihoods in an emergency department and otolaryngology hospital admissions setting. The literature search included articles from 1980 to May 2014. The analysis was modeled for a 50-year-old man with no other medical comorbidities. Severities of complications were modeled based on Environmental Protection Agency recommendations, and health state utilities were monetized based on a willingness to pay $22<e2><80><af>500 per quality-adjusted life-year. Six management strategies were developed using posterior packing, TESPAL, and embolization in various sequences (P, T, and E, respectively). MAIN OUTCOMES AND MEASURES: Total risk associated with each algorithm quantified in US dollars. RESULTS: Algorithms involving posterior packing and TESPAL as first-line interventions were found to be similarly low risk. The lowest-risk approaches were P-T-E ($2437.99 [range, $1482.83-$6976.40]), T-P-E ($2840.65 [range, $1136.89-$8604.97]), and T-E-P ($2867.82 [range, $1141.05-$9833.96]). Embolization as a first-line treatment raised the total risk significantly owing to the risk of cerebrovascular events (E-T-P, $11<e2><80><af>945.42 [range, $3911.43-$31<e2><80><af>847.00]; and E-P-T, $11<e2><80><af>945.71 [range, $3919.91-$31<e2><80><af>767.66]). CONCLUSIONS AND RELEVANCE: Laddered approaches using TESPAL and posterior packing appear to provide the lowest risk. Combining risk and cost-effectiveness perspectives, we recommend a laddered approach to intractable epistaxis with TESPAL first, followed by either embolization or posterior packing.",2015,10.1001/jamaoto.2015.106,141,5,405-409,eng,2168-619X 2168-6181,"Humans and Risk Assessment and Cost-Benefit Analysis and Comorbidity and Quality of Life and *Algorithms and Embolization, Therapeutic/economics and Endoscopy/economics and Epistaxis/*economics/*therapy and Ligation/economics",NA,NA,2015/05/01/,JAMA Otolaryngol Head Neck Surg,NA,NA,NA,NA
Gelbard_2020_Joh.ns,JOUR,Comparative Treatment Outcomes for Patients With Idiopathic Subglottic Stenosis,"Gelbard, Alexander and Anderson, Catherine and Berry, Lynne D. and Amin, Milan R. and Benninger, Michael S. and Blumin, Joel H. and Bock, Jonathan M. and Bryson, Paul C. and Castellanos, Paul F. and Chen, Sheau-Chiann and Clary, Matthew S. and Cohen, Seth M. and Crawley, Brianna K. and Dailey, Seth H. and Daniero, James J. and de Alarcon, Alessandro and Donovan, Donald T. and Edell, Eric S. and Ekbom, Dale C. and Fernandes-Taylor, Sara and Fink, Daniel S. and Franco, Ramon A. and Garrett, C. Gaelyn and Guardiani, Elizabeth A. and Hillel, Alexander T. and Hoffman, Henry T. and Hogikyan, Norman D. and Howell, Rebecca J. and Huang, Li-Ching and Hussain, Lena K. and Johns, Michael M. 3rd and Kasperbauer, Jan L. and Khosla, Sid M. and Kinnard, Cheryl and Kupfer, Robbi A. and Langerman, Alexander J. and Lentz, Robert J. and Lorenz, Robert R. and Lott, David G. and Lowery, Anne S. and Makani, Samir S. and Maldonado, Fabien and Mannion, Kyle and Matrka, Laura and McWhorter, Andrew J. and Merati, Albert L. and Mori, Matthew C. and Netterville, James L. and O'Dell, Karla and Ongkasuwan, Julina and Postma, Gregory N. and Reder, Lindsay S. and Rohde, Sarah L. and Richardson, Brent E. and Rickman, Otis B. and Rosen, Clark A. and Rutter, Michael J. and Sandhu, Guri S. and Schindler, Joshua S. and Schneider, G. Todd and Shah, Rupali N. and Sikora, Andrew G. and Sinard, Robert J. and Smith, Marshall E. and Smith, Libby J. and Soliman, Ahmed M. S. and Sveinsdottir, Sigridur and Van Daele, Douglas J. and Veivers, David and Verma, Sunil P. and Weinberger, Paul M. and Weissbrod, Philip A. and Wootten, Christopher T. and Shyr, Yu and Francis, David O.",JAMA otolaryngology-- head & neck surgery,"IMPORTANCE: Surgical treatment comparisons in rare diseases are difficult secondary to the geographic distribution of patients. Fortunately, emerging technologies offer promise to reduce these barriers for research. OBJECTIVE: To prospectively compare the outcomes of the 3 most common surgical approaches for idiopathic subglottic stenosis (iSGS), a rare airway disease. DESIGN, SETTING, AND PARTICIPANTS: In this international, prospective, 3-year multicenter cohort study, 810 patients with untreated, newly diagnosed, or previously treated iSGS were enrolled after undergoing a surgical procedure (endoscopic dilation [ED], endoscopic resection with adjuvant medical therapy [ERMT], or cricotracheal resection [CTR]). Patients were recruited from clinician practices in the North American Airway Collaborative and an online iSGS community on Facebook. MAIN OUTCOMES AND MEASURES: The primary end point was days from initial surgical procedure to recurrent surgical procedure. Secondary end points included quality of life using the Clinical COPD (chronic obstructive pulmonary disease) Questionnaire (CCQ), Voice Handicap Index-10 (VHI-10), Eating Assessment Test-10 (EAT-10), the 12-Item Short-Form Version 2 (SF-12v2), and postoperative complications. RESULTS: Of 810 patients in this cohort, 798 (98.5%) were female and 787 (97.2%) were white, with a median age of 50 years (interquartile range, 43-58 years). Index surgical procedures were ED (n = 603; 74.4%), ERMT (n = 121; 14.9%), and CTR (n = 86; 10.6%). Overall, 185 patients (22.8%) had a recurrent surgical procedure during the 3-year study, but recurrence differed by modality (CTR, 1 patient [1.2%]; ERMT, 15 [12.4%]; and ED, 169 [28.0%]). Weighted, propensity score-matched, Cox proportional hazards regression models showed ED was inferior to ERMT (hazard ratio [HR], 3.16; 95% CI, 1.8-5.5). Among successfully treated patients without recurrence, those treated with CTR had the best CCQ (0.75 points) and SF-12v2 (54 points) scores and worst VHI-10 score (13 points) 360 days after enrollment as well as the greatest perioperative risk. CONCLUSIONS AND RELEVANCE: In this cohort study of 810 patients with iSGS, endoscopic dilation, the most popular surgical approach for iSGS, was associated with a higher recurrence rate compared with other procedures. Cricotracheal resection offered the most durable results but showed the greatest perioperative risk and the worst long-term voice outcomes. Endoscopic resection with medical therapy was associated with better disease control compared with ED and had minimal association with vocal function. These results may be used to inform individual patient treatment decision-making.",2020,10.1001/jamaoto.2019.3022,146,1,20-29,eng,2168-619X 2168-6181,Humans and Female and Male and Adult and Middle Aged and Surveys and Questionnaires and Prospective Studies and Treatment Outcome and Quality of Life and Reoperation and Cricoid Cartilage/*surgery and Laryngoscopy and Laryngostenosis/*surgery,NA,NA,2020/01/01/,JAMA Otolaryngol Head Neck Surg,NA,NA,NA,NA
Franzese_2007_TheLar,JOUR,When to cut? Using an objective structured clinical examination to evaluate surgical decision-making,"Franzese, Christine",The Laryngoscope,"OBJECTIVES: To create an objective structured clinical examination (OSCE) tailored to surgical residents that uses surgical case scenarios appropriate for the experience level of the resident to evaluate whether residents understand the indications for a specific surgery, identify when indications are met, and make the appropriate decision to proceed with an operation. METHODS: The surgical OSCE consisted of two case scenarios: a junior case created for postgraduate year (PGY) 2 to 3 level residents and a senior case created for PGY 4 to 5 level residents. Four senior residents and four junior residents in the otolaryngology department participated. Residents were instructed to proceed as if they had all the capabilities of the otolaryngology clinic. Recordings were made of each encounter and were reviewed by two separate faculty member with expertise in each case. Faculty evaluated whether surgical indications were elicited by history, whether certain physical examination or radiographic findings were recognized, whether residents made the correct diagnosis, and whether residents not only made the decision to proceed with surgery but also indicated the correct surgery. RESULTS: Seniors (100%) were better at obtaining needed surgical information and indications than juniors (25%). Seniors were more willing to make the decision to proceed with surgery (100%), whereas no juniors actually scheduled surgery. The reasons for this ranged from failure to elicit surgical indications to lack of surety in proceeding with surgery. All seniors recommended the appropriate surgery, but only 75% correctly identified the need for emergent intervention. Results of evaluations were reviewed with each resident individually. CONCLUSIONS: The surgical OSCE was successful in evaluating resident surgical decision-making. Juniors were not as capable as seniors in eliciting surgical indications and in ""making the jump"" to proceed with surgery. These results were used by our faculty to work with juniors on surgical history-taking and decision-making. These results were also useful in identifying seniors who could recognize an emergency situation.",2007,10.1097/MLG.0b013e31812e9621,117,11,1938-1942,eng,0023-852X,"Humans and Clinical Competence and *Educational Measurement and *Decision Making and *Internship and Residency and Education, Medical, Graduate/*methods and Otorhinolaryngologic Surgical Procedures/*education",NA,NA,2007/11//undefined,Laryngoscope,NA,NA,NA,NA
Rudmik_2014_Joh.ns,JOUR,Cost-effectiveness analysis of endoscopic sphenopalatine artery ligation vs arterial embolization for intractable epistaxis,"Rudmik, Luke and Leung, Randy",JAMA otolaryngology-- head & neck surgery,"IMPORTANCE: Intractable epistaxis is a common otolaryngology emergency. Transnasal endoscopic sphenopalatine artery ligation (TESPAL) and endovascular arterial embolization both provide excellent success rates, and therefore the decision to choose one over the other can be challenging. OBJECTIVE: To aid in decision making by evaluating the cost-effectiveness of TESPAL vs endovascular arterial embolization for intractable epistaxis. DESIGN, SETTING, AND PARTICIPANTS: Economic evaluation using a decision tree model with a 14-day time horizon for emergency department consultations for patients with intractable epistaxis defined as persistent bleeding despite bilateral anterior nasal packing. The economic perspective was the health care third-party payer. Effectiveness and probability data were obtained from the published medical literature. Costs were obtained from the published literature, the Centers for Medicare & Medicaid Services database, and the Healthcare Cost and Utilization Project database. Multiple sensitivity analyses were performed, including a probabilistic sensitivity analysis. Comparative treatment groups were (1) TESPAL and (2) embolization. INTERVENTIONS: TESPAL and endovascular arterial embolization. MAIN OUTCOME AND MEASURES: The primary outcome was the incremental cost-effectiveness ratio (ICER) for successful control of epistaxis. RESULTS: The reference case demonstrated that the embolization strategy was more effective but more costly compared with the TESPAL strategy: $22,324.70 per 0.70 effectiveness compared with $12,484.14 per 0.68 of effectiveness, respectively. The embolization vs TESPAL ICER was $492,028, which is higher than any willingness to pay (WTP), suggesting that TESPAL is the cost-effective decision. The sensitivity analysis demonstrated a 77.6% and 73.7% certainty that the TESPAL strategy is cost-effective at WTP thresholds of $10,000 and $50,000, respectively. CONCLUSIONS AND RELEVANCE: Results from this economic evaluation suggest that when both TESPAL and arterial embolization are viable options (based on patient and institutional factors), TESPAL is the more cost-effective treatment strategy for patients with intractable epistaxis.",2014,10.1001/jamaoto.2014.1450,140,9,802-808,eng,2168-619X 2168-6181,"United States and Humans and Cost-Benefit Analysis and Models, Economic and Multivariate Analysis and Emergency Service, Hospital and *Decision Trees and Epistaxis/*economics/*therapy and Ligation/economics and Embolization, Therapeutic/*economics and Endoscopy/*economics and Maxillary Artery/*surgery",NA,NA,2014/09//undefined,JAMA Otolaryngol Head Neck Surg,NA,NA,NA,NA
