label,type,title,author,journal,abstract,year,doi,volume,issue,pages,language,issn,keywords,url,institution,DA,j2,DP,l1,l2,ST
Kerscher_2008_TheLar,JOUR,The residency experience in pediatric otolaryngology,"Kerscher, Kara and Tabaee, Abtin and Ward, Robert and Haddad, Joseph Jr and Grunstein, Eli",The Laryngoscope,"OBJECTIVES: To assess the residency experience in pediatric otolaryngology, determine the impact of pediatric fellowship programs on residency training, and evaluate the need for fellowship training in pediatric otolaryngology. DESIGN: An anonymous, web-based survey of chief residents in otolaryngology. METHODS: Respondents described their experience in pediatric otolaryngology using a 5-point Likert scale and reported their comfort levels (yes/no) with various medical and surgical issues in pediatric otolaryngology. RESULTS: The survey was successfully completed by 70 respondents, representing a response rate of 26%. The majority of the respondents reported positive experiences with regard to the following aspects of pediatric otolaryngology training: didactics (81%), clinical research opportunities (78%), positive faculty role models (87%), career mentorship (74%), independent medical (84%) and surgical (81%) decision-making, and overall comprehensive residency experience (87%). Basic science research opportunities (50%) were reported as less available than clinical research opportunities (78%) (P = .002). Compared with other surveyed issues, a lower comfort level was reported for management of craniofacial anomalies (P < .001), excision of large lymphatic malformations (P < .001), cochlear implantation (P < .001), laryngotracheal reconstruction (P < .001), and surgical correction of velopharyngeal insufficiency (P < .001). No statistically significant difference was noted in responses based on the presence of a fellowship program at the institution. CONCLUSIONS: The residency experience in pediatric otolaryngology is perceived as comprehensive by graduating chief residents participating in this survey. The presence of a fellowship program does not appear to negatively impact the residency experience. Based on the reported comfort levels, the management of complex issues in pediatric otolaryngology may require additional training.",2008,10.1097/MLG.0b013e3181620847,118,4,718-722,eng,0023-852X,"United States and Humans and Decision Making and Surveys and Questionnaires and Interprofessional Relations and Faculty, Medical and *Attitude of Health Personnel and Pediatrics/*education and *Internship and Residency and Fellowships and Scholarships and Mentors and Otolaryngology/*education and Teaching/methods and Reconstructive Surgical Procedures and Cochlear Implantation and Craniofacial Abnormalities/surgery and Larynx/surgery and Lymphatic System/abnormalities and Otorhinolaryngologic Surgical Procedures and Research/education and Trachea/surgery and Velopharyngeal Insufficiency/surgery",NA,NA,2008/04//undefined,Laryngoscope,NA,NA,NA,NA
Goepfert_2015_TheLar,JOUR,Development of a chemoradiation therapy toxicity staging system for oropharyngeal carcinoma,"Goepfert, Ryan P. and Yom, Sue S. and Ryan, William R. and Cheung, Steven W.",The Laryngoscope,"OBJECTIVES/HYPOTHESIS: Develop an innovative tool to standardize representation of treatment toxicity and enable shared decision making by mapping provider-based outcome descriptions to four overall stages of toxicity from chemoradiation therapy for oropharyngeal carcinoma. STUDY DESIGN: Cross-sectional, provider-based questionnaire. METHODS: Five short-term and five long-term treatment outcomes of cisplatin and intensity-modulated radiation therapy for oropharyngeal carcinoma were chosen by a focus group of head and neck oncologists. A pilot survey was developed in an online platform, and feedback from extramural head and neck oncologists was used to refine it for institutional review board submission and formal deployment. Respondents were surgical, radiation, and medical oncologists with experience in treating oropharyngeal carcinoma. One hundred five responses were analyzed, of which 67% were from providers with >10 years in practice and 79% were from providers who treat >15 new oropharyngeal carcinoma patients per year. RESULTS: A particular overall chemoradiation toxicity class is accounted for by two adjoining distress levels (>90% occurrence) for both short-term and long-term outcomes. Providers deemed mucositis and nausea, and pain and xerostomia the most distressing short-term and long-term toxicities, respectively. Providers were split as to their impression of the relative importance that patients place on short-term versus long-term outcomes when considering treatment options. CONCLUSIONS: A clinical tool to represent overall chemoradiation toxicity considering short-term and long-term outcomes has been developed by analyzing provider-centric responses to a realistic clinical scenario. Results from this pilot study enhance patient counseling and shared decision making, and serve as foundational information for a prospective, longitudinal patient-centric observational study.",2015,10.1002/lary.25023,125,4,869-876,eng,1531-4995 0023-852X,"Humans and Female and Male and Middle Aged and Cross-Sectional Studies and Risk Assessment and Aged and Time Factors and Pilot Projects and Surveys and Questionnaires and shared decision making and Follow-Up Studies and Focus Groups and Severity of Illness Index and Neoplasm Invasiveness/pathology and Radiotherapy, Intensity-Modulated/*adverse effects/methods and Chemoradiation toxicity and Chemoradiotherapy/*adverse effects/methods and Cisplatin/*adverse effects/therapeutic use and Neoplasm Staging/methods and oropharyngeal carcinoma and Oropharyngeal Neoplasms/mortality/*pathology/*therapy and provider-centric representations and short-term and long-term outcomes and staging system",NA,NA,2015/04//undefined,Laryngoscope,NA,NA,NA,NA
Cooper_2020_TheLar,JOUR,An Evaluation of the Presence of Spin in the Abstracts of Tonsillectomy Systematic Reviews,"Cooper, Craig M. and Johnson, Austin and Gray, Harrison and Vassar, Matt",The Laryngoscope,"OBJECTIVES/HYPOTHESIS: Spin-the practice of adding or omitting information intentionally or unintentionally to make the results of a study more favorable-may influence clinical decision making, especially when present in study abstracts. Here, we quantify and characterize the presence of spin in the abstracts of systematic reviews regarding tonsillectomy. METHODS: This study is an analysis of systematic review abstracts. Searches were conducted on September 23, 2019 on PubMed and Embase using the advanced search feature to retrieve systematic reviews regarding tonsillectomies. The nine most severe forms of spin were then evaluated. Spin was classified by two investigators in parallel, with each blinded to the classifications of the other. Study characteristics were also recorded in duplicate. Consensus meetings between investigators were held to resolve disagreements. RESULTS: In the 85 included systematic reviews, at least one form of spin was present in 44.7% (38/85) of abstracts. Journals with higher impact factors were less likely to contain spin in the abstracts of systematic reviews (point biserial correlation coefficient of -0.30). No statistically significant associations were found between the presence of spin and intervention type (P = .56) or adherence to Preferred Reporting Items for Systematic Reviews and Meta-Analyses (P = .08); however, there was a significant association between spin and funding source (P = .03). CONCLUSIONS: Spin was common in the abstracts of our sample of tonsillectomy systematic reviews. Researchers, clinicians, and peer reviewers could benefit from learning to recognize spin in medical literature. Further research is needed into the effects of spin on clinical decision making. LEVEL OF EVIDENCE: NA Laryngoscope, 2020.",2020,10.1002/lary.29002,NA,NA,E727-E731,eng,1531-4995 0023-852X,systematic reviews and reporting quality and Spin,NA,NA,2020/09/03/,Laryngoscope,NA,NA,NA,NA
Rosenwasser_2010_TheLar,JOUR,Perioperative medication errors in otolaryngology,"Rosenwasser, Rebecca and Winterstein, Almut G. and Rosenberg, Amy F. and Rosenberg, Eric I. and Antonelli, Patrick J.",The Laryngoscope,"OBJECTIVES/HYPOTHESIS: Medication errors are a common cause of poor clinical outcomes. Information on perioperative medication errors is scarce. This study was aimed at identifying the nature, cause, and potential remedies for medication errors in otolaryngologic surgery. STUDY DESIGN: Prospective and descriptive. METHODS: Clinicians were incentivized for reporting possible medication errors that occurred from the preoperative through the first postoperative clinic visit over a 2-month period. Each report was investigated by an expert panel to determine validity, preventability, contributing factors, and potential preventative measures. A random sample of procedures and clinic visits were monitored for compliance with safe medication practices and information flow. RESULTS: From 589 surgeries, 20 medication errors were reported (two preoperative, four operative, five during hospital admission, two in transition between services, four during discharge, and three postoperative). Errors included wrong dose (seven), omitted dose (six), wrong drug (five), wrong site (two), and unnecessary drug (one). Causes included failure to consider weight-based dosing, use accurate drug references, calculate the total medication supply needed, verify the administration site, consider pertinent patient information (e.g., allergies), reconcile medications upon transfers, and document medication histories. Use of preprinted order forms was flawed, and discharge instructions were insufficient to guide patients postoperatively. CONCLUSIONS: Failure to adhere to safe medication-use practices occurred throughout perioperative care. Improvement in medication documentation, following established safe practices, integration of patient information in prescribing decisions, and use of clinical decision support systems appear necessary to prevent perioperative medication errors in otolaryngology.",2010,10.1002/lary.20922,120,6,1214-1219,eng,1531-4995 0023-852X,Humans and Prospective Studies and Risk Factors and Medication Errors/*statistics & numerical data and *Otolaryngology and Florida/epidemiology,NA,NA,2010/06//undefined,Laryngoscope,NA,NA,NA,NA
Gildener.Leapman_2016_H.n,JOUR,Utility of up-front transoral robotic surgery in tailoring adjuvant therapy,"Gildener-Leapman, Neil and Kim, Jeehong and Abberbock, Shira and Choby, Garret W. and Mandal, Rajarsi and Duvvuri, Umamaheswar and Ferris, Robert L. and Kim, Seungwon",Head & neck,"BACKGROUND: The purpose of this study was to describe how the up-front transoral robotic surgery (TORS) approach could be used to individually tailor adjuvant therapy based on surgical pathology. METHODS: Between January 2009 and December 2013, 76 patients received TORS for oropharyngeal squamous cell carcinoma (OPSCC). Clinical predictors of adjuvant therapy were analyzed and comparisons were made between recommended treatment guidelines for up-front surgery versus definitive nonsurgical approaches. RESULTS: Advanced N classification, human papillomavirus (HPV)-positive tumor, extracapsular spread (ECS; 26 of 76), perineural invasion (PNI; 14 of 76), and positive margins (7 of 76) were significant predictors of adjuvant chemoradiotherapy (CRT) (p < .05). Up-front TORS deintensified adjuvant therapy; 76% of stage I/II and 46% of stage III/IV patients avoided CRT. Conversely, pathologic staging resulted in 33% of patients who would have received radiotherapy (RT) alone based on clinical staging, to be intensified to receive adjuvant CRT. CONCLUSION: The TORS approach deintensifies adjuvant therapy and provides valuable pathologic information to intensify treatment in select patients. TORS may be less effective in deintensification of adjuvant therapy in patients with clinically advanced N classification disease. (C) 2016 Wiley Periodicals, Inc. Head Neck 38:1201-1207, 2016.",2016,10.1002/hed.24390,38,8,1201-1207,eng,1097-0347 1043-3074,"decision-making and United States and Humans and Female and Male and Adult and Middle Aged and Retrospective Studies and Aged and Cohort Studies and Treatment Outcome and Prognosis and Analysis of Variance and Disease-Free Survival and Chi-Square Distribution and Survival Analysis and Kaplan-Meier Estimate and Academic Medical Centers and Patient Care Planning and Neoplasm Staging and Radiotherapy, Adjuvant and Neoplasm Invasiveness/pathology and adjuvant therapy and Carcinoma, Squamous Cell/mortality/pathology/surgery/*therapy and Chemoradiotherapy, Adjuvant/*methods and Head and Neck Neoplasms/mortality/pathology/surgery/*therapy and Laryngectomy/methods and Oropharyngeal Neoplasms/mortality/pathology/surgery/*therapy and oropharyngeal squamous cell carcinoma (OPSCC) and oropharynx and Robotic Surgical Procedures/*methods/mortality and Squamous Cell Carcinoma of Head and Neck and transoral robotic surgery (TORS)",NA,NA,2016/08//undefined,Head Neck,NA,NA,NA,NA
Eytan_2018_TheLar,JOUR,Utility of preoperative fine needle aspiration in parotid lesions,"Eytan, Danielle F. and Yin, Linda X. and Maleki, Zahra and Koch, Wayne M. and Tufano, Ralph P. and Eisele, David W. and Boahene, Kofi D. O. and Fakhry, Carole and Bishop, Justin A. and Westra, William H. and Gourin, Christine G.",The Laryngoscope,"OBJECTIVES: Preoperative fine needle aspiration (FNA) of parotid lesions often is used in the initial evaluation of parotid masses, but its role in guiding surgical decision making remains unclear, in part due to varying diagnostic accuracy reported. We sought to evaluate the role of preoperative FNA in detection of malignancy and impact on surgical management. STUDY DESIGN: Retrospective study. METHODS: The medical records of patients who underwent parotidectomy at a single tertiary medical center were reviewed from 2000 to 2015. Patients who had a preoperative FNA comprised the study cohort. RESULTS: A total of 1,074 consecutive patients underwent parotidectomy during the study period; of those, 477 had a preoperative FNA. FNA was nondiagnostic in 26 cases. There were 29 false positives (6.4%), 26 false negatives (5.8%), 122 true positives (27.1%), and 274 true negatives (60.8%). The sensitivity and specificity of FNA were 82.4% and 90.4%, respectively, with a positive predictive value of 80.8% and a negative predictive value of 91.3%. The overall accuracy of preoperative FNA was 87.8%. The preoperative FNA resulted in a change in the surgical plan in 85 (18.9%) cases. In 66 of these cases (78%), surgery was extended to include neck dissection at time of resection. In 10 cases, FNA led to surgical management over surveillance. In 11 cases, FNA downgraded the extent of surgery planned to an excisional biopsy. CONCLUSION: Preoperative FNA is a valuable adjunct in the surgical management of parotid lesions, with high specificity for the detection of malignant disease. LEVEL OF EVIDENCE: 4. Laryngoscope, 128:398-402, 2018.",2018,10.1002/lary.26776,128,2,398-402,eng,1531-4995 0023-852X,"Humans and Female and Male and Adolescent and Adult and Middle Aged and Young Adult and Child and Retrospective Studies and Aged and Sensitivity and Specificity and surgery and Aged, 80 and over and Predictive Value of Tests and False Positive Reactions and Clinical Decision-Making/*methods and False Negative Reactions and Biopsy, Fine-Needle/methods/*statistics & numerical data and cytology and fine needle aspiration and Parotid Gland/*pathology/surgery and Parotid neoplasms and Parotid Neoplasms/diagnosis/*pathology/surgery and pathology and Preoperative Care/methods/*statistics & numerical data",NA,NA,2018/02//undefined,Laryngoscope,NA,NA,NA,NA
Datema_2010_H.n,JOUR,Impact of comorbidity on short-term mortality and overall survival of head and neck cancer patients,"Datema, Frank R. and Ferrier, Marciano B. and van der Schroeff, Marc P. and Baatenburg de Jong, Robert J.",Head & neck,"BACKGROUND: In 2001, we presented a Cox regression model that is able to predict survival of the newly diagnosed patient with head and neck squamous cell carcinoma (HNSCC). This model is based on the TNM classification and other important clinical variables such as age at diagnosis, sex, primary tumor site, and prior malignancies. We aim to improve this model by including comorbidity as an extra prognostic variable. Accurate prediction of the prognosis of the newly diagnosed patient with head and neck cancer can assist the physician in patient counseling, clinical decision-making, and quality maintenance. METHODS: All patients with HNSCC of the oral cavity, pharynx, and larynx diagnosed in the Leiden University Medical Centre between 1981 and 1998 were included. From these 1371 patients, data on primary tumor site, age at diagnosis, sex, TNM classification, and prior malignancies were already available. Comorbidity data were collected retrospectively according to the ACE27 manual. The prognostic value of each variable on overall survival was studied univariately by Kaplan-Meier curves and the log-rank test. The Cox regression model was used to investigate the impact of these variables on overall survival simultaneously. Furthermore, univariate analyses were performed to investigate the impact of comorbidity severity on short-term mortality and to investigate the impact of organ-specific-comorbidity on short-term mortality. RESULTS: Comorbidity was present in 36.4% of our patients. Mild decompensation was seen in 17.4%, moderate decompensation in 13.5%, and severe decompensation in 5.5%. Most frequently observed ailments were cardiovascular, respiratory, and gastrointestinal. In univariate analyses, all prognostic variables, including comorbidity, contributed significantly to overall survival. Their contribution (except sex) remained significant in the multivariate Cox model. Internal validation of this model showed a concordance index of 0.73, indicating a good predictive value. Short-term mortality was seen in 5.7% of our patients. Cardiovascular comorbidity, respiratory comorbidity, gastrointestinal comorbidity, and diabetes showed a significant relationship with short-term mortality. CONCLUSIONS: Comorbidity impacts overall survival of the newly diagnosed patient with HNSCC. There is a clear distinction between the impact of the 4 ACE27 severity grades. The impact of an ACE27 grade 3 is comparable to the impact of a T4 tumor or an N2 neck. Comorbidity impacts short-term mortality as well. Especially cardiovascular comorbidity, respiratory comorbidity, gastrointestinal comorbidity, and diabetes show a strong relationship.",2010,10.1002/hed.21245,32,6,728-736,eng,1097-0347 1043-3074,"Humans and Middle Aged and Aged and Logistic Models and Comorbidity and Observer Variation and Carcinoma, Squamous Cell/*epidemiology/mortality and Head and Neck Neoplasms/*epidemiology/mortality and Laryngeal Neoplasms/epidemiology/mortality and Mouth Neoplasms/epidemiology/mortality and Pharyngeal Neoplasms/*epidemiology/mortality",NA,NA,2010/06//undefined,Head Neck,NA,NA,NA,NA
Leclerc_2020_TheLar,JOUR,The prevalence of cognitive impairment in laryngology treatment-seeking patients,"Leclerc, Andree-Anne and Gillespie, Amanda I. and Tadic, Stasa D. and Smith, Libby J. and Rosen, Clark A.",The Laryngoscope,"OBJECTIVES/HYPOTHESIS: The incidence of cognitive impairment (CI) in the elderly general population is 10% to 20%. The incidence of CI in the elderly laryngology treatment-seeking population is unknown, and CI may impact decision making for elective medical/surgical treatment and negatively impact the outcome of voice/swallowing therapy. We sought to determine the prevalence of CI in elderly patients who are seeking laryngology care and to evaluate the feasibility of administering a cognitive screening instrument. STUDY DESIGN: Prospective, Cross-sectional. METHODS: One hundred fifty patients (<e2><89><a5>65 years old) without a previous diagnosis of CI, seeking laryngology evaluation, were administered the Montreal Cognitive Assessment (MoCA) test by a trained physician. Other members of the clinical team were blinded to the MoCA results. RESULTS: Twenty-five percent of participants obtained a score diagnostic for at least mild CI. The results showed a correlation between the MoCA scores and 1) the time needed to complete the test, 2) participant age, and 3) participant education level. No differences were observed between gender, alcohol consumption, or use of medications that can affect cognition and MoCA score. CONCLUSION: One in four elderly laryngology treatment-seeking patients were found to have undiagnosed CI. This finding warrants consideration for CI screening for these patients being evaluated for voice therapy and elective surgery. Treatment decision making in this population may benefit from additional family involvement. LEVEL OF EVIDENCE: 2c Laryngoscope, 130: 2003-2007, 2020.",2020,10.1002/lary.28355,130,8,2003-2007,eng,1531-4995 0023-852X,"Humans and Female and Male and Cross-Sectional Studies and Aged and Feasibility Studies and Prospective Studies and Prevalence and Aged, 80 and over and dementia and Patient Acceptance of Health Care and Cognitive impairment and laryngology and Mental Status and Dementia Tests and Cognitive Dysfunction/*complications/diagnosis/*epidemiology and Laryngeal Diseases/*complications and Montreal Cognitive Assessment",NA,NA,2020/08//undefined,Laryngoscope,NA,NA,NA,NA
Leung_2021_TheLar,JOUR,Should Oral Corticosteroids be Used in Medical Therapy for Chronic Rhinosinusitis? A Risk Analysis,"Leung, Randy M. and Smith, Timothy L. and Kern, Robert C. and Chandra, Rakesh K. and Schlosser, Rodney J. and Harvey, Richard J. and Conley, David B. and Lee, John M.",The Laryngoscope,"OBJECTIVES: Oral corticosteroid (OCS) as a part of appropriate medical therapy (AMT) (formerly maximal medical therapy) in chronic rhinosinusitis remains controversial. While the risks of OCS are well known, the benefit remains unclear due the absence of a standardized prescribing regimen. Consequently, it is difficult to characterize whether the risks of OCS and its ability to avert endoscopic sinus surgery (ESS) are helpful in AMT. When OCS is highly effective at averting surgery, the lesser risks of OCS would be justified because it can avoid the greater risks of ESS. When OCS is poorly effective at averting ESS, the risks of OCS would not be justified because many patients will be exposed to both risks. This study seeks to identify the threshold effectiveness of OCS at averting ESS that would minimize risk exposure to patients. METHODS: A probabilistic risks-based decision analysis was constructed from literature reported incidences and impacts of adverse events of OCS and ESS. Monte Carlo analysis was performed to identify the minimum effectiveness required to avoid further intervention (MERAFI) for chronic sinusitis without nasal polyp (CRSsNP) and chronic sinusitis with nasal polyp (CRSwNP). RESULTS: The analysis showed MERAFI results of 20.8% (95% CI 20.7-20.9%) for CRSsNP and 16.8% (95% CI 16.7-16.9%) for CRSwNP. CONCLUSIONS: Given reported OCS effectiveness in the range of 34-71% in CRSsNP and 46-63% in CRSwNP, this analysis suggests that the inclusion of OCS in AMT may be the lower risk strategy. LEVEL OF EVIDENCE: N/A Laryngoscope, 131:473-481, 2021.",2021,10.1002/lary.28843,131,3,473-481,eng,1531-4995 0023-852X,"Humans and Male and Middle Aged and Treatment Outcome and Computer Simulation and Administration, Oral and Monte Carlo Method and Likelihood Functions and Clinical Decision-Making and Risk Assessment/methods/statistics & numerical data and Chronic Disease/therapy and Endoscopy/adverse effects and Glucocorticoids/administration & dosage/*adverse effects and Nasal Polyps/immunology/*therapy and Nasal Surgical Procedures/adverse effects and Postoperative Complications/epidemiology/etiology/prevention & control and Rhinitis/immunology/*therapy and Risk analysis, chronic rhinosinusitis, oral corticosteroid, endoscopic sinus surgery, evidence-based medicine and Sinusitis/immunology/*therapy",NA,NA,2021/03//undefined,Laryngoscope,NA,NA,NA,NA
