label,type,title,author,journal,abstract,year,doi,volume,issue,pages,language,issn,keywords,url,institution,DA,j2,DP,l1,l2,ST
Matheson_2013_Spormedi.AucN.Z.,JOUR,"Prevention and management of non-communicable disease: the IOC consensus statement, Lausanne 2013","Matheson, Gordon O. and Klugl, Martin and Engebretsen, Lars and Bendiksen, Fredrik and Blair, Steven N. and Borjesson, Mats and Budgett, Richard and Derman, Wayne and Erdener, Ugur and Ioannidis, John P. A. and Khan, Karim M. and Martinez, Rodrigo and van Mechelen, Willem and Mountjoy, Margo and Sallis, Robert E. and Schwellnus, Martin and Shultz, Rebecca and Soligard, Torbjorn and Steffen, Kathrin and Sundberg, Carl Johan and Weiler, Richard and Ljungqvist, Arne","Sports medicine (Auckland, N.Z.)","Morbidity and mortality from preventable, non-communicable chronic disease (NCD) threatens the health of our populations and our economies. The accumulation of vast amounts of scientific knowledge has done little to change this. New and innovative thinking is essential to foster new creative approaches that leverage and integrate evidence through the support of big data, technology, and design thinking. The purpose of this paper is to summarize the results of a consensus meeting on NCD prevention sponsored by the International Olympic Committee (IOC) in April, 2013. Within the context of advocacy for multifaceted systems change, the IOC's focus is to create solutions that gain traction within health care systems. The group of participants attending the meeting achieved consensus on a strategy for the prevention and management of chronic disease that includes the following: 1. Focus on behavioural change as the core component of all clinical programs for the prevention and management of chronic disease. 2. Establish actual centres to design, implement, study, and improve preventive programs for chronic disease. 3. Use human-centered design in the creation of prevention programs with an inclination to action, rapid prototyping and multiple iterations. 4. Extend the knowledge and skills of Sports and Exercise Medicine (SEM) professionals to build new programs for the prevention and treatment of chronic disease focused on physical activity, diet and lifestyle. 5. Mobilize resources and leverage networks to scale and distribute programs of prevention. True innovation lies in the ability to align thinking around these core strategies to ensure successful implementation of NCD prevention and management programs within health care. The IOC and SEM community are in an ideal position to lead this disruptive change. The outcome of the consensus meeting was the creation of the IOC Non-Communicable Diseases ad-hoc Working Group charged with the responsibility of moving this agenda forward.",2013,10.1007/s40279-013-0104-3,43,11,1075-1088,eng,1179-2035 0112-1642,Humans and Consumer Behavior and Life Style and Chronic Disease/*prevention & control and International Agencies and *Health Promotion and Preventive Health Services/*organization & administration and *Risk Reduction Behavior and Sports Medicine/education/methods,NA,NA,2013/11//undefined,Sports Med,NA,NA,NA,NA
Guan_2018_Thinjoofbenuanphac,JOUR,Targeted retail coupons influence category-level food purchases over 2-years,"Guan, Xintong and Atlas, Stephen A. and Vadiveloo, Maya",The international journal of behavioral nutrition and physical activity,"BACKGROUND: Targeted coupons strongly influence purchasing behavior and may represent an innovative approach for improving dietary behaviors. METHODS: The retail analytics firm, Dunnhumby, provided secondary retail data containing grocery transactions, targeted coupon exposures, and coupon use for 2500 households over 2-years. The USDA Quarterly At-Home Food Purchasing Database was used to categorize individual foods into 52 categories and combined into 12 food groups. Mixed effects linear models estimated the difference-in-difference effects of coupon exposure on category-level purchase rate/wk. pre- and post-campaign; models also tested effect modification by food category. RESULTS: Category-level food purchases significantly increased post-campaign. Mean (SD) food purchases/wk. Among exposed households (17.34 (13.08) units/wk) vs. unexposed households (3.75 (4.59) units/wk) were higher (p < 0.001). Difference-in-difference effects of coupon exposure showed a higher increase in purchase rate among exposed vs. unexposed households (5.73 vs. 0.67, p < 0.001). Food category significantly modified the association between coupon exposure and coupon campaign. Category-level purchase rate among exposed vs. unexposed households was relatively higher in less healthful (e.g. convenience foods) vs. more healthful categories (e.g. nuts) with a 1.17 unit/wk. increase in convenience foods purchase (p < 0.001) vs. a 0.03 unit/wk. increase in nuts (p < 0.001). Exploratory analyses suggested that price elasticity of food categories for targeted coupons (1.02-2.81) was higher than previous estimates for untargeted coupons. CONCLUSION: Across food categories, coupon exposure increased category-level purchase rate, with a relatively larger effect size for less healthful than more healthful categories. Promising results from this preliminary study suggest that experimental research is warranted to determine whether targeting with the explicit purpose of improving dietary quality can more effectively influence diet, and whether it can do so more cost effectively.",2018,10.1186/s12966-018-0744-7,15,1,111,eng,1479-5868,"Intervention and Incentives and Humans and Commerce and Cost-Benefit Analysis and Longitudinal Studies and Health Behavior and Family Characteristics and Longitudinal and Food Quality and Consumer Behavior/*economics and Diet, Healthy/economics and Dietary pattern and Difference-in-difference and Fast Foods/economics and Food Supply/economics and Grocery purchases and Healthful food purchase and Marketing/*economics and Retail purchase quality and Targeted coupon",NA,NA,2018/11/15/,Int J Behav Nutr Phys Act,NA,NA,NA,NA
Brondeel_2017_Thinjoofbenuanphac,JOUR,An evaluation of transport mode shift policies on transport-related physical activity through simulations based on random forests,"Brondeel, Ruben and Kestens, Yan and Chaix, Basile",The international journal of behavioral nutrition and physical activity,"BACKGROUND: Physical inactivity is widely recognized as one of the leading causes of mortality, and transport accounts for a large part of people's daily physical activity. This study develops a simulation approach to evaluate the impact of the Ile-de-France Urban Mobility Plan (2010-2020) on physical activity, under the hypothesis that the intended transport mode shifts are realized. METHODS: Based on the Global Transport Survey (2010, n = 21,332) and on the RECORD GPS Study (2012-2013, n = 229) from the French capital region of Paris (Ile-de-France), a simulation method was designed and tested. The simulation method used accelerometer data and random forest models to predict the impact of the transport mode shifts anticipated in the Mobility Plan on transport-related moderate-to-vigorous physical activity (T-MVPA). The transport mode shifts include less private motorized trips in favor of more public transport, walking, and biking trips. RESULTS: The simulation model indicated a mean predicted increase of 2 min per day of T-MVPA, in case the intended transport mode shifts in the Ile-de-France Urban Mobility Plan were realized. The positive effect of the transport mode shifts on T-MVPA would, however, be larger for people with a higher level of education. This heterogeneity in the positive effect would further increase the existing inequality in transport-related physical activity by educational level. CONCLUSIONS: The method presented in this paper showed a significant increase in transport-related physical activity in case the intended mode shifts in the Ile-de-France Urban Mobility Plan were realized. This simulation method could be applied on other important health outcomes, such as exposure to noise or air pollution, making it a useful tool to anticipate the health impact of transport interventions or policies.",2017,10.1186/s12966-017-0600-1,14,1,143,eng,1479-5868,Machine learning and Humans and Health Promotion and Surveys and Questionnaires and Educational Status and Health inequalities and Data integration and Policy and France and Paris and *Exercise and Transportation/*methods and Active transport and Air Pollution/statistics & numerical data and Bicycling/statistics & numerical data and RECORD cohort study and Simulation study and Transport and Walking/statistics & numerical data,NA,NA,2017/10/23/,Int J Behav Nutr Phys Act,NA,NA,NA,NA
Chiampas_2015_Spormedi.AucN.Z.,JOUR,Innovative Operations Measures and Nutritional Support for Mass Endurance Events,"Chiampas, George T. and Goyal, Anita V.","Sports medicine (Auckland, N.Z.)","Endurance and sporting events have increased in popularity and participation in recent years worldwide, and with this comes the need for medical directors to apply innovative operational strategies and nutritional support to meet such demands. Mass endurance events include sports such as cycling and running half, full and ultra-marathons with over 1000 participants. Athletes, trainers and health care providers can all agree that both participant outcomes and safety are of the utmost importance for any race or sporting event. While demand has increased, there is relatively less published guidance in this area of sports medicine. This review addresses public safety, operational systems, nutritional support and provision of medical care at endurance events. Significant medical conditions in endurance sports include heat illness, hyponatraemia and cardiac incidents. These conditions can differ from those typically encountered by clinicians or in the setting of low-endurance sports, and best practices in their management are discussed. Hydration and nutrition are critical in preventing these and other race-related morbidities, as they can impact both performance and medical outcomes on race day. Finally, the command and communication structures of an organized endurance event are vital to its safety and success, and such strategies and concepts are reviewed for implementation. The nature of endurance events increasingly relies on medical leaders to balance safety and prevention of morbidity while trying to help optimize athlete performance.",2015,10.1007/s40279-015-0396-6,45 Suppl 1,Suppl 1,69-S61,eng,1179-2035 0112-1642,Humans and Algorithms and Clinical Decision-Making and Emergency Medical Services/*organization & administration and *Sports Nutritional Physiological Phenomena and Athletic Injuries/*prevention & control/therapy and Competitive Behavior/*physiology and Dehydration/prevention & control and Heart Arrest/prevention & control/therapy and Heat Stress Disorders/prevention & control/therapy and Hyponatremia/prevention & control/therapy and Physical Endurance/*physiology and Sports Medicine/*organization & administration,NA,NA,2015/11//undefined,Sports Med,NA,NA,NA,NA
Shrier_2015_Brjoofspme,JOUR,Strategic Assessment of Risk and Risk Tolerance (StARRT) framework for return-to-play decision-making,"Shrier, Ian",British journal of sports medicine,"The sport medicine clinician is faced with return-to-play (RTP) decisions for every patient who wants to return to activity. The complex interaction of factors related to history, physical examination, testing, activity and baseline characteristics can make RTP decision-making challenging. Further, when reasoning is not explicit, unnecessary conflict can arise among clinicians themselves, or among clinicians and patients. This conflict can have negative health consequences for the patient. In 2010, a transparent framework for RTP decisions was proposed. However, some have identified limitations to the framework and found difficulties in its implementation. This paper presents a revised framework that addresses the limitations, and provides concrete examples of how to apply it in simple and complex cases.",2015,10.1136/bjsports-2014-094569,49,20,1311-1315,eng,1473-0480 0306-3674,Humans and Prognosis and Review and Medical History Taking and Secondary Prevention and *Clinical Decision-Making and Risk Assessment/methods and Physical Examination and Clinical Competence/standards and Athletic Injuries/*prevention & control/rehabilitation and Method and Return to Sport/*physiology and Sports & exercise medicine and Sports Medicine/*standards,NA,NA,2015/10//undefined,Br J Sports Med,NA,NA,NA,NA
Panhuyzen.Goedkoop_2014_Brjoofspme,JOUR,Legal responsibilities of physicians when making participation decisions in athletes with cardiac disorders: Do guidelines provide a solid legal footing?,"Panhuyzen-Goedkoop, Nicole M. and Smeets, Joep L. R. M.",British journal of sports medicine,"Safe sports participation involves protecting athletes from injury and life-threatening situations. Preparticipation cardiovascular screening (PPS) in athletes is intended to prevent exercise-related sudden cardiac death by medical management of athletes at risk, which may include disqualification from sports participation. The screening physician relies on current guidelines and expert recommendations for management and decision-making. There is concern about false-positive screening results and wrongly grounding an athlete. Similarly, there is a concern about false-negative screening results and athletes participating with potentially lethal disorders. Who is legally responsible if an athlete suddenly dies after a proper PPS resulting in low risk? Several consensus documents based on expert opinion describe only a few lines on legal responsibilities in eligibility screening and disqualification decision-making in athletes. This article discusses legal responsibilities and concerns in eligibility decision-making for physicians.",2014,10.1136/bjsports-2013-093023,48,15,1193-1195,eng,1473-0480 0306-3674,"Cardiology and Humans and Social Responsibility and Adolescent and Adult and Young Adult and Child and Decision Making and Exercise and Practice Guidelines as Topic and Early Diagnosis and Athletics and Cardiology Prevention and Death, Sudden, Cardiac/*prevention & control and Professional Practice/legislation & jurisprudence and Sports Analysis in Different Types of Sports and Sports Medicine/*legislation & jurisprudence",NA,NA,2014/08//undefined,Br J Sports Med,NA,NA,NA,NA
Maiorana_2018_Spormedi.AucN.Z.,JOUR,Exercise Professionals with Advanced Clinical Training Should be Afforded Greater Responsibility in Pre-Participation Exercise Screening: A New Collaborative Model between Exercise Professionals and Physicians,"Maiorana, Andrew J. and Williams, Andrew D. and Askew, Christopher D. and Levinger, Itamar and Coombes, Jeff and Vicenzino, Bill and Davison, Kade and Smart, Neil A. and Selig, Steve E.","Sports medicine (Auckland, N.Z.)","Regular exercise improves health but can also induce adverse responses. Although such episodes are rare, many guidelines for pre-participation exercise screening have historically had a low threshold for recommending medical clearance prior to the commencement of exercise, placing the responsibility for decision making about exercise participation on physicians. The 'clearance to exercise' model still occurs widely in practice, but creates cost burdens and barriers to the uptake of exercise. Moreover, many physicians are not provided the training, nor time in a standard consultation, to be able to effectively perform this role. We present a model for pre-participation exercise screening and the initial assessment of clients wishing to commence an exercise programme. It is designed to guide professional practice for the referral, assessment and prescription of exercise for people across the health spectrum, from individuals who are apparently healthy, through to clients with pre-existing or occult chronic conditions. The model removes the request that physicians provide a 'clearance' for patients to engage in exercise programmes. Instead the role of physicians is identified as providing relevant clinical guidance to suitably qualified exercise professionals to allow them to use their knowledge, skills and expertise in exercise prescription to assess and manage any risks related to the prescription and delivery of appropriate exercise programmes. It is anticipated that removing unjustified barriers to exercise participation, such as mandated medical review, will improve the uptake of exercise by the unacceptably high proportion of the population who do not undertake sufficient physical activity for health benefit.",2018,10.1007/s40279-018-0888-2,48,6,1293-1302,eng,1179-2035 0112-1642,Humans and Chronic Disease and Exercise Therapy and Australia and Consensus and New Zealand and *Physicians and *Interprofessional Relations and *Exercise and *Physical Fitness and Mass Screening/*methods/standards and Surveys and Questionnaires/standards,NA,NA,2018/06//undefined,Sports Med,NA,NA,NA,NA
Schmidt_2020_Spormedi.AucN.Z.,JOUR,Medical Disqualification Following Concussion in Collegiate Student-Athletes: Findings from the CARE Consortium,"Schmidt, Julianne D. and Rawlins, Michelle L. Weber and Lynall, Robert C. and D'Lauro, Christopher and Clugston, James R. and McAllister, Tom W. and McCrea, Michael and Broglio, Steven P.","Sports medicine (Auckland, N.Z.)","BACKGROUND: The absence of evidence-based guidelines make medical disqualification (MDQ) following concussion one of the most challenging decision-making processes faced by sports medicine professionals. OBJECTIVE: We aimed to compare premorbid and postmorbid factors between student-athletes that were and were not medically disqualified from sport following a concussion. METHODS: Among 1832 student-athletes diagnosed with concussion within the CARE Consortium, 53 (2.9%) were medically disqualified (MDQ +) and 1779 (97.1%) were not medically disqualified (MDQ-). We used contingency tables and descriptive statistics for an initial evaluation of a broad list of premorbid and postmorbid factors. For those factors showing association with MDQ status, we calculated odds ratios and 95% confidence intervals for the odds of being MDQ + in the presence of the identified factor. RESULTS: History of 2 (OR: 3.2, 95% CI 1.5, 6.9) or 3 + (OR: 7.4, 95% CI 3.4, 15.9) previous concussions; 1 + headaches in past 3 months (OR: 1.8, 95% CI 1.0, 3.2); immediate removal from play (OR: 2.4, 95% CI 1.2, 4.9); alcohol (OR: 2.6, 95% CI 1.2, 5.4), tobacco (OR: 3.3, 95% CI 1.1, 9.5), or marijuana use since injury (OR: 5.4, 95% CI 1.5, 19.0); as well as prolonged recovery due to mental health alterations (OR: 5.3, 95% CI 2.0, 14.1) or motivation/malingering (OR: 7.5, 95% CI 3.3, 17.0) increased odds of being MDQ + . The MDQ + group took longer to become asymptomatic relative to the MDQ- group (MDQ + : 23.5 days, 95% CI 15.8, 31.2; MDQ-: 10.6 days, 95% CI 9.5, 11.6; p < 0.001). CONCLUSIONS: MDQ following concussion was relatively rare. We identified three patterns related to MDQ following concussion: (1) concussion and headache history were the only premorbid factors that differed (2) initial concussion presentation was more severe and more immediate in the MDQ + group, and (3) post-concussion recovery outcomes expressed the greatest differences between groups.",2020,10.1007/s40279-020-01302-y,50,10,1843-1855,eng,1179-2035 0112-1642,Humans and Female and Male and Risk Factors and Universities and *Clinical Decision-Making and *Return to Sport and Athletic Injuries/*physiopathology and Brain Concussion/*physiopathology,NA,NA,2020/10//undefined,Sports Med,NA,NA,NA,NA
Kerr_2018_Meanscinspanex,JOUR,Improving Hip-Worn Accelerometer Estimates of Sitting Using Machine Learning Methods,"Kerr, Jacqueline and Carlson, Jordan and Godbole, Suneeta and Cadmus-Bertram, Lisa and Bellettiere, John and Hartman, Sheri",Medicine and science in sports and exercise,"PURPOSE: This study aimed to improve estimates of sitting time from hip-worn accelerometers used in large cohort studies by using machine learning methods developed on free-living activPAL data. METHODS: Thirty breast cancer survivors concurrently wore a hip-worn accelerometer and a thigh-worn activPAL for 7 d. A random forest classifier, trained on the activPAL data, was used to detect sitting, standing, and sit-stand transitions in 5-s windows in the hip-worn accelerometer. The classifier estimates were compared with the standard accelerometer cut point, and significant differences across different bout lengths were investigated using mixed-effect models. RESULTS: Overall, the algorithm predicted the postures with moderate accuracy (stepping, 77%; standing, 63%; sitting, 67%; sit-to-stand, 52%; and stand-to-sit, 51%). Daily level analyses indicated that errors in transition estimates were only occurring during sitting bouts of 2 min or less. The standard cut point was significantly different from the activPAL across all bout lengths, overestimating short bouts and underestimating long bouts. CONCLUSIONS: This is among the first algorithms for sitting and standing for hip-worn accelerometer data to be trained from entirely free-living activPAL data. The new algorithm detected prolonged sitting, which has been shown to be the most detrimental to health. Further validation and training in larger cohorts is warranted.",2018,10.1249/MSS.0000000000001578,50,7,1518-1524,eng,1530-0315 0195-9131,"Humans and Female and Middle Aged and Cross-Sectional Studies and Aged and Pilot Projects and Algorithms and Breast Neoplasms and *Machine Learning and Accelerometry/*instrumentation and *Exercise and Survivors and *Hip and *Sitting Position and Monitoring, Ambulatory/methods and Thigh",NA,NA,2018/07//undefined,Med Sci Sports Exerc,NA,NA,NA,NA
Kerr_2016_Meanscinspanex,JOUR,Objective Assessment of Physical Activity: Classifiers for Public Health,"Kerr, Jacqueline and Patterson, Ruth E. and Ellis, Katherine and Godbole, Suneeta and Johnson, Eileen and Lanckriet, Gert and Staudenmayer, John",Medicine and science in sports and exercise,"PURPOSE: Walking for health is recommended by health agencies, partly based on epidemiological studies of self-reported behaviors. Accelerometers are now replacing survey data, but it is not clear that intensity-based cut points reflect the behaviors previously reported. New computational techniques can help classify raw accelerometer data into behaviors meaningful for public health. METHODS: Five hundred twenty days of triaxial 30-Hz accelerometer data from three studies (n = 78) were employed as training data. Study 1 included prescribed activities completed in natural settings. The other two studies included multiple days of free-living data with SenseCam-annotated ground truth. The two populations in the free-living data sets were demographically and physical different. Random forest classifiers were trained on each data set, and the classification accuracy on the training data set and that applied to the other available data sets were assessed. Accelerometer cut points were also compared with the ground truth from the three data sets. RESULTS: The random forest classified all behaviors with over 80% accuracy. Classifiers developed on the prescribed data performed with higher accuracy than the free-living data classifier, but these did not perform as well on the free-living data sets. Many of the observed behaviors occurred at different intensities compared with those identified by existing cut points. CONCLUSIONS: New machine learning classifiers developed from prescribed activities (study 1) were considerably less accurate when applied to free-living populations or to a functionally different population (studies 2 and 3). These classifiers, developed on free-living data, may have value when applied to large cohort studies with existing hip accelerometer data.",2016,10.1249/MSS.0000000000000841,48,5,951-957,eng,1530-0315 0195-9131,"Public Health and Humans and Female and Male and Adult and Middle Aged and Aged and Obesity and *Algorithms and Overweight and *Machine Learning and Monitoring, Ambulatory/*methods and *Exercise and Activities of Daily Living/classification and Accelerometry/*methods and Bicycling",NA,NA,2016/05//undefined,Med Sci Sports Exerc,NA,NA,NA,NA
