label,type,title,author,journal,abstract,year,doi,volume,issue,pages,language,issn,keywords,url,institution,DA,j2,DP,l1,l2,ST
Shrier_2014_Brjoofspme,JOUR,Return to play following injury: whose decision should it be?,"Shrier, Ian and Safai, Parissa and Charland, Lyn",British journal of sports medicine,"BACKGROUND: Return-to-play (RTP) decision-making is required for every injured athlete. However, these decisions often lead to conflict between sport medicine professionals, athletes, coaches and sport associations. This study explores differences in professionals' opinion about which criteria should be used for RTP decisions, and who is best able to evaluate them. METHODS: We surveyed Canadian sport medicine physicians, physiotherapists, athletic therapists, chiropractors, massage therapists, athletes, coaches and representatives from three sport associations. The 10 min online survey asked respondents to rate criteria as mandatory to irrelevant on a five-point Likert scale, and to indicate which profession was best able to evaluate the criteria. RESULTS: In general, medical doctors, physiotherapists and athletic therapists were considered best able to assess factors related to risk of injury and complications from injury. Each clinician group (except sport massage therapists) generally believed their own profession has the best capacity to evaluate the criteria. Athletes, coaches and sport associations were considered to have the best capacity to assess factors related to competition (desire, psychological and financial impact and loss of competitive standing). There remained considerable heterogeneity both between and within stakeholder groups. CONCLUSIONS: We found that differences in approach to RTP decisions were generally greater within versus between-stakeholder groups. If shared decision-making is to become the norm in clinical sport medicine, we need to begin a discussion on which discrepancies are due to lack of training (resolved through education) or scientific knowledge (resolved through research) or simply reflect the divergence of personal/societal values.",2014,10.1136/bjsports-2013-092492,48,5,394-401,eng,1473-0480 0306-3674,Humans and Adolescent and Adult and Middle Aged and Young Adult and Aged and Evaluation and Attitude to Health and Attitude of Health Personnel and *Decision Making and Risk Assessment/methods and Professional Practice and *Sports Medicine and Athletic Injuries/physiopathology/*rehabilitation and Recovery of Function/physiology and Sporting injuries and Sports rehabilitation programs,NA,NA,2014/03//undefined,Br J Sports Med,NA,NA,NA,NA
Heesch_2018_Thinjoofbenuanphac,JOUR,Validity of objective methods for measuring sedentary behaviour in older adults: a systematic review,"Heesch, Kristiann C. and Hill, Robert L. and Aguilar-Farias, Nicolas and van Uffelen, Jannique G. Z. and Pavey, Toby",The international journal of behavioral nutrition and physical activity,"BACKGROUND: The evidence showing the ill health effects of prolonged sedentary behaviour (SB) is growing. Most studies of SB in older adults have relied on self-report measures of SB. However, SB is difficult for older adults to recall and objective measures that combine accelerometry with inclinometry are now available for more accurately assessing SB. The aim of this systematic review was to assess the validity and reliability of these accelerometers for the assessment of SB in older adults. METHODS: EMBASE, PubMed and EBSCOhost databases were searched for articles published up to December 13, 2017. Articles were eligible if they: a) described reliability, calibration or validation studies of SB measurement in healthy, community-dwelling individuals, b) were published in English, Portuguese or Spanish, and c) were published or in press as journal articles in peer-reviewed journals. RESULTS: The review identified 15 studies in 17 papers. Of the included studies, 11 assessed the ActiGraph accelerometer. Of these, three examined reliability only, seven (in eight papers) examined validity only and one (in two papers) examined both. The strongest evidence from the studies reviewed is from studies that assessed the validity of the ActiGraph. These studies indicate that analysis of the data using 60-s epochs and a vertical magnitude cut-point < 200 cpm or using 30- or 60-s epochs with a machine learning algorithm provides the most valid estimates of SB. Non-wear algorithms of 90+ consecutive zeros is also suggested for the ActiGraph. CONCLUSIONS: Few studies have examined the reliability and validity of accelerometers for measuring SB in older adults. Studies to date suggest that the criteria researchers use for classifying an epoch as sedentary instead of as non-wear time (e.g., the non-wear algorithm used) may need to be different for older adults than for younger adults. The required number of hours and days of wear for valid estimates of SB in older adults was not clear from studies to date. More older-adult-specific validation studies of accelerometers are needed, to inform future guidelines on the appropriate criteria to use for analysis of data from different accelerometer brands. TRIAL REGISTRATION: PROSPERO ID# CRD42017080754 registered December 12, 2017.",2018,10.1186/s12966-018-0749-2,15,1,119,eng,1479-5868,Accelerometer and Measurement and Humans and Female and Male and Aged and Reproducibility of Results and Self Report and *Algorithms and Mental Recall and *Exercise and Wearable Electronic Devices and Actigraphy/methods and Older adults and Accelerometry/*methods and *Sedentary Behavior and Sedentary time and Sitting,NA,NA,2018/11/26/,Int J Behav Nutr Phys Act,NA,NA,NA,NA
Rosenberg_2017_Meanscinspanex,JOUR,Classifiers for Accelerometer-Measured Behaviors in Older Women,"Rosenberg, Dori and Godbole, Suneeta and Ellis, Katherine and Di, Chongzhi and Lacroix, Andrea and Natarajan, Loki and Kerr, Jacqueline",Medicine and science in sports and exercise,"PURPOSE: Machine learning methods could better improve the detection of specific types of physical activities and sedentary behaviors from accelerometer data. No studies in older populations have developed and tested algorithms for walking and sedentary time in free-living daily life. Our goal was to rectify this gap by leveraging access to data from two studies in older women. METHODS: In study 1, algorithms were developed and tested in a sample of older women (N = 39, age range = 55-96 yr) in the field. Women wore accelerometers and SenseCam (ground truth annotation) devices for 7 d, yielding 3191 h and 320 d of data. Images were annotated and time matched to accelerometer data, and random forest classifiers labeled behaviors (sitting, riding in a vehicle, standing still, standing moving, and walking/running). In study 2, we examined the concurrent validity of the algorithms using accelerometer data from an observed 400-m walk test (2983 min of data available) and 6 d of wearing both accelerometers and global positioning systems devices in a sample of 222 women (age range = 67-100; 313,290 min of data available). Analyses included sensitivity, specificity balanced accuracy, and precision, as appropriate, averaged over each test participant at the minute level for each behavior. RESULTS: In study 1, the algorithms had 82.2% balanced accuracy. In study 2, the classifier had 87.9% accuracy for predicting walking. Overall machine learning classifiers and global positioning systems had 88.6% agreement. CONCLUSIONS: Free-living algorithms for walking and sedentary time yielded high levels of accuracy and concurrent validity and can be applied to existing accelerometer data from older women.",2017,10.1249/MSS.0000000000001121,49,3,610-616,eng,1530-0315 0195-9131,"Humans and Female and Aged and Machine Learning and Reproducibility of Results and Aged, 80 and over and Activities of Daily Living and *Algorithms and Geographic Information Systems and *Health Behavior and Accelerometry/*methods and *Walking and *Sedentary Behavior",NA,NA,2017/03//undefined,Med Sci Sports Exerc,NA,NA,NA,NA
Price_2012_Brjoofspme,JOUR,Current practices in determining return to play following head injury in professional football in the UK,"Price, Jo and Malliaras, Peter and Hudson, Zoe",British journal of sports medicine,"OBJECTIVE: To investigate the awareness of English football team doctors of the 'Consensus in Sport' (CIS) guidelines for the assessment and management of concussion, and to identify adherence to these internationally accepted recommendations. METHOD: A questionnaire was sent to Club Medical Officers of all the 92 English Football league teams. RESULTS: The majority (55.6%) of teams in the English Football Association (FA) do not routinely follow the CIS guidelines. Only 21% of teams routinely record an approved preseason cognitive score and only 42% complete a recommended postconcussion assessment. One-third are still using outdated fixed periods of abstinence following a concussion. CONCLUSIONS: FA players are not being treated according to the guidelines recommended by International sporting organisations. The endorsement of the CIS guidelines by the English FA would ensure that all medical teams have a sound and safe protocol for managing concussed players and making return to play decisions.",2012,10.1136/bjsports-2011-090687,46,14,1000-1003,eng,1473-0480 0306-3674,England and Humans and Decision Making and Surveys and Questionnaires and Practice Guidelines as Topic and Neuropsychological Tests and Guideline Adherence and Recovery of Function and Sports Medicine/*standards and *Convalescence and Brain Concussion/*rehabilitation and Craniocerebral Trauma/*rehabilitation and Football/*injuries and Professional Practice/*standards,NA,NA,2012/11//undefined,Br J Sports Med,NA,NA,NA,NA
Provvidenza_2013_Brjoofspme,JOUR,"From consensus to action: knowledge transfer, education and influencing policy on sports concussion","Provvidenza, Christine and Engebretsen, Lars and Tator, Charles and Kissick, Jamie and McCrory, Paul and Sills, Allen and Johnston, Karen M.",British journal of sports medicine,"OBJECTIVE: To: (1) provide a review of knowledge transfer (KT) and related concepts; (2) look at the impact of traditional and emerging KT strategies on concussion knowledge and education; (3) discuss the value and impact of KT to organisations and concussion-related decision making and (4) make recommendations for the future of concussion education. DESIGN: Qualitative literature review of KT and concussion education literature. INTERVENTION: PubMed, Medline and Sport Discus databases were reviewed and an internet search was conducted. The literature search was restricted to articles published in the English language, but not restricted to any particular years. Altogether, 67 journal articles, 21 websites, 1 book and 1 report were reviewed. RESULTS: The value of KT as part of concussion education is increasingly becoming recognised. Target audiences benefit from specific learning strategies. Concussion tools exist, but their effectiveness and impact require further evaluation. The media is valuable in drawing attention to concussion, but efforts need to ensure that the public is aware of the right information. Social media as a concussion education tool is becoming more prominent. Implementation of KT models is one approach which organisations can use to assess knowledge gaps; identify, develop and evaluate education strategies and use the outcomes to facilitate decision-making. CONCLUSIONS: Implementing KT strategies requires a defined plan. Identifying the needs, learning styles and preferred learning strategies of target audiences, coupled with evaluation, should be a piece of the overall concussion education puzzle to have an impact on enhancing knowledge and awareness.",2013,10.1136/bjsports-2012-092099,47,5,332-338,eng,1473-0480 0306-3674,"Humans and Diffusion of Innovation and Health Policy and Health Knowledge, Attitudes, Practice and Learning and Consensus and Social Media and Video Recording and Education, Medical/*methods and Clinical Competence/standards and Athletic Injuries/*prevention & control and Brain Concussion/*prevention & control and Sports Medicine/*education/standards",NA,NA,2013/04//undefined,Br J Sports Med,NA,NA,NA,NA
de.Zambotti_2019_Meanscinspanex,JOUR,Wearable Sleep Technology in Clinical and Research Settings,"de Zambotti, Massimiliano and Cellini, Nicola and Goldstone, Aimee and Colrain, Ian M. and Baker, Fiona C.",Medicine and science in sports and exercise,": The accurate assessment of sleep is critical to better understand and evaluate its role in health and disease. The boom in wearable technology is part of the digital health revolution and is producing many novel, highly sophisticated and relatively inexpensive consumer devices collecting data from multiple sensors and claiming to extract information about users' behaviors, including sleep. These devices are now able to capture different biosignals for determining, for example, HR and its variability, skin conductance, and temperature, in addition to activity. They perform 24/7, generating overwhelmingly large data sets (big data), with the potential of offering an unprecedented window on users' health. Unfortunately, little guidance exists within and outside the scientific sleep community for their use, leading to confusion and controversy about their validity and application. The current state-of-the-art review aims to highlight use, validation and utility of consumer wearable sleep-trackers in clinical practice and research. Guidelines for a standardized assessment of device performance is deemed necessary, and several critical factors (proprietary algorithms, device malfunction, firmware updates) need to be considered before using these devices in clinical and sleep research protocols. Ultimately, wearable sleep technology holds promise for advancing understanding of sleep health; however, a careful path forward needs to be navigated, understanding the benefits and pitfalls of this technology as applied in sleep research and clinical sleep medicine.",2019,10.1249/MSS.0000000000001947,51,7,1538-1557,eng,1530-0315 0195-9131,"Humans and Reproducibility of Results and Age Factors and Polysomnography and Sleep/*physiology and Equipment Failure and *Wearable Electronic Devices/standards and Actigraphy and Biomedical Research/*instrumentation/standards and Monitoring, Physiologic/instrumentation/standards and Sleep Latency and Sleep Wake Disorders/diagnosis and Wakefulness",NA,NA,2019/07//undefined,Med Sci Sports Exerc,NA,NA,NA,NA
Narayanan_2020_Meanscinspanex,JOUR,A Dual-Accelerometer System for Detecting Human Movement in a Free-living Environment,"Narayanan, Anantha and Stewart, Tom and Mackay, Lisa",Medicine and science in sports and exercise,"PURPOSE: Accurate measurement of various human movement behaviors is essential in developing 24-h movement profiles. A dual-accelerometer system recently showed promising results for accurately classifying a broad range of behaviors in a controlled laboratory environment. As a progressive step, the aim of this study is to validate the same dual-accelerometer system in semi free-living conditions in children and adults. The efficacy of several placement sites (e.g., wrist, thigh, back) was evaluated for comparison. METHODS: Thirty participants (15 children) wore three Axivity AX3 accelerometers alongside an automated clip camera (clipped to the lapel) that recorded video of their free-living environment (ground truth criterion measure of physical activity). Participants were encouraged to complete a range of daily-living activities within a 2-h timeframe. A random forest machine-learning classifier was trained using features generated from the raw accelerometer data. Three different placement combinations were examined (thigh-back, thigh-wrist, back-wrist), and their performance was evaluated using leave-one-out cross-validation for the child and adult samples separately. RESULTS: Machine learning models developed using the thigh-back accelerometer combination performed the best in distinguishing seven distinct activity classes with an overall accuracy of 95.6% in the adult sample, and eight activity classes with an overall accuracy of 92.0% in the child sample. There was a drop in accuracy (at least 11.0%) when other placement combinations were evaluated. CONCLUSIONS: This validation study demonstrated that a dual-accelerometer system previously validated in a laboratory setting also performs well in semi free-living conditions. Although these results are promising and progressive, further work is needed to expand the scope of this measurement system to detect other components of behavior (e.g., activity intensity and sleep) that are related to health.",2020,10.1249/MSS.0000000000002107,52,1,252-258,eng,1530-0315 0195-9131,Humans and Adult and Child and Machine Learning and Environment and Reproducibility of Results and Video Recording and *Activities of Daily Living and Movement/*physiology and Exercise/*physiology and Accelerometry/*methods and *Sedentary Behavior,NA,NA,2020/01//undefined,Med Sci Sports Exerc,NA,NA,NA,NA
Lebrun_2013_Brjoofspme,JOUR,"Sport concussion knowledge base, clinical practises and needs for continuing medical education: a survey of family physicians and cross-border comparison","Lebrun, Constance M. and Mrazik, Martin and Prasad, Abhaya S. and Tjarks, B. Joel and Dorman, Jason C. and Bergeron, Michael F. and Munce, Thayne A. and Valentine, Verle D.",British journal of sports medicine,"CONTEXT: Evolving concussion diagnosis/management tools and guidelines make Knowledge Transfer and Exchange (KTE) to practitioners challenging. OBJECTIVE: Identify sports concussion knowledge base and practise patterns in two family physician populations; explore current/preferred methods of KTE. DESIGN: A cross-sectional study. SETTING: Family physicians in Alberta, Canada (CAN) and North/South Dakota, USA. PARTICIPANTS: CAN physicians were recruited by mail: 2.5% response rate (80/3154); US physicians through a database: 20% response rate (109/545). INTERVENTION/INSTRUMENT: Online survey. MAIN AND SECONDARY OUTCOME MEASURES: Diagnosis/management strategies for concussions, and current/preferred KTE. RESULTS: Main reported aetiologies: sports/recreation (52.5% CAN); organised sports (76.5% US). Most physicians used clinical examination (93.8% CAN, 88.1% US); far fewer used the Sport Concussion Assessment Tool (SCAT1/SCAT2) and balance testing. More US physicians initially used concussion-grading scales (26.7% vs 8.8% CAN, p=0.002); computerised neurocognitive testing (19.8% vs 1.3% CAN; p<0.001) and Standardised Assessment of Concussion (SAC) (21.8% vs 7.5% CAN; p=0.008). Most prescribed physical rest (83.8% CAN, 75.5% US), while fewer recommended cognitive rest (47.5% CAN, 28.4% US; p=0.008). Return-to-play decisions were based primarily on clinical examination (89.1% US, 73.8% CAN; p=0.007); US physicians relied more on neurocognitive testing (29.7% vs 5.0% CAN; p<0.001) and recognised guidelines (63.4% vs 23.8% CAN; p<0.001). One-third of Canadian physicians received KTE from colleagues, websites and medical school training. Leading KTE preferences included Continuing Medical Education (CME) courses and online CME. CONCLUSIONS: Existing published recommendations regarding diagnosis/management of concussion are not always translated into practise, particularly the recommendation for cognitive rest; predicating enhanced, innovative CME initiatives.",2013,10.1136/bjsports-2012-091480,47,1,54-59,eng,1473-0480 0306-3674,"Humans and Adolescent and Adult and Young Adult and Child and Child, Preschool and Infant and Cross-Sectional Studies and Decision Making and Practice Patterns, Physicians' and Recovery of Function and Alberta and Education, Medical, Continuing/*methods and Family Practice/*education and Athletic Injuries/diagnosis/*therapy and Brain Concussion/diagnosis/*therapy and North Dakota and Physicians, Family/*education and South Dakota and Sports Medicine/*education",NA,NA,2013/01//undefined,Br J Sports Med,NA,NA,NA,NA
Vriend_2015_Brjoofspme,JOUR,Implementation of an app-based neuromuscular training programme to prevent ankle sprains: a process evaluation using the RE-AIM Framework,"Vriend, Ingrid and Coehoorn, Iris and Verhagen, Evert",British journal of sports medicine,"BACKGROUND/AIM: The contemporary electronic media is regarded as a practical tool in the dissemination of preventive measures and interventions. For this purpose an App (free of charge) was developed including an efficacious programme for the prevention of ankle sprain recurrences. This study evaluated the implementation effectiveness of this 'Versterk je Enkel' App. METHODS: The App was evaluated within its practical context using the Reach Effectiveness Adoption Implementation Maintenance (RE-AIM) Framework. The launch of the App was accompanied by a press release, website banners, as well as online and offline advertisements. Data for the evaluation of the App were objectively registered through Google analytics. Data were obtained in February 2013 based on 25,781 users resulting in follow-ups of 18 months (iOS version) and 15 months (Android version), respectively. Users questionnaires provided a qualitative view of the objectively assessed measures (n=82) to gain insight into the demographics of users, reasons to download, user experience and how the information was used. RESULTS: The App reached only 2.6% of the projected target population. User ratings for the App's relevancy, clarity, usefulness, appeal, information and reliability were high. App usage indicates that compliance with the embedded programme was low. CONCLUSIONS: Although the App was well received by the users, targeted efforts are required to ensure proper uptake and usage of the App by the target population. This also holds true for eHealth and mHealth efforts aimed at athlete care and injury prevention in general.",2015,10.1136/bjsports-2013-092896,49,7,484-488,eng,1473-0480 0306-3674,"Humans and Diffusion of Innovation and Adolescent and Adult and Middle Aged and Young Adult and Child and Child, Preschool and Aged and Implementation and Medical Informatics Applications and Treatment Outcome and Aged, 80 and over and Attitude of Health Personnel and Personal Satisfaction and Mobile Applications/*statistics & numerical data and Exercise Therapy/*methods and Athletic Injuries/*prevention & control and Ankle injuries and Ankle Injuries/*prevention & control and Injury Prevention and Telemedicine/methods/*statistics & numerical data",NA,NA,2015/04//undefined,Br J Sports Med,NA,NA,NA,NA
Ellingson_2016_Meanscinspanex,JOUR,Validity of an Integrative Method for Processing Physical Activity Data,"Ellingson, Laura D. and Schwabacher, Isaac J. and Kim, Youngwon and Welk, Gregory J. and Cook, Dane B.",Medicine and science in sports and exercise,"Accurate assessments of both physical activity and sedentary behaviors are crucial to understand the health consequences of movement patterns and to track changes over time and in response to interventions. PURPOSE: The study evaluates the validity of an integrative, machine learning method for processing activity monitor data in relation to a portable metabolic analyzer (Oxycon mobile [OM]) and direct observation (DO). METHODS: Forty-nine adults (age 18-40 yr) each completed 5-min bouts of 15 activities ranging from sedentary to vigorous intensity in a laboratory setting while wearing ActiGraph (AG) on the hip, activPAL on the thigh, and OM. Estimates of energy expenditure (EE) and categorization of activity intensity were obtained from the AG processed with Lyden's sojourn (SOJ) method and from our new sojourns including posture (SIP) method, which integrates output from the AG and activPAL. Classification accuracy and estimates of EE were then compared with criterion measures (OM and DO) using confusion matrices and comparisons of the mean absolute error of log-transformed data (MAE ln Q). RESULTS: The SIP method had a higher overall classification agreement (79%, 95% CI = 75%-82%) than the SOJ (56%, 95% CI = 52%-59%) based on DO. Compared with OM, estimates of EE from SIP had lower mean absolute error of log-transformed data than SOJ for light-intensity (0.21 vs 0.27), moderate-intensity (0.33 vs 0.42), and vigorous-intensity (0.16 vs 0.35) activities. CONCLUSIONS: The SIP method was superior to SOJ for distinguishing between sedentary and light activities as well as estimating EE at higher intensities. Thus, SIP is recommended for research in which accuracy of measurement across the full range of activity intensities is of interest.",2016,10.1249/MSS.0000000000000915,48,8,1629-1638,eng,1530-0315 0195-9131,Humans and Female and Male and Adolescent and Adult and Young Adult and *Machine Learning and *Exercise and *Energy Metabolism and Actigraphy/*instrumentation,NA,NA,2016/08//undefined,Med Sci Sports Exerc,NA,NA,NA,NA
