label,type,title,author,journal,abstract,year,doi,volume,issue,pages,language,issn,keywords,url,institution,DA,j2,DP,l1,l2,ST
De.Souza_2014_Brjoofspme,JOUR,"2014 Female Athlete Triad Coalition Consensus Statement on Treatment and Return to Play of the Female Athlete Triad: 1st International Conference held in San Francisco, California, May 2012 and 2nd International Conference held in Indianapolis, Indiana, May 2013","De Souza, Mary Jane and Nattiv, Aurelia and Joy, Elizabeth and Misra, Madhusmita and Williams, Nancy I. and Mallinson, Rebecca J. and Gibbs, Jenna C. and Olmsted, Marion and Goolsby, Marci and Matheson, Gordon",British journal of sports medicine,"The Female Athlete Triad is a medical condition often observed in physically active girls and women, and involves three components: (1) low energy availability with or without disordered eating, (2) menstrual dysfunction and (3) low bone mineral density. Female athletes often present with one or more of the three Triad components, and an early intervention is essential to prevent its progression to serious endpoints that include clinical eating disorders, amenorrhoea and osteoporosis. This consensus statement represents a set of recommendations developed following the 1st (San Francisco, California, USA) and 2nd (Indianapolis, Indiana, USA) International Symposia on the Female Athlete Triad. It is intended to provide clinical guidelines for physicians, athletic trainers and other healthcare providers for the screening, diagnosis and treatment of the Female Athlete Triad and to provide clear recommendations for return to play. The 2014 Female Athlete Triad Coalition Consensus Statement on Treatment and Return to Play of the Female Athlete Triad expert panel has proposed a risk stratification point system that takes into account magnitude of risk to assist the physician in decision-making regarding sport participation, clearance and return to play. Guidelines are offered for clearance categories, management by a multidisciplinary team and implementation of treatment contracts. This consensus paper has been endorsed by the Female Athlete Triad Coalition, an International Consortium of leading Triad researchers, physicians and other healthcare professionals, the American College of Sports Medicine and the American Medical Society for Sports Medicine.",2014,10.1136/bjsports-2013-093218,48,4,289,eng,1473-0480 0306-3674,"Humans and Female and Adolescent and Adult and Young Adult and Health Status and Child and Patient Care Team and Treatment Outcome and Practice Guidelines as Topic and Indiana and Early Diagnosis and San Francisco and Patient Care Planning and Patient Selection and Risk Assessment/methods and Absorptiometry, Photon and Medical History Taking/methods and Athletic Performance/physiology and Bone Density/physiology and Energy Metabolism/physiology and Female Athlete Triad Syndrome/diagnosis/drug therapy/*rehabilitation and Recovery of Function/*physiology and Sports Medicine/*methods and Women in Sport",NA,NA,2014/02//undefined,Br J Sports Med,NA,NA,NA,NA
Fuller_2017_Brjoofspme,JOUR,Evaluation of World Rugby's concussion management process: results from Rugby World Cup 2015,"Fuller, Colin W. and Fuller, Gordon W. and Kemp, Simon P. T. and Raftery, Martin",British journal of sports medicine,"OBJECTIVE: To evaluate World Rugby's concussion management process during Rugby World Cup (RWC) 2015. DESIGN: A prospective, whole population study. POPULATION: 639 international rugby players representing 20 countries. METHOD: The concussion management process consisted of 3 time-based, multifaceted stages: an initial on-pitch and/or pitch-side assessment of the injury, a follow-up assessment within 3 hours and an assessment at 36-48 hours. The initial on-pitch assessment targeted obvious signs of concussion, which, if identified, lead to a 'permanent removal from play' decision and a diagnosis of concussion. If the on-pitch diagnosis was unclear, a 10-min off-pitch assessment was undertaken for signs and symptoms of concussion leading to a 'suspected concussion with permanent removal from play' or a 'no indication of concussion with return to play' decision. Evaluations at 3 and 36-48 hours postmatch lead to diagnoses of 'confirmed concussion' or 'no concussion'. Medical staff's decision-making was supported during each stage by real-time video review of events. Players diagnosed with confirmed concussion followed a 5-stage graduated-return-to-play protocol before being allowed to return to training and/or competition. RESULTS: Players were evaluated for concussion on 49 occasions, of which 24 resulted in diagnoses of concussion. Fourteen players showing on-pitch signs of concussion were permanently removed from play: 4 of the 5 players removed from play following off-pitch medical room evaluation were later diagnosed with a confirmed concussion. Five players not exhibiting in-match signs or symptoms of concussion were later diagnosed with concussion. The overall incidence of concussion during RWC 2015 was 12.5 concussions/1000 player-match-hours. CONCLUSIONS: This study supports the implementation of a multimodal, multitime-based concussion evaluation process to ensure that immediate and late developing concussions are captured.",2017,10.1136/bjsports-2016-096461,51,1,64-69,eng,1473-0480 0306-3674,Epidemiology and Humans and Prospective Studies and Risk factor and Football/*injuries and Athletic Injuries/*diagnosis and Brain Concussion/*diagnosis and Concussion and Contact sports and Return to Sport and Rugby and Sports Medicine/methods,NA,NA,2017/01//undefined,Br J Sports Med,NA,NA,NA,NA
Bassett_2015_Meanscinspanex,JOUR,Accelerometer-based physical activity: total volume per day and standardized measures,"Bassett, David R. and Troiano, Richard P. and McClain, James J. and Wolff, Dana L.",Medicine and science in sports and exercise,"The use of accelerometers in physical activity (PA) research has increased exponentially over the past 20 yr. The first commercially available accelerometer for assessing PA, the Caltrac, was worn on the waist and estimated PA energy expenditure in kilocalories. Around 1995, the emphasis shifted to measuring minutes of moderate-to-vigorous PA (MVPA), especially for bouts of 10 min or longer. Recent studies, however, show that light-intensity PA and intermittent (nonbout) MVPA also have important health benefits. The total volume of PA performed is an important variable because it takes the frequency, intensity, and duration of activity bouts and condenses them down into a single metric. The total volume of PA is appropriate for many research applications and can enhance comparisons between studies. In the future, machine learning algorithms will provide improved accuracy for activity type recognition and estimation of PA energy expenditure. However, in the current landscape of objectively measured PA, total activity counts per day (TAC/d) is a proxy for the total volume of PA. TAC/d percentiles for age- and gender-specific groups have been developed from the National Health and Nutrition Examination Survey ActiGraph data (2003-2006), providing a novel way to assess PA. The use of TAC/d or standardized units of acceleration could harmonize PA across studies. TAC/d should be viewed as an additional metric, not intended to replace other metrics (e.g., sedentary time, light-intensity PA, moderate PA, and vigorous PA) that may also be related to health. As future refinements to wearable monitors occur, researchers should continue to consider metrics that reflect the total volume of PA in addition to existing PA metrics.",2015,10.1249/MSS.0000000000000468,47,4,833-838,eng,1530-0315 0195-9131,"Humans and History, 21st Century and History, 20th Century and Equipment Design and Energy Metabolism and Motor Activity/*physiology and Accelerometry/history/instrumentation/*standards",NA,NA,2015/04//undefined,Med Sci Sports Exerc,NA,NA,NA,NA
Bruce_2018_Brjoofspme,JOUR,Development of a risk prediction model among professional hockey players with visible signs of concussion,"Bruce, Jared M. and Echemendia, Ruben J. and Meeuwisse, Willem and Hutchison, Michael G. and Aubry, Mark and Comper, Paul",British journal of sports medicine,"BACKGROUND: Little research examines how to best identify concussed athletes. The purpose of the present study was to develop a preliminary risk decision model that uses visible signs (VS) and mechanisms of injury (MOI) to predict the likelihood of subsequent concussion diagnosis. METHODS: Coders viewed and documented VS and associated MOI for all NHL games over the course of the 2013-2014 and 2014-2015 regular seasons. After coding was completed, player concussions were identified from the NHL injury surveillance system and it was determined whether players exhibiting VS were subsequently diagnosed with concussions by club medical staff as a result of the coded event. RESULTS: Among athletes exhibiting VS, suspected loss of consciousness, motor incoordination or balance problems, being in a fight, having an initial hit from another player's shoulder and having a secondary hit on the ice were all associated with increased risk of subsequent concussion diagnosis. In contrast, having an initial hit with a stick was associated with decreased risk of subsequent concussion diagnosis. A risk prediction model using a combination of the above VS and MOI was superior to approaches that relied on individual VS and associated MOI (sensitivity=81%, specificity=72%, positive predictive value=26%). CONCLUSIONS: Combined use of VS and MOI significantly improves a clinician's ability to identify players who need to be evaluated for possible concussion. A preliminary concussion prediction log has been developed from these data. Pending prospective validation, the use of these methods may improve early concussion detection and evaluation.",2018,10.1136/bjsports-2016-097091,52,17,1143-1148,eng,1473-0480 0306-3674,"Athletes and Humans and Risk Assessment and Models, Theoretical and Sports and Ice hockey and Clinical Decision-Making and Athletic Injuries/*diagnosis and Brain Concussion/*diagnosis and Concussion and Hockey/*injuries",NA,NA,2018/09//undefined,Br J Sports Med,NA,NA,NA,NA
Purcell_2009_Brjoofspme,JOUR,What are the most appropriate return-to-play guidelines for concussed child athletes?,"Purcell, L.",British journal of sports medicine,"OBJECTIVE: To examine concussion literature for specific guidelines regarding return to play (RTP) following sport-related concussion in child athletes. To make recommendations regarding the most appropriate RTP guidelines for child athletes following sport-related concussion. DESIGN: A literature review of concussion literature. INTERVENTION: A literature search was conducted using Medline and Embase databases from 1998 to 2008. More than 60 articles and two websites were reviewed. RESULTS: There is a paucity of research on sport-related concussion in child athletes, particularly younger children (age 5-12 years). In particular, there is no research on RTP guidelines for child athletes following sport-related concussion. Child athletes take longer to recover from concussions than adults. Concussion symptoms may resolve before cognitive function has completely recovered. Concussion assessment and management in children can be confounded by their growth and development, as well as the lack of trained medical personnel involved with youth sports. There are no child-specific assessment tools for concussion. CONCLUSIONS: RTP decisions in children should be made cautiously and should be individualised. No concussed child athlete should be allowed to RTP the same day. Physical and cognitive rest is very important to allow for the resolution of concussion symptoms. Child athletes should remain symptom free for several days before starting a medically supervised stepwise exertion protocol. Further research is needed to elucidate the effects of concussion in children and to determine the most appropriate RTP guidelines. Child-specific concussion assessment tools need to be developed to improve concussion assessment and management in children.",2009,10.1136/bjsm.2009.058214,43 Suppl 1,NA,55-i51,eng,1473-0480 0306-3674,"Humans and Child and Child, Preschool and Decision Making and Self Disclosure and Disease Susceptibility and Child Development and *Practice Guidelines as Topic and *Recovery of Function and Athletic Injuries/etiology/*rehabilitation and Brain Concussion/etiology/*rehabilitation and Emergency Treatment/methods and Multiple Trauma/etiology/rehabilitation",NA,NA,2009/05//undefined,Br J Sports Med,NA,NA,NA,NA
