label,type,title,author,journal,abstract,year,doi,volume,issue,pages,language,issn,keywords,url,institution,DA,j2,DP,l1,l2,ST
Kressel_2007_Joofgeinme,JOUR,The influence of default options on the expression of end-of-life treatment preferences in advance directives,"Kressel, Laura M. and Chapman, Gretchen B. and Leventhal, Elaine",Journal of general internal medicine,"BACKGROUND: Advance directives promise to preserve patient autonomy, but research indicates that end-of-life preferences can be influenced by the way in which questions are posed. OBJECTIVE: To determine whether preferences expressed by geriatric patients on advance directives are influenced by the default response inherent in the question. DESIGN: Mailed survey containing 1 of 3 versions of an advance directive. SETTING: General internal medicine outpatient medical practice. PARTICIPANTS: Outpatients aged 65 or older (n = 106, response rate = 27%). INTERVENTIONS: In the ""withhold"" version of the survey, participants indicated situations where they would want treatments withheld (i.e., the default preference was in favor of treatment). In the ""provide"" version, participants indicated situations where they would want treatment provided (i.e., the default preference was against treatment). In the forced-choice control version, participants made an explicit decision to withhold or provide treatment for each situation. MAIN OUTCOME MEASURE: Participants' treatment preferences. RESULTS: Preferences differed by condition, F(2, 103) = 3.61, MSE = 0.09, eta2 = .07, p = .03. Participants tended to express the default preference, and thus, were more likely to favor treatment in the ""withhold"" condition than in the ""provide"" condition. Preferences in the forced-choice control condition were intermediate. CONCLUSIONS: The default inherent in a question can impact preferences for medical treatment. This default effect limits the utility of advance directives.",2007,10.1007/s11606-007-0204-6,22,7,1007-1010,eng,1525-1497 0884-8734,"Language and Humans and Data Collection and Female and Male and Aged and Surveys and Questionnaires and Attitude to Health and Aged, 80 and over and *Decision Making and Postal Service and *Patient Satisfaction and Advance Directives/*psychology and *Withholding Treatment",NA,NA,2007/07//undefined,J Gen Intern Med,NA,NA,NA,NA
Schefft_2019_Amerfamiphys,JOUR,Right Care for Children: Top Five Do's and Don'ts,"Schefft, Matthew and Schroeder, Alan R. and Liu, Diane and Nicklas, Daniel and Moher, Justin and Quinonez, Ricardo",American family physician,"Underuse and overuse of medical interventions, failure to use interventions known to be effective, and provision of tests or interventions in which benefits do not exceed harms are types of low-value care. The Lown Institute's Right Care Alliance Children's Health Council identified five ""do"" recommendations that highlight underuse and five ""don't"" recommendations that highlight overuse in children's health care. The five ""do"" recommendations include: do provide access to long-acting reversible contraception for adolescents, do use nonpharmacologic interventions first for treatment of attention-deficit/hyperactivity disorder, do discuss quality of life for children with complex medical conditions using a shared decision-making model and access resources such as palliative care subspecialists, do promote childhood literacy development by providing free, age-appropriate books in clinical settings, and do screen for socioeconomic status of the patient and family and provide access to community health and wellness resources. The five ""don't"" recommendations include: don't routinely prescribe antibiotics in children two to 12 years of age with a middle ear infection, don't perform computed tomography of the head for children with minor head trauma, don't use albuterol in children with bronchiolitis, don't routinely screen for hyperlipidemia in children and adolescents, and don't routinely perform preparticipation sports evaluations. These 10 examples of underuse and overuse were identified with the intent of improving health care value and promoting ""Right Care.""",2019,NA,99,6,376-382,eng,1532-0650 0002-838X,Humans and Female and Adolescent and Child and Pregnancy and Quality of Life and Literacy and Primary Health Care/*standards and Child Health/*standards and Medical Overuse/*prevention & control and Pregnancy in Adolescence/prevention & control and Antimicrobial Stewardship and Adolescent Health/*standards and Attention Deficit Disorder with Hyperactivity/therapy and Physical Examination/methods,NA,NA,2019/03/15/,Am Fam Physician,NA,NA,NA,NA
Graber_2008_Joofgeinme,JOUR,Performance of a web-based clinical diagnosis support system for internists,"Graber, Mark L. and Mathew, Ashlei",Journal of general internal medicine,"BACKGROUND: Clinical decision support systems can improve medical diagnosis and reduce diagnostic errors. Older systems, however, were cumbersome to use and had limited success in identifying the correct diagnosis in complicated cases. OBJECTIVE: To measure the sensitivity and speed of ""Isabel"" (Isabel Healthcare Inc., USA), a new web-based clinical decision support system designed to suggest the correct diagnosis in complex medical cases involving adults. METHODS: We tested 50 consecutive Internal Medicine case records published in the New England Journal of Medicine. We first either manually entered 3 to 6 key clinical findings from the case (recommended approach) or pasted in the entire case history. The investigator entering key words was aware of the correct diagnosis. We then determined how often the correct diagnosis was suggested in the list of 30 differential diagnoses generated by the clinical decision support system. We also evaluated the speed of data entry and results recovery. RESULTS: The clinical decision support system suggested the correct diagnosis in 48 of 50 cases (96%) with key findings entry, and in 37 of the 50 cases (74%) if the entire case history was pasted in. Pasting took seconds, manual entry less than a minute, and results were provided within 2-3 seconds with either approach. CONCLUSIONS: The Isabel clinical decision support system quickly suggested the correct diagnosis in almost all of these complex cases, particularly with key finding entry. The system performed well in this experimental setting and merits evaluation in more natural settings and clinical practice.",2008,10.1007/s11606-007-0271-8,23 Suppl 1,Suppl 1,37-40,eng,1525-1497 0884-8734,"Humans and Female and Male and Adult and Boston and Sensitivity and Specificity and Medical Records and Academic Medical Centers and Total Quality Management and Diagnosis, Computer-Assisted/*methods and Decision Support Systems, Clinical/*instrumentation and Internet/*organization & administration and Diagnostic Errors/prevention & control and Internal Medicine/*methods",NA,NA,2008/01//undefined,J Gen Intern Med,NA,NA,NA,NA
Foster_2015_Amerfamiphys,JOUR,Corticosteroid Injections for Common Musculoskeletal Conditions,"Foster, Zoe J. and Voss, Tyler T. and Hatch, Jacquelynn and Frimodig, Adam",American family physician,"Family physicians considering corticosteroid injections as part of a comprehensive treatment plan for musculoskeletal diagnoses will find few high-quality studies to assist with evidence-based decision making. Most studies of corticosteroid injections for the treatment of osteoarthritis, tendinopathy, bursitis, or neuropathy include only small numbers of patients and have inconsistent long-term follow-up. Corticosteroid injections for the treatment of adhesive capsulitis result in short-term improvements in pain and range of motion. For subacromial impingement syndrome, corticosteroid injections provide short-term pain relief and improvement in function. In medial and lateral epicondylitis, corticosteroid injections offer only short-term improvement of symptoms and have a high rate of symptom recurrence. Corticosteroid injections for carpal tunnel syndrome may help patients avoid or delay surgery. Trigger finger and de Quervain tenosynovitis may be treated effectively with corticosteroid injections. Patients with hip or knee osteoarthritis may have short-term symptom relief with corticosteroid injections.",2015,NA,92,8,694-699,eng,1532-0650 0002-838X,"United States and Humans and Female and Male and Adult and Middle Aged and Aged and Aged, 80 and over and Education, Medical, Continuing and *Practice Guidelines as Topic and Family Practice/*standards and Adrenal Cortex Hormones/*therapeutic use and Injections, Intra-Articular and Musculoskeletal Diseases/*diagnosis/*drug therapy",NA,NA,2015/10/15/,Am Fam Physician,NA,NA,NA,NA
Herzig_2020_Joofgeinme,JOUR,Risk Factors for Severe Opioid-Related Adverse Events in a National Cohort of Medical Hospitalizations,"Herzig, Shoshana J. and Stefan, Mihaela S. and Pekow, Penelope S. and Shieh, Meng-Shiou and Soares, William and Raghunathan, Karthik and Lindenauer, Peter K.",Journal of general internal medicine,"BACKGROUND: Opioids are a leading cause of adverse drug events in the hospital. Guidelines recommend that physicians assess the risks of opioids and discuss them with patients when considering opioid use. There are no studies examining patient- and prescribing-related risk factors for opioid-related adverse drug events (ORADEs) in hospitalized medical patients. OBJECTIVE: To identify independent risk factors for severe ORADEs in hospitalized medical patients. DESIGN: Retrospective cohort study. PATIENTS: Medical patients hospitalized at US, non-federal, and acute care facilities, with at least one pharmacy charge for an opioid during hospitalization. We excluded patients with metastatic malignancy, hospice, or palliative care billing codes. MAIN MEASURES: We used Cox proportional hazards modeling to identify risk factors for severe ORADEs, defined by a pharmacy charge for naloxone. Candidate risk factors were chosen a priori, based on clinical grounds and prior literature. KEY RESULTS: Among 731,208 hospitalizations (median age 60, 56.5% female), a severe ORADE occurred in 2727 (0.4%). Independent risk factors included patient characteristics (advanced age, female gender), comorbidities (congestive heart failure, opioid abuse/dependence, non-opioid drug abuse/dependence, psychosis, depression, obstructive sleep apnea), organ failures on admission (respiratory failure, shock/hypotension, renal failure, hepatic failure, acidosis, and neurologic failure), medication co-administrations (antipsychotics and short-acting benzodiazepines), and characteristics of the opioid prescriptions themselves (total dose for the day, parenteral route of administration, and receipt of multiple types of opioids in a day). Although a risk prediction model derived from these factors performed well on stratified k-fold cross-validation (average c-statistics 0.68-0.71), the low incidence of the outcome limited the positive predictive value of the risk score. CONCLUSIONS: In this national cohort of medical patients, we identified several risk factors for ORADEs that can be used to inform physician decision-making, conversations with patients about risk, and development and targeting of harm reduction strategies for at-risk populations.",2020,10.1007/s11606-019-05490-w,35,2,538-545,eng,1525-1497 0884-8734,"Hospitalization and Humans and Female and Male and Middle Aged and Retrospective Studies and Cohort Studies and Risk Factors and opioids and hospitalization and adverse drug events and naloxone and risk scores and *Analgesics, Opioid/adverse effects and *Pain, Postoperative and adverse effects of opioids",NA,NA,2020/02//undefined,J Gen Intern Med,NA,NA,NA,NA
Djulbegovic_2019_Joofgeinme,JOUR,The Patient Care Ownership Scale: Development of an Instrument to Measure Patient Care Ownership Among Internal Medicine Trainees,"Djulbegovic, Mia and Beckstead, Jason W. and Fraenkel, Liana",Journal of general internal medicine,"BACKGROUND: Patient care ownership is essential to delivering high-quality medical care but appears to be eroding among trainees. The lack of an objective measure has limited the study of ownership in physicians. OBJECTIVE: To develop an instrument to measure psychological ownership of patient care. DESIGN: Cross-sectional study. PARTICIPANTS: Internal medicine trainees in a large, academic hospital completing an inpatient rotation. MAIN MEASURES: Our scale prototype adapted an existing ownership scale (developed in the non-medical setting) based on themes identified in qualitative studies of patient care ownership. We conducted cognitive interviews to determine face validity of the scale items. Our finalized scale measures ownership's key constructs: advocacy, responsibility, accountability, follow-through, knowledge, communication, initiative, continuity of care, autonomy, and perceived ownership. We distributed an online, anonymous, 46-question survey to 219 residents; 192 residents completed the survey; and 166 responses were included in the analysis. We calculated Cronbach's <ce><b1> to determine the scale's internal consistency. Exploratory factor analysis was used to explore possible subscales. We examined construct validity using bivariate and correlational analysis. KEY RESULTS: The 15-item ownership scale demonstrated good internal consistency (Cronbach's <ce><b1> = 0.89). We identified three possible subscales corresponding to assertiveness, being the ""go-to"" person, and diligence. Training level and prior intensive care unit experience significantly predicted ownership (p < 0.01). There was no significant relationship between ownership and age, gender, inpatient service type, call schedule, patient turnover, or supervisory experience of the attending physician. We found a significant negative correlation between ownership and perceived degree of burnout (r = - 0.33), depression (r = - 0.24), detachment (r = - 0.35), and frustration (r = - 0.31) and a significant positive association between ownership and fulfillment (r = 0.37) and happiness (r = 0.36). CONCLUSION: We developed an instrument to quantify patient care ownership in residents. Our scale demonstrates good internal consistency and preliminary evidence of validity. With further validation, we expect this to be a valuable tool to evaluate interventions aimed at improving ownership.",2019,10.1007/s11606-019-05066-8,34,8,1530-1537,eng,1525-1497 0884-8734,Humans and Female and Male and Adult and Young Adult and Ownership and Qualitative Research and Reproducibility of Results and Attitude of Health Personnel and Internship and Residency and Surveys and Questionnaires/*standards and Internal Medicine/*education and medical decision-making and Patient Care/*psychology and medical education and behavioral science,NA,NA,2019/08//undefined,J Gen Intern Med,NA,NA,NA,NA
Nidiry_2008_Joofgeinme,JOUR,The closure of a medical practice forces older patients to make difficult decisions: a qualitative study of a natural experiment,"Nidiry, Mary Anne J. and Gozu, Aysegul and Carrese, Joseph A. and Wright, Scott M.",Journal of general internal medicine,"OBJECTIVE: The closure of a primary care practice and the relocation of the physicians and staff to a new office forced patients to decide whether to follow their primary care physicians (PCP) or to transfer their care elsewhere. This study explores the perspectives of the older patients affected by this change. DESIGN: Qualitative study. SETTING AND PARTICIPANTS: Two lists of patients older than 60 years from the original office were generated: (1) those who had followed their PCPs to the further practice and (2) those who chose new PCPs at an affiliated nearby clinic. One hundred forty patients from each of the two lists were randomly selected for study. MEASUREMENT: Eight months after the clinic's closure, patients responded to an open-ended question asking patients to describe the transition. Using content analysis, two investigators independently coded all of the written responses. RESULTS: Over 85% of patients in both groups had been with their original PCP for longer than 2 years. Patients that elected to transition their care to a new PCP within their community were older (75 vs 70 years) and more likely to be living alone (38% vs 18%), both p < 0.01. There was still considerable frustration associated with the clinic's closure. Patients from both groups had variable levels of satisfaction with their new primary care arrangements. Patients who moved to the near clinic, now seeing a new physician, commented on being satisfied with the proximity of the site. On the other hand, these patients also expressed longing for the previous arrangement (the building, the staff, and especially their prior physician). Patients who transferred their care to the further clinic indicated a profound loyalty to their PCP and an appreciation of the added features at the new site. Yet, many patients still described being upset with the difficulties associated with the further distance. CONCLUSION: The closing of this practice was difficult for this cohort of older patients. Patients' decisions were considerably influenced by whether they imagined that convenience or their established relationship with their PCP was of a higher priority to them.",2008,10.1007/s11606-008-0718-6,23,10,1576-1580,eng,1525-1497 0884-8734,"Humans and Female and Male and Aged and Pilot Projects and Cohort Studies and Age Factors and *Decision Making and *Physician-Patient Relations/ethics and *Qualitative Research and *Practice Management, Medical/trends and Family Practice/methods/trends and Health Facility Closure/*methods/trends and Office Visits/trends",NA,NA,2008/10//undefined,J Gen Intern Med,NA,NA,NA,NA
Maratt_2019_Joofgeinme,JOUR,Measures Used to Assess the Impact of Interventions to Reduce Low-Value Care: a Systematic Review,"Maratt, Jennifer K. and Kerr, Eve A. and Klamerus, Mandi L. and Lohman, Shannon E. and Froehlich, Whit and Bhatia, R. Sacha and Saini, Sameer D.",Journal of general internal medicine,"IMPORTANCE: Studies of interventions to reduce low-value care are increasingly common. However, little is known about how the effects of such interventions are measured. OBJECTIVE: To characterize measures used to assess interventions to reduce low-value care. EVIDENCE REVIEW: We searched PubMed and Web of Science to identify studies published between 2010 and 2016 that examined the effects of interventions to reduce low-value care. We also searched ClinicalTrials.gov to identify ongoing studies. We extracted data on characteristics of studies, interventions, and measures. We then developed a framework to classify measures into the following categories: utilization (e.g., number of tests ordered), outcome (e.g., mortality), appropriateness (e.g., overuse of antibiotics), patient-reported (e.g., satisfaction), provider-reported (e.g., satisfaction), patient-provider interaction (e.g., informed decision-making elements), value, and cost. We also determined whether each measure was designed to assess unintended consequences. FINDINGS: A total of 1805 studies were identified, of which 101 published and 16 ongoing studies were included. Of published studies (N = 101), 68% included at least one measure of utilization, 41% of an outcome, 52% of appropriateness, 36% of cost, 8% patient-reported, and 3% provider-reported. Funded studies were more likely to use patient-reported measures (17% vs 0%). Of ongoing studies (registered trials) (N = 16), 69% included at least one measure of utilization, 75% of an outcome, 50% of appropriateness, 19% of cost, 50% patient-reported, 13% provider-reported, and 6% patient-provider interaction. Of published studies, 34% included at least one measure of an unintended consequence as compared to 63% of ongoing studies. CONCLUSIONS AND RELEVANCE: Most published studies focused on reductions in utilization rather than on clinically meaningful measures (e.g., improvements in appropriateness, patient-reported outcomes) or unintended consequences. Investigators should systematically incorporate more clinically meaningful measures into their study designs, and sponsors should develop standardized guidance for the evaluation of interventions to reduce low-value care.",2019,10.1007/s11606-019-05069-5,34,9,1857-1864,eng,1525-1497 0884-8734,"Humans and Quality Indicators, Health Care and measures and Attitude of Health Personnel and Patient Reported Outcome Measures and interventions and low-value care and Medical Overuse/economics/*statistics & numerical data",NA,NA,2019/09//undefined,J Gen Intern Med,NA,NA,NA,NA
Moise_2018_Joofgeinme,JOUR,Interventions to Increase Depression Treatment Initiation in Primary Care Patients: a Systematic Review,"Moise, Nathalie and Falzon, Louise and Obi, Megan and Ye, Siqin and Patel, Sapana and Gonzalez, Christopher and Bryant, Kelsey and Kronish, Ian M.",Journal of general internal medicine,"INTRODUCTION: Nearly 50% of depressed primary care patients referred to mental health services do not initiate mental health treatment. The most promising interventions for increasing depression treatment initiation in primary care settings remain unclear. METHODS: We performed a systematic search of publicly available databases from inception through August 2017 to identify interventions designed to increase depression treatment initiation. Two authors independently selected, extracted data, and rated risk of bias from included studies. Eligible studies used a randomized or pre-post design and assessed depression treatment initiation (i.e., <e2><89><a5> 1 mental health visit or antidepressant fill) among adults, the majority of whom met criteria for depression. Interventions were classified as simple or complex and sub-classified into intervention strategies that were graded for strength of evidence. RESULTS: Of 9516 articles identified, we included 14 unique studies representing 16 (4 simple and 12 complex) interventions and 8 treatment initiation strategies. We found low to moderate strength of evidence for collaborative/integrated care (3 studies), treatment preference matching (2 studies), and case management (2 studies) strategies. However, there was insufficient evidence to determine the benefit of cultural tailoring (2 studies), motivation (alone, with reminders or with cultural tailoring (5 studies)), education (1 study), and shared decision-making strategies (1 study). Overall, we found moderate strength of evidence for complex interventions (8 of 12 complex interventions demonstrated statistically significant effects on treatment initiation). DISCUSSION: Collaborative/integrated care, preference treatment matching, and case management strategies had the best evidence for improving depression treatment initiation, but none of the strategies had high strength of evidence. While primary care settings can consider using some of these strategies when referring depressed patients to treatment, our review highlights the need for further rigorous research in this area.",2018,10.1007/s11606-018-4554-z,33,11,1978-1989,eng,1525-1497 0884-8734,Humans and depression and Treatment Outcome and primary healthcare and Randomized Controlled Trials as Topic/methods and Depression/*diagnosis/psychology/*therapy and Early Medical Intervention/*methods/trends and patient engagement/participation and Primary Health Care/*methods/trends,NA,NA,2018/11//undefined,J Gen Intern Med,NA,NA,NA,NA
