label,type,title,author,journal,abstract,year,doi,volume,issue,pages,language,issn,keywords,url,institution,DA,j2,DP,l1,l2,ST
Alexander_2015_BMCfampra,JOUR,The challenges of trying to increase preventive healthcare for children in general practice: results of a feasibility study,"Alexander, Karyn E. and Brijnath, Bianca and Mazza, Danielle",BMC family practice,"BACKGROUND: In Australia, general practice, the linchpin for delivery of preventive health care to large segments of the population, provides child-immunisation and preventive health alongside government services. Despite this, less than half of eligible children complete a Healthy Kids Check (HKC), a preschool preventative health assessment available since 2008. Using a rigorous theoretical process, the barriers that affected delivery and reduced general practitioner and practice nurse motivation to provide HKCs, were addressed. The resulting multifaceted intervention, aimed at increasing the proportion of children receiving evidence informed HKCs from general practice, was piloted to inform a future randomised controlled trial. METHODS: The intervention was piloted in a before and after study at three sites located southeast of Melbourne, between February and October 2014. The HKC-intervention involved: 1) Delivery of training modules that motivated reception and clinical staff by delivering key messages about local prevalence rates and the ""Core Story of Child Development"" 2) Practical advice to prepare clinics for specific HKC-examinations 3) Workflow advice regarding systems that included all staff in the HKC process, and 4) Provision of a ""Community Resources Folder"" that enabled decision making and referrals. A major component of the intervention incorporated the promotion of structured developmental screening by the practice team using Parents' Evaluation of Developmental Status. RESULTS: Twenty of 22 practitioners and practice managers agreed to join the study. Post-training questionnaires showed participants had developed their skills working with young children as a result of the training and all respondents believed they had successfully implemented standardised HKC services. Post intervention proportions of children completing HKCs significantly increased in two of the practices and quality improvements in HKC-processes were recorded across all three sites. CONCLUSION: This pilot study confirmed the feasibility of delivering a multi-faceted intervention to increase HKCs from general practice and demonstrated that significant quality improvements could be made. Future studies need to extend the intervention to other states and research the health outcomes of HKCs.",2015,10.1186/s12875-015-0306-x,16,NA,94,eng,1471-2296,"Humans and Child, Preschool and Quality Improvement and Pilot Projects and Surveys and Questionnaires and Feasibility Studies and Australia and Follow-Up Studies and Attitude of Health Personnel and Education, Medical, Continuing and Child Development and *General Practice/education/methods/organization & administration/statistics & numerical data and Child Health Services/organization & administration/*statistics & numerical data and Education, Nursing, Continuing and Health Services Accessibility/*organization & administration/statistics & numerical data and Preventive Health Services/methods/organization & administration/*statistics & numerical data",NA,NA,2015/08/05/,BMC Fam Pract,NA,NA,NA,NA
Samson_2012_Joofgeinme,JOUR,"Chapter 2: medical tests guidance (2) developing the topic and structuring systematic reviews of medical tests: utility of PICOTS, analytic frameworks, decision trees, and other frameworks","Samson, David and Schoelles, Karen M.",Journal of general internal medicine,"Topic development and structuring a systematic review of diagnostic tests are complementary processes. The goals of a medical test review are to identify and synthesize evidence to evaluate the impacts alternative testing strategies on health outcomes and to promote informed decision making. A common challenge is that the request for a review may state the claim for the test ambiguously. Due to the indirect impact of medical tests on clinical outcomes, reviewers need to identify which intermediate outcomes link a medical test to improved clinical outcomes. In this paper, we propose the use of five principles to deal with challenges: the PICOTS typology (patient population, intervention, comparator, outcomes, timing, setting), analytic frameworks, simple decision trees, other organizing frameworks and rules for when diagnostic accuracy is sufficient.",2012,10.1007/s11606-012-2007-7,27 Suppl 1,Suppl 1,19-S11,eng,1525-1497 0884-8734,Humans and Abbreviations as Topic and *Decision Support Techniques and *Guidelines as Topic and *Review Literature as Topic and Diagnostic Techniques and Procedures/*standards and Evidence-Based Medicine/methods/standards,NA,NA,2012/06//undefined,J Gen Intern Med,NA,NA,NA,NA
Alfandre_2013_Joofgeinme,JOUR,Reconsidering against medical advice discharges: embracing patient-centeredness to promote high quality care and a renewed research agenda,"Alfandre, David",Journal of general internal medicine,"Hospital discharges against medical advice (AMA) are common, costly, stigmatizing to patients, and are associated with excess morbidity and mortality. Achieving better quality care for patients discharged AMA has been limited both by the sparse research illuminating how best to care for this challenging patient population, as well as a lack of standards regarding this clinical practice. This paper will review elements of the AMA literature and highlight the gaps, including the predictors of AMA discharge, challenges to high quality informed consent in AMA discharges, problematic aspects of AMA discharge forms, and the stigma associated with patients discharged AMA. These gaps in the evidence base collectively limit the ability to adequately and completely address AMA discharges and improve health care quality. This paper will recommend future directions to answer remaining questions for the field, and offer guidance for providing ethically sound and high quality care for the affected population. Applying the widely accepted principles of patient-centered care and shared decision making to AMA discharges offers the opportunity to improve quality of care and promote ethical health care practice.",2013,10.1007/s11606-013-2540-z,28,12,1657-1662,eng,1525-1497 0884-8734,Humans and Male and Middle Aged and *Decision Making and Patient Discharge/*standards and Quality of Health Care/*standards and Patient-Centered Care/methods/*standards and Treatment Refusal/*psychology and Biomedical Research/methods/*standards,NA,NA,2013/12//undefined,J Gen Intern Med,NA,NA,NA,NA
Putman_2014_Joofgeinme,JOUR,Directive counsel and morally controversial medical decision-making: findings from two national surveys of primary care physicians,"Putman, Michael S. and Yoon, John D. and Rasinski, Kenneth A. and Curlin, Farr A.",Journal of general internal medicine,"BACKGROUND: Because of the potential to unduly influence patients' decisions, some ethicists counsel physicians to be nondirective when negotiating morally controversial medical decisions. OBJECTIVE: To determine whether primary care providers (PCPs) are less likely to endorse directive counsel for morally controversial medical decisions than for typical ones and to identify predictors of endorsing directive counsel in such situations. DESIGN AND PARTICIPANTS: Surveys were mailed to two separate national samples of practicing primary care physicians. Survey 1 was conducted from 2009 to 2010 on 1,504 PCPs; Survey 2 was conducted from 2010 to 2011 on 1,058 PCPs. MAIN MEASURES: Survey 1: After randomization, half of the PCPs were asked if physicians should encourage patients to make the decision that the physician believes is best (directive counsel) with respect to ""typical"" medical decisions and half were asked the same question with respect to ""morally controversial"" medical decisions. Survey 2: After reading a vignette in which a patient asked for palliative sedation to unconsciousness, PCPs were asked whether it would be appropriate for the patient's physician to encourage the patient to make the decision the physician believes is best. KEY RESULTS: Of 1,427 eligible physicians, 896 responded to Survey 1 (63 %). Physicians asked about morally controversial decisions were half as likely (35 % vs. 65 % for typical decisions, p < 0.001) to endorse directive counsel. Of 986 eligible physicians, 600 responded to Survey 2 (61 %). Two in five physicians (41 %) endorsed directive counsel after reading a vignette describing a patient requesting palliative sedation to unconsciousness; these physicians tended to be male and more religious. CONCLUSIONS: PCPs are less likely to endorse directive counsel when negotiating morally controversial medical decisions. Male physicians and those who are more religious are more likely to endorse directive counsel in these situations.",2014,10.1007/s11606-013-2653-4,29,2,335-340,eng,1525-1497 0884-8734,"Humans and Female and Male and Adult and Middle Aged and Young Adult and Aged and United States/epidemiology and *Attitude of Health Personnel and Decision Making/ethics and Physician-Patient Relations/*ethics and *Moral Obligations and *Data Collection/methods and Directive Counseling/*ethics/standards and Physicians, Primary Care/*ethics/standards",NA,NA,2014/02//undefined,J Gen Intern Med,NA,NA,NA,NA
Chin_2016_Anoffame,JOUR,The 12-Month Incidence and Predictors of PHQ-9-Screened Depressive Symptoms in Chinese Primary Care Patients,"Chin, Weng-Yee and Wan, Eric Yuk Fai and Choi, Edmond Pui Hang and Chan, Kit Tsui Yan and Lam, Cindy Lo Kuen",Annals of family medicine,"PURPOSE: Evidence regarding the onset of depressive symptoms in primary care is rarely available but can help inform policy development, service planning, and clinical decision making. The objective of this study was to estimate the 12-month cumulative incidence and predictors of a positive screen for depressive symptoms on the 9-item Patient Health Questionnare-9 (PHQ-9) among primary care patients with no history of physician-diagnosed depression. METHODS: We monitored a cohort of 2,929 adult primary care patients with no past history of physician-diagnosed depression and with baseline PHQ-9 scores of 9 or lower by telephone interview at 3, 6, and 12 months. A generalized linear mixed effects Poisson Model was used to explore factors associated with the incidence of PHQ-positive symptoms. RESULTS: The cumulative incidence of positive screening on the PHQ-9 over 12 months was 5.23% (95% CI, 3.83%-6.64%). Positive predictors included being female, coming from a lower-income household, being a smoker, having at least 2 comorbidities, having a family history of depression, and having consulted a physician at least twice in the past 4 weeks. Consulting a physician with qualifications in both family medicine and psychological medicine was a negative predictor. CONCLUSIONS: The cumulative incidence of PHQ-9-screened depressive symptoms in this study population was higher than those reported for depressive disorders in earlier systematic reviews. Groups who may warrant greater treatment attention include women, patients with multimorbidity, smokers, patients with recent high rates of medical consultations, and those who are from lower-income households or who have a family history of depression. Greater physician training may have a protective effect.",2016,10.1370/afm.1854,14,1,47-53,eng,1544-1717 1544-1709,mental health and Humans and Female and Male and Adult and Middle Aged and Cross-Sectional Studies and Longitudinal Studies and Sex Factors and Surveys and Questionnaires and depression and Prospective Studies and Risk Factors and screening and primary care and Socioeconomic Factors and Incidence and Poisson Distribution and Hong Kong/epidemiology and Referral and Consultation/statistics & numerical data and practice-based research and Primary Health Care/*statistics & numerical data and Chinese and Mass Screening/methods/*statistics & numerical data and Depression/diagnosis/*epidemiology/etiology and Family Practice/statistics & numerical data and Smoking/epidemiology/psychology,NA,NA,2016/02//Jan undefined,Ann Fam Med,NA,NA,NA,NA
Halpern_2008_Joofgeinme,JOUR,Affective forecasting: an unrecognized challenge in making serious health decisions,"Halpern, Jodi and Arnold, Robert M.",Journal of general internal medicine,"Patients facing medical decisions that will impact quality of life make assumptions about how they will adjust emotionally to living with health declines and disability. Despite abundant research on decision-making, we have no direct research on how accurately patients envision their future well-being and how this influences their decisions. Outside medicine, psychological research on ""affective forecasting"" consistently shows that people poorly predict their future ability to adapt to adversity. This finding is important for medicine, since many serious health decisions hinge on quality-of-life judgments. We describe three specific mechanisms for affective forecasting errors that may influence health decisions: focalism, in which people focus more on what will change than on what will stay the same; immune neglect, in which they fail to envision how their own coping skills will lessen their unhappiness; and failure to predict adaptation, in which people fail to envision shifts in what they value. We discuss emotional and social factors that interact with these cognitive biases. We describe how caregivers can recognize these biases in the clinical setting and suggest interventions to help patients recognize and address affective forecasting errors.",2008,10.1007/s11606-008-0719-5,23,10,1708-1712,eng,1525-1497 0884-8734,"Humans and Forecasting and Physician-Patient Relations and Patient Satisfaction and *Decision Making and *Health Status and *Affect and *Recognition, Psychology",NA,NA,2008/10//undefined,J Gen Intern Med,NA,NA,NA,NA
DuBenske_2018_Joofgeinme,JOUR,Key Elements of Mammography Shared Decision-Making: a Scoping Review of the Literature,"DuBenske, Lori L. and Schrager, Sarina B. and Hitchcock, Mary E. and Kane, Amanda K. and Little, Terry A. and McDowell, Helene E. and Burnside, Elizabeth S.",Journal of general internal medicine,"BACKGROUND: New guidelines recommend shared decision-making (SDM) for women and their clinician in consideration of breast cancer screening, particularly for women ages 35-50 where guidelines for routine mammography are controversial. A number of models offer general guidelines for SDM across clinical practice, yet they do not offer specific guidance about conducting SDM in mammography. We conducted a scoping review of the literature to identify the key elements of breast cancer screening SDM and synthesize these key elements for utilization by primary care clinicians. METHODS: The Cochrane Database of Systematic Reviews; Cumulative Index to Nursing and Allied Health Literature (CINAHL Plus); PsycInfo, PubMed (MEDLINE), Scopus, and SocIndex databases were searched. Inclusion criteria were original studies from peer-reviewed publications (from 2009 or later) reporting breast cancer screening (mammography), medical decision-making, and patient-centered care. Study populations needed to include female patients 18+ years of age facing a real-life breast cancer screening decision. Article findings were specific to shared decision-making and/or use of a decision aid. Data extracted includes study design, population, setting, intervention, and critical findings related to breast cancer screening SDM elements. Scoping analysis includes descriptive analysis of study features and content analysis to identify the SDM key elements. RESULTS: Twenty-four articles were retained. Three thematic categories of key elements emerged from the extracted elements: information delivery/patient education (specific content and delivery modes), interpersonal clinician-patient communication (aspects of interpersonal relationship impacting SDM), and framework of the decision (sociocultural factors beyond direct SDM deliberation). A number of specific breast cancer screening SDM elements relevant to primary care clinical practice are delineated. DISCUSSION: The findings underscore the importance of the relationship between the patient and clinician and the necessity of spelling out each step in the SDM process. The clinician needs to be explicit in telling a woman that she has a choice about whether to get a mammogram and the benefits and harms of screening mammography. Finally, clinicians need to be aware of sociocultural factors that can influence their relationships and their patients' decision-making processes and attempt to identify and address these factors.",2018,10.1007/s11606-018-4576-6,33,10,1805-1814,eng,1525-1497 0884-8734,Humans and Female and Adult and Middle Aged and Physician-Patient Relations and primary care and patient-centered care and health communication and *Decision Making and Clinical Decision-Making and mammography and breast cancer screening and Breast Neoplasms/*diagnostic imaging and Patient Education as Topic/methods and Primary Health Care/methods and shared decision-making and Patient-Centered Care/methods and Patient Participation/psychology and Early Detection of Cancer/methods/psychology and Mammography/*psychology and women's health,NA,NA,2018/10//undefined,J Gen Intern Med,NA,NA,NA,NA
Lewis.Hunter_2016_Joofgeinme,JOUR,Factors Influencing Hospital Admission of Non-critically Ill Patients Presenting to the Emergency Department: a Cross-sectional Study,"Lewis Hunter, Ashley E. and Spatz, Erica S. and Bernstein, Steven L. and Rosenthal, Marjorie S.",Journal of general internal medicine,"BACKGROUND: Little is known about the factors that influence physicians' admission decisions, especially among lower acuity patients. For the purpose of our study, non-medical refers to all of the factors-other than the patient's clinical condition-that could potentially influence admission decisions. OBJECTIVE: To describe the influence of non-medical factors on physicians' decisions to admit non-critically ill patients presenting to the ED. DESIGN: Cross-sectional study of hospital admissions at a single academic medical center. PARTICIPANTS: Non-critically ill adult patients admitted to the hospital (n = 297) and the admitting emergency medicine physicians (n = 34). MAIN MEASURES: A patient survey assessed non-medical factors, including primary care access and utilization. A physician survey assessed clinical and non-medical factors influencing the decision to admit. Based on physician responses, admissions were characterized as ""strongly acuity-driven,"" ""moderately acuity-driven,"" or ""weakly acuity-driven."" Among these admission types, we compared length of stay, cost, and readmission within 30 days to the hospital or ED. KEY RESULTS: Based on the admitting physician's assessment, we categorized the motivation for admission as strongly acuity-driven in 185 (62 %) admissions, moderately acuity-driven in 92 (31 %), and weakly acuity-driven in 20 (7 %). Per the physician surveys, 51 % of hospitalizations were strongly or moderately influenced by one or more non-medical factors, including lack of information about baseline conditions (23 %); inadequate access to outpatient specialty care (14 %); need for a diagnostic testing or procedure (12 %); a recent ED visit (11 %); and inadequate access to primary care (10 %). Compared with strongly-acuity driven admissions, admissions that were moderately or weakly acuity-driven were shorter and less costly but were associated with similar rates of ED (35 %) and hospital (27 %) readmission. CONCLUSIONS: Non-medical factors are influential in the admission decisions for many patients presenting to the emergency department. Moderately and weakly acuity-driven admissions may represent a feasible target for alternative care pathways.",2016,10.1007/s11606-015-3438-8,31,1,37-44,eng,1525-1497 0884-8734,"Humans and Female and Male and Middle Aged and Cross-Sectional Studies and Time Factors and decision making and utilization and health care delivery and socioeconomic factors and Incidence and Critical Illness and access to care and United States/epidemiology and *Surveys and Questionnaires and medical decision making and emergency medicine and Emergency Service, Hospital/*statistics & numerical data and Patient Admission/*trends and Academic Medical Centers/statistics & numerical data and Acute Disease/epidemiology/*therapy and care transitions and hospital admission decision and non-medical factors and severity of illness",NA,NA,2016/01//undefined,J Gen Intern Med,NA,NA,NA,NA
Reed_2012_Joofgeinme,JOUR,Relationship of electronic medical knowledge resource use and practice characteristics with Internal Medicine Maintenance of Certification Examination scores,"Reed, Darcy A. and West, Colin P. and Holmboe, Eric S. and Halvorsen, Andrew J. and Lipner, Rebecca S. and Jacobs, Carola and McDonald, Furman S.",Journal of general internal medicine,"BACKGROUND: Maintenance of certification examination performance is associated with quality of care. We aimed to examine relationships between electronic medical knowledge resource use, practice characteristics and examination scores among physicians recertifying in internal medicine. METHODS: We conducted a cross-sectional study of 3,958 United States physicians who took the Internal Medicine Maintenance of Certification Examination (IM-MOCE) between January 1, 2006 and December 31, 2008, and who held individual licenses to one or both of two large electronic knowledge resource programs. We examined associations between physicians' IM-MOCE scores and their days of electronic resource use, practice type (private practice, residency teaching clinic, inpatient, nursing home), practice model (single or multi-specialty), sex, age, and medical school location. RESULTS: In the 365 days prior to the IM-MOCE, physicians used electronic resources on a mean (SD, range) of 20.3 (36.5, 0-265) days. In multivariate analyses, the number of days of resource use was independently associated with increased IM-MOCE scores (0.07-point increase per day of use, p = 0.02). Increased age was associated with decreased IM-MOCE scores (1.8-point decrease per year of age, p < 0.001). Relative to physicians working in private practice settings, physicians working in residency teaching clinics and hospital inpatient practices had higher IM-MOCE scores by 29.1 and 20.0 points, respectively (both p < 0.001). CONCLUSIONS: Frequent use of electronic resources was associated with modestly enhanced IM-MOCE performance. Physicians involved in residency education clinics and hospital inpatient practices had higher IM-MOCE scores than physicians working in private practice settings.",2012,10.1007/s11606-012-2017-5,27,8,917-923,eng,1525-1497 0884-8734,"Humans and Female and Male and Adult and Middle Aged and Cross-Sectional Studies and Clinical Competence/*standards and *Decision Making, Computer-Assisted and Certification/methods/*standards and Internal Medicine/*education/*standards and Internship and Residency/methods/standards and Licensure, Medical/standards",NA,NA,2012/08//undefined,J Gen Intern Med,NA,NA,NA,NA
