label,type,title,author,journal,abstract,year,doi,volume,issue,pages,language,issn,keywords,url,institution,DA,j2,DP,l1,l2,ST
Freier_2020_BMCfampra,JOUR,Prescribing and medical non-adherence after myocardial infarction: qualitative interviews with general practitioners in Germany,"Freier, Christian and Heintze, Christoph and Herrmann, Wolfram J.",BMC family practice,"BACKGROUND: An increasing prevalence of having survived a myocardial infarction increases the importance of medical secondary prevention. Although preventive medication reduces mortality, prescribing and adherence are known to be frequently insufficient. General practitioners are the most important prescriber. However, their perspective on prescribing and medical non-adherence following myocardial infarction has not yet been explored. Thus, the aim of this study was to explore the general practitioners' perspective on long-term care after myocardial infarction focussing on medical prevention. METHODS: In this qualitative interview study we conducted episodic interviews with sixteen general practitioners from rural and urban surgeries in Germany. Framework analysis with focus on general practitioners' prescribing and patients' non-adherence was performed. RESULTS: Almost all general practitioners reported following guidelines for myocardial infarction aftercare and prescribing the medication that was initiated in the hospital; however, they described deviating from guidelines because of drugs' side effects or patients' intolerances. Some questioned the benefits of medical secondary prevention for the oldest of patients. General practitioners perceived good adherence among their patients who had had an MI while they regarded their methods for assessing medical non-adherence as limited. They perceived diverse reasons for non-adherence, particularly side effects, patients' freedom from symptoms and patients' indifference to health. They attributed mainly negative characteristics, like lack of knowledge and understanding, to non-adherent patients. These characteristics contribute to the difficulty of convincing these patients to take medications as prescribed. General practitioners improved adherence by preventing side effects, explaining the medication's necessity, facilitating intake and involving patients in decision-making. However, about half of the general practitioners reported threatening their patients with negative consequences of non-adherence. CONCLUSIONS: General practitioners should be aware that discharge medication can be insufficient and thus, should always check hospital recommendations for accordance with guideline recommendations. Improving physicians' communication skills and informing and motivating patients in an adequate manner, for example in simple language, should be an important goal in the hospital and the general practitioner setting. General practitioners should assess patients' motivations through motivational interviewing, which no general practitioner mentioned during the interviews, and talk with them about adherence and long-term treatment goals regularly.",2020,10.1186/s12875-020-01145-6,21,1,81,eng,1471-2296,"Interviews and General practice and Primary care and Myocardial infarction and Humans and Female and Male and Adult and Middle Aged and Prescribing and Qualitative research and Practice Guidelines as Topic and Interviews as Topic and Qualitative Research and Germany and Secondary Prevention and Motivational Interviewing and *Practice Patterns, Physicians' and *General Practitioners and Aftercare and Medication adherence and *Patient Compliance/psychology and Family practice and Myocardial Infarction/*drug therapy/prevention & control and Secondary prevention",NA,NA,2020/05/08/,BMC Fam Pract,NA,NA,NA,NA
Gattellari_2020_BMCfampra,JOUR,Supporting anticoagulant treatment decision making to optimise stroke prevention in complex patients with atrial fibrillation: a cluster randomised trial,"Gattellari, Melina and Hayen, Andrew and Leung, Dominic Y. C. and Zwar, Nicholas A. and Worthington, John M.",BMC family practice,"BACKGROUND: Anticoagulation for preventing stroke in atrial fibrillation is under-utilised despite evidence supporting its use, resulting in avoidable death and disability. We aimed to evaluate an intervention to improve the uptake of anticoagulation. METHODS: We carried out a national, cluster randomised controlled trial in the Australian primary health care setting. General practitioners received an educational session, delivered via telephone by a medical peer and provided information about their patients selected either because they were not receiving anticoagulation or for whom anticoagulation was considered challenging. General practitioners were randomised to receive feedback from a medical specialist about the cases (expert decisional support) either before or after completing a post-test audit. The primary outcome was the proportion of patients reported as receiving oral anticoagulation. A secondary outcome assessed antithrombotic treatment as appropriate against guideline recommendations. RESULTS: One hundred and seventy-nine general practitioners participated in the trial, contributing information about 590 cases. At post-test, 152 general practitioners (84.9%) completed data collection on 497 cases (84.2%). A 4.6% (Adjusted Relative Risk = 1.11, 95% CI = 0.86-1.43) difference in the post-test utilization of anticoagulation between groups was not statistically significant (p = 0.42). Sixty-one percent of patients in both groups received appropriate antithrombotic management according to evidence-based guidelines at post-test (Adjusted Relative Risk = 1.0; 95% CI = 0.85 to 1.19) (p = 0.97). CONCLUSIONS: Specialist feed-back in addition to an educational session did not increase the uptake of anticoagulation in patients with AF. TRIAL REGISTRATION: ANZCTRN12611000076976 Retrospectively registered.",2020,10.1186/s12875-020-01175-0,21,1,102,eng,1471-2296,"Humans and Female and Male and Aged and Educational Measurement and Atrial fibrillation and Outcome Assessment, Health Care and Administration, Oral and Patient Selection and Cluster Analysis and Clinical Decision-Making/*methods and Primary Health Care/methods and *Anticoagulants/administration & dosage/adverse effects and *Atrial Fibrillation/complications/drug therapy and *General Practitioners/education/statistics & numerical data and *Stroke/etiology/prevention & control and Knowledge translation and Staff Development/*methods and Stroke prevention",NA,NA,2020/06/08/,BMC Fam Pract,NA,NA,NA,NA
Huang_2019_BMCfampra,JOUR,"A preliminary effect analysis of family doctor and medical insurance payment coordination reform in Changning District of Shanghai, China","Huang, Jiaoling and Lu, Wei and Wang, Luan and Zhang, Tao and Liu, Chengjun and Liu, Shanshan and Liang, Hong and Zhang, Yimin and Guo, Dongfeng",BMC family practice,"BACKGROUND: Changning District of Shanghai pioneered in implementing Family Doctor and Medical Insurance Payment Coordination Reform. The survey aimed to assess the effect of the reform to provide a decision-making basis for ensuring the ""gatekeeper"" role of the family doctor. METHODS: A cross-sectional survey was conducted using a self-designed questionnaire in Changning District of Shanghai during January and February in 2014. Multi-stage random cluster was applied and 3040 residents were selected. Comparisons were made with statistically test between the contracted and non-contracted residents in four policy targeted dimensions, doctor-visiting behavior, health management and status, medical cost control and satisfaction. RESULTS: Compared with the non-contracted residents, the contracted residents (72.9%) presented a higher prevalence rate of chronic diseases (32.6%), a higher proportion (51.9%) in first-contact in the community health service center and a higher proportion to refer to specialists as well (P < 0.001).The result showed that the average annual medical expense were significantly higher than non-contracted residents (P < 0.001), however, the difference disappeared after age, medical insurance and other socio-demographic variables were controlled. In terms of self-management of non-communicable diseases and complication prevention, the blood pressure control rate and blood glucose control rate for the contracted group were also higher than the counterparts, reaching up to 85.6 and 72.7% respectively. CONCLUSION: The preliminary analysis indicated that the contracted residents performed better in orderly doctor visiting behavior, health management behavior, health status and satisfaction. Follow up survey is necessary to further analyze the policy effect.",2019,10.1186/s12875-019-0949-0,20,1,60,eng,1471-2296,"China and Humans and Female and Male and Adult and Middle Aged and Health Status and Cross-Sectional Studies and Hypertension and Chronic Disease and Health Policy and Diabetes Mellitus and Reimbursement Mechanisms and *Health Behavior and *Patient Satisfaction and *Gatekeeping and *Health Care Costs and *Health Care Reform and *Physicians, Family and *Insurance, Health and Health Services/economics/*statistics & numerical data",NA,NA,2019/05/10/,BMC Fam Pract,NA,NA,NA,NA
Bowie_2012_BMCfampra,JOUR,Maximising harm reduction in early specialty training for general practice: validation of a safety checklist,"Bowie, Paul and McKay, John and Kelly, Moya",BMC family practice,"BACKGROUND: Making health care safer is a key policy priority worldwide. In specialty training, medical educators may unintentionally impact on patient safety e.g. through failures of supervision; providing limited feedback on performance; and letting poorly developed behaviours continue unchecked. Doctors-in-training are also known to be susceptible to medical error. Ensuring that all essential educational issues are addressed during training is problematic given the scale of the tasks to be undertaken. Human error and the reliability of local systems may increase the risk of safety-critical topics being inadequately covered. However adherence to a checklist reminder may improve the reliability of task delivery and maximise harm reduction. We aimed to prioritise the most safety-critical issues to be addressed in the first 12-weeks of specialty training in the general practice environment and validate a related checklist reminder. METHODS: We used mixed methods with different groups of GP educators (n=127) and specialty trainees (n=9) in two Scottish regions to prioritise, develop and validate checklist content. Generation and refinement of checklist themes and items were undertaken on an iterative basis using a range of methods including small group work in dedicated workshops; a modified-Delphi process; and telephone interviews. The relevance of potential checklist items was rated using a 4-point scale content validity index to inform final inclusion. RESULTS: 14 themes (e.g. prescribing safely; dealing with medical emergency; implications of poor record keeping; and effective & safe communication) and 47 related items (e.g. how to safety-net face-to-face or over the telephone; knowledge of practice systems for results handling; recognition of harm in children) were judged to be essential safety-critical educational issues to be covered. The mean content validity index ratio was 0.98. CONCLUSION: A checklist was developed and validated for educational supervisors to assist in the reliable delivery of safety-critical educational issues in the opening 12-week period of training, and aligned with national curriculum competencies. The tool can also be adapted for use as a self-assessment instrument by trainees to guide patient safety-related learning needs. Dissemination and implementation of the checklist and self-rating scale are proceeding on a national, voluntary basis with plans to evaluate its feasibility and educational impact.",2012,10.1186/1471-2296-13-62,13,NA,62,eng,1471-2296,"Humans and Specialization and Time Factors and Decision Making and Physician-Patient Relations and Reproducibility of Results and Interprofessional Relations and Self-Assessment and Scotland and *Curriculum and *Checklist and Clinical Competence/standards and *Harm Reduction and *Safety Management/methods/standards and Education, Continuing and Faculty, Medical/standards and General Practice/*education and Holistic Health and Medical Errors/prevention & control and Quality Assurance, Health Care/*standards",NA,NA,2012/06/21/,BMC Fam Pract,NA,NA,NA,NA
Fraenkel_2007_Joofgeinme,JOUR,What are the essential elements to enable patient participation in medical decision making?,"Fraenkel, Liana and McGraw, Sarah",Journal of general internal medicine,"BACKGROUND: Patient participation in shared decision making (SDM) results in increased patient knowledge, adherence, and improved outcomes. Despite the benefits of the SDM model, many patients do not attain the level of participation they desire. OBJECTIVE: To gain a more complete understanding of the essential elements, or the prerequisites, critical to active patient participation in medical decision making from the patient's perspective. DESIGN: Qualitative study. SETTING: Individual, in-depth patient interviews were conducted until thematic saturation was reached. Two analysts independently read the transcripts and jointly developed a list of codes. PATIENTS: Twenty-six consecutive subjects drawn from community dwelling subjects undergoing bone density measurements. MEASUREMENTS: Respondents' experiences and beliefs related to patient participation in SDM. RESULTS: Five elements were repeatedly described by respondents as being essential to enable patient participation in medical decision making: (1) patient knowledge, (2) explicit encouragement of patient participation by physicians, (3) appreciation of the patient's responsibility/rights to play an active role in decision making, (4) awareness of choice, and (5) time. LIMITATIONS: The generalizability of the results is limited by the homogeneity of the study sample. CONCLUSIONS: Our findings have important clinical implications and suggest that several needs must be met before patients can become active participants in decisions related to their health care. These needs include ensuring that patients (1) appreciate that there is uncertainty in medicine and ""buy in"" to the importance of active patient participation in decisions related to their health care, (2) understand the trade-offs related to available options, and (3) have the opportunity to discuss these options with their physician to arrive at a decision concordant with their values.",2007,10.1007/s11606-007-0149-9,22,5,614-619,eng,1525-1497 0884-8734,Humans and Female and Male and Middle Aged and Aged and Choice Behavior and *Decision Making and *Physician-Patient Relations and Interviews as Topic/methods and Patient Participation/*methods,NA,NA,2007/05//undefined,J Gen Intern Med,NA,NA,NA,NA
Sahni_2018_Joofgeinme,JOUR,Development and Validation of Machine Learning Models for Prediction of 1-Year Mortality Utilizing Electronic Medical Record Data Available at the End of Hospitalization in Multicondition Patients: a Proof-of-Concept Study,"Sahni, Nishant and Simon, Gyorgy and Arora, Rashi",Journal of general internal medicine,"BACKGROUND: Predicting death in a cohort of clinically diverse, multicondition hospitalized patients is difficult. Prognostic models that use electronic medical record (EMR) data to determine 1-year death risk can improve end-of-life planning and risk adjustment for research. OBJECTIVE: Determine if the final set of demographic, vital sign, and laboratory data from a hospitalization can be used to accurately quantify 1-year mortality risk. DESIGN: A retrospective study using electronic medical record data linked with the state death registry. PARTICIPANTS: A total of 59,848 hospitalized patients within a six-hospital network over a 4-year period. MAIN MEASURES: The last set of vital signs, complete blood count, basic and complete metabolic panel, demographic information, and ICD codes. The outcome of interest was death within 1 year. KEY RESULTS: Model performance was measured on the validation data set. Random forests (RF) outperformed logisitic regression (LR) models in discriminative ability. An RF model that used the final set of demographic, vitals, and laboratory data from the final 48 h of hospitalization had an AUC of 0.86 (0.85-0.87) for predicting death within a year. Age, blood urea nitrogen, platelet count, hemoglobin, and creatinine were the most important variables in the RF model. Models that used comorbidity variables alone had the lowest AUC. In groups of patients with a high probability of death, RF models underestimated the probability by less than 10%. CONCLUSION: The last set of EMR data from a hospitalization can be used to accurately estimate the risk of 1-year mortality within a cohort of multicondition hospitalized patients.",2018,10.1007/s11606-018-4316-y,33,6,921-928,eng,1525-1497 0884-8734,"machine learning and Humans and Female and Male and Adult and Middle Aged and Retrospective Studies and Aged and Forecasting and data mining and Cohort Studies and Risk Factors and Reproducibility of Results and Aged, 80 and over and *Proof of Concept Study and *Models, Theoretical and Data Analysis and predictive models and Machine Learning/*standards/trends and *Hospitalization/trends and *Mortality/trends and Electronic Health Records/*standards/trends and hospital outcomes",NA,NA,2018/06//undefined,J Gen Intern Med,NA,NA,NA,NA
Koch_2020_Joofgeinme,JOUR,Teaching Conflicts of Interest and Shared Decision-Making to Improve Risk Communication: a Randomized Controlled Trial,"Koch, Cora and Dreimuller, Nadine and Weisskircher, Janosch and Deis, Nicole and Gaitzsch, Eva and Wagner, Stefanie and Stoll, Marlene and Bassler, Franziska and Lieb, Klaus and Junger, Jana",Journal of general internal medicine,"BACKGROUND: Risk communication is a core aspect of a physician's work and a fundamental prerequisite for successful shared decision-making. However, many physicians are not able to adequately communicate risks to patients due to a lack of understanding of statistics as well as inadequate management of conflicts of interest (COI). OBJECTIVE: To evaluate the effects of an integrated curriculum encompassing COI and shared decision-making on the participants' risk communication competence, that is, their competence to advise patients on the benefits and harms of diagnostic or therapeutic interventions. DESIGN: A rater-blind randomized controlled trial with a 30 (<c2><b1> 1)-week follow-up conducted from October 2016 to June 2017 at two German academic medical centers. PARTICIPANTS: Sixty-three medical students in their fourth or fifth year. INTERVENTIONS: Participants received either a newly developed 15-h curriculum or a course manual adapted from teaching as usual. MAIN MEASURES: Primary outcome: change in risk communication performance in a video-observed structured clinical examination (VOSCE). KEY RESULTS: Participants were 25.7 years old on average (SD 3.6); 73% (46/63) were female. Increase in risk communication performance was significantly higher in the intervention group with post-intervention Cohen's d of 2.35 (95% confidence interval (CI) 1.62 to 3.01, p < 0.01) and of 1.83 (CI 1.13 to 2.47, p < 0.01) 30 (<c2><b1> 1) weeks later. Secondary outcomes with the exception of frequency of interactions with the pharmaceutical industry also showed relevant improvements in the intervention as compared with the control group (d between 0.91 and 2.04 (p < 0.001)). CONCLUSIONS: Our results show that an integrated curriculum encompassing COI and risk communication leads to a large and sustainable increase in risk communication performance. We interpret the large effect sizes to be a result of the integration of topics that are usually taught separately, leading to a more effective organization of knowledge. TRIAL REGISTRATION: The trial is registered in the International Clinical Trials Registry with the trial number DRKS00010890.",2020,10.1007/s11606-019-05420-w,35,2,473-480,eng,1525-1497 0884-8734,"Communication and Curriculum and Humans and Female and Male and Adult and Risk communication and *Students, Medical and *Conflict of Interest and Medical education and Decision Making, Shared and Shared decision-making and Conflict of interest",NA,NA,2020/02//undefined,J Gen Intern Med,NA,NA,NA,NA
Van.Roy_2013_BMCfampra,JOUR,What makes up good consultations? A qualitative study of GPs' discourses,"Van Roy, Kaatje and Vanheule, Stijn and Deveugele, Myriam",BMC family practice,"BACKGROUND: In medical literature, several principles that define 'good consultations' have been outlined. These principles tend to be prescriptive in nature, overlooking the complexity of general practitioners (GPs)' perspectives of everyday practice. Focusing on perspectives might be particularly relevant, since they may affect decisions and actions. Therefore, the present study adopts a bottom-up approach, analyzing GPs' narratives about 'good' and 'bad' consultations. We aimed at describing the range of discourses GPs use in relating on their practice. METHODS: Semi-structured interviews were conducted with 19 Belgian GPs. By means of a qualitative analysis, the authors mapped patterns in the interview narratives and described the range of different discourses. RESULTS: Four discourses were identified: a biomedically-centered discourse, a communication-focused discourse, a problem-solving discourse and a satisfaction-oriented discourse. Each discourse was further specified in terms of predominant themes, problems the GPs prefer to deal with and inherent difficulties. Although most participants used elements from all four discourses, the majority of the GPs relied on an individual set of predominant discourses and focused on a limited number of themes. CONCLUSION: This study clearly indicates that there is no uniform way in which GPs perceive clinical practice. Each of the participants used a subtle mix of different criteria to define good and bad medical consultations. Some discourse elements appear to be rooted in medical literature, whereas others are of a more personal nature. By focusing on the limitations of each discourse, this study can shed new light on some of the difficulties GPs encounter in their daily practice: being confronted with specific problems might be an effect of adhering to a specific discourse. The typification of different discourses on consultations may function as a framework to help GPs reflect on how they perceive their practice, and help them manage some of the challenges met in daily practice.",2013,10.1186/1471-2296-14-62,14,NA,62,eng,1471-2296,"Humans and Adult and Middle Aged and Decision Making and Health Knowledge, Attitudes, Practice and Interviews as Topic and Qualitative Research and Belgium and *Physician-Patient Relations and General Practitioners/*psychology and General Practice/*standards and Referral and Consultation/*standards and Patient-Centered Care/methods and Clinical Competence/statistics & numerical data and Group Practice/statistics & numerical data and Private Practice/statistics & numerical data",NA,NA,2013/05/16/,BMC Fam Pract,NA,NA,NA,NA
