label,type,title,author,journal,abstract,year,doi,volume,issue,pages,language,issn,keywords,url,institution,DA,j2,DP,l1,l2,ST
Su_2020_IEtronmeim,JOUR,Automatic Collateral Scoring From 3D CTA Images,"Su, Jiahang and Wolff, Lennard and van Es, Adriaan C. G. M. and van Zwam, Wim and Majoie, Charles and W J Dippel, Diederik and van der Lugt, Aad and J Niessen, Wiro and Van Walsum, Theo",IEEE transactions on medical imaging,"The collateral score is an important biomarker in decision making for endovascular treatment (EVT) of patients with ischemic stroke. The existing collateral grading systems are based on visual inspection and prone to subjective interpretation and interobserver variation. The purpose of our work is the development of an automatic collateral scoring method. In this work, we present a method that is inspired by human collateral scoring. Firstly, we define an anatomical region by atlas-based registration and extract vessel structures using a deep convolutional neural network. From this, high-level features based on the ratios of vessel length and volume of the occluded and the contralateral side are defined. Multi-class classification models are used to map the feature space to a four-grade collateral score and a quantitative score. The dataset used for training, validation and testing is from a registry of images acquired in clinical routine at multiple medical centers. The model performance is tested on 269 subjects, achieving an accuracy of 0.8. The dichotomized collateral score accuracy is 0.9. The error is comparable to the interobserver variation, the results are comparable to the performance of two radiologists with 10 to 30 years of experience.",2020,10.1109/TMI.2020.2966921,39,6,2190-2200,eng,1558-254X 0278-0062,"Humans and Observer Variation and Neural Networks, Computer and Radiologists and Imaging, Three-Dimensional and *Stroke/diagnostic imaging",NA,NA,2020/06//undefined,IEEE Trans Med Imaging,NA,NA,NA,NA
Hill_2017_JACCCardimag,JOUR,Radiation Safety in Children With Congenital and Acquired Heart Disease: A Scientific Position Statement on Multimodality Dose Optimization From the Image Gently Alliance,"Hill, Kevin D. and Frush, Donald P. and Han, B. Kelly and Abbott, Brian G. and Armstrong, Aimee K. and DeKemp, Robert A. and Glatz, Andrew C. and Greenberg, S. Bruce and Herbert, Alexander Sheldon and Justino, Henri and Mah, Douglas and Mahesh, Mahadevappa and Rigsby, Cynthia K. and Slesnick, Timothy C. and Strauss, Keith J. and Trattner, Sigal and Viswanathan, Mohan N. and Einstein, Andrew J.",JACC. Cardiovascular imaging,"There is a need for consensus recommendations for ionizing radiation dose optimization during multimodality medical imaging in children with congenital and acquired heart disease (CAHD). These children often have complex diseases and may be exposed to a relatively high cumulative burden of ionizing radiation from medical imaging procedures, including cardiac computed tomography, nuclear cardiology studies, and fluoroscopically guided diagnostic and interventional catheterization and electrophysiology procedures. Although these imaging procedures are all essential to the care of children with CAHD and have contributed to meaningfully improved outcomes in these patients, exposure to ionizing radiation is associated with potential risks, including an increased lifetime attributable risk of cancer. The goal of these recommendations is to encourage informed imaging to achieve appropriate study quality at the lowest achievable dose. Other strategies to improve care include a patient-centered approach to imaging, emphasizing education and informed decision making and programmatic approaches to ensure appropriate dose monitoring. Looking ahead, there is a need for standardization of dose metrics across imaging modalities, so as to encourage comparative effectiveness studies across the spectrum of CAHD in children.",2017,10.1016/j.jcmg.2017.04.003,10,7,797-818,eng,1876-7591 1936-878X,"Humans and Female and Male and Adolescent and Child and Child, Preschool and Infant and Risk Assessment and children and Risk Factors and Predictive Value of Tests and Age Factors and Consensus and Infant, Newborn and Patient Safety/standards and cardiovascular imaging and *Radiation Dosage and cardiovascular interventions and Fluoroscopy/standards and Heart Defects, Congenital/*diagnostic imaging and ionizing radiation and Multimodal Imaging/adverse effects/methods/*standards and Radiation Exposure/adverse effects/prevention & control/*standards and Radiation Injuries/prevention & control and radiation safety and Radiography, Interventional/adverse effects/*standards and Radionuclide Imaging/adverse effects/*standards and Tomography, X-Ray Computed/adverse effects/*standards",NA,NA,2017/07//undefined,JACC Cardiovasc Imaging,NA,NA,NA,NA
Walsh_2020_Euroradi,JOUR,Patient cumulative radiation exposure-the potential for unintended consequences,"Walsh, Colin and O'Reilly, Geraldine and Murphy, Dara",European radiology,"Several recent publications have sought to highlight the benefits of tracking patient radiation exposure and how it can be used to strengthen the justification and optimization processes to enhance patient safety. In some cases, authors promote the use of dose tracking to keep medical prescribers aware of the patients' cumulative exposure, presumably with a view to influencing the justification process. Inclusion of patient dose history in the justification process can be problematic for reasons that are not always well understood by medical prescribers. Our paper seeks to highlight these issues and attempts to provide some clarification. Key Points <e2><80><a2> Care must be taken in how cumulative radiation exposure is interpreted as it pertains to the justification process.",2020,10.1007/s00330-020-06800-1,30,8,4434-4437,eng,1432-1084 0938-7994,"Risk and Patient safety and Patients and Cardiology and Humans and Risk Assessment and Patient Safety and Tomography, X-Ray Computed and *Clinical Decision-Making and Radiation dosage and *Radiation Dosage and *Radiation Exposure and Magnetic Resonance Angiography and Radiation protection and Radiation Protection and Radiography, Interventional",NA,NA,2020/08//undefined,Eur Radiol,NA,NA,NA,NA
Mielniczuk_2017_JACCCardimag,JOUR,Can Functional Testing for Ischemia and Viability Guide Revascularization?,"Mielniczuk, Lisa M. and Toth, Gabor G. and Xie, Joe X. and De Bruyne, Bernard and Shaw, Leslee J. and Beanlands, Rob S.",JACC. Cardiovascular imaging,"Cardiac imaging procedures are a cornerstone of the diagnosis and management of patients with cardiac disease. The optimal management of the patient with stable ischemic heart disease or ischemic heart failure often rests on the totality of symptom burden, patient risk, and disease severity, whether assessed anatomically or functionally. Recent trials have demonstrated the power of flow measurements to direct revascularization as well as the strengths and limitations of ischemia and viability/hibernation imaging as markers of risk to direct interventions. They have also highlighted the challenges in evaluating imaging or functional testing to direct therapies, because imaging does not directly affect outcome itself, rather it affects the management decisions that may result in a positive outcome. Ongoing studies with randomized designs, such as FAME 3 (Fractional Flow Reserve versus Angiography for Multivessel Evaluation), ISCHEMIA (International Study of Comparative Health Effectiveness with Medical and Invasive Approaches), and AIMI-HF (Alternative Imaging Modalities in Ischemic Heart Failure) (IMAGE-HF [Imaging Modalities to Assist with Guiding Therapy in The Evaluation of Patients with Heart Failure]), will provide the highest level of evidence to support practice changes that may further clarify the role of cardiac imaging in the evaluation of these patients and result in improved patient outcomes.",2017,10.1016/j.jcmg.2016.12.011,10,3,354-364,eng,1876-7591,Humans and Time Factors and Treatment Outcome and Predictive Value of Tests and heart failure and Patient Selection and *Decision Support Techniques and *Clinical Decision-Making and PET and *Cardiac Imaging Techniques and coronary revascularization and fractional flow reserve and ischemic heart disease and Myocardial Ischemia/*diagnostic imaging/pathology/physiopathology/*therapy and Myocardial Revascularization/*methods and Myocardium/*pathology and Tissue Survival,NA,NA,2017/03//undefined,JACC Cardiovasc Imaging,NA,NA,NA,NA
Wang_2019_IEtronmeim,JOUR,3D Auto-Context-Based Locality Adaptive Multi-Modality GANs for PET Synthesis,"Wang, Yan and Zhou, Luping and Yu, Biting and Wang, Lei and Zu, Chen and Lalush, David S. and Lin, Weili and Wu, Xi and Zhou, Jiliu and Shen, Dinggang",IEEE transactions on medical imaging,"Positron emission tomography (PET) has been substantially used recently. To minimize the potential health risk caused by the tracer radiation inherent to PET scans, it is of great interest to synthesize the high-quality PET image from the low-dose one to reduce the radiation exposure. In this paper, we propose a 3D auto-context-based locality adaptive multi-modality generative adversarial networks model (LA-GANs) to synthesize the high-quality FDG PET image from the low-dose one with the accompanying MRI images that provide anatomical information. Our work has four contributions. First, different from the traditional methods that treat each image modality as an input channel and apply the same kernel to convolve the whole image, we argue that the contributions of different modalities could vary at different image locations, and therefore a unified kernel for a whole image is not optimal. To address this issue, we propose a locality adaptive strategy for multi-modality fusion. Second, we utilize 1 *1 *1 kernel to learn this locality adaptive fusion so that the number of additional parameters incurred by our method is kept minimum. Third, the proposed locality adaptive fusion mechanism is learned jointly with the PET image synthesis in a 3D conditional GANs model, which generates high-quality PET images by employing large-sized image patches and hierarchical features. Fourth, we apply the auto-context strategy to our scheme and propose an auto-context LA-GANs model to further refine the quality of synthesized images. Experimental results show that our method outperforms the traditional multi-modality fusion methods used in deep networks, as well as the state-of-the-art PET estimation approaches.",2019,10.1109/TMI.2018.2884053,38,6,1328-1339,eng,1558-254X 0278-0062,"Humans and Databases, Factual and Radiation Dosage and *Deep Learning and Imaging, Three-Dimensional/*methods and Phantoms, Imaging and Positron-Emission Tomography/*methods and Magnetic Resonance Imaging/methods and Brain/diagnostic imaging",NA,NA,2019/06//undefined,IEEE Trans Med Imaging,NA,NA,NA,NA
Minaee_2019_IEtronmeim,JOUR,MTBI Identification From Diffusion MR Images Using Bag of Adversarial Visual Features,"Minaee, Shervin and Wang, Yao and Aygar, Alp and Chung, Sohae and Wang, Xiuyuan and Lui, Yvonne W. and Fieremans, Els and Flanagan, Steven and Rath, Joseph",IEEE transactions on medical imaging,"In this paper, we propose bag of adversarial features (BAFs) for identifying mild traumatic brain injury (MTBI) patients from their diffusion magnetic resonance images (MRIs) (obtained within one month of injury) by incorporating unsupervised feature learning techniques. MTBI is a growing public health problem with an estimated incidence of over 1.7 million people annually in USA. Diagnosis is based on clinical history and symptoms, and accurate, concrete measures of injury are lacking. Unlike most of the previous works, which use hand-crafted features extracted from different parts of brain for MTBI classification, we employ feature learning algorithms to learn more discriminative representation for this task. A major challenge in this field thus far is the relatively small number of subjects available for training. This makes it difficult to use an end-to-end convolutional neural network to directly classify a subject from MRIs. To overcome this challenge, we first apply an adversarial auto-encoder (with convolutional structure) to learn patch-level features, from overlapping image patches extracted from different brain regions. We then aggregate these features through a bag-of-words approach. We perform an extensive experimental study on a dataset of 227 subjects (including 109 MTBI patients, and 118 age and sex-matched healthy controls) and compare the bag-of-deep-features with several previous approaches. Our experimental results show that the BAF significantly outperforms earlier works relying on the mean values of MR metrics in selected brain regions.",2019,10.1109/TMI.2019.2905917,38,11,2545-2555,eng,1558-254X 0278-0062,"Humans and Adolescent and Adult and Middle Aged and Young Adult and Algorithms and Databases, Factual and ROC Curve and *Deep Learning and Image Interpretation, Computer-Assisted/*methods and Brain/diagnostic imaging and Diffusion Magnetic Resonance Imaging/*methods and Brain Concussion/*diagnostic imaging",NA,NA,2019/11//undefined,IEEE Trans Med Imaging,NA,NA,NA,NA
Armstrong_2012_JACCCardimag,JOUR,"LV mass assessed by echocardiography and CMR, cardiovascular outcomes, and medical practice","Armstrong, Anderson C. and Gidding, Samuel and Gjesdal, Ola and Wu, Colin and Bluemke, David A. and Lima, Joao A. C.",JACC. Cardiovascular imaging,"The authors investigated 3 important areas related to the clinical use of left ventricular mass (LVM): accuracy of assessments by echocardiography and cardiac magnetic resonance (CMR), the ability to predict cardiovascular outcomes, and the comparative value of different indexing methods. The recommended formula for echocardiographic estimation of LVM uses linear measurements and is based on the assumption of the left ventricle (LV) as a prolate ellipsoid of revolution. CMR permits a modeling of the LV free of cardiac geometric assumptions or acoustic window dependency, showing better accuracy and reproducibility. However, echocardiography has lower cost, easier availability, and better tolerability. From the MEDLINE database, 26 longitudinal echocardiographic studies and 5 CMR studies investigating LVM or LV hypertrophy as predictors of death or major cardiovascular outcomes were identified. LVM and LV hypertrophy were reliable cardiovascular risk predictors using both modalities. However, no study directly compared the methods for the ability to predict events, agreement in hypertrophy classification, or performance in cardiovascular risk reclassification. Indexing LVM to body surface area was the earliest normalization process used, but it seems to underestimate the prevalence of hypertrophy in obese and overweight subjects. Dividing LVM by height to the allometric power of 1.7 or 2.7 is the most promising normalization method in terms of practicality and usefulness from a clinical and scientific standpoint for scaling myocardial mass to body size. The measurement of LVM, calculation of LVM index, and classification for LV hypertrophy should be standardized by scientific societies across measurement techniques and adopted by clinicians in risk stratification and therapeutic decision making.",2012,10.1016/j.jcmg.2012.06.003,5,8,837-848,eng,1876-7591 1936-878X,"Humans and Risk Assessment and Ultrasonography and Imaging, Three-Dimensional and *Magnetic Resonance Imaging, Cine and Chagas Cardiomyopathy/pathology and Heart Ventricles/*diagnostic imaging/*pathology and Hypertrophy, Left Ventricular/*diagnosis",NA,NA,2012/08//undefined,JACC Cardiovasc Imaging,NA,NA,NA,NA
Bekkers_2008_IEtronmeim,JOUR,Multiscale vascular surface model generation from medical imaging data using hierarchical features,"Bekkers, Eric J. and Taylor, Charles A.",IEEE transactions on medical imaging,"Computational fluid dynamics (CFD) modeling of blood flow from image-based patient specific models can provide useful physiologic information for guiding clinical decision making. A novel method for the generation of image-based, 3-D, multiscale vascular surface models for CFD is presented. The method generates multiscale surfaces based on either a linear triangulated or a globally smooth nonuniform rational B-spline (NURB) representation. A robust local curvature analysis is combined with a novel global feature analysis to set mesh element size. The method is particularly useful for CFD modeling of complex vascular geometries that have a wide range of vasculature size scales, in conditions where 1) initial surface mesh density is an important consideration for balancing surface accuracy with manageable size volumetric meshes, 2) adaptive mesh refinement based on flow features makes an underlying explicit smooth surface representation desirable, and 3) semi-automated detection and trimming of a large number of inlet and outlet vessels expedites model construction.",2008,10.1109/TMI.2007.905081,27,3,331-341,eng,0278-0062,"Humans and Sensitivity and Specificity and Reproducibility of Results and Computer Simulation and *Algorithms and Models, Biological and *Artificial Intelligence and Pattern Recognition, Automated/*methods and Image Interpretation, Computer-Assisted/*methods and Imaging, Three-Dimensional/*methods and Models, Anatomic and Angiography/*methods and Image Enhancement/methods and Blood Vessels/*anatomy & histology",NA,NA,2008/03//undefined,IEEE Trans Med Imaging,NA,NA,NA,NA
Enzmann_2012_Radi,JOUR,Radiology's value chain,"Enzmann, Dieter R.",Radiology,"A diagnostic radiology value chain is constructed to define its main components, all of which are vulnerable to change, because digitization has caused disaggregation of the chain. Some components afford opportunities to improve productivity, some add value, while some face outsourcing to lower labor cost and to information technology substitutes, raising commoditization risks. Digital image information, because it can be competitive at smaller economies of scale, allows faster, differential rates of technological innovation of components, initiating a centralization-to-decentralization technology trend. Digitization, having triggered disaggregation of radiology's professional service model, may soon usher in an information business model. This means moving from a mind-set of ""reading images"" to an orientation of creating and organizing information for greater accuracy, faster speed, and lower cost in medical decision making. Information businesses view value chain investments differently than do small professional services. In the former model, producing a better business product will extend image interpretation beyond a radiologist's personal fund of knowledge to encompass expanding external imaging databases. A follow-on expansion with integration of image and molecular information into a report will offer new value in medical decision making. Improved interpretation plus new integration will enrich and diversify radiology's key service products, the report and consultation. A more robust, information-rich report derived from a ""systems"" and ""computational"" radiology approach will be facilitated by a transition from a professional service to an information business. Under health care reform, radiology will transition its emphasis from volume to greater value. Radiology's future brightens with the adoption of a philosophy of offering information rather than ""reads"" for decision making. Staunchly defending the status quo via turf wars is unlikely to constitute a forward-looking, competitive strategy.",2012,10.1148/radiol.12110227,263,1,243-252,eng,1527-1315 0033-8419,"Organizational Culture and Humans and Organizational Innovation and Organizational Objectives and Decision Making and Forecasting and Health Care Reform and Efficiency, Organizational and *Models, Organizational and Practice Management, Medical/*organization & administration and Radiology/*economics/*trends",NA,NA,2012/04//undefined,Radiology,NA,NA,NA,NA
Veredas_2010_IEtronmeim,JOUR,Binary tissue classification on wound images with neural networks and bayesian classifiers,"Veredas, Francisco and Mesa, Hector and Morente, Laura",IEEE transactions on medical imaging,"A pressure ulcer is a clinical pathology of localized damage to the skin and underlying tissue caused by pressure, shear, or friction. Diagnosis, treatment, and care of pressure ulcers are costly for health services. Accurate wound evaluation is a critical task for optimizing the efficacy of treatment and care. Clinicians usually evaluate each pressure ulcer by visual inspection of the damaged tissues, which is an imprecise manner of assessing the wound state. Current computer vision approaches do not offer a global solution to this particular problem. In this paper, a hybrid approach based on neural networks and Bayesian classifiers is used in the design of a computational system for automatic tissue identification in wound images. A mean shift procedure and a region-growing strategy are implemented for effective region segmentation. Color and texture features are extracted from these segmented regions. A set of k multilayer perceptrons is trained with inputs consisting of color and texture patterns, and outputs consisting of categorical tissue classes which are determined by clinical experts. This training procedure is driven by a k-fold cross-validation method. Finally, a Bayesian committee machine is formed by training a Bayesian classifier to combine the classifications of the k neural networks. Specific heuristics based on the wound topology are designed to significantly improve the results of the classification. We obtain high efficiency rates from a binary cascade approach for tissue identification. Results are compared with other similar machine-learning approaches, including multiclass Bayesian committee machine classifiers and support vector machines. The different techniques analyzed in this paper show high global classification accuracy rates. Our binary cascade approach gives high global performance rates (average sensitivity =78.7% , specificity =94.7% , and accuracy =91.5% ) and shows the highest average sensitivity score ( =86.3%) when detecting necrotic tissue in the wound.",2010,10.1109/TMI.2009.2033595,29,2,410-427,eng,1558-254X 0278-0062,"Humans and Algorithms and Sensitivity and Specificity and Reproducibility of Results and *Neural Networks, Computer and *Bayes Theorem and Image Processing, Computer-Assisted/*methods and Image Interpretation, Computer-Assisted/*methods and Photography/*methods and Pressure Ulcer/*pathology",NA,NA,2010/02//undefined,IEEE Trans Med Imaging,NA,NA,NA,NA
Wu_2018_IEtronmeim,JOUR,Sparse Representation-Based Radiomics for the Diagnosis of Brain Tumors,"Wu, Guoqing and Chen, Yinsheng and Wang, Yuanyuan and Yu, Jinhua and Lv, Xiaofei and Ju, Xue and Shi, Zhifeng and Chen, Liang and Chen, Zhongping",IEEE transactions on medical imaging,"Brain tumors are the most common malignant neurologic tumors with the highest mortality and disability rate. Because of the delicate structure of the brain, the clinical use of several commonly used biopsy diagnosis is limited for brain tumors. Radiomics is an emerging technique for noninvasive diagnosis based on quantitative medical image analyses. However, current radiomics techniques are not standardized regarding feature extraction, feature selection, and decision making. In this paper, we propose a sparse representation-based radiomics (SRR) system for the diagnosis of brain tumors. First, we developed a dictionary learning- and sparse representation-based feature extraction method that exploits the statistical characteristics of the lesion area, leading to fine and more effective feature extraction compared with the traditional explicitly calculation-based methods. Then, we set up an iterative sparse representation method to solve the redundancy problem of the extracted features. Finally, we proposed a novel multi-feature collaborative sparse representation classification framework that introduces a new coefficient of regularization term to combine features from multi-modal images at the sparse representation coefficient level. Two clinical problems were used to validate the performance and usefulness of the proposed SRR system. One was the differential diagnosis between primary central nervous system lymphoma (PCNSL) and glioblastoma (GBM), and the other was isocitrate dehydrogenase 1 estimation for gliomas. The SRR system had superior PCNSL and GBM differentiation performance compared with some advanced imaging techniques and yielded 11% better performance for estimating IDH1 compared with the traditional radiomics methods.",2018,10.1109/TMI.2017.2776967,37,4,893-905,eng,1558-254X 0278-0062,"Humans and Algorithms and Cluster Analysis and Radiographic Image Interpretation, Computer-Assisted/*methods and Tomography, X-Ray Computed/*methods and Brain/diagnostic imaging and Brain Neoplasms/*diagnostic imaging",NA,NA,2018/04//undefined,IEEE Trans Med Imaging,NA,NA,NA,NA
