label,type,title,author,journal,abstract,year,doi,volume,issue,pages,language,issn,keywords,url,institution,DA,j2,DP,l1,l2,ST
Betancur_2018_JACCCardimag,JOUR,Prognostic Value of Combined Clinical and Myocardial Perfusion Imaging Data Using Machine Learning,"Betancur, Julian and Otaki, Yuka and Motwani, Manish and Fish, Mathews B. and Lemley, Mark and Dey, Damini and Gransar, Heidi and Tamarappoo, Balaji and Germano, Guido and Sharir, Tali and Berman, Daniel S. and Slomka, Piotr J.",JACC. Cardiovascular imaging,"OBJECTIVES: This study evaluated the added predictive value of combining clinical information and myocardial perfusion single-photon emission computed tomography (SPECT) imaging (MPI) data using machine learning (ML) to predict major adverse cardiac events (MACE). BACKGROUND: Traditionally, prognostication by MPI has relied on visual or quantitative analysis of images without objective consideration of the clinical data. ML permits a large number of variables to be considered in combination and at a level of complexity beyond the human clinical reader. METHODS: A total of 2,619 consecutive patients (48% men; 62 <c2><b1> 13 years of age) who underwent exercise (38%) or pharmacological stress (62%) with high-speed SPECT MPI were monitored for MACE. Twenty-eight clinical variables, 17 stress test variables, and 25 imaging variables (including total perfusion deficit [TPD]) were recorded. Areas under the receiver-operating characteristic curve (AUC) for MACE prediction were compared among: 1) ML with all available data (ML-combined); 2) ML with only imaging data (ML-imaging); 3) 5-point scale visual diagnosis (physician [MD] diagnosis); and 4) automated quantitative imaging analysis (stress TPD and ischemic TPD). ML involved automated variable selection by information gain ranking, model building with a boosted ensemble algorithm, and 10-fold stratified cross validation. RESULTS: During follow-up (3.2 <c2><b1> 0.6 years), 239 patients (9.1%) had MACE. MACE prediction was significantly higher for ML-combined than ML-imaging (AUC: 0.81 vs. 0.78; p < 0.01). ML-combined also had higher predictive accuracy compared with MD diagnosis, automated stress TPD, and automated ischemic TPD (AUC: 0.81 vs. 0.65 vs. 0.73 vs. 0.71, respectively; p < 0.01 for all). Risk reclassification for ML-combined compared with visual MD diagnosis was 26% (p < 0.001). CONCLUSIONS: ML combined with both clinical and imaging data variables was found to have high predictive accuracy for 3-year risk of MACE and was superior to existing visual or automated perfusion assessments. ML could allow integration of clinical and imaging data for personalized MACE risk computations in patients undergoing SPECT MPI.",2018,10.1016/j.jcmg.2017.07.024,11,7,1000-1009,eng,1876-7591 1936-878X,"machine learning and Humans and Female and Male and Middle Aged and Health Status and Risk Assessment and Aged and Time Factors and Risk Factors and Hemodynamics and Prognosis and Reproducibility of Results and Aged, 80 and over and Predictive Value of Tests and *Machine Learning and Exercise Test and *Tomography, Emission-Computed, Single-Photon and Cardiovascular Diseases/*diagnostic imaging/mortality/physiopathology/therapy and Coronary Circulation and major adverse cardiac event(s) and Myocardial Perfusion Imaging/*methods and SPECT myocardial imaging",NA,NA,2018/07//undefined,JACC Cardiovasc Imaging,NA,NA,NA,NA
Iskandrian_2014_JACCCardimag,JOUR,Serial myocardial perfusion imaging: defining a significant change and targeting management decisions,"Iskandrian, Ami E. and Hage, Fadi G. and Shaw, Leslee J. and Mahmarian, John J. and Berman, Daniel S.",JACC. Cardiovascular imaging,"Myocardial perfusion imaging (MPI) with gated single-photon emission tomography provides important information on the extent and severity of myocardial perfusion abnormalities, including myocardial ischemia. The availability of software for automated quantitative assessment of myocardial perfusion in an objective and more reproducible manner than visual assessment has allowed MPI to be particularly effective in serial evaluation. Serial testing using MPI is widely used in guiding patient care despite the lack of well-defined appropriateness use criteria. This should not be surprising because ischemic heart disease is a life-long malady subject to dynamic changes throughout its natural course and particularly following man-made interventions that may improve or worsen the disease process, such as medical therapy and coronary revascularization. Serial MPI has filled an important clinical gap by providing crucial information for managing patients with changes in clinical presentations or in anticipation of such changes in patients with stable symptoms. In the research arena, serial MPI has been widely applied in randomized controlled trials to study the impact of various medical and interventional therapies on myocardial perfusion, as well as the relative merits of new imaging procedures (hardware and/or software), radiotracers, and stressor agents. Serial testing, however, unlike initial or 1-time testing, has more stringent requirements and is subject to variability because of technical, procedural, interpretational, and biological factors. The intrinsic variability of MPI becomes important in interpreting serial tests in order to define a true change in a given patient and to guide clinical decision making. The purpose of this first comprehensive review on this subject is to illustrate where serial MPI may be useful clinically and in research studies, and to highlight strategies for addressing the various issues that are unique to serial testing in order to derive more valid and robust data from the serial scans.",2014,10.1016/j.jcmg.2013.05.022,7,1,79-96,eng,1876-7591,"Humans and Decision Making and Reproducibility of Results and PCI and *Disease Management and coronary artery disease and Myocardial Perfusion Imaging/*methods and CAD and Coronary Artery Disease/*diagnostic imaging and left ventricular and LV and MPI and myocardial ischemia and myocardial perfusion imaging and OMT and optimal medical therapy and PDS and percutaneous coronary intervention and perfusion defect size and PET and positron emission tomography and single-photon emission computed tomography and single-photon emission tomography and SPECT and stress testing and Tomography, Emission-Computed, Single-Photon/*methods and total perfusion deficit and TPD",NA,NA,2014/01//undefined,JACC Cardiovasc Imaging,NA,NA,NA,NA
Wehbe_2021_Radi,JOUR,DeepCOVID-XR: An Artificial Intelligence Algorithm to Detect COVID-19 on Chest Radiographs Trained and Tested on a Large U.S. Clinical Data Set,"Wehbe, Ramsey M. and Sheng, Jiayue and Dutta, Shinjan and Chai, Siyuan and Dravid, Amil and Barutcu, Semih and Wu, Yunan and Cantrell, Donald R. and Xiao, Nicholas and Allen, Bradley D. and MacNealy, Gregory A. and Savas, Hatice and Agrawal, Rishi and Parekh, Nishant and Katsaggelos, Aggelos K.",Radiology,"Background There are characteristic findings of coronavirus disease 2019 (COVID-19) on chest images. An artificial intelligence (AI) algorithm to detect COVID-19 on chest radiographs might be useful for triage or infection control within a hospital setting, but prior reports have been limited by small data sets, poor data quality, or both. Purpose To present DeepCOVID-XR, a deep learning AI algorithm to detect COVID-19 on chest radiographs, that was trained and tested on a large clinical data set. Materials and Methods DeepCOVID-XR is an ensemble of convolutional neural networks developed to detect COVID-19 on frontal chest radiographs, with reverse-transcription polymerase chain reaction test results as the reference standard. The algorithm was trained and validated on 14 788 images (4253 positive for COVID-19) from sites across the Northwestern Memorial Health Care System from February 2020 to April 2020 and was then tested on 2214 images (1192 positive for COVID-19) from a single hold-out institution. Performance of the algorithm was compared with interpretations from five experienced thoracic radiologists on 300 random test images using the McNemar test for sensitivity and specificity and the DeLong test for the area under the receiver operating characteristic curve (AUC). Results A total of 5853 patients (mean age, 58 years <c2><b1> 19 [standard deviation]; 3101 women) were evaluated across data sets. For the entire test set, accuracy of DeepCOVID-XR was 83%, with an AUC of 0.90. For 300 random test images (134 positive for COVID-19), accuracy of DeepCOVID-XR was 82%, compared with that of individual radiologists (range, 76%-81%) and the consensus of all five radiologists (81%). DeepCOVID-XR had a significantly higher sensitivity (71%) than one radiologist (60%, P < .001) and significantly higher specificity (92%) than two radiologists (75%, P < .001; 84%, P = .009). AUC of DeepCOVID-XR was 0.88 compared with the consensus AUC of 0.85 (P = .13 for comparison). With consensus interpretation as the reference standard, the AUC of DeepCOVID-XR was 0.95 (95% CI: 0.92, 0.98). Conclusion DeepCOVID-XR, an artificial intelligence algorithm, detected coronavirus disease 2019 on chest radiographs with a performance similar to that of experienced thoracic radiologists in consensus. (C) RSNA, 2020 Supplemental material is available for this article. See also the editorial by van Ginneken in this issue.",2021,10.1148/radiol.2020203511,299,1,E167-E176,eng,1527-1315 0033-8419,"SARS-CoV-2 and United States and Humans and Female and Male and Middle Aged and Algorithms and Sensitivity and Specificity and Datasets as Topic and *Artificial Intelligence and COVID-19/*diagnostic imaging and Lung/*diagnostic imaging and Radiographic Image Interpretation, Computer-Assisted/*methods and Radiography, Thoracic/*methods",NA,NA,2021/04//undefined,Radiology,NA,NA,NA,NA
Patra_2019_Micaci.M.ICoMICaCI,JOUR,Efficient Ultrasound Image Analysis Models with Sonographer Gaze Assisted Distillation,"Patra, Arijit and Cai, Yifan and Chatelain, Pierre and Sharma, Harshita and Drukker, Lior and Papageorghiou, Aris and Noble, J. Alison",Medical image computing and computer-assisted intervention : MICCAI ... International Conference on Medical Image Computing and Computer-Assisted Intervention,"Recent automated medical image analysis methods have attained state-of-the-art performance but have relied on memory and compute-intensive deep learning models. Reducing model size without significant loss in performance metrics is crucial for time and memory-efficient automated image-based decision-making. Traditional deep learning based image analysis only uses expert knowledge in the form of manual annotations. Recently, there has been interest in introducing other forms of expert knowledge into deep learning architecture design. This is the approach considered in the paper where we propose to combine ultrasound video with point-of-gaze tracked for expert sonographers as they scan to train memory-efficient ultrasound image analysis models. Specifically we develop teacher-student knowledge transfer models for the exemplar task of frame classification for the fetal abdomen, head, and femur. The best performing memory-efficient models attain performance within 5% of conventional models that are 1000* larger in size.",2019,10.1007/978-3-030-32251-9_43,22,Pt 4,394-402,eng,NA,Expert knowledge and Gaze tracking and Model compression,NA,NA,2019///,Med Image Comput Comput Assist Interv,NA,NA,NA,NA
Shan_2018_IEtronmeim,JOUR,3-D Convolutional Encoder-Decoder Network for Low-Dose CT via Transfer Learning From a 2-D Trained Network,"Shan, Hongming and Zhang, Yi and Yang, Qingsong and Kruger, Uwe and Kalra, Mannudeep K. and Sun, Ling and Cong, Wenxiang and Wang, Ge",IEEE transactions on medical imaging,"Low-dose computed tomography (LDCT) has attracted major attention in the medical imaging field, since CT-associated X-ray radiation carries health risks for patients. The reduction of the CT radiation dose, however, compromises the signal-to-noise ratio, which affects image quality and diagnostic performance. Recently, deep-learning-based algorithms have achieved promising results in LDCT denoising, especially convolutional neural network (CNN) and generative adversarial network (GAN) architectures. This paper introduces a conveying path-based convolutional encoder-decoder (CPCE) network in 2-D and 3-D configurations within the GAN framework for LDCT denoising. A novel feature of this approach is that an initial 3-D CPCE denoising model can be directly obtained by extending a trained 2-D CNN, which is then fine-tuned to incorporate 3-D spatial information from adjacent slices. Based on the transfer learning from 2-D to 3-D, the 3-D network converges faster and achieves a better denoising performance when compared with a training from scratch. By comparing the CPCE network with recently published work based on the simulated Mayo data set and the real MGH data set, we demonstrate that the 3-D CPCE denoising model has a better performance in that it suppresses image noise and preserves subtle structures.",2018,10.1109/TMI.2018.2832217,37,6,1522-1534,eng,1558-254X 0278-0062,"Humans and Algorithms and *Deep Learning and Imaging, Three-Dimensional/*methods and Phantoms, Imaging and Tomography, X-Ray Computed/*methods",NA,NA,2018/06//undefined,IEEE Trans Med Imaging,NA,NA,NA,NA
Tesche_2017_Radi,JOUR,Coronary CT Angiography-derived Fractional Flow Reserve,"Tesche, Christian and De Cecco, Carlo N. and Albrecht, Moritz H. and Duguay, Taylor M. and Bayer, Richard R. 2nd and Litwin, Sheldon E. and Steinberg, Daniel H. and Schoepf, U. Joseph",Radiology,"Invasive coronary angiography (ICA) with measurement of fractional flow reserve (FFR) by means of a pressure wire technique is the established reference standard for the functional assessment of coronary artery disease (CAD) ( 1 , 2 ). Coronary computed tomographic (CT) angiography has emerged as a noninvasive method for direct assessment of CAD and plaque characterization with high diagnostic accuracy compared with ICA ( 3 , 4 ). However, the solely anatomic assessment provided with both coronary CT angiography and ICA has poor discriminatory power for ischemia-inducing lesions. FFR derived from standard coronary CT angiography (FFR(CT)) data sets by using any of several advanced computational analytic approaches enables combined anatomic and hemodynamic assessment of a coronary lesion by a single noninvasive test. Current technical approaches to the calculation of FFR(CT) include algorithms based on full- and reduced-order computational fluid dynamic modeling, as well as artificial intelligence deep machine learning ( 5 , 6 ). A growing body of evidence has validated the diagnostic accuracy of FFR(CT) techniques compared with invasive FFR. Improved therapeutic guidance has been demonstrated, showing the potential of FFR(CT) to streamline and rationalize the care of patients suspected of having CAD and improve outcomes while reducing overall health care costs ( 7 , 8 ). The purpose of this review is to describe the scientific principles, clinical validation, and implementation of various FFR(CT) approaches, their precursors, and related imaging tests. ((C)) RSNA, 2017.",2017,10.1148/radiol.2017162641,285,1,17-33,eng,1527-1315 0033-8419,"Humans and Female and Male and Middle Aged and Aged and Machine Learning and Cohort Studies and Reproducibility of Results and Computed Tomography Angiography/*methods/standards and Coronary Angiography/*methods/standards and Coronary Stenosis/diagnostic imaging and Fractional Flow Reserve, Myocardial/*physiology",NA,NA,2017/10//undefined,Radiology,NA,NA,NA,NA
Pinto.Dos.Santos_2019_Euroradi,JOUR,Medical students' attitude towards artificial intelligence: a multicentre survey,"Pinto Dos Santos, D. and Giese, D. and Brodehl, S. and Chon, S. H. and Staab, W. and Kleinert, R. and Maintz, D. and Baessler, B.",European radiology,"OBJECTIVES: To assess undergraduate medical students' attitudes towards artificial intelligence (AI) in radiology and medicine. MATERIALS AND METHODS: A web-based questionnaire was designed using SurveyMonkey, and was sent out to students at three major medical schools. It consisted of various sections aiming to evaluate the students' prior knowledge of AI in radiology and beyond, as well as their attitude towards AI in radiology specifically and in medicine in general. Respondents' anonymity was ensured. RESULTS: A total of 263 students (166 female, 94 male, median age 23 years) responded to the questionnaire. Around 52% were aware of the ongoing discussion about AI in radiology and 68% stated that they were unaware of the technologies involved. Respondents agreed that AI could potentially detect pathologies in radiological examinations (83%) but felt that AI would not be able to establish a definite diagnosis (56%). The majority agreed that AI will revolutionise and improve radiology (77% and 86%), while disagreeing with statements that human radiologists will be replaced (83%). Over two-thirds agreed on the need for AI to be included in medical training (71%). In sub-group analyses male and tech-savvy respondents were more confident on the benefits of AI and less fearful of these technologies. CONCLUSION: Contrary to anecdotes published in the media, undergraduate medical students do not worry that AI will replace human radiologists, and are aware of the potential applications and implications of AI on radiology and medicine. Radiology should take the lead in educating students about these emerging technologies. KEY POINTS: <e2><80><a2> Medical students are aware of the potential applications and implications of AI in radiology and medicine in general. <e2><80><a2> Medical students do not worry that the human radiologist or physician will be replaced. <e2><80><a2> Artificial intelligence should be included in medical training.",2019,10.1007/s00330-018-5601-1,29,4,1640-1646,eng,1432-1084 0938-7994,"Artificial intelligence and Humans and Female and Male and Adult and Young Adult and Surveys and Questionnaires and Radiology and Germany and *Artificial Intelligence and *Attitude of Health Personnel and *Attitude to Computers and Students, Medical/*psychology and Radiologists and Education, Medical, Undergraduate/methods and Education, medical and Radiology/*education/methods and Surveys and questionnaires",NA,NA,2019/04//undefined,Eur Radiol,NA,NA,NA,NA
Meineke_2019_Euroradi,JOUR,Potential of a machine-learning model for dose optimization in CT quality assurance,"Meineke, Axel and Rubbert, Christian and Sawicki, Lino M. and Thomas, Christoph and Klosterkemper, Yan and Appel, Elisabeth and Caspers, Julian and Bethge, Oliver T. and Kropil, Patric and Antoch, Gerald and Boos, Johannes",European radiology,"OBJECTIVES: To evaluate machine learning (ML) to detect chest CT examinations with dose optimization potential for quality assurance in a retrospective, cross-sectional study. METHODS: Three thousand one hundred ninety-nine CT chest examinations were used for training and testing of the feed-forward, single hidden layer neural network (January 2016-December 2017, 60% male, 62 <c2><b1> 15 years, 80/20 split). The model was optimized and trained to predict the volumetric computed tomography dose index (CTDI(vol)) based on scan patient metrics (scanner, study description, protocol, patient age, sex, and water-equivalent diameter (D(W))). The root mean-squared error (RMSE) was calculated as performance measurement. One hundred separate, consecutive chest CTs were used for validation (January 2018, 60% male, 63 <c2><b1> 16 years), independently reviewed by two blinded radiologists with regard to dose optimization, and used to define an optimal cutoff for the model. RESULTS: RMSE was 1.71, 1.45, and 1.52 for the training, test, and validation dataset, respectively. The scanner and D(W) were the most important features. The radiologists found dose optimization potential in 7/100 of the validation cases. A percentage deviation of 18.3% between predicted and actual CTDI(vol) was found to be the optimal cutoff: 8/100 cases were flagged as suboptimal by the model (range 18.3-53.2%). All of the cases found by the radiologists were identified. One examination was flagged only by the model. CONCLUSIONS: ML can comprehensively detect CT examinations with dose optimization potential. It may be a helpful tool to simplify CT quality assurance. CT scanner and D(W) were most important. Final human review remains necessary. A threshold of 18.3% between the predicted and actual CTDI(vol) seems adequate for CT quality assurance. KEY POINTS: <e2><80><a2> Machine learning can be integrated into CT quality assurance to improve retrospective analysis of CT dose data. <e2><80><a2> Machine learning may help to comprehensively detect dose optimization potential in chest CT, but an individual review of the results by an experienced radiologist or radiation physicist is required to exclude false-positive findings.",2019,10.1007/s00330-019-6013-6,29,7,3705-3713,eng,1432-1084 0938-7994,"Machine learning and Humans and Female and Male and Adolescent and Adult and Middle Aged and Young Adult and Retrospective Studies and Cross-Sectional Studies and Aged and Aged, 80 and over and Radiation Dosage and *Quality Assurance, Health Care and Thorax and *Machine Learning and Radiography, Thoracic/*standards and Multidetector computed tomography and Multidetector Computed Tomography/*standards and Quality assurance, health care and Radiation dosage and Radiation Injuries/*prevention & control and Thoracic Diseases/*diagnosis",NA,NA,2019/07//undefined,Eur Radiol,NA,NA,NA,NA
Liu_2013_Micaci.M.ICoMICaCI,JOUR,A variational framework for joint detection and segmentation of ovarian cancer metastases,"Liu, Jianfei and Wang, Shijun and Linguraru, Marius George and Yao, Jianhua and Summers, Ronald M.",Medical image computing and computer-assisted intervention : MICCAI ... International Conference on Medical Image Computing and Computer-Assisted Intervention,"Detection and segmentation of ovarian cancer metastases have great clinical impacts on women's health. However, the random distribution and weak boundaries of metastases significantly complicate this task. This paper presents a variational framework that combines region competition based level set propagation and image matching flow computation to jointly detect and segment metastases. Image matching flow not only detects metastases, but also creates shape priors to reduce over-segmentation. Accordingly, accurate segmentation helps to improve the detection accuracy by separating flow computation in metastasis and non-metastasis regions. Since all components in the image processing pipeline benefit from each other, our joint framework can achieve accurate metastasis detection and segmentation. Validation on 50 patient datasets demonstrated that our joint approach was superior to a sequential method with sensitivity 89.2% vs. 81.4% (Fisher exact test p = 0.046) and false positive per patient 1.04 vs. 2.04. The Dice coefficient of metastasis segmentation was 92 +/- 5.2% vs. 72 +/- 8% (paired t-test p = 0.022), and the average surface distance was 1.9 +/- 1.5mm vs. 4.5 +/- 2.2mm (paired t-test p = 0.004).",2013,10.1007/978-3-642-40763-5_11,16,Pt 2,83-90,eng,NA,"Humans and Female and Sensitivity and Specificity and Reproducibility of Results and *Algorithms and *Artificial Intelligence and Pattern Recognition, Automated/*methods and Image Interpretation, Computer-Assisted/*methods and Image Enhancement/methods and Ovarian Neoplasms/*pathology/*secondary",NA,NA,2013///,Med Image Comput Comput Assist Interv,NA,NA,NA,NA
Grote_2019_IEtronmeim,JOUR,Crowdsourcing of Histological Image Labeling and Object Delineation by Medical Students,"Grote, Anne and Schaadt, Nadine S. and Forestier, Germain and Wemmert, Cedric and Feuerhake, Friedrich",IEEE transactions on medical imaging,"Crowdsourcing in pathology has been performed on tasks that are assumed to be manageable by nonexperts. Demand remains high for annotations of more complex elements in digital microscopic images, such as anatomical structures. Therefore, this paper investigates conditions to enable crowdsourced annotations of high-level image objects, a complex task considered to require expert knowledge. Seventy six medical students without specific domain knowledge who voluntarily participated in three experiments solved two relevant annotation tasks on histopathological images: 1) labeling of images showing tissue regions and 2) delineation of morphologically defined image objects. We focus on methods to ensure sufficient annotation quality including several tests on the required number of participants and on the correlation of participants' performance between tasks. In a set up simulating annotation of images with limited ground truth, we validated the feasibility of a confidence score using full ground truth. For this, we computed a majority vote using weighting factors based on individual assessment of contributors against scattered gold standard annotated by pathologists. In conclusion, we provide guidance for task design and quality control to enable a crowdsourced approach to obtain accurate annotations required in the era of digital pathology.",2019,10.1109/TMI.2018.2883237,38,5,1284-1294,eng,1558-254X 0278-0062,"Humans and Feasibility Studies and Reproducibility of Results and Image Processing, Computer-Assisted and *Students, Medical and Crowdsourcing/*methods and Decision Making/physiology and *Histocytochemistry/classification/methods",NA,NA,2019/05//undefined,IEEE Trans Med Imaging,NA,NA,NA,NA
