label,type,title,author,journal,abstract,year,doi,volume,issue,pages,language,issn,keywords,url,institution,DA,j2,DP,l1,l2,ST
Zusman_2018_JACCCardimag,JOUR,Intervention Versus Observation in Symptomatic Patients With Normal Flow Low Gradient Severe Aortic Stenosis,"Zusman, Oren and Pressman, Gregg S. and Banai, Shmuel and Finkelstein, Ariel and Topilsky, Yan",JACC. Cardiovascular imaging,"OBJECTIVES: The purpose of this study was to describe patients with severe symptomatic aortic stenosis with normal flow and low gradients and determine whether they benefit from intervention. BACKGROUND: Severe symptomatic aortic stenosis is a progressive disease with high mortality. Although surgical aortic valve replacement (SAVR) or transcatheter aortic valve replacement (TAVR) are indicated for patients with high gradients (>40 mm Hg) or low gradients due to low flow, the approach for patients with normal flow and low gradients is poorly defined. METHODS: Consecutive adult patients who underwent echocardiography between 2012 and 2015 at Tel-Aviv Medical Center and had an aortic valve area of <e2><89><a4>1.0 cm(2), a mean gradient of <40 mm Hg, a stroke volume index of >35 ml/m(2), and symptoms formed the study group. Patients designated for intervention (SAVR or TAVR) had their procedure within 6 months of the echocardiogram; the others were treated conservatively. The endpoints were all-cause mortality and cardiac-related mortality. RESULTS: During the study period, 1,358 patients with an aortic valve area of <e2><89><a4>1.0 cm(2) and symptoms were identified; 34% of these had normal flow and low gradient aortic stenosis and 303 were included. After mean follow-up of 652 days, 60 patients (20%) had died, with overall mortality rates of 28%, 10%, and 12% for conservatively treated, TAVR, and SAVR patients, respectively (p < 0.001). Using Cox regression with adjustment for other variables, TAVR was associated with improved survival versus conservative treatment (hazard ratio [HR]: 0.49; 95% confidence interval [CI]: 0.26 to 0.93; p = 0.03), and lower cardiac mortality (HR: 0.30; 95% CI: 0.10 to 0.74; p = 0.007) with no significant difference for SAVR versus TAVR. After propensity score matching of TAVR and conservatively treated patients, 25 of 94 (28%) conservatively treated and 10 of 94 (12%) TAVR patients had died (p = 0.016). In the matched cohort, Cox regression showed that TAVR had a significant association with improved survival (HR: 0.42; 95% CI: 0.20 to 0.86; p = 0.03). CONCLUSIONS: Symptomatic patients with an aortic valve area of <e2><89><a4>1.0 cm(2), normal flow, and low gradient may benefit from intervention as opposed to conservative treatment.",2018,10.1016/j.jcmg.2017.07.020,11,9,1225-1232,eng,1876-7591,"Humans and Female and Male and Middle Aged and Retrospective Studies and Aged and Time Factors and Risk Factors and Treatment Outcome and Aged, 80 and over and Predictive Value of Tests and Severity of Illness Index and Patient Selection and Time-to-Treatment and Clinical Decision-Making and *Hemodynamics and *Watchful Waiting and Echocardiography and *Conservative Treatment and *Heart Valve Prosthesis Implantation/adverse effects/mortality and aortic stenosis and Aortic Valve Stenosis/diagnostic imaging/physiopathology/*surgery and Aortic Valve/diagnostic imaging/physiopathology/*surgery and SAVR and TAVR and Transcatheter Aortic Valve Replacement",NA,NA,2018/09//undefined,JACC Cardiovasc Imaging,NA,NA,NA,NA
Lysdahl_2010_Euroradi,JOUR,Radiologists' responses to inadequate referrals,"Lysdahl, Kristin Bakke and Hofmann, Bjorn Morten and Espeland, Ansgar",European radiology,"OBJECTIVES: To investigate radiologists' responses to inadequate imaging referrals. METHODS: A survey was mailed to Norwegian radiologists; 69% responded. They graded the frequencies of actions related to referrals with ambiguous indications or inappropriate examination choices and the contribution of factors preventing and not preventing an examination of doubtful usefulness from being performed as requested. RESULTS: Ninety-five percent (344/361) reported daily or weekly actions related to inadequate referrals. Actions differed among subspecialties. The most frequent were contacting the referrer to clarify the clinical problem and checking test results/information in the medical records. Both actions were more frequent among registrars than specialists and among hospital radiologists than institute radiologists. Institute radiologists were more likely to ask the patient for additional information and to examine the patient clinically. Factors rated as contributing most to prevent doubtful examinations were high risk of serious complications/side effects, high radiation dose and low patient age. Factors facilitating doubtful examinations included respect for the referrer's judgment, patient/next-of-kin wants the examination, patient has arrived, unreachable referrer, and time pressure. CONCLUSIONS: In summary, radiologists facing inadequate referrals considered patient safety and sought more information. Vetting referrals on arrival, easier access to referring clinicians, and time for radiologists to handle inadequate referrals may contribute to improved use of imaging.",2010,10.1007/s00330-009-1640-y,20,5,1227-1233,eng,1432-1084 0938-7994,"Humans and Decision Making and Surveys and Questionnaires and Norway and Chi-Square Distribution and *Radiology and *Attitude of Health Personnel and Physicians/*psychology and Practice Patterns, Physicians'/*statistics & numerical data and Referral and Consultation/*standards",NA,NA,2010/05//undefined,Eur Radiol,NA,NA,NA,NA
Eley_2021_Radi,JOUR,Multiparametric Imaging for Presurgical Planning of Craniopagus Twins: The Experience of Two Tertiary Pediatric Hospitals with Six Sets of Twins,"Eley, Karen A. and Rossi-Espagnet, Maria Camilla and Schievano, Silvia and Napolitano, Antonio and Ong, Juling and Secinaro, Aurelio and Borro, Luca and Dunaway, David and Marras, Carlo Efisio and Rennie, Adam and Robertson, Fergus and Picardo, Sergio and Longo, Daniela and Inserra, Alessandro and Rollo, Massimo and Cooper, Jessica and Mankad, Kshitij and Jeelani, Noor-Owase and D'Arco, Felice",Radiology,"Conjoined twins are rare and pose a challenge to radiologists and surgeons. Craniopagus twins, where conjunction involves the cranium, are especially rare. Even in large pediatric centers, radiologists are unlikely to encounter more than one such event in their medical careers. This rarity makes it daunting to select a CT and MRI protocol for these infants. Using the experience of two tertiary pediatric hospitals with six sets of craniopagus twins, this multidisciplinary and multimodal integrated imaging approach highlights the key questions that need addressing in the decision-making process for possible surgical intervention.",2021,10.1148/radiol.2020202216,298,1,18-27,eng,1527-1315 0033-8419,"Humans and Hospitals, Pediatric and Tertiary Care Centers and Clinical Decision-Making/*methods and Tomography, X-Ray Computed/*methods and Magnetic Resonance Imaging/*methods and Preoperative Care/*methods and Skull/abnormalities/*diagnostic imaging/surgery and Twins, Conjoined/*surgery",NA,NA,2021/01//undefined,Radiology,NA,NA,NA,NA
Keil_2008_Euroradi,JOUR,"Semi-automated measurement of hyperdense, hypodense and heterogeneous hepatic metastasis on standard MDCT slices. Comparison of semi-automated and manual measurement of RECIST and WHO criteria","Keil, Sebastian and Behrendt, Florian F. and Stanzel, Sven and Suhling, Michael and Koch, Alexander and Bubenzer, Jhenee and Muhlenbruch, Georg and Mahnken, Andreas H. and Gunther, Rolf W. and Das, Marco",European radiology,"As semi-automated measurement would be desirable for lesion quantification and therapy-response control, the purpose of this study was to compare semi-automated measurements with manual assessment of different types of hepatic metastases. Seventy-six patients with known liver metastases were analysed. All of them underwent contrast-enhanced 16-MDCT (16 x 0.75 mm collimation, 120 kV, 0.5 s rotation time, 160 mAs(eff)) for evaluation of follow-up status. On the basis of standard reconstructed 5-mm slices (in 4-mm increments), each lesion was quantified based on RECIST and WHO criteria using a semi-automated software tool (Syngo Oncology) and also manually by an experienced radiologist. Results from the software were compared to manual measurements. Statistical analysis was performed applying the concordance correlation coefficient, and results were represented graphically in Bland-Altman plots. A total of 52 hyperdense, 57 hypodense and 56 heterogeneous metastases were found and correctly measured by the software. All three lesion types revealed a strong correlation agreement between measurement techniques [RECIST diameter: 0.93 (hyperdense), 0.95(hypodense), 0.94 (heterogeneous); WHO area: 0.95, 0.98, 0.93]. Semi-automatic measurement of hyperdense, hypodense and heterogeneous liver metastases showed reliable results on standard axial reconstructions in comparison to manual quantification.",2008,10.1007/s00330-008-1050-6,18,11,2456-2465,eng,1432-1084 0938-7994,"Humans and Adult and Middle Aged and Aged and Algorithms and Sensitivity and Specificity and Reproducibility of Results and Aged, 80 and over and World Health Organization and *Artificial Intelligence and Pattern Recognition, Automated/*methods and Radiographic Image Interpretation, Computer-Assisted/*methods and Tomography, X-Ray Computed/*methods and Carcinoma, Hepatocellular/*diagnostic imaging/*secondary and Liver Neoplasms/*diagnostic imaging and Radiographic Image Enhancement/methods",NA,NA,2008/11//undefined,Eur Radiol,NA,NA,NA,NA
Ertl.Wagner_2009_Euroradi,JOUR,Reliability of tumor volume estimation from MR images in patients with malignant glioma. Results from the American College of Radiology Imaging Network (ACRIN) 6662 Trial,"Ertl-Wagner, Birgit B. and Blume, Jeffrey D. and Peck, Donald and Udupa, Jayaram K. and Herman, Benjamin and Levering, Anthony and Schmalfuss, Ilona M.",European radiology,"Reliable assessment of tumor growth in malignant glioma poses a common problem both clinically and when studying novel therapeutic agents. We aimed to evaluate two software-systems in their ability to estimate volume change of tumor and/or edema on magnetic resonance (MR) images of malignant gliomas. Twenty patients with malignant glioma were included from different sites. Serial post-operative MR images were assessed with two software systems representative of the two fundamental segmentation methods, single-image fuzzy analysis (3DVIEWNIX-TV) and multi-spectral-image analysis (Eigentool), and with a manual method by 16 independent readers (eight MR-certified technologists, four neuroradiology fellows, four neuroradiologists). Enhancing tumor volume and tumor volume plus edema were assessed independently by each reader. Intraclass correlation coefficients (ICCs), variance components, and prediction intervals were estimated. There were no significant differences in the average tumor volume change over time between the software systems (p > 0.05). Both software systems were much more reliable and yielded smaller prediction intervals than manual measurements. No significant differences were observed between the volume changes determined by fellows/neuroradiologists or technologists.Semi-automated software systems are reliable tools to serve as outcome parameters in clinical studies and the basis for therapeutic decision-making for malignant gliomas, whereas manual measurements are less reliable and should not be the basis for clinical or research outcome studies.",2009,10.1007/s00330-008-1191-7,19,3,599-609,eng,1432-1084 0938-7994,"Software and Radiography and Automation and Humans and Time Factors and Treatment Outcome and Decision Support Techniques and Reproducibility of Results and Societies, Medical and Computer Graphics and Tumor Burden and Magnetic Resonance Imaging/methods and Diagnostic Imaging/*methods and Brain Neoplasms/*diagnostic imaging/*pathology and Glioma/*diagnostic imaging/*pathology and Magnetic Resonance Spectroscopy/*methods",NA,NA,2009/03//undefined,Eur Radiol,NA,NA,NA,NA
Diekhoff_2020_Euroradi,JOUR,Effectiveness of the clinical decision support tool ESR eGUIDE for teaching medical students the appropriate selection of imaging tests: randomized cross-over evaluation,"Diekhoff, Torsten and Kainberger, Franz and Oleaga, Laura and Dewey, Marc and Zimmermann, Elke",European radiology,"OBJECTIVES: To evaluate ESR eGUIDE-the European Society of Radiology (ESR) e-Learning tool for appropriate use of diagnostic imaging modalities-for learning purposes in different clinical scenarios. METHODS: This anonymized evaluation was performed after approval of ESR Education on Demand leadership. Forty clinical scenarios were developed in which at least one imaging modality was clinically most appropriate, and the scenarios were divided into sets 1 and 2. These sets were provided to medical students randomly assigned to group A or B to select the most appropriate imaging test for each scenario. Statistical comparisons were made within and across groups. RESULTS: Overall, 40 medical students participated, and 31 medical students (78%) answered both sets. The number of correctly chosen imaging methods per set in these 31 paired samples was significantly higher when answered with versus without use of ESR eGUIDE (13.7 <c2><b1> 2.6 questions vs. 12.1 <c2><b1> 3.2, p = 0.012). Among the students in group A, who first answered set 1 without ESR eGUIDE (11.1 <c2><b1> 3.2), there was significant improvement when set 2 was answered with ESR eGUIDE (14.3 <c2><b1> 2.5, p = 0.013). The number of correct answers in group B did not drop when set 2 was answered without ESR eGUIDE (12.4 <c2><b1> 2.6) after having answered set 1 first with ESR eGUIDE (13.0 <c2><b1> 2.7, p = 0.66). CONCLUSION: The clinical decision support tool ESR eGUIDE is suitable for training medical students in choosing the best radiological imaging modality in typical scenarios, and its use in teaching radiology can thus be recommended. KEY POINTS: <e2><80><a2> ESR eGUIDE improved the number of appropriately selected imaging modalities among medical students. <e2><80><a2> This improvement was also seen in the group of students which first selected imaging tests without ESR eGUIDE. <e2><80><a2> In the student group which used ESR eGUIDE first, appropriate selection remained stable even without the teaching tool.",2020,10.1007/s00330-020-06942-2,30,10,5684-5689,eng,1432-1084 0938-7994,"Radiography and Teaching and Humans and User-Computer Interface and Educational Measurement/*methods and Europe and Cross-Over Studies and Learning and Clinical decision support systems and Radiology/*education and *Decision Support Systems, Clinical and Education, Medical, Undergraduate/*methods and *Students, Medical and *Diagnostic Imaging and Medical students and Diagnostic imaging and Random allocation",NA,NA,2020/10//undefined,Eur Radiol,NA,NA,NA,NA
Medina_2007_Radi,JOUR,Evidence-based radiology: review and dissemination,"Medina, L. Santiago and Blackmore, C. Craig",Radiology,"Evidence-based radiology (EBR) is an important tool for the practice of radiology. The user of the EBR approach identifies evidence in a systematic fashion and then assimilates information through in-depth, explicit critical review of the best-designed and most recent literature on the subject in question. Clinical decision making is then based on the best current evidence, clinical expertise, and patient values. Substantial progress has been made in the review and dissemination of EBR. Dissemination of EBR within radiology has two critical aspects. The first is increased understanding of the methods required for EBR and of the appropriate use of EBR. The second important component is the dissemination of the data and critical literature reviews necessary to allow use of the EBR approach. Resources available for both EBR methods and EBR data in radiology include societies, journals, medical meetings, Web sites, and textbooks. Although radiology has made important progress in this field in recent years, the specialty is still behind other specialties that have been at the forefront of evidence-based medicine in the past decade.",2007,10.1148/radiol.2442051766,244,2,331-336,eng,0033-8419,"Humans and Diffusion of Innovation and Societies, Medical and Technology Assessment, Biomedical and Professional Competence and Biomedical Research/methods/trends and Diagnostic Imaging/*trends and *Evidence-Based Medicine/education/methods/trends and Clinical Trials as Topic/methods/trends and Education, Medical/methods/trends and Radiology/education/methods/*trends",NA,NA,2007/08//undefined,Radiology,NA,NA,NA,NA
Marks_2015_Radi,JOUR,"""Error Bars"" in Medical Imaging: Stealth and Treacherous","Marks, Lawrence B.",Radiology,"Given the critical role that diagnostic radiology has in patient care, it is important for providers and patients to understand the level of certainty associated with imaging. Over-reliance on imaging and failure to appreciate its limitations can lead to unforeseen consequences. Further, there are uncertainties and inconsistencies in the manner in which imaging-based information is considered, communicated, and applied. There are opportunities to alter practice to maximize comprehension of radiologic reports and thus optimize the manner in which imaging-based information is applied clinically.",2015,10.1148/radiol.2015150175,277,2,318-328,eng,1527-1315 0033-8419,Communication and Humans and Decision Making and *Diagnostic Imaging and *Radiation Oncology and Neoplasms/*diagnosis/*radiotherapy and Radiology Information Systems/standards,NA,NA,2015/11//undefined,Radiology,NA,NA,NA,NA
Park_2020_Euroradi,JOUR,Quality of science and reporting of radiomics in oncologic studies: room for improvement according to radiomics quality score and TRIPOD statement,"Park, Ji Eun and Kim, Donghyun and Kim, Ho Sung and Park, Seo Young and Kim, Jung Youn and Cho, Se Jin and Shin, Jae Ho and Kim, Jeong Hoon",European radiology,"OBJECTIVES: To evaluate radiomics studies according to radiomics quality score (RQS) and Transparent Reporting of a multivariable prediction model for Individual Prognosis Or Diagnosis (TRIPOD) to provide objective measurement of radiomics research. MATERIALS AND METHODS: PubMed and Embase were searched for studies published in high clinical imaging journals until December 2018 using the terms ""radiomics"" and ""radiogenomics."" Studies were scored against the items in the RQS and TRIPOD guidelines. Subgroup analyses were performed for journal type (clinical vs. imaging), intended use (diagnostic vs. prognostic), and imaging modality (CT vs. MRI), and articles were compared using Fisher's exact test and Mann-Whitney analysis. RESULTS: Seventy-seven articles were included. The mean RQS score was 26.1% of the maximum (9.4 out of 36). The RQS was low in demonstration of clinical utility (19.5%), test-retest analysis (6.5%), prospective study (3.9%), and open science (3.9%). None of the studies conducted a phantom or cost-effectiveness analysis. The adherence rate for TRIPOD was 57.8% (mean) and was particularly low in reporting title (2.6%), stating study objective in abstract and introduction (7.8% and 16.9%), blind assessment of outcome (14.3%), sample size (6.5%), and missing data (11.7%) categories. Studies in clinical journals scored higher and more frequently adopted external validation than imaging journals. CONCLUSIONS: The overall scientific quality and reporting of radiomics studies is insufficient. Scientific improvements need to be made to feature reproducibility, analysis of clinical utility, and open science categories. Reporting of study objectives, blind assessment, sample size, and missing data is deemed to be necessary. KEY POINTS: <e2><80><a2> The overall scientific quality and reporting of radiomics studies is insufficient. <e2><80><a2> The RQS was low in demonstration of clinical utility, test-retest analysis, prospective study, and open science. <e2><80><a2> Room for improvement was shown in TRIPOD in stating study objective in abstract and introduction, blind assessment of outcome, sample size, and missing data categories.",2020,10.1007/s00330-019-06360-z,30,1,523-536,eng,1432-1084 0938-7994,"Machine learning and Humans and Prospective Studies and Prognosis and Reproducibility of Results and Computed tomography and Quality improvement and Magnetic resonance imaging and Tomography, X-Ray Computed/*methods and Magnetic Resonance Imaging/*methods and Research Design/*standards and Quality of Health Care/*statistics & numerical data and Neoplasm and Neoplasms/*diagnostic imaging",NA,NA,2020/01//undefined,Eur Radiol,NA,NA,NA,NA
Maher_2007_Radi,JOUR,Evidence-based Practice in Radiology: steps 3 and 4--appraise and apply interventional radiology literature,"Maher, Michael M. and Hodnett, Philip A. and Kalra, Mannudeep K.",Radiology,"When introducing new interventional radiology techniques or devices, it is important to learn from previous experiences and to remember that there are numerous examples of new techniques that were initially enthusiastically promoted and then subsequently abandoned when early promise was not realized. Appropriateness of new or established interventional radiology techniques to specific clinical conditions must be determined from clinical experience, from communication with experts in the field and/or careful review of available medical literature, and on an individual patient basis by means of review of clinical notes and diagnostic imaging studies. Several paradigms for evidence-based practice (EBP) exist. One model proposes that a central specialized process involving academic centers should primarily construct valid guidelines to direct practice at all levels of medical practice (""top-down"" model). An alternative model integrates ""the best research evidence with clinical expertise and patient values"" (""bottom-up"" model). This article will focus on the bottom-up model and describe the use of EBP by individual practitioners or groups of practitioners in optimizing literature review and critical appraisal. EBP is applied to two scenarios as a means of deciding the appropriateness of introducing interventional radiology techniques in a community hospital setting. The authors will also briefly discuss other applications for EBP techniques in interventional radiology, including development of practice guidelines or policy to ensure appropriate and safe practices.",2007,10.1148/radiol.2423060008,242,3,658-670,eng,0033-8419,"United States and *Practice Guidelines as Topic and *Decision Making, Organizational and *Publications and Evidence-Based Medicine/*trends and Clinical Trials as Topic/*trends and Practice Patterns, Physicians'/*trends and Radiology, Interventional/*trends",NA,NA,2007/03//undefined,Radiology,NA,NA,NA,NA
Roemer_2020_Radi,JOUR,State of the Art: Imaging of Osteoarthritis-Revisited 2020,"Roemer, Frank W. and Demehri, Shadpour and Omoumi, Patrick and Link, Thomas M. and Kijowski, Richard and Saarakkala, Simo and Crema, Michel D. and Guermazi, Ali",Radiology,"Osteoarthritis (OA) is a highly prevalent chronic condition with marked implications for affected individuals and public health care. There are available treatments to manage pain and symptoms but no effective treatment for OA. In the past 10 years, joint imaging, particularly MRI, has evolved rapidly due to technical advances and their application to clinical research, which has led to abundant evidence regarding the natural history of the disease. Radiography remains the primary imaging modality in clinical practice for the diagnosis and follow-up of OA. The many developments in MRI techniques capable of assessing cartilage morphologic features and the methods for evaluating its biochemical composition will be discussed. Advances in quantitative morphologic cartilage assessment and semiquantitative whole-organ assessment will be reviewed, as will other modalities such as US, CT and CT arthrography, and nuclear medicine techniques that play a complementary role. Various therapeutic approaches and ongoing developments, including the impact of artificial intelligence on the field of OA imaging, will also be discussed.",2020,10.1148/radiol.2020192498,296,1,21-5,eng,1527-1315 0033-8419,Humans and Diagnostic Imaging/*methods and Osteoarthritis/*diagnostic imaging,NA,NA,2020/07//undefined,Radiology,NA,NA,NA,NA
