label,type,title,author,journal,abstract,year,doi,volume,issue,pages,language,issn,keywords,url,institution,DA,j2,DP,l1,l2,ST
DeWitt.Foy_2021_ThJoofur,JOUR,"Race, Decisional Regret and Prostate Cancer Beliefs: Identifying Targets to Reduce Racial Disparities in Prostate Cancer","DeWitt-Foy, Molly E. and Gam, Kristina and Modlin, Charles and Kim, Simon P. and Abouassaly, Robert",The Journal of urology,"PURPOSE: African American men are more likely to be diagnosed with, die of and experience decisional regret about their prostate cancer than nonAfrican American men. Although some clinical discrepancies may be attributed to genetic risk and/or access to care, explanations for racial discrepancies in decisional regret remain largely speculative. We aim to identify sources of prostate cancer decisional regret with a focus on racial disparities. MATERIALS AND METHODS: A cohort of 1,112 patients with localized prostate cancer treated at the Cleveland Clinic between 2010 and 2016 were matched by race, Gleason score, treatment (external beam radiation, brachytherapy, prostatectomy, active surveillance), prostate specific antigen at diagnosis, age at treatment and time since treatment. All patients received 4 surveys, including the Expanded Prostate Cancer Index Composite (EPIC) 26, the Decisional Regret Scale, our novel Prostate Cancer Beliefs Questionnaire and a modified EPIC demographics form. Descriptive and comparative statistics and multivariable logistic regression were used to compare survey outcomes by race and treatment method. RESULTS: Of 1,048 deliverable surveys 378 (36.07%) were returned. African American men had worse decisional regret than nonAfrican American men even after adjusting for relevant covariates (OR 2.46, p <0.0001). African American men also had higher Prostate Cancer Beliefs Questionnaire medical mistrust and masculinity scores, both of which predicted worse decisional regret independent of race (1.415 and 1.350, p=0.0001, respectively). CONCLUSIONS: African American men suffer worse decisional regret than nonAfrican American men, which may be partially explained by higher medical mistrust and concerns about masculinity as captured by the Prostate Cancer Beliefs Questionnaire. This novel survey may facilitate identifying targets to reduce racial disparities in prostate cancer.",2021,10.1097/JU.0000000000001385,205,2,426-433,eng,1527-3792 0022-5347,Humans and Healthcare Disparities and Male and Middle Aged and decision making and Cohort Studies and healthcare disparities and *Decision Making and *Culture and *Emotions and African Americans/*statistics & numerical data and prostatic neoplasms and Racial Groups/statistics & numerical data and Prostatic Neoplasms/*psychology/*therapy,NA,NA,2021/02//undefined,J Urol,NA,NA,NA,NA
Punnen_2015_Eurourol,JOUR,Long-term health-related quality of life after primary treatment for localized prostate cancer: results from the CaPSURE registry,"Punnen, Sanoj and Cowan, Janet E. and Chan, June M. and Carroll, Peter R. and Cooperberg, Matthew R.",European urology,"BACKGROUND: Few studies have reported on late declines and long-term health-related quality of life (HRQOL) after prostate cancer (PCa) treatment. OBJECTIVE: We assessed long-term HRQOL following various treatments for localized PCa. DESIGN, SETTING, AND PARTICIPANTS: This cohort study of HRQOL up to 10 yr after treatment used a prospectively accrued, nationwide PCa registry that collects longitudinal patient-reported HRQOL. INTERVENTION: Various primary treatments for localized PCa. OUTCOME MEASUREMENTS AND STATISTICAL ANALYSIS: The Medical Outcomes Studies 36-item Short Form and the University of California, Los Angeles, Prostate Cancer Index characterized physical function, mental health, and sexual, urinary, and bowel function and bother. Repeated measures mixed-model analysis assessed change in HRQOL by treatment over time, and logistic regression was used to measure the likelihood of a clinically significant decline in HRQOL. RESULTS AND LIMITATIONS: Among 3294 men, 1139 (34%) underwent nerve-sparing radical prostatectomy (NSRP), 860 (26%) underwent non-NSRP, 684 (21%) underwent brachytherapy, 386 (12%) underwent external beam radiotherapy, 161 (5%) underwent primary androgen deprivation therapy, and 64 (2%) pursued watchful waiting/active surveillance. Median follow-up was 74 mo (interquartile range: 50-102). Most treatments resulted in early declines in HRQOL, with some recovery over the next 1-2 yr and a plateau in scores thereafter. Surgery had the largest impact on sexual function and bother and on urinary function, radiation had the strongest effect on bowel function, and androgen deprivation therapy had the strongest effect on physical function. The main limitation was attrition among the cohort. CONCLUSIONS: Although most men experience initial declines in HRQOL in the first 2 yr after treatment, there is little change from 3 to 10 yr and most differences between treatments attenuated over time. PATIENT SUMMARY: Various treatments for prostate cancer result in a distinct constellation of adverse effects on health-related quality of life, which may have a long-term impact. These findings are helpful regarding shared decision making over choice of primary treatment.",2015,10.1016/j.eururo.2014.08.074,68,4,600-608,eng,1873-7560 0302-2838,"United States and Prostate cancer and Treatment and Humans and Male and Middle Aged and Aged and Time Factors and Logistic Models and Longitudinal Studies and Surveys and Questionnaires and Prospective Studies and Risk Factors and Treatment Outcome and Aged, 80 and over and Chi-Square Distribution and Registries and *Quality of Life and Survivors/*psychology and *Watchful Waiting and *Brachytherapy/adverse effects/psychology and *Prostatectomy/adverse effects/psychology and Androgen Antagonists/adverse effects/*therapeutic use and Antineoplastic Agents, Hormonal/adverse effects/*therapeutic use and HRQOL and Prostatic Neoplasms/pathology/psychology/*therapy",NA,NA,2015/10//undefined,Eur Urol,NA,NA,NA,NA
Gratzke_2015_Eurourol,JOUR,EAU Guidelines on the Assessment of Non-neurogenic Male Lower Urinary Tract Symptoms including Benign Prostatic Obstruction,"Gratzke, Christian and Bachmann, Alexander and Descazeaud, Aurelien and Drake, Marcus J. and Madersbacher, Stephan and Mamoulakis, Charalampos and Oelke, Matthias and Tikkinen, Kari A. O. and Gravas, Stavros",European urology,"CONTEXT: Lower urinary tract symptoms (LUTS) represent one of the most common clinical complaints in adult men and have multifactorial aetiology. OBJECTIVE: To develop European Association of Urology (EAU) guidelines on the assessment of men with non-neurogenic LUTS. EVIDENCE ACQUISITION: A structured literature search on the assessment of non-neurogenic male LUTS was conducted. Articles with the highest available level of evidence were selected. The Delphi technique consensus approach was used to develop the recommendations. EVIDENCE SYNTHESIS: As a routine part of the initial assessment of male LUTS, a medical history must be taken, a validated symptom score questionnaire with quality-of-life question(s) should be completed, a physical examination including digital rectal examination should be performed, urinalysis must be ordered, post-void residual urine (PVR) should be measured, and uroflowmetry may be performed. Micturition frequency-volume charts or bladder diaries should be used to assess male LUTS with a prominent storage component or nocturia. Prostate-specific antigen (PSA) should be measured only if a diagnosis of prostate cancer will change the management or if PSA can assist in decision-making for patients at risk of symptom progression and complications. Renal function must be assessed if renal impairment is suspected from the history and clinical examination, if the patient has hydronephrosis, or when considering surgical treatment for male LUTS. Uroflowmetry should be performed before any treatment. Imaging of the upper urinary tract in men with LUTS should be performed in patients with large PVR, haematuria, or a history of urolithiasis. Imaging of the prostate should be performed if this assists in choosing the appropriate drug and when considering surgical treatment. Urethrocystoscopy should only be performed in men with LUTS to exclude suspected bladder or urethral pathology and/or before minimally invasive/surgical therapies if the findings may change treatment. Pressure-flow studies should be performed only in individual patients for specific indications before surgery or when evaluation of the pathophysiology underlying LUTS is warranted. CONCLUSIONS: These guidelines provide evidence-based practical guidance for assessment of non-neurogenic male LUTS. An extended version is available online (www.uroweb.org/guidelines). PATIENT SUMMARY: This article presents a short version of European Association of Urology guidelines for non-neurogenic male lower urinary tract symptoms (LUTS). The recommended tests should be able to distinguish between uncomplicated male LUTS and possible differential diagnoses and to evaluate baseline parameters for treatment. The guidelines also define the clinical profile of patients to provide the best evidence-based care. An algorithm was developed to guide physicians in using appropriate diagnostic tests.",2015,10.1016/j.eururo.2014.12.038,67,6,1099-1109,eng,1873-7560 0302-2838,"Diagnosis and Humans and Male and Adult and Middle Aged and Aged and Europe and Aged, 80 and over and Urinalysis and Evidence-Based Practice and Diagnosis, Differential and Prostate-Specific Antigen/*blood and Clinical practice guidelines and Prostate/*pathology and Benign prostatic hyperplasia and Bladder outlet obstruction and Cystoscopy/methods and Detrusor overactivity and Guidelines as Topic/*standards and Lower urinary tract symptoms and Lower Urinary Tract Symptoms/blood/*diagnosis/etiology/urine and Nocturia and Nocturnal polyuria and Overactive bladder and Prostatic Hyperplasia/blood/complications/*diagnosis",NA,NA,2015/06//undefined,Eur Urol,NA,NA,NA,NA
Sanda_2018_ThJoofur_1,JOUR,Clinically Localized Prostate Cancer: AUA/ASTRO/SUO Guideline. Part II: Recommended Approaches and Details of Specific Care Options,"Sanda, Martin G. and Cadeddu, Jeffrey A. and Kirkby, Erin and Chen, Ronald C. and Crispino, Tony and Fontanarosa, Joann and Freedland, Stephen J. and Greene, Kirsten and Klotz, Laurence H. and Makarov, Danil V. and Nelson, Joel B. and Rodrigues, George and Sandler, Howard M. and Taplin, Mary Ellen and Treadwell, Jonathan R.",The Journal of urology,"PURPOSE: This guideline is structured to provide a clinical framework stratified by cancer severity to facilitate care decisions and guide the specifics of implementing the selected management options. The summary presented herein represents Part II of the two-part series dedicated to Clinically Localized Prostate Cancer: AUA/ASTRO/SUO Guideline discussing risk stratification and care options by cancer severity. Please refer to Part I for discussion of specific care options and outcome expectations and management. MATERIALS AND METHODS: The systematic review utilized in the creation of this guideline was completed by the Agency for Healthcare Research and Quality and through additional supplementation by ECRI Institute. This review included articles published between January 2007 and March 2014 with an update search conducted through August 2016. When sufficient evidence existed, the body of evidence for a particular treatment was assigned a strength rating of A (high), B (moderate), or C (low) for support of Strong, Moderate, or Conditional Recommendations. Additional information is provided as Clinical Principles and Expert Opinions (table 2 in supplementary unabridged guideline, http://jurology.com/). RESULTS: The AUA (American Urological Association), ASTRO, and SUO (Society of Urologic Oncology) formulated an evidence-based guideline based on a risk stratified clinical framework for the management of localized prostate cancer. CONCLUSIONS: This guideline attempts to improve a clinician's ability to treat patients diagnosed with localized prostate cancer, but higher quality evidence in future trials will be essential to improve the level of care for these patients. In all cases, patient preferences should be considered when choosing a management strategy.",2018,10.1016/j.juro.2018.01.002,199,4,990-997,eng,1527-3792 0022-5347,"United States and Humans and Male and Severity of Illness Index and Patient Selection and Patient Preference and *Clinical Decision-Making and prostate and guideline and Prostate/pathology and prostatic neoplasms and Societies, Medical/*standards and Medical Oncology/*standards and Urology/*standards and Prostatic Neoplasms/diagnosis/pathology/*therapy",NA,NA,2018/04//undefined,J Urol,NA,NA,NA,NA
Berry_2018_ThJoofur,JOUR,Decision Support with the Personal Patient Profile-Prostate: A Multicenter Randomized Trial,"Berry, Donna L. and Hong, Fangxin and Blonquist, Traci M. and Halpenny, Barbara and Filson, Christopher P. and Master, Viraj A. and Sanda, Martin G. and Chang, Peter and Chien, Gary W. and Jones, Randy A. and Krupski, Tracey L. and Wolpin, Seth and Wilson, Leslie and Hayes, Julia H. and Trinh, Quoc-Dien and Sokoloff, Mitchell and Somayaji, Prabhakara",The Journal of urology,"PURPOSE: We evaluated the efficacy of the web based P3P (Personal Patient Profile-Prostate) decision aid vs usual care with regard to decisional conflict in men with localized prostate cancer. MATERIALS AND METHODS: A randomized (1:1), controlled, parallel group, nonblinded trial was performed in 4 regions of the United States. Eligible men had clinically localized prostate cancer and an upcoming consultation, and they spoke and read English or Spanish. Participants answered questionnaires to report decision making stage, personal characteristics, concerns and preferences plus baseline symptoms and decisional conflict. A randomization algorithm allocated participants to receive tailored education and communication coaching, generic teaching sheets and external websites plus a 1-page summary to clinicians (intervention) or the links plus materials provided in clinic (usual care). Conflict outcomes and the number of consultations were measured at 1 month. Univariate and multivariable models were used to analyze outcomes. RESULTS: A total of 392 men were randomized, including 198 to intervention and 194 to usual care, of whom 152 and 153, respectively, returned 1-month outcomes. The mean <c2><b1> SD 1-month decisional conflict scale (score range 0 to 100) was 10.9 <c2><b1> 16.7 for intervention and 9.9 <c2><b1> 18.0 for usual care. The multivariable model revealed significantly reduced conflict in the intervention group (-5.00, 95% CI -9.40--0.59). Other predictors of conflict included income, marital or partner status, decision status, number of consultations, clinical site and D'Amico risk classification. CONCLUSIONS: In this multicenter trial the decision aid significantly reduced decisional conflict. Other variables impacted conflict and modified the effect of the decision aid, notably risk classification, consultations and resources. P3P is an effective adjunct for shared decision making in men with localized prostate cancer.",2018,10.1016/j.juro.2017.07.076,199,1,89-97,eng,1527-3792 0022-5347,medical informatics and United States and Humans and Male and Adult and Middle Aged and Aged and Demography and Surveys and Questionnaires and Algorithms and *Internet and Biopsy and *Decision Support Techniques and decision support techniques and surveys and questionnaires and prostatic neoplasms and planning techniques and Prostatic Neoplasms/pathology/*therapy,NA,NA,2018/01//undefined,J Urol,NA,NA,NA,NA
Punnen_2018_ThJoofur,JOUR,A Multi-Institutional Prospective Trial Confirms Noninvasive Blood Test Maintains Predictive Value in African American Men,"Punnen, Sanoj and Freedland, Stephen J. and Polascik, Thomas J. and Loeb, Stacy and Risk, Michael C. and Savage, Stephen and Mathur, Sharad C. and Uchio, Edward and Dong, Yan and Silberstein, Jonathan L.",The Journal of urology,"PURPOSE: The 4Kscore(R) test accurately detects aggressive prostate cancer and reduces unnecessary biopsies. However, its performance in African American men has been unknown. We assessed test performance in a cohort of men with a large African American representation. MATERIALS AND METHODS: Men referred for prostate biopsy at 8 Veterans Affairs medical centers were prospectively enrolled in the study. All men underwent phlebotomy for 4Kscore test assessment prior to prostate biopsy. The primary outcome was the detection of Grade Group 2 or higher cancer on biopsy. We assessed the discrimination, calibration and clinical usefulness of 4Kscore to predict Grade Group 2 or higher prostate cancer and compared it to a base model consisting of age, digital rectal examination and prostate specific antigen. Additionally, we compared test performance in African American and nonAfrican American men. RESULTS: Of the 366 enrolled men 205 (56%) were African American and 131 (36%) had Grade Group 2 or higher prostate cancer. The 4Kscore test showed better discrimination (AUC 0.81 vs 0.74, p <0.01) and higher clinical usefulness on decision curve analysis than the base model. Test prediction closely approximated the observed risk of Grade Group 2 or higher prostate cancer. There was no difference in test performance in African American and nonAfrican American men (0.80 vs 0.84, p = 0.32), The test outperformed the base model in each group. CONCLUSIONS: The 4Kscore test accurately predicts aggressive prostate cancer for biopsy decision making in African American and nonAfrican American men.",2018,10.1016/j.juro.2017.11.113,199,6,1459-1463,eng,1527-3792 0022-5347,"United States and Humans and United States Department of Veterans Affairs and Male and Middle Aged and Aged and Prospective Studies and Prognosis and African Americans and Predictive Value of Tests and Patient Selection and Biopsy and Clinical Decision-Making and Neoplasm Grading and Risk Assessment/methods and Biomarkers, Tumor/*blood and biomarkers and African Americans/*statistics & numerical data and prostatic neoplasms and Prostate/*pathology and Adenocarcinoma/blood/*diagnosis/pathology and Hospitals, Veterans/statistics & numerical data and kallikreins and neoplasm grading and Prostatic Neoplasms/blood/*diagnosis/pathology and tumor",NA,NA,2018/06//undefined,J Urol,NA,NA,NA,NA
Fesperman_2008_ThJoofur,JOUR,Study characteristics of abstracts presented at the annual meetings of the southeastern section of the American Urological Association (1996-2005),"Fesperman, Susan F. and West, C. Shawn and Bischoff, Carl J. and Algood, Chester B. and Vieweg, Johannes and Dahm, Philipp",The Journal of urology,"PURPOSE: We determined study characteristics, authorship and institutional origin of studies presented in abstract form at the Southeastern Section of the American Urological Association annual meetings and identified predictors of full text publication. MATERIALS AND METHODS: All abstracts of poster and podium presentations from the Southeastern Section of the American Urological Association annual meetings from 1996 to 2005 were reviewed. A standardized evaluation form was developed and tested in 2 subsets of 50 abstracts, and then applied by 2 individual reviewers with specific coding instructions. Predictor variables analyzed included study origin, design, topic, domain, presentation form, number of patients, reporting of statistical analysis and gender. Univariate and multivariate analysis was applied using SPSS version 14.0. RESULTS: A total of 1,195 abstracts were found eligible for review. The mean number of abstracts presented per year was 120 +/- 16 (range 107 to 146). In clinical studies (1,068) approximately three-quarters of the abstracts reported case series (801, 75.0%). Cohort studies accounted for 11.2% of the abstracts and 4.0% were randomized controlled trials or systematic reviews/meta-analyses. Median followup was 64 months (range 17 to 126) and the overall publication rate was 33.5%. First and senior female authorship were identified in 6.2% (74) and 5.4% (64) of abstracts presented, respectively. CONCLUSIONS: A majority of studies presented at the Southeastern Section of the American Urological Association annual meetings continue to represent small case series that may not be well suited to guide clinical decision making. Only a third of studies are subsequently published in the peer reviewed literature. The percentage of abstracts with female authorship remains low suggesting that increased efforts to involve women in urological research are indicated.",2008,10.1016/j.juro.2007.09.070,179,2,667-71; discussion 671-672,eng,1527-3792 0022-5347,"United States and Humans and Societies, Medical and Periodicals as Topic and Congresses as Topic and *Bibliometrics and Abstracting and Indexing and *Peer Review, Research and *Urology and Research Design/statistics & numerical data",NA,NA,2008/02//undefined,J Urol,NA,NA,NA,NA
Otto_2015_ThJoofur,JOUR,Prostate cancer risk estimation tool use by members of the American Urological Association: a survey based study,"Otto, Brandon J. and Osterberg, E. Charles and Salgado, Sanjay and Scherr, Douglas S. and Shariat, Shahrokh F.",The Journal of urology,"PURPOSE: Prostate cancer risk estimation tools have been developed to help guide patients and physicians with clinical decision making across all disease states. We assessed use patterns of these tools using an online survey sent to AUA (American Urological Association) members. MATERIALS AND METHODS: We distributed a 21-question online survey to 5,674 AUA members to query prostate cancer risk estimation tool use. The survey was divided into 4 categories, including 1) demographics, 2) prebiopsy risk assessment, 3) pretreatment risk assessment and 4) risk estimation tool use. RESULTS: A total of 565 members (10%) responded to the online survey, of whom 31% reported using a risk estimation tool in the prebiopsy decision setting. Providers who spent more than 20 minutes counseling patients were more likely to use a risk estimation tool (OR 2.2, p <0.01). After the prostate cancer diagnosis 70% of providers used a risk estimation tools to guide treatment recommendations. The total time spent counseling a patient (greater than 30 minutes) and the number of years in practice (fewer than 10) predicted prostate cancer risk tool use (OR 2.4, p <0.01 and 3.4, p <0.01, respectively). CONCLUSIONS: AUA respondents use risk estimation tools more frequently in the pretreatment setting than in the prebiopsy setting. The time spent counseling patients and the time since graduation from residency predicted the likelihood of using risk estimation tools.",2015,10.1016/j.juro.2014.12.090,193,6,1933-1937,eng,1527-3792 0022-5347,"risk and United States and Humans and Male and Risk Assessment and Urology and Surveys and Questionnaires and Societies, Medical and *Decision Support Techniques and *Practice Patterns, Physicians' and Nomograms and questionnaires and prostatic neoplasms and nomograms and physician's practice patterns and Prostatic Neoplasms/*epidemiology",NA,NA,2015/06//undefined,J Urol,NA,NA,NA,NA
