label,type,title,author,journal,abstract,year,doi,volume,issue,pages,language,issn,keywords,url,institution,DA,j2,DP,l1,l2,ST
Sealfon_2020_Kidninte,JOUR,"Machine learning, the kidney, and genotype-phenotype analysis","Sealfon, Rachel S. G. and Mariani, Laura H. and Kretzler, Matthias and Troyanskaya, Olga G.",Kidney international,"With biomedical research transitioning into data-rich science, machine learning provides a powerful toolkit for extracting knowledge from large-scale biological data sets. The increasing availability of comprehensive kidney omics compendia (transcriptomics, proteomics, metabolomics, and genome sequencing), as well as other data modalities such as electronic health records, digital nephropathology repositories, and radiology renal images, makes machine learning approaches increasingly essential for analyzing human kidney data sets. Here, we discuss how machine learning approaches can be applied to the study of kidney disease, with a particular focus on how they can be used for understanding the relationship between genotype and phenotype.",2020,10.1016/j.kint.2020.02.028,97,6,1141-1149,eng,1523-1755 0085-2538,deep learning and machine learning and Humans and Phenotype and Genotype and Kidney and *Machine Learning and *Computational Biology and genotype,NA,NA,2020/06//undefined,Kidney Int,NA,NA,NA,NA
Rashidi_2020_NatureviNeph,JOUR,Artificial intelligence approaches to improve kidney care,"Rashidi, Parisa and Bihorac, Azra",Nature reviews. Nephrology,"Artificial intelligence is increasingly being used to improve diagnosis and prognostication for acute and chronic kidney diseases. Studies published in 2019 relied on a variety of available data sources towards this objective, including electronic health records, intraoperative physiological signals, kidney ultrasound imaging, and digitized biopsy specimens.",2020,10.1038/s41581-019-0243-3,16,2,71-72,eng,1759-507X 1759-5061,"Humans and Electronic Health Records and Deep Learning and Image Interpretation, Computer-Assisted and Kidney Transplantation and Biopsy and *Artificial Intelligence and Ultrasonography and Postoperative Complications/*epidemiology and Acute Kidney Injury/*epidemiology and Kidney/*diagnostic imaging/*pathology and Nephrectomy and Renal Insufficiency, Chronic/classification/*diagnostic imaging/metabolism and Transplants/pathology",NA,NA,2020/02//undefined,Nat Rev Nephrol,NA,NA,NA,NA
Ghani_2014_Eurourol,JOUR,Harnessing big data for health care and research: are urologists ready?,"Ghani, Khurshid R. and Zheng, Kai and Wei, John T. and Friedman, Charles P.",European urology,"We are at a crossroads in terms of the data we collect and how they are analyzed. In health care, big data analytics may uncover associations, patterns, and trends with the potential to advance patient care and lower costs. To adapt to this approach, urologists will have to ask the right questions.",2014,10.1016/j.eururo.2014.07.032,66,6,975-977,eng,1873-7560 0302-2838,Humans and Urology and Data Mining and Artificial Intelligence and Registries and Social Media and *Electronic Health Records and *Medical Informatics and *Biomedical Research,NA,NA,2014/12//undefined,Eur Urol,NA,NA,NA,NA
Kellum_2019_NatureviNeph,JOUR,Artificial intelligence to predict AKI: is it a breakthrough?,"Kellum, John A. and Bihorac, Azra",Nature reviews. Nephrology,"A new study of deep learning based on electronic health records promises to forecast acute kidney injury up to 48 hours before it can be diagnosed clinically. However, employing data science to predict acute kidney injury might be more challenging than it seems.",2019,10.1038/s41581-019-0203-y,15,11,663-664,eng,1759-507X 1759-5061,Humans and Artificial Intelligence and *Acute Kidney Injury,NA,NA,2019/11//undefined,Nat Rev Nephrol,NA,NA,NA,NA
Garcelon_2020_Kidninte,JOUR,Electronic health records for the diagnosis of rare diseases,"Garcelon, Nicolas and Burgun, Anita and Salomon, Remi and Neuraz, Antoine",Kidney international,"With the emergence of electronic health records, the reuse of clinical data offers new perspectives for the diagnosis and management of patients with rare diseases. However, there are many obstacles to the repurposing of clinical data. The development of decision support systems depends on the ability to recruit patients, extract and integrate the patients' data, mine and stratify these data, and integrate the decision support algorithm into patient care. This last step requires an adaptability of the electronic health records to integrate learning health system tools. In this literature review, we examine the research that provides solutions to unlock these barriers and accelerate translational research: structured electronic health records and free-text search engines to find patients, data warehouses and natural language processing to extract phenotypes, machine learning algorithms to classify patients, and similarity metrics to diagnose patients. Medical informatics is experiencing an impellent request to develop decision support systems, and this requires ethical considerations for clinicians and patients to ensure appropriate use of health data.",2020,10.1016/j.kint.2019.11.037,97,4,676-686,eng,1523-1755 0085-2538,artificial intelligence and education and Humans and Algorithms and Machine Learning and electronic health record and Natural Language Processing and *Electronic Health Records and *Rare Diseases/diagnosis/epidemiology and pediatric nephrology and rare diseases,NA,NA,2020/04//undefined,Kidney Int,NA,NA,NA,NA
Gansevoort_2020_NatureviNeph,JOUR,CKD is a key risk factor for COVID-19 mortality,"Gansevoort, Ron T. and Hilbrands, Luuk B.",Nature reviews. Nephrology,"A new study uses the OpenSAFELY health analytics platform to identify risk factors for COVID-19 mortality. This analysis, which includes data for more than 17 million people in the UK, suggests that patients with chronic kidney disease are at higher risk than those with other known risk factors, including chronic heart and lung disease.",2020,10.1038/s41581-020-00349-4,16,12,705-706,eng,1759-507X 1759-5061,"SARS-CoV-2 and Humans and Risk Factors and Pandemics and *COVID-19 and *Renal Insufficiency, Chronic/epidemiology",NA,NA,2020/12//undefined,Nat Rev Nephrol,NA,NA,NA,NA
Martin_2020_NatureviNeph,JOUR,Ethical challenges in nephrology: a call for action,"Martin, Dominique E. and Harris, David C. H. and Jha, Vivekanand and Segantini, Luca and Demme, Richard A. and Le, Thu H. and McCann, Laura and Sands, Jeff M. and Vong, Gerard and Wolpe, Paul Root and Fontana, Monica and London, Gerard M. and Vanderhaegen, Bert and Vanholder, Raymond",Nature reviews. Nephrology,"The American Society of Nephrology, the European Renal Association-European Dialysis and Transplant Association and the International Society of Nephrology Joint Working Group on Ethical Issues in Nephrology have identified ten broad areas of ethical concern as priority challenges that require collaborative action. Here, we describe these challenges - equity in access to kidney failure care, avoiding futile dialysis, reducing dialysis costs, shared decision-making in kidney failure care, living donor risk evaluation and decision-making, priority setting in kidney disease prevention and care, the ethical implications of genetic kidney diseases, responsible advocacy for kidney health and management of conflicts of interest - with the aim of highlighting the need for ethical analysis of specific issues, as well as for the development of tools and training to support clinicians who treat patients with kidney disease in practising ethically and contributing to ethical policy-making.",2020,10.1038/s41581-020-0295-4,16,10,603-613,eng,1759-507X 1759-5061,"Humans and Conflict of Interest and Decision Making, Shared and Medical Futility/ethics and Patient Advocacy/ethics and Cost Control/ethics and Health Priorities/ethics and Health Services Accessibility/ethics and Healthcare Disparities/ethics and Kidney Diseases/genetics and Kidney Transplantation/ethics and Nephrology/*ethics and Organ Trafficking/ethics and Renal Dialysis/economics/ethics and Renal Insufficiency/therapy and Tissue and Organ Procurement/ethics",NA,NA,2020/10//undefined,Nat Rev Nephrol,NA,NA,NA,NA
Nadkarni_2016_Kidninte,JOUR,Big data in nephrology: promises and pitfalls,"Nadkarni, Girish N. and Coca, Steven G. and Wyatt, Christina M.",Kidney international,"Data from the electronic health records hold great promise for nephrology research. However, due to significant limitations, reporting guidelines have been formulated for analyses conducted using electronic health records data.",2016,10.1016/j.kint.2016.06.003,90,2,240-241,eng,1523-1755 0085-2538,Humans and *Electronic Health Records and *Nephrology,NA,NA,2016/08//undefined,Kidney Int,NA,NA,NA,NA
Goldstein_2015_Kidninte,JOUR,Comparative health services research across populations: the unused opportunities in big data,"Goldstein, Benjamin A. and Winkelmayer, Wolfgang C.",Kidney international,"Large population registries present opportunities to understand the epidemiology of disease, study patters of care, and compare the effectiveness of different care practices. While these 'big data' tempt investigators to examine all available individuals, a targeted approach that restricts the study to an optimal sub-population may yield more relevant insights. We discuss how researchers might adapt their studies existing literature to generate additional insights.",2015,10.1038/ki.2015.91,87,6,1094-1096,eng,1523-1755 0085-2538,"Humans and Female and Male and *Renal Replacement Therapy and Atrial Fibrillation/*epidemiology and Kidney Failure, Chronic/*epidemiology/*therapy",NA,NA,2015/06//undefined,Kidney Int,NA,NA,NA,NA
Chang_2011_NatureviNeph,JOUR,Computerized decision support systems: improving patient safety in nephrology,"Chang, Jamison and Ronco, Claudio and Rosner, Mitchell H.",Nature reviews. Nephrology,"Incorrect prescription and administration of medications account for a substantial proportion of medical errors in the USA, causing adverse drug events (ADEs) that result in considerable patient morbidity and enormous costs to the health-care system. Patients with chronic kidney disease or acute kidney injury often have impaired drug clearance as well as polypharmacy, and are therefore at increased risk of experiencing ADEs. Studies have demonstrated that recognition of these conditions is not uniform among treating physicians, and prescribed drug doses are often incorrect. Early interventions that ensure appropriate drug dosing in this group of patients have shown encouraging results. Both computerized physician order entry and clinical decision support systems have been shown to reduce the rate of ADEs. Nevertheless, these systems have been implemented at surprisingly few institutions. Economic stimulus and health-care reform legislation present a rare opportunity to refine these systems and understand how they could be implemented more widely. Failure to explore this technology could mean that the opportunity to reduce the morbidity associated with ADEs is missed.",2011,10.1038/nrneph.2011.50,7,6,348-355,eng,1759-507X 1759-5061,"Humans and Decision Support Systems, Clinical/*standards and Kidney Diseases/mortality/*therapy and Medication Systems, Hospital/*standards and Nephrology/*standards and Quality Assurance, Health Care/methods and Safety Management/*methods",NA,NA,2011/06//undefined,Nat Rev Nephrol,NA,NA,NA,NA
Saez.Rodriguez_2019_Kidninte,JOUR,Big science and big data in nephrology,"Saez-Rodriguez, Julio and Rinschen, Markus M. and Floege, Jurgen and Kramann, Rafael",Kidney international,"There have been tremendous advances during the last decade in methods for large-scale, high-throughput data generation and in novel computational approaches to analyze these datasets. These advances have had a profound impact on biomedical research and clinical medicine. The field of genomics is rapidly developing toward single-cell analysis, and major advances in proteomics and metabolomics have been made in recent years. The developments on wearables and electronic health records are poised to change clinical trial design. This rise of 'big data' holds the promise to transform not only research progress, but also clinical decision making towards precision medicine. To have a true impact, it requires integrative and multi-disciplinary approaches that blend experimental, clinical and computational expertise across multiple institutions. Cancer research has been at the forefront of the progress in such large-scale initiatives, so-called 'big science,' with an emphasis on precision medicine, and various other areas are quickly catching up. Nephrology is arguably lagging behind, and hence these are exciting times to start (or redirect) a research career to leverage these developments in nephrology. In this review, we summarize advances in big data generation, computational analysis, and big science initiatives, with a special focus on applications to nephrology.",2019,10.1016/j.kint.2018.11.048,95,6,1326-1337,eng,1523-1755 0085-2538,Humans and Gene Expression Profiling and *Big Data and Biomedical Research/methods and Precision Medicine/*methods and Computational Biology/methods and Clinical Decision-Making/methods and Biomarkers/analysis/metabolism and chronic kidney disease and gene expression and Kidney Diseases/diagnosis/genetics/pathology/*therapy and Nephrology/*methods/trends and proteomic analysis,NA,NA,2019/06//undefined,Kidney Int,NA,NA,NA,NA
Hanson_2019_ThJoofur,JOUR,The Relative Importance of Race Compared to Health Care and Social Factors in Predicting Prostate Cancer Mortality: A Random Forest Approach,"Hanson, Heidi A. and Martin, Christopher and O'Neil, Brock and Leiser, Claire L. and Mayer, Erik N. and Smith, Ken R. and Lowrance, William T.",The Journal of urology,"PURPOSE: There is a differential in prostate cancer mortality between black and white men. Advances in precision medicine have shifted the research focus toward underlying genetic differences. However, nonbiological factors may have a large role in these observed disparities. Therefore, we sought to measure the relative importance of race compared to health care and social factors on prostate cancer specific mortality. MATERIALS AND METHODS: Using the SEER (Surveillance, Epidemiology, and End Results) database we identified 514,878 men diagnosed with prostate cancer at age 40 years or greater between 2004 and 2012. We also selected a subset of black and white men matched by age, stage and birth year. We stratified patients by age 40 to 54, 55 to 69 and 70 years or older and disease stage, resulting in 18 groups. By applying random forest methods with variable importance measures we analyzed 15 variables and interactions across 4 categories of factors (tumor characteristics, race, and health care and social factors) and the relative importance for prostate cancer specific mortality. RESULTS: Tumor characteristics at diagnosis were the most important factors for prostate cancer mortality. Across all groups race was less than 5% as important as tumor characteristics and only more important than health care and social factors in 2 of the 18 groups. Although race had a significant impact, health care and social factors known to be associated with racial disparities had greater or similarly important effects across all ages and stages. CONCLUSIONS: Eradicating disparities in prostate cancer survival will require a multipronged approach, including advances in precision medicine. Disparities will persist unless health care access and social equality are achieved among all populations.",2019,10.1097/JU.0000000000000416,202,6,1209-1216,eng,1527-3792 0022-5347,"Humans and Male and Adult and Middle Aged and Aged and Cohort Studies and Socioeconomic Factors and Data Interpretation, Statistical and Supervised Machine Learning and mortality and United States/epidemiology and *Health Status Disparities and Neoplasm Grading and Health Services Accessibility/statistics & numerical data and Prostate-Specific Antigen/blood and Blacks/*statistics & numerical data and health services accessibility and Healthcare Disparities/*statistics & numerical data and Prostate/pathology and prostatic neoplasms and Prostatic Neoplasms/blood/*mortality/pathology and race factors and SEER program and SEER Program/statistics & numerical data and Whites/*statistics & numerical data",NA,NA,2019/12//undefined,J Urol,NA,NA,NA,NA
Sandokji_2020_JotASoN.J,JOUR,"A Time-Updated, Parsimonious Model to Predict AKI in Hospitalized Children","Sandokji, Ibrahim and Yamamoto, Yu and Biswas, Aditya and Arora, Tanima and Ugwuowo, Ugochukwu and Simonov, Michael and Saran, Ishan and Martin, Melissa and Testani, Jeffrey M. and Mansour, Sherry and Moledina, Dennis G. and Greenberg, Jason H. and Wilson, F. Perry",Journal of the American Society of Nephrology : JASN,"BACKGROUND: Timely prediction of AKI in children can allow for targeted interventions, but the wealth of data in the electronic health record poses unique modeling challenges. METHODS: We retrospectively reviewed the electronic medical records of all children younger than 18 years old who had at least two creatinine values measured during a hospital admission from January 2014 through January 2018. We divided the study population into derivation, and internal and external validation cohorts, and used five feature selection techniques to select 10 of 720 potentially predictive variables from the electronic health records. Model performance was assessed by the area under the receiver operating characteristic curve in the validation cohorts. The primary outcome was development of AKI (per the Kidney Disease Improving Global Outcomes creatinine definition) within a moving 48-hour window. Secondary outcomes included severe AKI (stage 2 or 3), inpatient mortality, and length of stay. RESULTS: Among 8473 encounters studied, AKI occurred in 516 (10.2%), 207 (9%), and 27 (2.5%) encounters in the derivation, and internal and external validation cohorts, respectively. The highest-performing model used a machine learning-based genetic algorithm, with an overall receiver operating characteristic curve in the internal validation cohort of 0.76 [95% confidence interval (CI), 0.72 to 0.79] for AKI, 0.79 (95% CI, 0.74 to 0.83) for severe AKI, and 0.81 (95% CI, 0.77 to 0.86) for neonatal AKI. To translate this prediction model into a clinical risk-stratification tool, we identified high- and low-risk threshold points. CONCLUSIONS: Using various machine learning algorithms, we identified and validated a time-updated prediction model of ten readily available electronic health record variables to accurately predict imminent AKI in hospitalized children.",2020,10.1681/ASN.2019070745,31,6,1348-1357,eng,1533-3450 1046-6673,"risk and Humans and Electronic Health Records and Female and Male and Adolescent and Child and Child, Preschool and Infant and Retrospective Studies and electronic health records and Machine Learning and pediatrics and feature selection and Acute Kidney Injury/*etiology and acute kidney injury and Child, Hospitalized",NA,NA,2020/06//undefined,J Am Soc Nephrol,NA,NA,NA,NA
Nambiar_2017_Eurourol,JOUR,The Role of Urodynamics in the Evaluation of Urinary Incontinence: The European Association of Urology Recommendations in 2016,"Nambiar, Arjun K. and Lemack, Gary E. and Chapple, Christopher R. and Burkhard, Fiona C.",European urology,"This article summarises the European Association Urology guidelines position on the role of urodynamic studies in investigating the problem of urinary incontinence. The guidelines recommend that urodynamics should not be necessary to help decide the best treatment for uncomplicated urinary incontinence, but may help if there is any uncertainty over the choice of invasive treatments. The guidelines also stress the importance of conducting urodynamic tests to the highest possible quality standards for the results to be useful in the decision-making process.",2017,10.1016/j.eururo.2016.09.045,71,4,501-503,eng,1873-7560 0302-2838,"Humans and Urology and Europe and Societies, Medical and Clinical Decision-Making and *Urodynamics and Urinary Incontinence/*diagnosis/therapy",NA,NA,2017/04//undefined,Eur Urol,NA,NA,NA,NA
Gomez.Rivas_2020_Eurourol,JOUR,Undergraduate Education for Urology in Europe. Where Do We Stand?,"Gomez Rivas, Juan and Rodriguez Socarras, Moises and Somani, Bhaskar and Uvin, Pieter and Vasquez, Juan L. and Henningsohn, Lars and Pearce, Ian and Zondervan, Patricia and Van Poppel, Hendrik and Palou, Joan",European urology,"Regardless of career intentions, junior doctors will meet patients with urological problems. There are no studies on the status of undergraduate education for urology in Europe. We designed an 18-item online survey using the platform www.surveymonkey.com to assess the current status of undergraduate education in urology. A total of 347 medical students, trainees, and urologists responded to the survey. Medical students' exposure to urology during their undergraduate career was heterogeneous. Although the quality of urology education was valued from moderate to high, urology as a speciality did not influence their future training decision making. Decision making in relation to residency training correlated with the number of hours spent on practical training, duration of urology rotation, and year of medical school in which urological exposure was introduced. The current European exposure to urology at undergraduate level is heterogeneous, with various factors influencing future decisions regarding training and specialisation. A uniform undergraduate curriculum would eliminate such heterogeneous exposure and facilitate a workforce fit for the future urological needs. PATIENT SUMMARY: Junior doctors will meet patients with urological problems in the wards, emergency departments, and primary care. Institutions should work together for a urological curriculum that fits the future clinical requirements.",2020,10.1016/j.eururo.2020.05.037,78,3,381-384,eng,1873-7560 0302-2838,"Teaching and Urology and Europe and Students and Self Report and *Education, Medical, Undergraduate and Undergraduate education and University and Urology/*education",NA,NA,2020/09//undefined,Eur Urol,NA,NA,NA,NA
Yang_2020_Kidninte,JOUR,Executive summary for China Kidney Disease Network (CK-NET) 2016 Annual Data Report,"Yang, Chao and Gao, Bixia and Zhao, Xinju and Su, Zaiming and Sun, Xiaoyu and Wang, Huai-Yu and Zhang, Ping and Wang, Rong and Liu, Jian and Tang, Wen and Zhang, Dongliang and Chu, Hong and Wang, Jinwei and Wang, Fang and Wang, Song and Zuo, Li and Wang, Yue and Yu, Feng and Wang, Haibo and Zhang, Luxia and Zhang, Hong and Yang, Li and Chen, Jianghua and Zhao, Ming-Hui",Kidney international,"Chronic kidney disease (CKD) has been recognized as a public health problem globally. The spectrum of CKD in China has been evolving toward that of developed countries, which will have enormous impacts on the health care system. However, there has been no well-established national surveillance system for kidney diseases. Furthermore, China still faces several challenges of kidney care, including limited capacity and efficiency, suboptimal awareness, and huge heterogeneity in diagnosis and treatment. The China Kidney Disease Network has published 2 reports regarding the burden of CKD and end-stage kidney disease in China and intends to become a comprehensive surveillance system for kidney diseases based on multisource data. With the expansion of research group and data sources, the content of the China Kidney Disease Network 2016 Annual Data Report was further enriched. Section I addresses the epidemiologic characteristics of patients with CKD based on a national inpatient database, Hospital Quality Monitoring System, covering more than 52% of China's tertiary hospitals in China in 2016. Section II focuses on the burden of patients receiving dialysis, mainly based on the nationwide claims database, China Health Insurance Research Association database, which collects data from approximately 2% of the insured population from the municipalities/provincial capital cities and approximately 5% from the prefecture-level cities. An independent chapter regarding dialysis in 3 provincial dialysis quality control centers has been added. The China Kidney Disease Network 2016 Annual Data Report symbolizes a successful team effort in the era of big data, with support from the specialists and partners of the collaborative network, which is of substantial value for understanding the burden of kidney diseases in China and developing prevention and control strategies.",2020,10.1016/j.kint.2020.09.003,98,6,1419-1423,eng,1523-1755 0085-2538,"Humans and Big Data and Renal Dialysis and China/epidemiology and hemodialysis and chronic kidney disease and *Kidney Failure, Chronic and *Renal Insufficiency, Chronic/diagnosis/epidemiology/therapy and peritoneal dialysis",NA,NA,2020/12//undefined,Kidney Int,NA,NA,NA,NA
