label,type,title,author,journal,abstract,year,doi,volume,issue,pages,language,issn,keywords,url,institution,DA,j2,DP,l1,l2,ST
Anchala_2015_JoofthAmHeAs,JOUR,Evaluation of effectiveness and cost-effectiveness of a clinical decision support system in managing hypertension in resource constrained primary health care settings: results from a cluster randomized trial,"Anchala, Raghupathy and Kaptoge, Stephen and Pant, Hira and Di Angelantonio, Emanuele and Franco, Oscar H. and Prabhakaran, D.",Journal of the American Heart Association,"BACKGROUND: Randomized control trials from the developed world report that clinical decision support systems (DSS) could provide an effective means to improve the management of hypertension (HTN). However, evidence from developing countries in this regard is rather limited, and there is a need to assess the impact of a clinical DSS on managing HTN in primary health care center (PHC) settings. METHODS AND RESULTS: We performed a cluster randomized trial to test the effectiveness and cost-effectiveness of a clinical DSS among Indian adult hypertensive patients (between 35 and 64 years of age), wherein 16 PHC clusters from a district of Telangana state, India, were randomized to receive either a DSS or a chart-based support (CBS) system. Each intervention arm had 8 PHC clusters, with a mean of 102 hypertensive patients per cluster (n=845 in DSS and 783 in CBS groups). Mean change in systolic blood pressure (SBP) from baseline to 12 months was the primary endpoint. The mean difference in SBP change from baseline between the DSS and CBS at the 12th month of follow-up, adjusted for age, sex, height, waist, body mass index, alcohol consumption, vegetable intake, pickle intake, and baseline differences in blood pressure, was -6.59 mm Hg (95% confidence interval: -12.18 to -1.42; P=0.021). The cost-effective ratio for CBS and DSS groups was $96.01 and $36.57 per mm of SBP reduction, respectively. CONCLUSION: Clinical DSS are effective and cost-effective in the management of HTN in resource-constrained PHC settings. CLINICAL TRIAL REGISTRATION URL: http://www.ctri.nic.in. Unique identifier: CTRI/2012/03/002476.",2015,10.1161/JAHA.114.001213,4,1,e001213,eng,2047-9980,"Humans and Female and Male and Adult and Middle Aged and Cost-Benefit Analysis and India and effectiveness and computers and Cluster Analysis and Clinical Decision-Making/methods and Decision Support Systems, Clinical/*economics and hypertension and cluster randomized trials and cost-effectiveness and Health Resources/*economics and Hypertension/diagnosis/*economics/*therapy and Primary Health Care/economics/*methods",NA,NA,2015/01/05/,J Am Heart Assoc,NA,NA,NA,NA
Young_2020_JoofthAmHeAs,JOUR,Multidisciplinary Heart Team Approach for Complex Coronary Artery Disease: Single Center Clinical Presentation,"Young, Michael N. and Kolte, Dhaval and Cadigan, Mary E. and Laikhter, Elizabeth and Sinclair, Kevin and Pomerantsev, Eugene and Fifer, Michael A. and Sundt, Thoralf M. and Yeh, Robert W. and Jaffer, Farouc A.",Journal of the American Heart Association,"Background The Heart Team approach is ascribed a Class I recommendation in contemporary guidelines for revascularization of complex coronary artery disease. However, limited data are available regarding the decision-making and outcomes of patients based on this strategy. Methods and Results One hundred sixty-six high-risk coronary artery disease patients underwent Heart Team evaluation at a single institution between January 2015 and November 2018. We prospectively collected data on demographics, symptoms, Society of Thoracic Surgeons Predicted Risk of Mortality/Synergy Between PCI with Taxus and Cardiac Surgery (STS-PROM/SYNTAX) scores, mode of revascularization, and outcomes. Mean age was 70.0 years; 122 (73.5%) patients were male. Prevalent comorbidities included diabetes mellitus (51.8%), peripheral artery disease (38.6%), atrial fibrillation (27.1%), end-stage renal disease on dialysis (13.3%), and chronic obstructive pulmonary disease (21.7%). Eighty-seven (52.4%) patients had New York Heart Association III-IV and 112 (67.5%) had Canadian Cardiovascular Society III-IV symptomatology. Sixty-seven (40.4%) patients had left main and 118 (71.1%) had 3-vessel coronary artery disease. The median STS-PROM was 3.6% (interquartile range 1.9, 8.0) and SYNTAX score was 26 (interquartile range 20, 34). The median number of physicians per Heart Team meeting was 6 (interquartile range 5, 8). Seventy-nine (47.6%) and 49 (29.5%) patients underwent percutaneous coronary intervention and coronary artery bypass grafting, respectively. With increasing STS-PROM (low, intermediate, high operative risk), coronary artery bypass graft was performed less often (47.9%, 18.5%, 15.2%) and optimal medical therapy was recommended more often (11.3%, 18.5%, 30.3%). There were no trends in recommendation for coronary artery bypass graft, percutaneous coronary intervention, or optimal medical therapy by SYNTAX score tertiles. In-hospital and 30-day mortality was 3.9% and 4.8%, respectively. Conclusions Integrating a multidisciplinary Heart Team into institutional practice is feasible and provides a formalized approach to evaluating complex coronary artery disease patients. The comprehensive assessment of surgical, anatomical, and other risk scores using a decision aid may guide appropriate, evidence-based management within this team-based construct.",2020,10.1161/JAHA.119.014738,9,8,e014738,eng,2047-9980,"Humans and Female and Male and Middle Aged and Cooperative Behavior and Health Status and Risk Assessment and Aged and Time Factors and Boston and Prospective Studies and Risk Factors and Treatment Outcome and Aged, 80 and over and Predictive Value of Tests and quality improvement and Workflow and Interdisciplinary Communication and *Decision Support Techniques and Clinical Decision-Making and *Patient Care Team and percutaneous coronary intervention and *Coronary Artery Bypass/adverse effects/mortality and *Percutaneous Coronary Intervention/adverse effects/mortality and Cardiovascular Agents/adverse effects/*therapeutic use and revascularization and cardiac surgery and Coronary Angiography and Coronary Artery Disease/diagnostic imaging/mortality/*therapy and team-based care",NA,NA,2020/04/21/,J Am Heart Assoc,NA,NA,NA,NA
Nogueira_2017_Stro,JOUR,The FAST-ED App: A Smartphone Platform for the Field Triage of Patients With Stroke,"Nogueira, Raul G. and Silva, Gisele S. and Lima, Fabricio O. and Yeh, Yu-Chih and Fleming, Carol and Branco, Daniel and Yancey, Arthur H. and Ratcliff, Jonathan J. and Wages, Robert Keith and Doss, Earnest and Bouslama, Mehdi and Grossberg, Jonathan A. and Haussen, Diogo C. and Sakano, Teppei and Frankel, Michael R.",Stroke,"BACKGROUND AND PURPOSE: The Emergency Medical Services field triage to stroke centers has gained considerable complexity with the recent demonstration of clinical benefit of endovascular treatment for acute ischemic stroke. We sought to describe a new smartphone freeware application designed to assist Emergency Medical Services professionals with the field assessment and destination triage of patients with acute ischemic stroke. METHODS: Review of the application's platform and its development as well as the different variables, assessments, algorithms, and assumptions involved. RESULTS: The FAST-ED (Field Assessment Stroke Triage for Emergency Destination) application is based on a built-in automated decision-making algorithm that relies on (1) a brief series of questions assessing patient's age, anticoagulant usage, time last known normal, motor weakness, gaze deviation, aphasia, and hemineglect; (2) a database of all regional stroke centers according to their capability to provide endovascular treatment; and (3) Global Positioning System technology with real-time traffic information to compute the patient's eligibility for intravenous tissue-type plasminogen activator or endovascular treatment as well as the distances/transportation times to the different neighboring stroke centers in order to assist Emergency Medical Services professionals with the decision about the most suitable destination for any given patient with acute ischemic stroke. CONCLUSIONS: The FAST-ED smartphone application has great potential to improve the triage of patients with acute ischemic stroke, as it seems capable to optimize resources, reduce hospital arrivals times, and maximize the use of both intravenous tissue-type plasminogen activator and endovascular treatment ultimately leading to better clinical outcomes. Future field studies are needed to properly evaluate the impact of this tool in stroke outcomes and resource utilization.",2017,10.1161/STROKEAHA.116.016026,48,5,1278-1284,eng,1524-4628 0039-2499,"stroke and Humans and Algorithms and algorithms and Smartphone and Triage/*methods and Clinical Decision-Making/*methods and Stroke/*diagnosis and emergency medicine and Geographic Information Systems/instrumentation and Decision Support Systems, Clinical/*instrumentation and triage and aphasia and Brain Ischemia/*diagnosis and Transportation of Patients/methods",NA,NA,2017/05//undefined,Stroke,NA,NA,NA,NA
Brugnara_2020_Stro,JOUR,Multimodal Predictive Modeling of Endovascular Treatment Outcome for Acute Ischemic Stroke Using Machine-Learning,"Brugnara, Gianluca and Neuberger, Ulf and Mahmutoglu, Mustafa A. and Foltyn, Martha and Herweh, Christian and Nagel, Simon and Schonenberger, Silvia and Heiland, Sabine and Ulfert, Christian and Ringleb, Peter Arthur and Bendszus, Martin and Mohlenbruch, Markus A. and Pfaff, Johannes A. R. and Vollmuth, Philipp",Stroke,"BACKGROUND AND PURPOSE: This study assessed the predictive performance and relative importance of clinical, multimodal imaging, and angiographic characteristics for predicting the clinical outcome of endovascular treatment for acute ischemic stroke. METHODS: A consecutive series of 246 patients with acute ischemic stroke and large vessel occlusion in the anterior circulation who underwent endovascular treatment between April 2014 and January 2018 was analyzed. Clinical, conventional imaging (electronic Alberta Stroke Program Early CT Score, acute ischemic volume, site of vessel occlusion, and collateral score), and advanced imaging characteristics (CT-perfusion with quantification of ischemic penumbra and infarct core volumes) before treatment as well as angiographic (interval groin puncture-recanalization, modified Thrombolysis in Cerebral Infarction score) and postinterventional clinical (National Institutes of Health Stroke Scale score after 24 hours) and imaging characteristics (electronic Alberta Stroke Program Early CT Score, final infarction volume after 18-36 hours) were assessed. The modified Rankin Scale (mRS) score at 90 days (mRS-90) was used to measure patient outcome (favorable outcome: mRS-90 <e2><89><a4>2 versus unfavorable outcome: mRS-90 >2). Machine-learning with gradient boosting classifiers was used to assess the performance and relative importance of the extracted characteristics for predicting mRS-90. RESULTS: Baseline clinical and conventional imaging characteristics predicted mRS-90 with an area under the receiver operating characteristics curve of 0.740 (95% CI, 0.733-0.747) and an accuracy of 0.711 (95% CI, 0.705-0.717). Advanced imaging with CT-perfusion did not improved the predictive performance (area under the receiver operating characteristics curve, 0.747 [95% CI, 0.740-0.755]; accuracy, 0.720 [95% CI, 0.714-0.727]; P=0.150). Further inclusion of angiographic and postinterventional characteristics significantly improved the predictive performance (area under the receiver operating characteristics curve, 0.856 [95% CI, 0.850-0.861]; accuracy, 0.804 [95% CI, 0.799-0.810]; P<0.001). The most important parameters for predicting mRS 90 were National Institutes of Health Stroke Scale score after 24 hours (importance =100%), premorbid mRS score (importance =44%) and final infarction volume on postinterventional CT after 18 to 36 hours (importance =32%). CONCLUSIONS: Integrative assessment of clinical, multimodal imaging, and angiographic characteristics with machine-learning allowed to accurately predict the clinical outcome following endovascular treatment for acute ischemic stroke. Thereby, premorbid mRS was the most important clinical predictor for mRS-90, and the final infarction volume was the most important imaging predictor, while the extent of hemodynamic impairment on CT-perfusion before treatment had limited importance.",2020,10.1161/STROKEAHA.120.030287,51,12,3541-3551,eng,1524-4628 0039-2499,"machine learning and stroke and Humans and Female and Male and Retrospective Studies and Aged and Machine Learning and Aged, 80 and over and Tomography, X-Ray Computed and Image Processing, Computer-Assisted and Computed Tomography Angiography and *Clinical Decision Rules and thrombectomy and *Thrombectomy and *Endovascular Procedures and angiography and Carotid Artery Thrombosis/diagnostic imaging/surgery and cerebral infarction and Infarction, Anterior Cerebral Artery/diagnostic imaging/surgery and Infarction, Middle Cerebral Artery/diagnostic imaging/surgery and Ischemic Stroke/diagnostic imaging/physiopathology/*surgery and perfusion imaging and Perfusion Imaging and tomography, spiral computed",NA,NA,2020/12//undefined,Stroke,NA,NA,NA,NA
Wessler_2017_JoofthAmHeAs,JOUR,Regional Validation and Recalibration of Clinical Predictive Models for Patients With Acute Heart Failure,"Wessler, Benjamin S. and Ruthazer, Robin and Udelson, James E. and Gheorghiade, Mihai and Zannad, Faiez and Maggioni, Aldo and Konstam, Marvin A. and Kent, David M.",Journal of the American Heart Association,"BACKGROUND: Heart failure clinical practice guidelines recommend applying validated clinical predictive models (CPMs) to support decision making. While CPMs are now widely available, the generalizability of heart failure CPMs is largely unknown. METHODS AND RESULTS: We identified CPMs derived in North America that predict mortality for patients with acute heart failure and validated these models in different world regions to assess performance in a contemporary international clinical trial (N=4133) of patients with acute heart failure treated with guideline-directed medical therapy. We performed independent external validations of 3 CPMs predicting in-hospital mortality, 60-day mortality, and 1-year mortality, respectively. CPM discrimination decreased in all regional validation cohorts. The median change in area under the receiver operating curve was -0.09 (range -0.05 to -0.23). Regional calibration was highly variable (90th percentile of absolute difference between smoothed observed and predicted values range <1% to >50%). Calibration remained poor after global recalibrations; however, region-specific recalibration procedures significantly improved regional performance (recalibrated 90th percentile of absolute difference range <1% to 5% across all regions and all models). CONCLUSIONS: Acute heart failure CPM discrimination and calibration vary substantially across different world regions; region-specific (as opposed to global) recalibration techniques are needed to improve CPM calibration.",2017,10.1161/JAHA.117.006121,6,11,NA,eng,2047-9980,prediction and Humans and Female and Male and Middle Aged and Aged and Risk Factors and modeling and ROC Curve and Acute Disease and *Decision Support Techniques and Risk Assessment/*methods and North America/epidemiology and Hospital Mortality/trends and external validation and cardiovascular disease risk factors and Morbidity/trends and acute heart failure and clinical predictive model and Heart Failure/epidemiology/*therapy and prognostic factor,NA,NA,2017/11/18/,J Am Heart Assoc,NA,NA,NA,NA
Bray_2015_JoofthAmHeAs,JOUR,Mass Media Campaigns' Influence on Prehospital Behavior for Acute Coronary Syndromes: An Evaluation of the Australian Heart Foundation's Warning Signs Campaign,"Bray, Janet E. and Stub, Dion and Ngu, Philip and Cartledge, Susie and Straney, Lahn and Stewart, Michelle and Keech, Wendy and Patsamanis, Harry and Shaw, James and Finn, Judith",Journal of the American Heart Association,"BACKGROUND: The aim of this study was to examine the awareness of a recent mass media campaign, and its influence on knowledge and prehospital times, in a cohort of acute coronary syndrome (ACS) patients admitted to an Australian hospital. METHODS AND RESULTS: We conducted 199 semistructured interviews with consecutive ACS patients who were aged 35 to 75 years, competent to provide consent, and English speaking. Questions addressed the factors known to predict prehospital delay, awareness of the campaign, and whether it increased knowledge and influenced actions. Multivariable logistic regression was used to examine the association between campaign awareness and a 1-hour delay in deciding to seek medical attention (patient delay) and a 2-hour delay in presenting to hospital (prehospital delay). The median age was 62 years (IQR=53 to 68 years), and 68% (n=136) were male. Awareness of the campaign was reported by 127 (64%) patients, with most of these patients stating the campaign (1) increased their understanding of what is a heart attack (63%), (2) increased their awareness of the signs and symptoms of heart attack (68%), and (3) influenced their actions in response to symptoms (43%). After adjustment for other predictors, awareness of the campaign was significantly associated with patient delay time of <e2><89><a4>1 hour (adjusted odds ratio [AOR]=2.25, 95% CI: 1.03 to 4.91, P=0.04) and prehospital delay time <e2><89><a4>2 hours (AOR=3.11, 95% CI: 1.36 to 7.08, P=0.007). CONCLUSIONS: Our study showed reasonably high awareness of the warning signs campaign, which was significantly associated with shorter prehospital decision-making and faster presentation to hospital.",2015,10.1161/JAHA.115.001927,4,7,NA,eng,2047-9980,"Humans and Female and Male and Adult and Middle Aged and Risk Assessment and Aged and Time Factors and Logistic Models and Multivariate Analysis and Prospective Studies and Risk Factors and Program Evaluation and Interviews as Topic and Patient Education as Topic and Odds Ratio and emergency medical services and Chi-Square Distribution and Propensity Score and Victoria and prehospital delay and *Patient Acceptance of Health Care and *Consumer Health Information and *Health Knowledge, Attitudes, Practice and mass media and Awareness and *Health Promotion and health education and acute coronary syndrome and Recognition, Psychology and *Mass Media and *Time-to-Treatment and *Voluntary Health Agencies and Acute Coronary Syndrome/complications/diagnosis/psychology/*therapy",NA,NA,2015/07/06/,J Am Heart Assoc,NA,NA,NA,NA
Small_2017_Artthrandvasbio,JOUR,Biomarkers of Calcific Aortic Valve Disease,"Small, Aeron and Kiss, Daniel and Giri, Jay and Anwaruddin, Saif and Siddiqi, Hasan and Guerraty, Marie and Chirinos, Julio A. and Ferrari, Giovanni and Rader, Daniel J.","Arteriosclerosis, thrombosis, and vascular biology","Calcific aortic valve disease (CAVD) is a highly prevalent cardiovascular disorder accounting for a rising economic and social burden on aging populations. In spite of continuing study on the pathophysiology of disease, there remain no medical therapies to prevent the progression of CAVD. The discovery of biomarkers represents a potentially complementary approach in stratifying risk and timing of intervention in CAVD and has the advantage of providing insight into causal factors for the disease. Biomarkers have been studied extensively in atherosclerotic cardiovascular disease, with success as additive for clinical and scientific purposes. Similar research in CAVD is less robust; however, the available studies of biomarkers in CAVD show promise for enhanced clinical decision making and identification of causal factors for the disease. This comprehensive review summarizes available established and novel biomarkers in CAVD, their contributions toward an understanding of pathophysiology, their potential clinical utility, and provides an outline to direct future research in the field.",2017,10.1161/ATVBAHA.116.308615,37,4,623-632,eng,1524-4636 1079-5642,"Humans and Risk Factors and Prognosis and Animals and Predictive Value of Tests and Biomarkers/blood and biomarkers and Inflammation Mediators/*blood and *Bone Remodeling and *Lipid Metabolism and *Ventricular Remodeling and aortic valve and aortic valve stenosis and Aortic Valve Stenosis/*blood/epidemiology/therapy and Aortic Valve/*metabolism/*pathology/physiopathology and Calcinosis/*blood/epidemiology/therapy and heart defects, congenital and heart valve diseases",NA,NA,2017/04//undefined,Arterioscler Thromb Vasc Biol,NA,NA,NA,NA
Chadha_2019_JoofthAmHeAs,JOUR,Outcome of Normal-Flow Low-Gradient Severe Aortic Stenosis With Preserved Left Ventricular Ejection Fraction: A Propensity-Matched Study,"Chadha, Gagandeep and Bohbot, Yohann and Rusinaru, Dan and Marechaux, Sylvestre and Tribouilloy, Christophe",Journal of the American Heart Association,"Background Normal-flow, low-gradient severe aortic stenosis (NF-LG-SAS), defined by aortic valve area <1 cm(2), mean gradient <40 mm Hg, and indexed stroke volume >35 mL/m(2), is the most prevalent form of low-gradient aortic stenosis (AS). However, the true severity of AS and the management of NF-LG-SAS are controversial. The aim of this study was to evaluate the outcome of patients with NF-LG-SAS compared with moderate AS (MAS) and with high-gradient severe-AS (HG-SAS). Methods and Results A total of 154 patients with NF-LG-SAS, 366 with MAS (aortic valve area between 1.0 and 1.3 cm(2)), and 1055 with HG-SAS were included. On multivariate analysis, after adjustment for covariates of prognostic importance, NF-LG-SAS patients did not exhibit an excess risk of mortality compared with MAS patients under medical management (hazard ratio=1.13 [95% CI, 0.82-1.56]; P=0.45) and under medical and surgical management (hazard ratio 1.06 [95% CI, 0.79-1.43]; P=0.70), even after further adjustment for aortic valve replacement (hazard ratio=1.09 [95% CI, 0.81-1.48]; P=0.56). The 6-year cumulative incidence of aortic valve replacement (performed in accordance with guidelines) was comparable between the 2 groups (39<c2><b1>4% for NF-LG-SAS and 35<c2><b1>3% for MAS, P=0.10). After propensity score matching (n=226), NF-LG-SAS and MAS patients also had comparable outcomes under medical (P=0.41) and under medical and surgical management (P=0.52). NF-LG-SAS had better outcomes than HG-SAS patients (adjusted hazard ratio 1.84 [95% CI, 1.18-2.88]; P<0.001). Conclusions This study shows that patients with NF-LG-SAS have a comparable outcome to those with MAS when aortic valve replacement is performed during follow-up according to guidelines, mostly at the stage of HG-SAS. Rigorous echocardiographic assessment to rule out measurement errors and close follow-up are essential to detect progression to true severe AS in NF-LG-SAS.",2019,10.1161/JAHA.119.012301,8,19,e012301,eng,2047-9980,"Humans and Female and Male and Retrospective Studies and Risk Assessment and Aged and Time Factors and Databases, Factual and Risk Factors and Treatment Outcome and surgery and Aged, 80 and over and Severity of Illness Index and Patient Selection and France and Recovery of Function and mortality and Clinical Decision-Making and outcome and *Hemodynamics and *Ventricular Function, Left and Aortic Valve Stenosis/diagnostic imaging/physiopathology/*surgery and Aortic Valve/diagnostic imaging/physiopathology/*surgery and *Heart Valve Prosthesis Implantation/adverse effects and moderate aortic stenosis and normal-flow, low-gradient aortic stenosis",NA,NA,2019/10//undefined,J Am Heart Assoc,NA,NA,NA,NA
