label,type,title,author,journal,abstract,year,doi,volume,issue,pages,language,issn,keywords,url,institution,DA,j2,DP,l1,l2,ST
Kozak_2019_JoofthAmHeAs,JOUR,Discretionary Thrombophilia Test Acquisition and Outcomes in Patients With Venous Thromboembolism in a Real-World Clinical Setting,"Kozak, Patrick M. and Xu, Meng and Farber-Eger, Eric and Gailani, David and Wells, Quinn S. and Beckman, Joshua A.",Journal of the American Heart Association,"Background The value of thrombophilia test acquisition in improving risk prediction beyond clinical presentation remains unknown. We investigated the effect of thrombophilia test acquisition on venous thromboembolism (VTE) outcomes. Methods and Results We performed a retrospective cohort study of adult patients over a 15-year period (September 2001 and May 2016) with first diagnosis of VTE in a single academic medical center. Participants were identified by International Classification of Diseases, Ninth Revision (ICD-9), Current Procedural Terminology (CPT) codes and medication history. Participants with thrombophilia testing were matched to control participants without thrombophilia testing using a propensity model. Primary outcomes included recurrent VTE, anticoagulant use 12 months after the index VTE event, bleeding-related hospitalization, and death. From 3590 unique patients who met the inclusion criteria, 747 participants with VTE who underwent thrombophilia testing were matched to a control participant without testing. Tested participants were more likely to have a recurrent event (46.1% versus 28.5%; P<0.001) and an anticoagulant prescription 12 months from the index event (53.9% versus 37.1%; P<0.001) but had no significant difference in bleeding-related hospitalization (11.4% versus 11.8%; P=0.81) compared with untested participants. An abnormal thrombophilia test result, per se, did not predict recurrent VTE (47.8% versus 44.1%; P=0.13), longer duration anticoagulation (53.2% versus 54.8%; P=0.51), bleeding (11.5% versus 11.3%; P=0.70), or mortality (12.2% versus 16.1%; P=0.18) compared with participants who had normal test results. Conclusions The decision to perform thrombophilia testing, but not the test result, is associated with a high risk of recurrent VTE despite a greater likelihood of long-duration anticoagulation.",2019,10.1161/JAHA.119.013395,8,22,e013395,eng,2047-9980,Humans and Female and Male and Adult and Middle Aged and Retrospective Studies and Cohort Studies and Recurrence and *Clinical Decision-Making and Hemorrhage/chemically induced and Anticoagulants/*therapeutic use and *Duration of Therapy and deep vein thrombosis and Hematologic Tests/*statistics & numerical data and Pulmonary Embolism/*drug therapy/epidemiology and recurrent event and thrombophilia testing and Thrombophilia/*diagnosis/epidemiology and Venous Thromboembolism/*drug therapy/epidemiology and Venous Thrombosis/*drug therapy/epidemiology,NA,NA,2019/11/19/,J Am Heart Assoc,NA,NA,NA,NA
Baradaran_2019_JoofthAmHeAs,JOUR,Cost Effectiveness of Assessing Ultrasound Plaque Characteristics to Risk Stratify Asymptomatic Patients With Carotid Stenosis,"Baradaran, Hediyeh and Gupta, Ajay and Anzai, Yoshimi and Mushlin, Alvin I. and Kamel, Hooman and Pandya, Ankur",Journal of the American Heart Association,"Background Imaging may play an important role in identifying high-risk plaques in patients who have carotid disease and who could benefit from surgical revascularization. We sought to evaluate the cost effectiveness of a decision-making rule based on the ultrasound imaging assessment of plaque echolucency in patients with asymptomatic carotid stenosis. Methods and Results We used a decision-analytic model to project lifetime quality-adjusted life years and costs for 5 stroke prevention strategies: (1) medical therapy only; (2) revascularization if both plaque echolucency and stenosis progression to >90% are present; (3) revascularization only if plaque echolucency is present; (4) revascularization only if stenosis progression >90% is present; or (5) either plaque echolucency or stenosis progression is present. Risks of clinical events, costs, and quality-of-life values were estimated based on published sources and the analysis was conducted from a healthcare system perspective for asymptomatic patients with 70% to 89% carotid stenosis at presentation. Patients who did not undergo revascularization had the highest stroke events (17.6%) and lowest life-years (8.45), while those who underwent revascularization on the basis of either presence of plaque echolucency on ultrasound or progression of carotid stenosis had the lowest stroke events (12.0%) and longest life-years (14.41). The either plaque echolucency or progression-based revascularization group had an incremental cost-effectiveness ratio of $110 000/quality-adjusted life years compared with the plaque echolucency-based strategy, which had an incremental cost-effectiveness ratio of $29 000/quality-adjusted life years compared with the joint echolucency and progression-based strategy. Conclusions Plaque echolucency on ultrasound can be a cost-effective tool to identify patients with asymptomatic carotid artery stenosis most likely to benefit from carotid endarterectomy.",2019,10.1161/JAHA.119.012739,8,21,e012739,eng,2047-9980,"Humans and Female and Male and Middle Aged and Risk Assessment and Aged and Aged, 80 and over and Asymptomatic Diseases and *Cost-Benefit Analysis and ultrasound and cost effectiveness and carotid stenosis and Carotid Stenosis/*diagnostic imaging/*epidemiology and Plaque, Atherosclerotic/*diagnostic imaging/*epidemiology and Ultrasonography, Doppler/*economics",NA,NA,2019/11/05/,J Am Heart Assoc,NA,NA,NA,NA
Kramer_2017_JoofthAmHeAs,JOUR,"The Decisions, Interventions, and Goals in ImplaNtable Cardioverter-DefIbrillator TherapY (DIGNITY) Pilot Study","Kramer, Daniel B. and Habtemariam, Daniel and Adjei-Poku, Yaw and Samuel, Michelle and Engorn, Diane and Reynolds, Matthew R. and Mitchell, Susan L.",Journal of the American Heart Association,"BACKGROUND: Implantable cardioverter-defibrillators (ICDs) are commonly implanted in older patients, including those with multiple comorbidities. There are few prospective studies assessing the clinical course and end-of-life circumstances for these patients. METHODS AND RESULTS: We prospectively followed 51 patients with ICDs for up to 18 months to longitudinally assess in terms of (1) advance care planning, (2) health status, (3) healthcare utilization, and (4) end-of-life circumstances through quarterly phone interviews and electronic medical record review. The mean age was 71.1<c2><b1>8.3, 74.5% were men, and 19.6% were non-white. Congestive heart failure was predominant (82.4%), as was chronic kidney disease (92%). At baseline, a total of 12% of subjects met criteria for major depression, and 78.4% met criteria for mild cognitive impairment. From this initial study cohort, 76% survived to 18 months and completed all follow-up interviews, 18% died, and 19% withdrew or were lost to follow-up. Though living will completion and healthcare proxy assignment were common (cumulative outcome at 18 months 88% and 98%, respectively), discussions of prognosis were uncommon (baseline, 9.8%; by 18 months, 22.7%), as were conversations regarding ICD deactivation (baseline, 15.7%; by 18 months, 25.5%). Five decedents with available data received shocks in the days immediately prior to death, including 3 of whom ultimately had their ICDs deactivated prior to death. CONCLUSIONS: We demonstrated the feasibility of prospective enrollment and follow-up of older, vulnerable ICD patients. Early findings suggest a high burden of cognitive and psychological impairment, poor communication with providers, and frequent shocks at the end of life. These findings will inform the design of a larger cohort study designed to further explore the experiences of living and dying with an ICD in this important patient population.",2017,10.1161/JAHA.117.006881,6,9,NA,eng,2047-9980,"Humans and Electronic Health Records and Female and Male and Middle Aged and Health Status and Aged and Time Factors and Health Services Research and Pilot Projects and Cognition and Longitudinal Studies and Feasibility Studies and Prospective Studies and Risk Factors and Treatment Outcome and Comorbidity and health services research and Interviews as Topic and Mental Health and Quality of Life and Boston/epidemiology and Geriatric Assessment and Telephone and *Clinical Decision-Making and *Terminal Care and *Patient Care Planning and outcomes research and *Personhood and Right to Die and implantable cardioverter-defibrillator and *Defibrillators, Implantable and Electric Countershock/adverse effects/*instrumentation/mortality and end-of-life care and Heart Failure/mortality/physiopathology/psychology/*therapy",NA,NA,2017/09/22/,J Am Heart Assoc,NA,NA,NA,NA
Chang_2020_JoofthAmHeAs,JOUR,Total Sitting Time and Sitting Pattern in Postmenopausal Women Differ by Hispanic Ethnicity and are Associated With Cardiometabolic Risk Biomarkers,"Chang, Ya-Ju and Bellettiere, John and Godbole, Suneeta and Keshavarz, Samaneh and Maestas, Joseph P. and Unkart, Jonathan T. and Ervin, Daniel and Allison, Matthew A. and Rock, Cheryl L. and Patterson, Ruth E. and Jankowska, Marta M. and Kerr, Jacqueline and Natarajan, Loki and Sears, Dorothy D.",Journal of the American Heart Association,"Background Sedentary behavior is pervasive, especially in older adults, and is associated with cardiometabolic disease and mortality. Relationships between cardiometabolic biomarkers and sitting time are unexplored in older women, as are possible ethnic differences. Methods and Results Ethnic differences in sitting behavior and associations with cardiometabolic risk were explored in overweight/obese postmenopausal women (n=518; mean<c2><b1>SD age 63<c2><b1>6 years; mean body mass index 31.4<c2><b1>4.8 kg/m(2)). Accelerometer data were processed using validated machine-learned algorithms to measure total daily sitting time and mean sitting bout duration (an indicator of sitting behavior pattern). Multivariable linear regression was used to compare sitting among Hispanic women (n=102) and non-Hispanic women (n=416) and tested associations with cardiometabolic risk biomarkers. Hispanic women sat, on average, 50.3 minutes less/day than non-Hispanic women (P<0.001) and had shorter (3.6 minutes less, P=0.02) mean sitting bout duration. Among all women, longer total sitting time was deleteriously associated with fasting insulin and triglyceride concentrations, insulin resistance, body mass index and waist circumference; longer mean sitting bout duration was deleteriously associated with fasting glucose and insulin concentrations, insulin resistance, body mass index and waist circumference. Exploratory interaction analysis showed that the association between mean sitting bout duration and fasting glucose concentration was significantly stronger among Hispanic women than non-Hispanic women (P-interaction=0.03). Conclusions Ethnic differences in 2 objectively measured parameters of sitting behavior, as well as detrimental associations between parameters and cardiometabolic biomarkers were observed in overweight/obese older women. The detrimental association between mean sitting bout duration and fasting glucose may be greater in Hispanic women than in non-Hispanic women. Corroboration in larger studies is warranted.",2020,10.1161/JAHA.119.013403,9,4,e013403,eng,2047-9980,machine learning and Humans and Female and Middle Aged and Cross-Sectional Studies and Risk Assessment and Aged and Time Factors and Sex Factors and Randomized Controlled Trials as Topic and Body Mass Index and women's health and Biomarkers/blood and type 2 diabetes and Lipids/blood and Insulin/blood and California/epidemiology and Blood Glucose/analysis and Cardiometabolic Risk Factors and cardiovascular risk and *Sitting Position and *Hispanic or Latino and ActiGraph and glucoregulatory and Latina and Obesity/blood/diagnosis/*ethnology and Postmenopause/blood/*ethnology and Race Factors and Sedentary Behavior/*ethnology and Waist Circumference/ethnology,NA,NA,2020/02/18/,J Am Heart Assoc,NA,NA,NA,NA
Mangner_2018_JoofthAmHeAs,JOUR,Cardiac Surgery Compared With Antibiotics Only in Patients Developing Infective Endocarditis After Transcatheter Aortic Valve Replacement,"Mangner, Norman and Leontyev, Sergey and Woitek, Felix J. and Kiefer, Philipp and Haussig, Stephan and Binner, Christian and Mende, Meinhard and Schlotter, Florian and Stachel, Georg and Hollriegel, Robert and Hommel, Jennifer and Binner-Oussenek, Katrin and Misfeld, Martin and Thiele, Holger and Borger, Michael A. and Holzhey, David and Linke, Axel",Journal of the American Heart Association,"Background Infective endocarditis ( IE ) after transcatheter aortic valve replacement is a devastating complication associated with a high mortality. Our objective was to determine the impact of cardiac surgery (CS) and antibiotics ( IE - CS ) compared with medical treatment with antibiotics only ( IE - AB x) on 1-year mortality in patients developing IE after transcatheter aortic valve replacement. Methods and Results Patients developing IE after transcatheter aortic valve replacement were included in this retrospective analysis. All-cause 1-year mortality was the primary end point. A total of 20 patients underwent IE - CS compared with 44 patients treated by IE - AB x. In this unmatched cohort, patients treated by IE - AB x were older ( P=0.006), had a higher Society of Thoracic Surgeons score ( P=0.029), and more often had severe chronic kidney disease ( P=0.037). One-year mortality was not different between groups ( IE -CS versus IE-ABx, 65% versus 68.2%; P=0.802). The rate of any complication during treatment was higher in the IE - CS group ( P=0.024). In a matched cohort, baseline characteristics were not significantly different. All-cause 1-year mortality was not different between groups ( IE -CS versus IE-ABx, 65% versus 75%; P=0.490). A Cox regression analysis revealed any indication for surgery (hazard ratio, 6.20; 95% confidence interval, 1.80-21.41; P=0.004), sepsis on admission (hazard ratio, 4.03; 95% confidence interval, 1.97-8.24; P<0.001), and mitral regurgitation <e2><89><a5>2 (hazard ratio, 2.91; 95% confidence interval, 1.33-6.37) as factors associated with 1-year mortality. Conclusions In patients developing IE after transcatheter aortic valve replacement, mortality was predicted by the severity of IE and concomitant mitral regurgitation. In this small, and therefore statistically limited, but high-risk patient cohort, CS provided no significant mortality benefit compared with medical therapy. Individual decision making by a ""heart and endocarditis team"" is necessary to offer those patients the most reasonable treatment option.",2018,10.1161/JAHA.118.010027,7,17,e010027,eng,2047-9980,"Mortality and Humans and Female and Male and Retrospective Studies and Aged and Aged, 80 and over and Proportional Hazards Models and Severity of Illness Index and Cardiac Surgical Procedures/*methods and outcome and Anti-Bacterial Agents/*therapeutic use and *Transcatheter Aortic Valve Replacement and antibiotic and cardiac valvular surgery and Endocarditis, Bacterial/*therapy and Gram-Positive Bacterial Infections/*therapy and infective endocarditis and Mitral Valve Insufficiency/epidemiology and Postoperative Complications/*therapy and Renal Insufficiency, Chronic/epidemiology and Sepsis/epidemiology and Staphylococcal Infections/therapy and Streptococcal Infections/therapy and transcatheter aortic valve implantation",NA,NA,2018/09/04/,J Am Heart Assoc,NA,NA,NA,NA
Bello_2018_H.T.1,JOUR,Accuracy of Blood Pressure Measurement Devices in Pregnancy: A Systematic Review of Validation Studies,"Bello, Natalie A. and Woolley, Jonathan J. and Cleary, Kirsten Lawrence and Falzon, Louise and Alpert, Bruce S. and Oparil, Suzanne and Cutter, Gary and Wapner, Ronald and Muntner, Paul and Tita, Alan T. and Shimbo, Daichi","Hypertension (Dallas, Tex. : 1979)","The accurate measurement of blood pressure (BP) in pregnancy is essential to guide medical decision making that affects both mother and fetus. The aim of this systematic review was to determine the accuracy of ambulatory, home, and clinic BP measurement devices in pregnant women. We searched Ovid MEDLINE, The Cochrane Library, EMBASE, CINAHL EBSCO, ClinicalTrials.gov, International Clinical Trials Registry Platform, and dabl from inception through August 3, 2017 for articles that assessed the validity of an upper arm BP measurement device against a mercury sphygmomanometer in pregnant women. Two independent investigators determined eligibility, extracted data, and adjudicated protocol violations. From 1798 potential articles identified, 41, that assessed 28 devices, met the inclusion criteria. Most articles (n=32) followed a standard or modified American National Standards Institute/Association for the Advancement of Medical Instrumentation/International Organization for Standardization, British Hypertension Society, or European Society of Hypertension validation protocol. Several articles described the results of validation studies performed on >1 device (n=7) or in >1 population of pregnant women (n=12), comprising 64 pairwise validity assessments. The device was validated in 61% (32 of 52) of studies which used a standard or modified protocol. Only 34% (11 of 32) of the studies wherein the device was successfully validated were performed without a protocol violation. Given the implications of inaccurate BP measurement in pregnant women, healthcare providers should be aware of and try to use the BP measurement devices which have been properly validated in this population.",2018,10.1161/HYPERTENSIONAHA.117.10295,71,2,326-335,eng,1524-4563 0194-911X,Humans and Female and Pregnancy and Reproducibility of Results and blood pressure and Reference Standards and blood pressure monitors and Validation Studies as Topic and pregnancy and *Blood Pressure and hypertension and preeclampsia and Blood Pressure Determination/*instrumentation/methods/standards and Equipment Design/*standards and Hypertension/diagnosis and sphygmomanometers,NA,NA,2018/02//undefined,Hypertension,NA,NA,NA,NA
Gabel_2017_JoofthAmHeAs,JOUR,Molecular Fingerprint for Terminal Abdominal Aortic Aneurysm Disease,"Gabel, Gabor and Northoff, Bernd H. and Weinzierl, Irina and Ludwig, Stefan and Hinterseher, Irene and Wilfert, Wolfgang and Teupser, Daniel and Doderer, Stefan A. and Bergert, Hendrik and Schonleben, Frank and Lindeman, Jan H. N. and Holdt, Lesca M.",Journal of the American Heart Association,"BACKGROUND: Clinical decision making in abdominal aortic aneurysms (AAA) relies completely on diameter. At this point, improved decision tools remain an unmet medical need. Our goal was to identify changes at the molecular level specifically leading up to AAA rupture. METHODS AND RESULTS: Aortic wall tissue specimens were collected during open elective (eAAA; n=31) or emergency repair of ruptured AAA (rAAA; n=17), and gene expression was investigated using microarrays. Identified candidate genes were validated with quantitative real-time polymerase chain reaction in an independent sample set (eAAA: n=46; rAAA: n=18). Two gene sets were identified, 1 set containing 5 genes linked to terminal progression, that is, positively associated with progression of larger AAA, and with rupture (HILPDA, ANGPTL4, LOX, SRPX2, FCGBP), and a second set containing 5 genes exclusively upregulated in rAAA (ADAMTS9, STC1, GFPT2, GAL3ST4, CCL4L1). Genes in both sets essentially associated with processes related to impaired tissue remodeling, such as angiogenesis and adipogenesis. In gene expression experiments we were able to show that upregulated gene expression for identified candidate genes is unique for AAA. Functionally, the selected upregulated factors converge at processes coordinated by the canonical HIF-1<ce><b1> signaling pathway and are highly expressed in fibroblasts but not inflammatory cells of the aneurysmatic wall. Histological quantification of angiogenesis and exploration of the HIF-1<ce><b1> network in rAAA versus eAAA shows enhanced microvessel density but also clear activation of the HIF-1<ce><b1> network in rAAA. CONCLUSIONS: Our study shows a specific molecular fingerprint for terminal AAA disease. These changes appear to converge at activation of HIF-1<ce><b1> signaling in mesenchymal cells. Aspects of this cascade might represent targets for rupture risk assessment.",2017,10.1161/JAHA.117.006798,6,12,NA,eng,2047-9980,"Humans and Risk Factors and Predictive Value of Tests and Signal Transduction and Cells, Cultured and Oligonucleotide Array Sequence Analysis and Gene Regulatory Networks and Genetic Markers and Genetic Association Studies and *Transcriptome and Real-Time Polymerase Chain Reaction and abdominal aortic aneurysm and angiogenesis and Aorta, Abdominal/*metabolism/pathology/surgery and Aortic Aneurysm, Abdominal/*genetics/mortality/pathology/surgery and Aortic Rupture/*genetics/mortality/pathology/surgery and endothelial cell differentiation and Fibroblasts/metabolism/pathology and Gene Expression Profiling/methods and gene microarray and Hypoxia-Inducible Factor 1, alpha Subunit/genetics and hypoxia-inducible factor 1",NA,NA,2017/11/30/,J Am Heart Assoc,NA,NA,NA,NA
Yeatts_2014_Stro,JOUR,Challenges of decision making regarding futility in a randomized trial: the Interventional Management of Stroke III experience,"Yeatts, Sharon D. and Martin, Renee H. and Coffey, Christopher S. and Lyden, Patrick D. and Foster, Lydia D. and Woolson, Robert F. and Broderick, Joseph P. and Di Tullio, Marco R. and Jungreis, Charles A. and Palesch, Yuko Y.",Stroke,"BACKGROUND AND PURPOSE: Interventional Management of Stroke (IMS) III is a randomized, parallel arm trial comparing the approach of intravenous tissue-type plasminogen activator followed by endovascular treatment with intravenous tissue-type plasminogen activator alone in patients with acute ischemic stroke presenting <3 hours of symptom onset. The trial intended to enroll 900 subjects to ensure adequate statistical power to detect an absolute 10% difference in the percentage of subjects with good outcome, defined as modified Rankin Scale score of 0 to 2 at 3 months. In April 2012, after 656 subjects were randomized, further enrollment was terminated by the National Institute of Neurological Disorders and Stroke based on the prespecified criterion for futility using conditional power<20%. METHODS: Conditional power was defined as the likelihood of finding statistical significance at the end of the study, given the accumulated data to date and with the assumption that a minimum hypothesized difference of 10% truly exists between the 2 groups. The evolution of study data leading to futility determination is described, including the interaction between the unblinded study statisticians and the Data and Safety Monitoring Board in the complex deliberation of analysis results. RESULTS: The futility boundary was crossed at the trial's fourth interim analysis. At this point, based on the conditional power criteria, the Data and Safety Monitoring Board recommended termination of the trial. CONCLUSIONS: Even in spite of prespecified interim analysis boundaries, interim looks at data pose challenges in interpretation and decision making, underscoring the importance of objective stopping criteria. CLINICAL TRIAL REGISTRATION URL: http://www.clinicaltrials.gov. Unique identifier: NCT00359424.",2014,10.1161/STROKEAHA.113.003925,45,5,1408-1414,eng,1524-4628 0039-2499,"Humans and Treatment Outcome and Disease Management and Severity of Illness Index and clinical trial and *Data Interpretation, Statistical and Research Design/*standards and *Medical Futility and Decision Making/physiology and Randomized Controlled Trials as Topic/*standards and Brain Ischemia/drug therapy/*therapy and Combined Modality Therapy/standards and endovascular techniques and Fibrinolytic Agents/administration & dosage/therapeutic use and Stroke/drug therapy/*therapy and Thrombolytic Therapy/*standards and Tissue Plasminogen Activator/administration & dosage/therapeutic use",NA,NA,2014/05//undefined,Stroke,NA,NA,NA,NA
